input_id,link,title,category,address,open_hours,popular_times,website,phone,plus_code,review_count,review_rating,reviews_per_rating,latitude,longitude,cid,status,descriptions,reviews_link,thumbnail,timezone,price_range,data_id,place_id,images,reservations,order_online,menu,owner,complete_address,about,user_reviews,user_reviews_extended,emails
ffd001f2-cfc6-4064-b03f-f9635a967d8f,https://www.google.com/maps/place/Maple+Edge+Construction+Inc./data=!4m7!3m6!1s0xebd1f4a7f6b6305:0xd1eec8ccedad5531!8m2!3d44.2407566!4d-76.5729777!16s%2Fg%2F11w7syx2d8!19sChIJBWNrf0ofvQ4RMVWt7czI7tE?authuser=0&hl=en&rclk=1,Maple Edge Construction Inc.,Construction company,"745 Development Dr unit# 10, Kingston, ON K7M 4W6","{""Friday"":[""8 a.m.–5 p.m.""],""Monday"":[""8 a.m.–5 p.m.""],""Saturday"":[""Closed""],""Sunday"":[""Closed""],""Thursday"":[""8 a.m.–5 p.m.""],""Tuesday"":[""8 a.m.–5 p.m.""],""Wednesday"":[""8 a.m.–5 p.m.""]}",{},http://mapledge.ca/,(343) 306-0504,"6CRG+8R Kingston, Ontario",7,5.000000,"{""1"":0,""2"":0,""3"":0,""4"":0,""5"":7}",44.240757,-76.572978,15127248980870518065,,,,https://lh3.googleusercontent.com/gps-cs-s/AHVAweoXX5BfstB8NKadpxSzg2T0Sgt09iCIJN6tFnQmD7RW6qQ6lYFZ12KukGScH4n67KQnpI8s17K5PglqtGyP8UD91LKhryHrGnB9mV-TbCAtcARN4DvRMUKbwgZCxA5ttC1G9I5nCwIpLfs=w408-h544-k-no,America/Toronto,,0xebd1f4a7f6b6305:0xd1eec8ccedad5531,ChIJBWNrf0ofvQ4RMVWt7czI7tE,"[{""title"":""All"",""image"":""https://lh3.googleusercontent.com/gps-cs-s/AHVAweoXX5BfstB8NKadpxSzg2T0Sgt09iCIJN6tFnQmD7RW6qQ6lYFZ12KukGScH4n67KQnpI8s17K5PglqtGyP8UD91LKhryHrGnB9mV-TbCAtcARN4DvRMUKbwgZCxA5ttC1G9I5nCwIpLfs=w224-h298-k-no""},{""title"":""Inside"",""image"":""https://lh3.googleusercontent.com/gps-cs-s/AHVAwepv9iRMToUdAF4L8iHfi-YgHnUN8mbUcrFIfib-DEGBfw-O3CVAhEBFbiPpfkqjS_j19agMnhhU05El_k7rW3fklWFuS6BoymKo0dxb9-9KhWBOes8qCvjdKn0h90vZoQK3i3QJB5fgro0=w224-h298-k-no""},{""title"":""By owner"",""image"":""https://lh3.googleusercontent.com/gps-cs-s/AHVAwerbLVu4F0opX9Y5LYNagSnncEovx6LW8bjlGE3huY6bumUowNRYPUFwzk93TOKO5IospBDT3sMX7cpH-qo3rml09qUpEZOTB8Zxqe1mB6TIAY6bpkUSoFcpEANCeFU3PjDn5KljxKAHjmaJ=w224-h298-k-no""}]",null,null,"{""link"":"""",""source"":""""}","{""id"":""109517340293054523136"",""name"":""Maple Edge Construction Inc. (Owner)"",""link"":""https://www.google.com/maps/contrib/109517340293054523136""}","{""borough"":"""",""street"":""745 Development Dr unit# 10"",""city"":""Kingston"",""postal_code"":""K7M 4W6"",""state"":""Ontario"",""country"":""CA""}",null,"[{""Name"":""Liz Martin"",""ProfilePicture"":""https://lh3.googleusercontent.com/a-/ALV-UjVdXhkOz0EL6zlN_BZ4rav7JbeDYNGcLTBtsLQQD65MGw8-w8iw=s120-c-rp-mo-ba3-br100"",""Rating"":5,""Description"":""Maple Edge took care of replacing my shower when we needed to get an insert taken out and fix a mold problem due to a leak behind the shower. They were able to fit the job in right after the mold removal company finished up, so I wasn't without a shower for too long. Rob did an amazing job coming up with a beautiful tiled-in shower for us. They also effectively handled some surprises that came up. Communication was great and Rob talked me through aspects of the work that I didn't know anything about. Would definitely recommend. Thank you!"",""Images"":null,""When"":""""},{""Name"":""Tracy Lightle"",""ProfilePicture"":""https://lh3.googleusercontent.com/a/ACg8ocKgasBUmB6hxX8WzxayepIMlUSZcQ3xQeVz5HB4pFvkb0TOEQ=s120-c-rp-mo-br100"",""Rating"":5,""Description"":""Maple Edge construction recently completed our kitchen backsplash as well as the tiling of our fireplace in our new home. The owner, Rob,\ndid an excellent job! Very detail oriented , knowledgeable with very high standards which we appreciated immensely. We were so happy we will definitely use his company again for our deck and any other projects that arise as he has vast experience in all aspects of construction from his years of experience"",""Images"":[""www.google.com/local/imagery/report/?cb_client=maps_sv.tactile\u0026image_key=!1e10!2sCIHM0ogKEICAgICX9OTyMg\u0026fid=0x0:0xd1eec8ccedad5531""],""When"":""2024-10-13""},{""Name"":""Jay Vukadinovic"",""ProfilePicture"":""https://lh3.googleusercontent.com/a/ACg8ocJPffu-ngp4oqLqSmTPqBZUymvacxOdDoqSHZswyW_FHkc43g=s120-c-rp-mo-br100"",""Rating"":5,""Description"":""Rob is an expert at what he does and it’s obvious through his work. We couldn’t be happier with our bathroom reno! Our old house threw him some curveballs and he was able to come up with quick, comprehensive solutions without up charges. I really appreciated his open communication and honesty throughout the project, and I will definitely recommend Maple Edge to family and friends."",""Images"":null,""When"":""""},{""Name"":""Jerry Dering"",""ProfilePicture"":""https://lh3.googleusercontent.com/a/ACg8ocLmdJg36N3AXGIW5AwqYYA-b-yKMilI3RCV0lLtUAlwSd1yLQ=s120-c-rp-mo-br100"",""Rating"":5,""Description"":""Very happy with the courteous, prompt and excellent work Rob recently did at our house. We hope to have him in to do further work in the not too distant future!"",""Images"":null,""When"":""""},{""Name"":""Sam A"",""ProfilePicture"":""https://lh3.googleusercontent.com/a/ACg8ocJvyqDpHkNUAjb83w1xpR30n2V5wQ9QlptycV5fFerVlkv6rg=s120-c-rp-mo-br100"",""Rating"":5,""Description"":""We recently completed a renovation of our new home, and we couldn’t be happier with the results! From start to finish, Rob and team were professional, responsive, and incredibly detail-oriented. They took the time to understand our vision, offered thoughtful suggestions, and brought everything to life beyond our expectations."",""Images"":null,""When"":""""},{""Name"":""Joshua Kenney"",""ProfilePicture"":""https://lh3.googleusercontent.com/a/ACg8ocIw1WUAQqU2iUla8PR5OWYMMf98tNP3s3j_SJpx4V9beJAlgQ=s120-c-rp-mo-br100"",""Rating"":5,""Description"":""We've enlisted Rob and his team at Maple Edge for several jobs, and they have yet to let us down. Excellent craftsmanship, always honest, fair, and reliable. I would highly recommend bringing them on board for your next home project."",""Images"":null,""When"":""""},{""Name"":""Yoan M"",""ProfilePicture"":""https://lh3.googleusercontent.com/a/ACg8ocLMz833tVbrBX6nAY1skJtyRSf9n4Sp8cBH8zCJZpCHX5WUuw=s120-c-rp-mo-br100"",""Rating"":5,""Description"":""I couldn't be happier with the results of my two bathrooms remodels, thanks to Rob. From start to finish, is professionalism and attention to detail were evident in every aspect of the project. He transformed both of my bathrooms into functional spaces that match my vision. He also kept me updated on every unforeseen issue and found innovative solutions to keep the cost affordable"",""Images"":null,""When"":""""}]",null,
ffd001f2-cfc6-4064-b03f-f9635a967d8f,https://www.google.com/maps/place/Mascon/data=!4m7!3m6!1s0x4cd2adee7e647caf:0xb542a1ec933b81cd!8m2!3d44.2674932!4d-76.5085632!16s%2Fg%2F11fj477jkk!19sChIJr3xkfu6t0kwRzYE7k-yhQrU?authuser=0&hl=en&rclk=1,Mascon,General contractor,"244 Dalton Ave #3, Kingston, ON K7K 2T3","{""Friday"":[""7 a.m.–7 p.m.""],""Monday"":[""7 a.m.–7 p.m.""],""Saturday"":[""Closed""],""Sunday"":[""Closed""],""Thursday"":[""7 a.m.–7 p.m.""],""Tuesday"":[""7 a.m.–7 p.m.""],""Wednesday"":[""7 a.m.–7 p.m.""]}",{},https://masconrestorations.com/,(613) 547-3200,"7F8R+XH Kingston, Ontario",6,4.300000,"{""1"":1,""2"":0,""3"":0,""4"":0,""5"":5}",44.267493,-76.508563,13061179906782364109,,,,https://lh3.googleusercontent.com/gps-cs-s/AHVAwepwWlVxkjsnYGIZD6n6EufRSIj_48VVPOKHw_ADltGhhUXB1KwcKYSmO2Ig3aTri8H8kRPsMr-b-Oa1HUV4KQVrq7DJwvkYsmxRF__qdDTWwzvAWmJqhRDRDqgRoCHqH7j3ASlK=w630-h240-k-no,America/Toronto,,0x4cd2adee7e647caf:0xb542a1ec933b81cd,ChIJr3xkfu6t0kwRzYE7k-yhQrU,"[{""title"":""All"",""image"":""https://lh3.googleusercontent.com/gps-cs-s/AHVAwepwWlVxkjsnYGIZD6n6EufRSIj_48VVPOKHw_ADltGhhUXB1KwcKYSmO2Ig3aTri8H8kRPsMr-b-Oa1HUV4KQVrq7DJwvkYsmxRF__qdDTWwzvAWmJqhRDRDqgRoCHqH7j3ASlK=w783-h298-k-no""},{""title"":""Inside"",""image"":""https://lh3.googleusercontent.com/gps-cs-s/AHVAwer58V9EgiJDJn_ZvqMMEXn4ZdhrFAL2p2I5dJK7nreA7HAtUh8DRa-9Qp2D4pcCYG0wGw8ls3DWpQFlndhvpCx5chWvMUpTa22c5iE4iboRmHiV_zo6h9OLYjEO5VZKGBnrrIR4cQ=w224-h298-k-no""},{""title"":""By owner"",""image"":""https://lh3.googleusercontent.com/gps-cs-s/AHVAwerhRy-n6Vl0tXkIRcK40ej2wIIoQlHSiIzx1cr7yeBc-Qv4OdTt7YRRp_hYGdeyRuMLQmIwu2zMLAL6jHZgkZpaiRSRKk3O1Y_KyBmrgm_CXaA4mQRPYzhSPsyvUudFUzkYnEAg=w529-h298-k-no""}]",null,null,"{""link"":"""",""source"":""""}","{""id"":""117555031536115984117"",""name"":""Mascon (Owner)"",""link"":""https://www.google.com/maps/contrib/117555031536115984117""}","{""borough"":""Novelis"",""street"":""244 Dalton Ave #3"",""city"":""Kingston"",""postal_code"":""K7K 2T3"",""state"":""Ontario"",""country"":""CA""}","[{""id"":""service_options"",""name"":""Service options"",""options"":[{""name"":""Online estimates"",""enabled"":true},{""name"":""Onsite services"",""enabled"":true}]},{""id"":""accessibility"",""name"":""Accessibility"",""options"":[{""name"":""Wheelchair-accessible parking lot"",""enabled"":true}]}]","[{""Name"":""B MCI"",""ProfilePicture"":""https://lh3.googleusercontent.com/a-/ALV-UjUK-6qtryG6SyvKtQVLEFM2cjml_fZ-obtqUy_EVbTXOEP1Up93=s120-c-rp-mo-ba3-br100"",""Rating"":5,""Description"":""Mascon just completed repair on 2 story condo garage. They finished on time and came in at their estimated price. They are conscientious and clean up at the end of every work day. We would certainly recommend them to other condo corporations"",""Images"":null,""When"":""""},{""Name"":""Mick Powell"",""ProfilePicture"":""https://lh3.googleusercontent.com/a/ACg8ocIiuYw16zYPvaHWSWeCiOgHFLq7qZzKfIspieLnwDAE-slRcA=s120-c-rp-mo-br100"",""Rating"":5,""Description"":""Mascon Restorations recently did a parging repair and window caulking on our townhouse in Bath.  Nice attention to detail.  Responsive and satisfying communication with both Jonathan and Ben.  Carol Powell"",""Images"":null,""When"":""""},{""Name"":""Zack Rowe"",""ProfilePicture"":""https://lh3.googleusercontent.com/a/ACg8ocInnkM4W-a5Bp9so1FFg9N5mIhYAHotqqt-RJHbuKctzXAR9w=s120-c-rp-mo-br100"",""Rating"":5,""Description"":""I would recommend Ben, and his crew for many jobs. The amount of commitment and professionalism Mason restorations has is second to none!\nStrong and reliable company."",""Images"":null,""When"":""""},{""Name"":""Sudeep Kumar"",""ProfilePicture"":""https://lh3.googleusercontent.com/a/ACg8ocJsX26yfo3CpWIlUPQiMfW76uLuLVzSkNAadBV2q7S8fwfjYw=s120-c-rp-mo-ba3-br100"",""Rating"":1,""Description"":""I just called today i.e on 10/12/2023 at 10:06 AM, and the person on the phone with an accent hung up the phone without saying anything. I called back and he said \""just hold on,will call back in 2 minutes\"". No call yet! You need professional people with basic manners working at the reception."",""Images"":null,""When"":""""},{""Name"":""Shawntel Affleck (Telly)"",""ProfilePicture"":""https://lh3.googleusercontent.com/a-/ALV-UjUGwo6f0-6_3_KP7cRDGIO8oxyCSHiXJHqqDfFmpbpZYo_4x03-=s120-c-rp-mo-br100"",""Rating"":5,""Description"":"""",""Images"":null,""When"":""""},{""Name"":""Laura Leigh"",""ProfilePicture"":""https://lh3.googleusercontent.com/a-/ALV-UjWB6Pv-5szr6CNPt2IOffuUSyn6V3FZaqOtnEx9j16xG0JqGkye=s120-c-rp-mo-ba4-br100"",""Rating"":5,""Description"":"""",""Images"":null,""When"":""""}]",null,
ffd001f2-cfc6-4064-b03f-f9635a967d8f,https://www.google.com/maps/place/Full+House+Roofing+LTD/data=!4m7!3m6!1s0x4ccd5b91e2422eab:0x20410ae3cb002a49!8m2!3d44.2290005!4d-76.6778977!16s%2Fg%2F11jpvbwgr5!19sChIJqy5C4pFbzUwRSSoAy-MKQSA?authuser=0&hl=en&rclk=1,Full House Roofing LTD,Roofing contractor,"88 Jack Davey Dr, Bath, ON K0H 1G0","{""Friday"":[""7 a.m.–6 p.m.""],""Monday"":[""7 a.m.–6 p.m.""],""Saturday"":[""9 a.m.–2 p.m.""],""Sunday"":[""Closed""],""Thursday"":[""7 a.m.–6 p.m.""],""Tuesday"":[""7 a.m.–6 p.m.""],""Wednesday"":[""7 a.m.–6 p.m.""]}",{},https://fullhouseroofing.ca/,(613) 893-4804,"68HC+JR Bath, Ontario",165,5.000000,"{""1"":1,""2"":0,""3"":0,""4"":3,""5"":161}",44.229000,-76.677898,2324150856179526217,,,,https://lh3.googleusercontent.com/gps-cs-s/AHVAwep3jc3naBjA7aAAWD3iBEVnzCpEqb5ZQOglNSvJz3_v96G0BFVlk6yIlAoETtorCaD-wCPiZDzIp_n5Kdpz2hWR4FVOTQxvMzETzeBZvGfyFKKjFGz-2Er2pIwi5jxxbZib5VU=w426-h240-k-no,America/Toronto,,0x4ccd5b91e2422eab:0x20410ae3cb002a49,ChIJqy5C4pFbzUwRSSoAy-MKQSA,"[{""title"":""All"",""image"":""https://lh3.googleusercontent.com/gps-cs-s/AHVAwep3jc3naBjA7aAAWD3iBEVnzCpEqb5ZQOglNSvJz3_v96G0BFVlk6yIlAoETtorCaD-wCPiZDzIp_n5Kdpz2hWR4FVOTQxvMzETzeBZvGfyFKKjFGz-2Er2pIwi5jxxbZib5VU=w529-h298-k-no""},{""title"":""Inside"",""image"":""https://lh3.googleusercontent.com/gps-cs-s/AHVAweriYI6sA6EOuXl66LuKshg0EFywOde-veXubcPFbHNyzBVPlzn0flLRVcEYMo9yruzSMNiXmrMfBIr80PyvJ953HPGLthI2NbYv0qte1FdpmwY5QGbwkl3DYS4x7zrqj-qdUnw=w397-h298-k-no""},{""title"":""Videos"",""image"":""https://lh3.googleusercontent.com/gps-cs-s/AHVAwepw55-SfEvvWVEo06lCFoOH-qTRbzCAKNnXqG3S-dolOJvzmiFk7o8YBbxWOsOISBjjTSKiSZeBdoLhfQz5gZBqorFodJBVKsKsbjC6AR-N0RF7xQY_sKn0VmMH2WrXcebOI7cYQFgk4HyA=w224-h398-k-no""},{""title"":""House"",""image"":""https://lh3.googleusercontent.com/gps-cs-s/AHVAweofPhsAtKMvnCZIgLyeTmJSICthJ2QzJoDvE_nKx-umXcDKR1N5yphSQ7wcxX2iBJkQw2XvyB-1zrSdkl0-q-JVcPKjm-DKYv288pF3ENBEOtYilPMPlOPan4HLZcT5OpMP9o4UcasgRpfb=w529-h298-k-no""},{""title"":""Roof shingle"",""image"":""https://lh3.googleusercontent.com/gps-cs-s/AHVAweoTGQhN93VCGsiCDcGAKy4pitSaTXqYJX9XoDnz2KcmYyqlsRFEMYenBfwuxTKHvwqyzXpsquzRm6imfEiAQtyPBzcmAhkmyASsaALE1COetbNZaOaBbtAMWDbIBhzsb56OHiYX=w224-h298-k-no""},{""title"":""By owner"",""image"":""https://lh3.googleusercontent.com/gps-cs-s/AHVAweqeIVowTGH5ZukUPaZAbPjd6WYSishnaUPPJSv6LCCYtNQgRD4483tDTOh0le9jq73DX4y2p3yKprjXXBBerzdK7ZSHKn22RR5pnknt9w8bV3MGPJUDvmIeCBatJqEXdx1d54NF=w298-h298-k-no""}]",null,"[{""link"":""https://fullhouseroofing.ca/contact-us/"",""source"":""fullhouseroofing.ca""}]","{""link"":"""",""source"":""""}","{""id"":""102733192493445228440"",""name"":""Full House Roofing LTD (Owner)"",""link"":""https://www.google.com/maps/contrib/102733192493445228440""}","{""borough"":"""",""street"":""88 Jack Davey Dr"",""city"":""Bath"",""postal_code"":""K0H 1G0"",""state"":""Ontario"",""country"":""CA""}","[{""id"":""service_options"",""name"":""Service options"",""options"":[{""name"":""Online estimates"",""enabled"":true},{""name"":""Onsite services"",""enabled"":true},{""name"":""Language assistance"",""enabled"":false}]},{""id"":""accessibility"",""name"":""Accessibility"",""options"":[{""name"":""Wheelchair accessible seating"",""enabled"":true},{""name"":""Wheelchair-accessible washroom"",""enabled"":true}]},{""id"":""crowd"",""name"":""Crowd"",""options"":[{""name"":""LGBTQ+ friendly"",""enabled"":true}]},{""id"":""parking"",""name"":""Parking"",""options"":[{""name"":""On-site parking"",""enabled"":true}]}]","[{""Name"":""colleen macneil"",""ProfilePicture"":""https://lh3.googleusercontent.com/a-/ALV-UjU94kkfEhTSsrCJ_D3d9vYFIA0axIlBVuIF-FN4RScAC_6OkGRD=s120-c-rp-mo-ba2-br100"",""Rating"":5,""Description"":""We recently had Full House Roofing  install new board and batten siding,new soffit fascia and eavestrough . It was a pleasure working with them at each point in the venture from the sales information meeting to the design meeting to the install crew. Alla allowed us to see the different options for soffit that perhaps we would not have imagined and the install crew kept the job site neat and organized and  were very accommodating whenever we had questions about the install. We highly recommend them for your home projects. Thanks to Will and his team for a great result."",""Images"":[""www.google.com/local/imagery/report/?cb_client=maps_sv.tactile\u0026image_key=!1e10!2sCIABIhBJX4DQwzzI4BJBiPX-DaJ2\u0026fid=0x0:0x20410ae3cb002a49""],""When"":""2026-1-7""},{""Name"":""Ashley Duncan"",""ProfilePicture"":""https://lh3.googleusercontent.com/a/ACg8ocKQ_pgvcz5MtK_RazdrJw0sXEhxPjMrQTgEtjdtjk8cioO7=s120-c-rp-mo-br100"",""Rating"":5,""Description"":""I have nothing but amazing things to say about Will and his team at Full House Roofing. We contacted Will regarding our roof and siding needs and he was professional, diligent and eager to get us the best deal on the best products. We had steel shingles and siding done on our home. All of our communication with Will was positive and both teams (siding and roofing) were efficient and professional. We had a huge job and Will and his team made it seamless! We got quotes from many other companies and nothing compared to Full House (quote wise and professionalism wise). After our project was complete we had a separate HVAC issue where we had our heat pumps removed, this left a hole in the new siding from where piping was previously. Unfortunately the HVAC company also made quite a mess with spray foam, which ran down the side of our new siding. We gave Will a call and he had a team out over the Christmas holidays to fix it! A mess that had nothing to do with his company or work. We cannot recommend FullHouse roofing enough. Thank you Will!"",""Images"":null,""When"":""""},{""Name"":""Hasan Alam"",""ProfilePicture"":""https://lh3.googleusercontent.com/a-/ALV-UjXWbypFNA4T3TG-64GPiUxfY1ehMGN_aNKdqafNa91ZsgZt-LRwbA=s120-c-rp-mo-ba2-br100"",""Rating"":5,""Description"":""William and the Full House Roofing is the best contractor I have ever seen in Kingston. He always goes above and beyond in terms of his service and quality of work. I started using him in 2018 with a big job, and I was so happy with his workmanship, materials quality, price and clear communication in every steps of the process. Since then I have become a fan of Full House Roofing.\n\nI have used this company for several works at my properties. Whenever I had a small fixing job I was first hesitant to contact him, but once I contacted William, he himself fixed the issues within a reasonable time. He knows how to serve a loyal customer and make them a permanent customer and an advocate for the company. For small job(s), he didn’t even charge me rather he said, its a gift from his side. William is such a wonderful soul. I already recommended this company to many of my friends. So far I know everybody is happy, and they are also recommending Full House Roofing to others.\n\nI strongly recommend Full House Roofing for any roofing related job, as they are the best in the town. Thank you William and the Full House Roofing."",""Images"":null,""When"":""""},{""Name"":""Julie Ringuette"",""ProfilePicture"":""https://lh3.googleusercontent.com/a-/ALV-UjV1b5H3XEPKVlH1nDJwyT-SxxVzInvHTd1DJsMdb6IFhxEQlGg=s120-c-rp-mo-br100"",""Rating"":5,""Description"":""I called Full House in a panic as we had an ice dam that was causing a small leak in our kitchen. They were extremely busy today but managed to find the time to come and take a look at our roof. William was very honest in saying that the issue was likely working itself out and saved us 100’s of dollars. This level of honesty is rare these days. Thank you! Cannot recommend enough and will be calling them for our future roofing and attic needs."",""Images"":null,""When"":""""},{""Name"":""Matt Nichols"",""ProfilePicture"":""https://lh3.googleusercontent.com/a-/ALV-UjWdmNMmBnQE5heh2mvmhHDOAp4T2paaJo3E4up0PzehS7YFp3br5A=s120-c-rp-mo-ba4-br100"",""Rating"":5,""Description"":""Full house went so above and beyond. I couldn't be happier with their craftsmanship, but what really put them above and beyond is customer service. We had them out for a quote/estimate. When he saw some of the flaws with our roof, he took the time to do some temporary fixes to address the biggest problems right away and free of charge. He didn't need to do that. We then agreed on the best course of action and price. He came out and did a stellar job fixing everything then, on top of all that, he called us and explained how certain aspects of the job were easier and took fewer materials than expected, so he reduced our bill to reflect that. I am not a roofer and would have never known the difference he could have charged the full amount, and we would have been happy, but the honesty is so next level that I will only use Full House Roofing for any of my roofing needs. I will recommend him to everyone I know! He just earned a super happy and loyal customer."",""Images"":[""www.google.com/local/imagery/report/?cb_client=maps_sv.tactile\u0026image_key=!1e10!2sCIHM0ogKEICAgIDPyLP01gE\u0026fid=0x0:0x20410ae3cb002a49""],""When"":""2024-11-28""},{""Name"":""Mike Williams"",""ProfilePicture"":""https://lh3.googleusercontent.com/a/ACg8ocJqXhhDQP6dgMBgaBXK4vg40KYgcPqRYF5B3CRJYd3D3CnFEA=s120-c-rp-mo-br100"",""Rating"":5,""Description"":""I called at 8:30 this morning because we had a leak in the roof over the weekend and I had to move my son out of his bed. It was raining in the afternoon, Will was in the area around 3:00 pm and within 5 minutes of calling he was on the roof and figured out the issue and fixed it. He gave me a good idea of what I needed to do to fix the issues we’ll have in the future, including a fair ballpark for new flashing around the chimney. Great service, I’ll be back!"",""Images"":null,""When"":""""},{""Name"":""Gayleen Garvin"",""ProfilePicture"":""https://lh3.googleusercontent.com/a/ACg8ocLwebWiiXuEkKsiaeACYVPyymFqYvf_DILN3rwCMtt2hlqXQg=s120-c-rp-mo-br100"",""Rating"":5,""Description"":""Full House Roofing has done excellent work for us.  The owner and crew are dedicated, reliable, trustworthy professionals.  When we need future work, we will be return customers."",""Images"":null,""When"":""""},{""Name"":""Gertrude \u0026 Ronald Cumming"",""ProfilePicture"":""https://lh3.googleusercontent.com/a/ACg8ocKLoZxXbI8VKmWujeJEBhGEuTNsm809XMlPRgiEM_tf2V1c2g=s120-c-rp-mo-br100"",""Rating"":5,""Description"":""I recently had a need for some minor repairs to my metal roof where high winds had removed a few panels. I called and talked to Ashley who scheduled William to drop by and assess what would be required but it would be a few days. I got a call from William the next day saying he was in the area and could drop in that day. He was there in half an hour, assessed what was required, ensured it could be done safely, as metal roofs are a challenge in terms of secure footing. He had the needed attachment material and arranged his long extension ladder, to accommodate access to the area and completed the job quickly. William is a true professional in terms of customer relations, competency and ensuring safety is a top priority. I would highly recommend William and  his organization to deal with any roofing needs you may have."",""Images"":null,""When"":""""}]",null,
