input_id,link,title,category,address,open_hours,popular_times,website,phone,plus_code,review_count,review_rating,reviews_per_rating,latitude,longitude,cid,status,descriptions,reviews_link,thumbnail,timezone,price_range,data_id,place_id,images,reservations,order_online,menu,owner,complete_address,about,user_reviews,user_reviews_extended,emails
018538ff-ac2c-4357-938d-a3e7cd5d73f1,https://www.google.com/maps/place/Sparkle+Roofing+Inc./data=!4m7!3m6!1s0x89d4d51d21aa5423:0x822ad5b694deb294!8m2!3d43.8444753!4d-79.3853035!16s%2Fg%2F11fkvwszpx!19sChIJI1SqIR3V1IkRlLLelLbVKoI?authuser=0&hl=en&rclk=1,Sparkle Roofing Inc.,Roofing contractor,"15 Wertheim Ct #606, Richmond Hill, ON L4B 3H7","{""Friday"":[""9 a.m.–5 p.m.""],""Monday"":[""9 a.m.–5 p.m.""],""Saturday"":[""9 a.m.–5 p.m.""],""Sunday"":[""9 a.m.–5 p.m.""],""Thursday"":[""9 a.m.–5 p.m.""],""Tuesday"":[""9 a.m.–5 p.m.""],""Wednesday"":[""9 a.m.–5 p.m.""]}",{},http://sparkleroofing.com/,(647) 889-5220,"RJV7+QV Richmond Hill, Ontario",13,4.900000,"{""1"":0,""2"":0,""3"":0,""4"":1,""5"":12}",43.844475,-79.385303,9379544154110866068,,,,https://lh3.googleusercontent.com/gps-cs-s/AHVAwepzlaYPcMk7JPM4_aiuELVkTPl4GVn9X9J1SJ54oRelxGNWRFQXHjR6umj5YkDgA0LqlOpv0GyfFIBd8BHUBibdl1RkvCWZDg5aIvfANsaxLceZ8KTX12fvYn0Ad4Nzr_JgugXQzA=w408-h544-k-no,America/Toronto,,0x89d4d51d21aa5423:0x822ad5b694deb294,ChIJI1SqIR3V1IkRlLLelLbVKoI,"[{""title"":""All"",""image"":""https://lh3.googleusercontent.com/gps-cs-s/AHVAwepzlaYPcMk7JPM4_aiuELVkTPl4GVn9X9J1SJ54oRelxGNWRFQXHjR6umj5YkDgA0LqlOpv0GyfFIBd8BHUBibdl1RkvCWZDg5aIvfANsaxLceZ8KTX12fvYn0Ad4Nzr_JgugXQzA=w224-h298-k-no""},{""title"":""House"",""image"":""https://lh3.googleusercontent.com/gps-cs-s/AHVAweqFppUUS5S5ZWIS8J3Zkh2fxB04UtcnnvZDhkhbeRKmkd6FugweuoabyWpcxUEtF26djZUonrC8ykuQ-sboEIT6fd1X6-2GBrUopOCSB-EwMzUHJ7hnDcpUf2dqTQfu7JSLW6Iw4w=w224-h298-k-no""},{""title"":""Roof shingle"",""image"":""https://lh3.googleusercontent.com/gps-cs-s/AHVAweonUcSEpjtT2Yl2AnN43u8iJ9eDu1QsuX9CZnhKPUG5T-uGWf6J5UglnDVoMUTkidDFXRIspzR54yXYsaYyRs2kQpBB0zSRAXU7ZQsxFO0k2JmGdBEqbjhHFytdR9yhWGaZ5dL4=w224-h298-k-no""},{""title"":""Street View \u0026 360°"",""image"":""https://streetviewpixels-pa.googleapis.com/v1/thumbnail?panoid=Z4t7SIT91Pnq1Gr7CYTHeQ\u0026cb_client=maps_sv.tactile.gps\u0026w=224\u0026h=298\u0026yaw=260.55377\u0026pitch=0\u0026thumbfov=100""}]",null,null,"{""link"":"""",""source"":""""}","{""id"":""113455932065950182955"",""name"":""Sparkle Roofing Inc. (Owner)"",""link"":""https://www.google.com/maps/contrib/113455932065950182955""}","{""borough"":"""",""street"":""15 Wertheim Ct #606"",""city"":""Richmond Hill"",""postal_code"":""L4B 3H7"",""state"":""Ontario"",""country"":""CA""}",null,"[{""Name"":""Coffee with RAnks\u0026Sweetness"",""ProfilePicture"":""https://lh3.googleusercontent.com/a-/ALV-UjWiX6qTxCsdm1vkeJ84xuuSmVLZ0jYgeKsJiyjjizc9TpKV-YaE=s120-c-rp-mo-ba4-br100"",""Rating"":5,""Description"":""Wilson at Sparkle Roofing\nThis past winter was brutal, with heavy ice buildup putting a serious strain on our home. Unfortunately, our gutter couldn’t handle the weight and came crashing down onto our back stairs and air conditioner. With just one call to Wilson at Sparkle Roofing, he promptly arrived to assess the damage and provided us with a fair and transparent quote for the necessary spring cleanup.\n\nWe’ve worked with Wilson before—back in 2021, his team replaced our roof, and they did an outstanding job. They were efficient, professional, and polite, completing the project on time without any hassle. It’s no surprise that we’re happy to be working with them again this year to complete our repairs.\n\nThank you, Wilson and the entire Sparkle Roofing team, for your excellent service and dedication. Highly recommended!"",""Images"":[""www.google.com/local/imagery/report/?cb_client=maps_sv.tactile\u0026image_key=!1e10!2sCIHM0ogKEICAgMDIqtOhrwE\u0026fid=0x0:0x822ad5b694deb294""],""When"":""2025-4-8""},{""Name"":""ALAN RUSTOM"",""ProfilePicture"":""https://lh3.googleusercontent.com/a/ACg8ocIeoG-gEmH6KNAZJneoRHN0szd9Cs8oyRviMjmvQYEnAwyvdw=s120-c-rp-mo-ba3-br100"",""Rating"":5,""Description"":""Amazing company to work with. They are punctual and efficient. Two years after they installed my roof, I had a minor issue. They fixed and looked after it as part of the warranty within 48 hours. Thank you Andy and team for great work and professionalism."",""Images"":null,""When"":""""},{""Name"":""Mansoor Mahmood"",""ProfilePicture"":""https://lh3.googleusercontent.com/a-/ALV-UjUXWwhwnstVxIQpkmFiKVOek9kG4m8GKP18WXboB8FJBnoDSpJRUA=s120-c-rp-mo-ba3-br100"",""Rating"":5,""Description"":""Great workmanship and were willing to fix a few issues caused by the builder the same day they came for the estimate, and they came all the way to Cambridge from Markham to get it done. Work was done quickly and effectively and I couldn’t have asked for more. Decent rate as well."",""Images"":null,""When"":""""},{""Name"":""Michelle Senior"",""ProfilePicture"":""https://lh3.googleusercontent.com/a-/ALV-UjVgmOkJNsg2lpq-cYq8XazF-d8_QYNZsGYCJ5O78oAGb_rh7ibbKA=s120-c-rp-mo-br100"",""Rating"":5,""Description"":""Sparkle roofing did our roof 3 years ago, we were incredibly impressed with every aspect of the job. Every year they reach out and touch base to make sure there have been no issues.\nSo when we needed to replace our eaves and down spouts, it was an easy choice.  Once again very impressed with quality, professionalism and pricing."",""Images"":null,""When"":""""},{""Name"":""Wanna Scrap?"",""ProfilePicture"":""https://lh3.googleusercontent.com/a-/ALV-UjVM2wR_KJTN6uExd5HmVH6_UiGr0c89jWF6O5jyR77Ue7G63ok=s120-c-rp-mo-br100"",""Rating"":5,""Description"":""We had our roof re-done by Sparkle Roofing. These guys were so fast and professional! Great value for your buck too! We highly recommend this company for your next roofing job! Thanks again guys!"",""Images"":null,""When"":""""},{""Name"":""Susan Bailie"",""ProfilePicture"":""https://lh3.googleusercontent.com/a/ACg8ocJKMDn4T2LJbHEcJEUq1ZIerJq7BxQZ8uab82hlbd78vdy_DA=s120-c-rp-mo-br100"",""Rating"":5,""Description"":""Really professional, best price. Fantastic service. Highly recommend"",""Images"":null,""When"":""""},{""Name"":""andy001520"",""ProfilePicture"":""https://lh3.googleusercontent.com/a/ACg8ocJXWBEpmoRvgOQkYI5xo2-cplVmmgIFqYoidq22UMuflzugYw=s120-c-rp-mo-br100"",""Rating"":5,""Description"":""Great service.  Great team.  Will definitely refer them."",""Images"":null,""When"":""""},{""Name"":""Joe Anselmo"",""ProfilePicture"":""https://lh3.googleusercontent.com/a-/ALV-UjWafgGFsUDdv7lZJZR9kGVR3qwxI6tuxQjvoPUYkh8MAnzg2HCkYA=s120-c-rp-mo-ba4-br100"",""Rating"":5,""Description"":""Five star service. First class quality. Highly recommended."",""Images"":null,""When"":""""}]",null,
018538ff-ac2c-4357-938d-a3e7cd5d73f1,https://www.google.com/maps/place/Roofing+Pros+of+Ontario/data=!4m7!3m6!1s0x882b2fe7e9bb9b51:0xfcb9b604f16aed3e!8m2!3d43.8341133!4d-79.5067679!16s%2Fg%2F11ftcszrm4!19sChIJUZu76ecvK4gRPu1q8QS2ufw?authuser=0&hl=en&rclk=1,Roofing Pros of Ontario,Roofing contractor,"9131 Keele St Unit A4, Vaughan, ON L4K 0G7","{""Friday"":[""7 a.m.–8 p.m.""],""Monday"":[""7 a.m.–8 p.m.""],""Saturday"":[""9 a.m.–6 p.m.""],""Sunday"":[""10 a.m.–6 p.m.""],""Thursday"":[""7 a.m.–8 p.m.""],""Tuesday"":[""7 a.m.–8 p.m.""],""Wednesday"":[""7 a.m.–8 p.m.""]}",{},https://theroofingpros.ca/,(905) 252-7767,"RFMV+J7 Vaughan, Ontario",100,5.000000,"{""1"":0,""2"":0,""3"":0,""4"":1,""5"":99}",43.834113,-79.506768,18210786700595752254,,,,https://lh3.googleusercontent.com/gps-cs-s/AHVAweoXMmFVrPhMPo9hQMsRHJGKkPZ2qqhkKGpxQyfV7CM57lvTPDf9tnlJ8U1s9Seru-Ybpem6paQ7qUGtbTNibSpmEGK5BqxIWOHLWnjZzYNCRTqTEKhB7ypRdjTH2OxorK1zOTqS=w426-h240-k-no,America/Toronto,,0x882b2fe7e9bb9b51:0xfcb9b604f16aed3e,ChIJUZu76ecvK4gRPu1q8QS2ufw,"[{""title"":""All"",""image"":""https://lh3.googleusercontent.com/gps-cs-s/AHVAweoXMmFVrPhMPo9hQMsRHJGKkPZ2qqhkKGpxQyfV7CM57lvTPDf9tnlJ8U1s9Seru-Ybpem6paQ7qUGtbTNibSpmEGK5BqxIWOHLWnjZzYNCRTqTEKhB7ypRdjTH2OxorK1zOTqS=w529-h298-k-no""},{""title"":""Exterior"",""image"":""https://lh3.googleusercontent.com/gps-cs-s/AHVAwerORLsrcIjKSxN2yTPCouYGyAnpjY5EnLPEDcX28hwvTBOUPeFEJSH9o2Cw7w90krMbwdlUtOqVHpmr1stgG1VKycZ7C8N6tUxw4U94Nw0CQd2uviYu_eI1Q3qOuEe6XYRYGmHo=w397-h298-k-no""},{""title"":""Videos"",""image"":""https://lh3.googleusercontent.com/gps-cs-s/AHVAwepJonjjQ7V5vuhMWUAWfRiNhjRs3MmJxj8L3tnU6QUvlHZiQS618sA4Np7Mv0tRxSs7sUp9KvIP5XpPjMuezb2F0L7DUqiwF4R0UNhbp-AmHRBPUkXP-FvCTZPc5OkIr8kIhQWfgQ=w526-h298-k-no""},{""title"":""House"",""image"":""https://lh3.googleusercontent.com/gps-cs-s/AHVAweou_azpeI09rd3UwNHZ8K9utjHnyZ5PyWk7CsRFhfGjLuio7vJ0FhqjVwQ2bhEWyYnHdlP0YrjTym9jQV6Q4oI1dlvcGjAAjgxMPQm9_ECPKneHDkSVyrtydATJkCaouodt5TEjpg=w529-h298-k-no""},{""title"":""Roof shingle"",""image"":""https://lh3.googleusercontent.com/gps-cs-s/AHVAweq9q8PpHLoXBAKopFd-DxuxU96eGI4Z41uTjUF4_Lejz97wb2DBl5yEZt_NUlcKPKRdUQFuUl6NLNQbmySBkmsv1APLSzR_jJAudwoKxou14Ygf432WafXgduR-T5aBYKmJdZHY=w568-h298-k-no""},{""title"":""By owner"",""image"":""https://lh3.googleusercontent.com/gps-cs-s/AHVAweo1bCmjnc8j2oXuuYjl0qKC7haANNVoKG304so6UicbAvIikK3L12KCuEOl_GjbhSDILhHyJcICSbAxWIPvIlfS1lc6aK0dGYuprcysOP8cmPObWoqyy8oxGVxukT-ZkXr2gXoj=w526-h298-k-no""},{""title"":""Street View \u0026 360°"",""image"":""https://streetviewpixels-pa.googleapis.com/v1/thumbnail?panoid=iNn8tVGbcO-qsgek4xCQpg\u0026cb_client=maps_sv.tactile.gps\u0026w=224\u0026h=298\u0026yaw=83.240555\u0026pitch=0\u0026thumbfov=100""}]",null,null,"{""link"":"""",""source"":""""}","{""id"":""116336029240117573389"",""name"":""Roofing Pros of Ontario (Owner)"",""link"":""https://www.google.com/maps/contrib/116336029240117573389""}","{""borough"":""Concord"",""street"":""9131 Keele St Unit A4"",""city"":""Vaughan"",""postal_code"":""L4K 0G7"",""state"":""Ontario"",""country"":""CA""}","[{""id"":""service_options"",""name"":""Service options"",""options"":[{""name"":""Online estimates"",""enabled"":true},{""name"":""Onsite services"",""enabled"":true}]},{""id"":""accessibility"",""name"":""Accessibility"",""options"":[{""name"":""Wheelchair-accessible parking lot"",""enabled"":true}]}]","[{""Name"":""Ron Gordon"",""ProfilePicture"":""https://lh3.googleusercontent.com/a-/ALV-UjX_1tGtEUD15fz9Dnw0t6qY3Aj6KNTepPMihMq92kTQtxOWmoMm=s120-c-rp-mo-br100"",""Rating"":5,""Description"":""Sam from Roofing Pros came over this morning to look at my roof after I complained that I had leaking in my bathroom for two days. Although the leaking stopped because of the unreasonable cold this weekend, Sam believes the issue is likely an ice dam build up caused by poor attic insulation. He has forwarded me a contact for roof insulation. Sam was extremely easy to deal with and not even charge me for the inspection. He is a real mensch. I would not hesitate to use Roofing Pros in the future."",""Images"":null,""When"":""""},{""Name"":""shaghayegh jaberi"",""ProfilePicture"":""https://lh3.googleusercontent.com/a/ACg8ocKtUFf-9G4KuomDk6xLygsHD9GcRCQ9eAb_VgOaecPdG5C0NQ=s120-c-rp-mo-br100"",""Rating"":5,""Description"":""I had a great experience with this company for a roof inspection. They were very responsive and came out in less than 24 hours. The inspection was thorough, and the team was extremely professional and knowledgeable. They took the time to explain everything clearly and provided great service overall. I highly recommend them."",""Images"":null,""When"":""""},{""Name"":""Elton C"",""ProfilePicture"":""https://lh3.googleusercontent.com/a-/ALV-UjVLJDxNaYlwMIstmsPPyWnVciSsLSL_HYwoBWLh-tXVeQpK_6vY=s120-c-rp-mo-br100"",""Rating"":5,""Description"":""Sam and his crew went above and beyond to replace my entire roof and a skylight during the one of the hottest days when temperature was above 30C. Thoroughly cleaned the skylight until it's spotless. Repaired all damaged roof decking with plywood. Removed all debris around the property after the job's done. Well done guys!"",""Images"":[""www.google.com/local/imagery/report/?cb_client=maps_sv.tactile\u0026image_key=!1e10!2sCIHM0ogKEICAgICL_bDjVw\u0026fid=0x0:0xfcb9b604f16aed3e""],""When"":""2024-6-22""},{""Name"":""Lisa Rodrigues"",""ProfilePicture"":""https://lh3.googleusercontent.com/a/ACg8ocLq4pRlI8mcLTfgKQVH8zgdMCOAHYl6Ozzlw7M9A6O4PSY7Fw=s120-c-rp-mo-br100"",""Rating"":5,""Description"":""Appreciate Roofing Pros and in particular Sam for coming to my house to help check my roof and flashing (on short notice) after some pest issues.  They changed our roof a couple of years ago and I am happy to see that their amazing service and quality has not changed.  Sam was thorough in his work and did an excellent job as always."",""Images"":null,""When"":""""},{""Name"":""Cheryl Burman"",""ProfilePicture"":""https://lh3.googleusercontent.com/a/ACg8ocKaTm6O5OEUcxiP13kJq0RXknEKRtyG88zkQGeyaqdVBnGadQ=s120-c-rp-mo-br100"",""Rating"":5,""Description"":""I had a catastrophe on my hands with my “frosted attic “ \u0026 subsequent issues related to same.  I can’t say enough about Sam!\nHe arrived the very next day; quickly diagnosed the problem \u0026 prioritizing my job as it was deemed urgent!  Such a relief for me \u0026 happy to say I can now sleep at night!\nThank you Roofingpros!!"",""Images"":null,""When"":""""},{""Name"":""Naeem Parvin"",""ProfilePicture"":""https://lh3.googleusercontent.com/a/ACg8ocJc7g0Xgcj0EBZ_E9b5eDUmTVuWJTeHic07UJOy0a6p97zElw=s120-c-rp-mo-br100"",""Rating"":5,""Description"":""Sam and his team did an outstanding job on my roof! They were professional, efficient, and paid great attention to detail. The whole process was smooth, and they left everything clean when they were done. Highly recommend Sam for quality roofing work"",""Images"":null,""When"":""""},{""Name"":""James Ferlisi"",""ProfilePicture"":""https://lh3.googleusercontent.com/a/ACg8ocJxp6x2HMgrqGnQb0jx0w95Fcs7oY0cEtiJn7xPO7zmHccSHg=s120-c-rp-mo-br100"",""Rating"":5,""Description"":""Sam and his crew were amazing.  They were professional / arrived on time / superb  quality and first class service.  I definitely plan on referring my family / friends / relatives and my business contacts to Sam and Roofing Pros of Ontario!"",""Images"":null,""When"":""""},{""Name"":""Domenic Ferri"",""ProfilePicture"":""https://lh3.googleusercontent.com/a-/ALV-UjUJ2x4Yj4wQ7rA67yA99lTw2jUXSzVoDnFxjR5OJuJTi9epftg=s120-c-rp-mo-br100"",""Rating"":5,""Description"":""October 02,2025\nHad an emergency roof leak and Sam responded quickly with his crew and did an amazing job.  Highly recommend this company from the fast response to a great job.  Thanks guys👍"",""Images"":null,""When"":""""}]",null,
018538ff-ac2c-4357-938d-a3e7cd5d73f1,https://www.google.com/maps/place/Dunlop+Roofing/data=!4m7!3m6!1s0x882b2a4dda5336cb:0xae854f35d064a789!8m2!3d43.8764573!4d-79.4386566!16s%2Fg%2F1vlzb_cl!19sChIJyzZT2k0qK4gRiadk0DVPha4?authuser=0&hl=en&rclk=1,Dunlop Roofing,Roofing contractor,"10216 Yonge St, Richmond Hill, ON L4C 3B6","{""Friday"":[""8 a.m.–5 p.m.""],""Monday"":[""8 a.m.–5 p.m.""],""Saturday"":[""Closed""],""Sunday"":[""Closed""],""Thursday"":[""8 a.m.–5 p.m.""],""Tuesday"":[""8 a.m.–5 p.m.""],""Wednesday"":[""8 a.m.–5 p.m.""]}",{},http://www.dunloproof.com/,(416) 527-4824,"VHG6+HG Richmond Hill, Ontario",6,5.000000,"{""1"":0,""2"":0,""3"":0,""4"":0,""5"":6}",43.876457,-79.438657,12575544627050096521,,,,https://streetviewpixels-pa.googleapis.com/v1/thumbnail?panoid=HqU2GdwwQjMkxaFU7w8DPw&cb_client=search.gws-prod.gps&w=408&h=240&yaw=262.76025&pitch=0&thumbfov=100,America/Toronto,,0x882b2a4dda5336cb:0xae854f35d064a789,ChIJyzZT2k0qK4gRiadk0DVPha4,"[{""title"":""All"",""image"":""https://streetviewpixels-pa.googleapis.com/v1/thumbnail?panoid=HqU2GdwwQjMkxaFU7w8DPw\u0026cb_client=maps_sv.tactile.gps\u0026w=224\u0026h=298\u0026yaw=262.76025\u0026pitch=0\u0026thumbfov=100""},{""title"":""Street View \u0026 360°"",""image"":""https://streetviewpixels-pa.googleapis.com/v1/thumbnail?panoid=HqU2GdwwQjMkxaFU7w8DPw\u0026cb_client=maps_sv.tactile.gps\u0026w=224\u0026h=298\u0026yaw=262.76025\u0026pitch=0\u0026thumbfov=100""}]",null,null,"{""link"":"""",""source"":""""}","{""id"":""108628382804200069779"",""name"":""Dunlop Roofing (Owner)"",""link"":""https://www.google.com/maps/contrib/108628382804200069779""}","{""borough"":"""",""street"":""10216 Yonge St"",""city"":""Richmond Hill"",""postal_code"":""L4C 3B6"",""state"":""Ontario"",""country"":""CA""}",null,"[{""Name"":""Nicole B"",""ProfilePicture"":""https://lh3.googleusercontent.com/a-/ALV-UjVYKR92VJjO_SMCSfxlc32pvayaOawEyXsLfS8Av8sHOzTUK4LU=s120-c-rp-mo-br100"",""Rating"":5,""Description"":""If I could give Dom an even higher rate I would.   He is honest, hard working and professional.  He was always responsive and patient with all my questions.  He never cuts corners and charges a fair price.  From the bottom of my heart, thank you Dom for taking such great care of us!"",""Images"":null,""When"":""""},{""Name"":""Michael Marmur"",""ProfilePicture"":""https://lh3.googleusercontent.com/a-/ALV-UjUA2PE_oL5_fMY6jO14E13sv2fEpdf3LCwxrmCqOjZp1eUdBClH=s120-c-rp-mo-ba5-br100"",""Rating"":5,""Description"":""Dominic Donia and his team at Dunlop Roofing provide reliable professional service. The trouble about roofs is that I have no idea as to what is really being done.   Dominic takes the time to explain and delivers.  If you think it’s time to check your roof, call Dominic.   He will give you an honest assessment of the condition of your roof.  Dunlop has done the roofs of three of my neighbours over the past years.  They have all been very satisfied."",""Images"":null,""When"":""""},{""Name"":""Kevin Pattison"",""ProfilePicture"":""https://lh3.googleusercontent.com/a-/ALV-UjVN5xHiZLuDzZsWmRTJPU-lNRCLx5cfSZi2kkwNdgrvKR7LO7Jg=s120-c-rp-mo-ba5-br100"",""Rating"":5,""Description"":""Domenic has been taking care of the roof at my Grandmother's house for several years now. Recently she called due to some minor damage on the roof and Domenic got back to her right away and was at her house the next day to repair the roof himself. Cannot thank him enough for his amazing prompt and fair service. If you need a quality roofer, look no further."",""Images"":null,""When"":""""},{""Name"":""Cindy P"",""ProfilePicture"":""https://lh3.googleusercontent.com/a/ACg8ocKDg89VVivJ6ClzvjA92_smmphfHUlVfmJOxFnYZP56INPGKQ=s120-c-rp-mo-ba3-br100"",""Rating"":5,""Description"":""Amazing to work with! Reliable, punctual, excellent workmanship. Great value, great company. Would highly recommend."",""Images"":null,""When"":""""},{""Name"":""Tara"",""ProfilePicture"":""https://lh3.googleusercontent.com/a/ACg8ocL42d3fVPEXlClw3g2VWzBXSz-V7GmbeMF4mbR3wMUKRYgvjA=s120-c-rp-mo-ba4-br100"",""Rating"":5,""Description"":""This is my go-to for a fair price, great work and superb service. Amazing company."",""Images"":null,""When"":""""},{""Name"":""Roma Sachdev"",""ProfilePicture"":""https://lh3.googleusercontent.com/a/ACg8ocITIZ9h1BTCv_3Yx40Y4YlK2uLd9P2au49nqfYpxZWXVbcPIDsW=s120-c-rp-mo-ba4-br100"",""Rating"":5,""Description"":"""",""Images"":null,""When"":""""}]",null,
018538ff-ac2c-4357-938d-a3e7cd5d73f1,https://www.google.com/maps/place/Maplewood+Roofing+%26+Property+Maintenance/data=!4m7!3m6!1s0x882b2b8457faf2a3:0x23bba095ea8b9a76!8m2!3d43.8887683!4d-79.4403454!16s%2Fg%2F11td4gh1cn!19sChIJo_L6V4QrK4gRdpqL6pWguyM?authuser=0&hl=en&rclk=1,Maplewood Roofing & Property Maintenance,Roofing contractor,"10711 Yonge St, Richmond Hill, ON L4C 3E1","{""Friday"":[""8 a.m.–9 p.m.""],""Monday"":[""8 a.m.–9 p.m.""],""Saturday"":[""8 a.m.–9 p.m.""],""Sunday"":[""8 a.m.–9 p.m.""],""Thursday"":[""8 a.m.–9 p.m.""],""Tuesday"":[""8 a.m.–9 p.m.""],""Wednesday"":[""8 a.m.–9 p.m.""]}",{},,(437) 247-3228,"VHQ5+GV Richmond Hill, Ontario",2,1.000000,"{""1"":2,""2"":0,""3"":0,""4"":0,""5"":0}",43.888768,-79.440345,2574828177717959286,,,,https://lh3.googleusercontent.com/gps-cs-s/AHVAweoaHN-F6OvLA-9Mj79ZsQr316E9ftfdKlkjt2uBTFoGtLDINdvPPR30ArnGIFTOJjFEdx6OX1PitgfoMR0JO0uGlYsPJ1cXijKDzxaJDIHOoZUD6ZrgyYt2c09C36FIXV9AMQsJng=w408-h541-k-no,America/Toronto,,0x882b2b8457faf2a3:0x23bba095ea8b9a76,ChIJo_L6V4QrK4gRdpqL6pWguyM,"[{""title"":""All"",""image"":""https://lh3.googleusercontent.com/gps-cs-s/AHVAweoaHN-F6OvLA-9Mj79ZsQr316E9ftfdKlkjt2uBTFoGtLDINdvPPR30ArnGIFTOJjFEdx6OX1PitgfoMR0JO0uGlYsPJ1cXijKDzxaJDIHOoZUD6ZrgyYt2c09C36FIXV9AMQsJng=w224-h298-k-no""},{""title"":""House"",""image"":""https://lh3.googleusercontent.com/gps-cs-s/AHVAweq5_wfu_-SuRFVMCNlTOhPKw-sUPnBJC0FHOAPAXrEDHB7Y-VjyfBJ8HsIp9Dgfk0nHZxFiQu-GGHWiSw0hAmqhFS9YUOJcJ4ZD9Mv7VSkaZUuiawDl9YHZvF3MzEyJbzzaY-iG=w224-h298-k-no""}]",null,null,"{""link"":"""",""source"":""""}","{""id"":""108453625411965097622"",""name"":""Maplewood Roofing \u0026 Property Maintenance (Owner)"",""link"":""https://www.google.com/maps/contrib/108453625411965097622""}","{""borough"":"""",""street"":""10711 Yonge St"",""city"":""Richmond Hill"",""postal_code"":""L4C 3E1"",""state"":""Ontario"",""country"":""CA""}","[{""id"":""accessibility"",""name"":""Accessibility"",""options"":[{""name"":""Wheelchair-accessible parking lot"",""enabled"":true}]}]","[{""Name"":""M Eb"",""ProfilePicture"":""https://lh3.googleusercontent.com/a/ACg8ocJJJzvPYBVj4BoZbNS8_a_l9tAcR9YJAqwrClWWXLs1ZiDkDA=s120-c-rp-mo-ba4-br100"",""Rating"":1,""Description"":""These guys will rip you off and sleep well at night without a problem. I paid them 6 thousand dollars to get my roof done. They had no idea what they were doing . They made a complete mess as the pictures show. It cost me another 10 thousand to get it done right. The company that came to fix it and stop my roof from leaking and potentially collapsing said that this company has no idea how to do roofing and in 27 years he has never seen anything as bad . Be warned. These guys don't care about you and certainly don't care about workmanship. If you want water pouring into your house ,then these guys can help you."",""Images"":[""www.google.com/local/imagery/report/?cb_client=maps_sv.tactile\u0026image_key=!1e10!2sCIHM0ogKEICAgICeo9v3twE\u0026fid=0x0:0x23bba095ea8b9a76""],""When"":""2022-9-22""},{""Name"":""Dylan Clark"",""ProfilePicture"":""https://lh3.googleusercontent.com/a-/ALV-UjVTUKdH8XrKIPjzCPQUDI6XdOZkwGRjMswKlsS4Z0ao7jE4sFHr=s120-c-rp-mo-ba2-br100"",""Rating"":1,""Description"":""I am Disgusted.. this is my 80 year old grandmothers bill for some small yard work. The property is very small, the lawn takes me 15 min to mow and edge. Driveway only fits two cars... This is three days work maximum, more than likely two. I run a painting company and use pressure washers all the time. I’ve done this actual job at my grandmothers house, however i’m not always available, so she hired others. I am absolutely disgusted at how much they charged my grandma to pick weeds and pressure wash driveway. Scamming the elderly."",""Images"":[""www.google.com/local/imagery/report/?cb_client=maps_sv.tactile\u0026image_key=!1e10!2sCIHM0ogKEICAgIDjrN3VfQ\u0026fid=0x0:0x23bba095ea8b9a76""],""When"":""2024-4-30""}]",null,
