input_id,link,title,category,address,open_hours,popular_times,website,phone,plus_code,review_count,review_rating,reviews_per_rating,latitude,longitude,cid,status,descriptions,reviews_link,thumbnail,timezone,price_range,data_id,place_id,images,reservations,order_online,menu,owner,complete_address,about,user_reviews,user_reviews_extended,emails
018538ff-ac2c-4357-938d-a3e7cd5d73f1,"https://www.google.com/maps/place/Alpha+Roofing+Canada+-+Metal+Roofing+Companies+Ontario,+Shingle+Roof,+Roofers+near+Markham/data=!4m7!3m6!1s0x882b2b110da6fab9:0x7b428f65464c732b!8m2!3d43.8302139!4d-79.3359061!16s%2Fg%2F11c2jm6h1b!19sChIJufqmDRErK4gRK3NMRmWPQns?authuser=0&hl=en&rclk=1","Alpha Roofing Canada - Metal Roofing Companies Ontario, Shingle Roof, Roofers near Markham",Roofing contractor,"400 Bentley St Unit 10, Markham, ON L3R 8H6","{""Friday"":[""8:30 a.m.–5 p.m.""],""Monday"":[""8:30 a.m.–5 p.m.""],""Saturday"":[""Closed""],""Sunday"":[""Closed""],""Thursday"":[""8:30 a.m.–5 p.m.""],""Tuesday"":[""8:30 a.m.–5 p.m.""],""Wednesday"":[""8:30 a.m.–5 p.m.""]}",{},http://www.alpharoofingcanada.com/,+1 877-271-3445,"RMJ7+3J Markham, Ontario",149,4.600000,"{""1"":11,""2"":1,""3"":0,""4"":9,""5"":128}",43.830214,-79.335906,8881819080261923627,,,,https://lh3.googleusercontent.com/gps-cs-s/AHVAweouCa6UWWcQvlrMdxaXuA8Rqwisho4c9_jQHs-orYzMIkQ4z8em3rn5W2bnKj_6pWVilynl4Ea8lqQF4mdiS60WdFn8bE4Kq_rxAkdZWGVGR9kl2oOBoTxL3wOnVdGPj-gX8dTi=w408-h306-k-no,America/Toronto,,0x882b2b110da6fab9:0x7b428f65464c732b,ChIJufqmDRErK4gRK3NMRmWPQns,"[{""title"":""All"",""image"":""https://lh3.googleusercontent.com/gps-cs-s/AHVAweouCa6UWWcQvlrMdxaXuA8Rqwisho4c9_jQHs-orYzMIkQ4z8em3rn5W2bnKj_6pWVilynl4Ea8lqQF4mdiS60WdFn8bE4Kq_rxAkdZWGVGR9kl2oOBoTxL3wOnVdGPj-gX8dTi=w397-h298-k-no""},{""title"":""Exterior"",""image"":""https://lh3.googleusercontent.com/gps-cs-s/AHVAweqndvTk1wvfASQ_lTOZHS4uI68zoX8G4MN6eNfd6XmMrQrkouHJkNTMc5P4rgamwTFF9eMgooig8WWP58ZQXj4AJvgajaDQlkb7aL8kvh_n9QDv53yhmqvnOxpb5lJnmVj-qfhFuQ=w224-h298-k-no""},{""title"":""House"",""image"":""https://lh3.googleusercontent.com/gps-cs-s/AHVAwepkHV8Jxpb92QqLiBtsio5mPYeRhrLP67Hbg7QYKjNuE6sGBiX_UNC6XLM-akj5Y1FV3mWfVSEuaKwLdxD0M7gv5qr-JbfAEZdXqZ4Iz_BuCfhjpuk4LV2SXr9TeBAl5aHfIbrRHC1h5A_e=w487-h298-k-no""},{""title"":""By owner"",""image"":""https://lh3.googleusercontent.com/gps-cs-s/AHVAwepMYtiLVUvVoZqq1QlCsSRg9xE868yziZ6beb77fZ74CWGTpfaFFhBaKq6P5QMfso_0quWS9b3ipuimpnnHc97_hN6JFFK4SaPhi5WUxpidovEGhoD3sCZudLjhJxh_6crA664=w224-h298-k-no""}]",null,null,"{""link"":"""",""source"":""""}","{""id"":""102388960194485783679"",""name"":""Alpha Roofing Canada - Metal Roofing Companies Ontario, Shingle Roof, Roofers near Markham (Owner)"",""link"":""https://www.google.com/maps/contrib/102388960194485783679""}","{""borough"":"""",""street"":""400 Bentley St Unit 10"",""city"":""Markham"",""postal_code"":""L3R 8H6"",""state"":""Ontario"",""country"":""CA""}","[{""id"":""service_options"",""name"":""Service options"",""options"":[{""name"":""Onsite services"",""enabled"":true}]},{""id"":""accessibility"",""name"":""Accessibility"",""options"":[{""name"":""Wheelchair-accessible parking lot"",""enabled"":true}]}]","[{""Name"":""Margaret Hughes"",""ProfilePicture"":""https://lh3.googleusercontent.com/a/ACg8ocJu5HjNKY0AUZ2yQbSBMmB3NuajiTaijXbaMqEC3RhOL5e0cg=s120-c-rp-mo-br100"",""Rating"":5,""Description"":""We needed to replace our old roof with a new metal roof and had heard great things about Alpha Roofing. Alan came out to assess the situation, and the whole process was straightforward and transparent. He clearly explained the benefits of a metal roof and how the installation would work. Their quote was competitive, and based on their solid reputation,  I expected quality workmanship—and they definitely delivered. The attention to detail was impressive, and everyone from the installers to the office staff was friendly and professional. I’m very happy with how my new metal roof turned out."",""Images"":[""www.google.com/local/imagery/report/?cb_client=maps_sv.tactile\u0026image_key=!1e10!2sCIABIhA9JidvOsrct4LmZ37aLaVo\u0026fid=0x0:0x7b428f65464c732b""],""When"":""2025-9-4""},{""Name"":""Pushpa Shanmuganathan"",""ProfilePicture"":""https://lh3.googleusercontent.com/a/ACg8ocLMorEXDqLEld2fzY09YoUAceaO2oIMCBYinooFMMzMZFDF6g=s120-c-rp-mo-br100"",""Rating"":5,""Description"":""Few weeks back ( September 9,2025), we had the good fortune of having Alpha Roofing replace our roof and we could not be happier with the results. From the very first meeting with Sandy, we were highly impressed. Sandy is very committed to his work, explained everything in detail, easy to deal with and professional. On the agreed date of installation, higly skilled professionals came and attended their tasks with thorougness and efficiency. They completed the work on the same as agreed. They disposed all the relative debris and with no damage to our property, specially the newly installed interlock. I want to say a big and special thank you to Sandy for going above and beyond to see that all our requests were satisfied and that I would have a pleasant experience. Sandy even came by during the installation to check with us that if we have any concerns or questions. We only had to pay at the end of the installation after everything was completed. Our neighbours stopped by and very impressed to see the work and we shared Sandy's contact to four of our neighbours. Two of them already signed an agreement and Sandy and his team are installing the roof for them. We would not hesitate to recommend Alpha Roofing for your next roof replacemnt project. Sandy, thank you again for all what you did for us.  Pushpa"",""Images"":[""www.google.com/local/imagery/report/?cb_client=maps_sv.tactile\u0026image_key=!1e10!2sCIABIhC8VpZsTqgNbasrTk99VWFz\u0026fid=0x0:0x7b428f65464c732b""],""When"":""2025-9-29""},{""Name"":""Canaan Pike"",""ProfilePicture"":""https://lh3.googleusercontent.com/a-/ALV-UjUnUIBtkG5Kq_AxbUT8fqRgBDTQ3C24JgJ-JNzRQ9hpyEQCLxg=s120-c-rp-mo-br100"",""Rating"":5,""Description"":""Alpha Roofing did a fantastic job installing our new metal roof. From start to finish, they were professional, respectful, and easy to communicate with. They took the time to answer all our questions and gave us peace of mind throughout the process. The team worked quickly but didn’t cut corners, and the finished roof looks amazing. I’m glad I chose them."",""Images"":[""www.google.com/local/imagery/report/?cb_client=maps_sv.tactile\u0026image_key=!1e10!2sCIABIhBhDkRcX8LwtlOBSn-XuZgL\u0026fid=0x0:0x7b428f65464c732b""],""When"":""2025-7-23""},{""Name"":""Wesson Austin"",""ProfilePicture"":""https://lh3.googleusercontent.com/a/ACg8ocKcewkrBmHaxEMM3wisYM_dMQe8KTt37WnLE9ufR0bZbuIZbw=s120-c-rp-mo-br100"",""Rating"":5,""Description"":""I just had my metal roof replaced by Alpha Roofing, and I’m super happy with how everything turned out. Alan gave me a really clear quote and explained all my options up front. The crew was on time, professional, and left everything spotless. Would definitely recommend them to anyone needing reliable roofing!"",""Images"":[""www.google.com/local/imagery/report/?cb_client=maps_sv.tactile\u0026image_key=!1e10!2sCIABIhBA8NPJuroQ3VyGmkRy20ii\u0026fid=0x0:0x7b428f65464c732b""],""When"":""2025-7-20""},{""Name"":""Roger Wiggins"",""ProfilePicture"":""https://lh3.googleusercontent.com/a-/ALV-UjW7rFQqzL_wwSQtMhPX80d9fjKaLM7KARTlb8TZukch8jFlvqk=s120-c-rp-mo-br100"",""Rating"":5,""Description"":""Alpha Roofing replaced our shingled roof with a metal roof.  Couldn't be happier with the outcome.  Looks amazing.  Installation team were very effective,  efficient and did a great job cleaning up when done.  Alan explained everything fullly and stayed in touch sending updates and pictures during the install.  I would highly recommend Alpha Roofing if you're looking to get your roof done."",""Images"":[""www.google.com/local/imagery/report/?cb_client=maps_sv.tactile\u0026image_key=!1e10!2sCIABIhAU6iF_vFEokwq1oQcOqOhC\u0026fid=0x0:0x7b428f65464c732b""],""When"":""2025-7-29""},{""Name"":""David deNobriga"",""ProfilePicture"":""https://lh3.googleusercontent.com/a-/ALV-UjWUzrBfz3KIga8RL2BaqXZQvZ0NYUagPAvossY9_8XrWIIQmIp2=s120-c-rp-mo-br100"",""Rating"":5,""Description"":""I live in the Kawartha. Alpha is out if North York. Very happy I found them. I have a 1600sft roof that needed replacing. I found that they also do Skylights so I had them install a 4ft X 4ft Sky light.\n\nIncredibly efficient and professional. Echo, the project manager was very kind and made sure I understood what was happening and answered all my questions. She and the team did great work and completed the job in just 1 day and finished just after it got dark.\n\nI highly recommend this team. 👌"",""Images"":null,""When"":""""},{""Name"":""Daleyza George"",""ProfilePicture"":""https://lh3.googleusercontent.com/a/ACg8ocL4HAdNiU3IXAUx0DSQGUUJLOKUWDd58ATtm61t5AcysE-Cwg=s120-c-rp-mo-br100"",""Rating"":5,""Description"":""Really appreciated how Jevy from Alpha Roofing handled our roofing project. He was always quick to respond to my messages, kept me in the loop the entire time, and made everything feel straightforward and stress-free. From the initial consultation, Jevy explained all my options in a way that was easy to understand and never made me feel pressured to choose the most expensive option. Throughout the project, I always knew what stage the work was at because Jevy provided regular updates and quickly answered any questions I had—even in the evenings when I reached out. The crew showed up on time, worked efficiently, and took a lot of care to keep the site clean. It was obvious that everyone involved took pride in the quality of their work.\n\nIn the end, our new roof turned out even better than I expected. I’m grateful for Jevy’s honesty, prompt communication, and the professional attitude of the whole Alpha Roofing team. I would absolutely recommend them to anyone looking for a reliable and customer-focused roofing company."",""Images"":[""www.google.com/local/imagery/report/?cb_client=maps_sv.tactile\u0026image_key=!1e10!2sCIABIhAtnt0E0H4M7_YdP06NEos7\u0026fid=0x0:0x7b428f65464c732b""],""When"":""2025-8-20""},{""Name"":""Jason R"",""ProfilePicture"":""https://lh3.googleusercontent.com/a/ACg8ocJLiwIEWWMQIEuI9n_zrN7Wv8lYM4eTnApHFQanXVg7CM2l-g=s120-c-rp-mo-ba2-br100"",""Rating"":5,""Description"":""We were very pleased with our visit with Alan and the quote we received.  We wanted Emerald Green shingles and Alpha was able to accommodate our request.  Three weeks later the 6-man crew arrived on time and worked in an organized and efficient manner.  They were done in 3 hours and the clean-up was spotless.  There is one area where the shingles are raised at the edge but we have been reassured by Jocelyn that in time they will flatten out.  We recommend Alpha for all your roofing needs."",""Images"":[""www.google.com/local/imagery/report/?cb_client=maps_sv.tactile\u0026image_key=!1e10!2sCIHM0ogKEICAgIDO6uWtVQ\u0026fid=0x0:0x7b428f65464c732b""],""When"":""2022-7-2""}]",null,
018538ff-ac2c-4357-938d-a3e7cd5d73f1,https://www.google.com/maps/place/Alt%C4%B1n+construction/data=!4m7!3m6!1s0x882b2b87733b9415:0xc5d7ac6e560ae22b!8m2!3d43.8843077!4d-79.436036!16s%2Fg%2F11x272mkq5!19sChIJFZQ7c4crK4gRK-IKVm6s18U?authuser=0&hl=en&rclk=1,Altın construction,Construction company,"Enford Rd, Richmond Hill, ON L4C 3A2",{},{},https://altinconstruction.com/,(437) 983-0194,"VHM7+PH Richmond Hill, Ontario",3,5.000000,"{""1"":0,""2"":0,""3"":0,""4"":0,""5"":3}",43.884308,-79.436036,14256052735354528299,,,,https://lh3.googleusercontent.com/gps-cs-s/AHVAwerDpWOqFZX7-FYXw4MZCp1-DMXHx-5-jV2ZkqYDX6XSCsnlk5Ibx4POIYR31R6Kxk1TEvB-7NzI_ffasN2wolKCGNTnny2HzuZhS3KUVGupKWoe8Gq0qrhdKoHMNu8-zYre7OA8MQ=w408-h306-k-no,America/Toronto,,0x882b2b87733b9415:0xc5d7ac6e560ae22b,ChIJFZQ7c4crK4gRK-IKVm6s18U,"[{""title"":""All"",""image"":""https://lh3.googleusercontent.com/gps-cs-s/AHVAwerDpWOqFZX7-FYXw4MZCp1-DMXHx-5-jV2ZkqYDX6XSCsnlk5Ibx4POIYR31R6Kxk1TEvB-7NzI_ffasN2wolKCGNTnny2HzuZhS3KUVGupKWoe8Gq0qrhdKoHMNu8-zYre7OA8MQ=w397-h298-k-no""},{""title"":""Inside"",""image"":""https://lh3.googleusercontent.com/gps-cs-s/AHVAweowUEyRjJCELckJmhGWElrPup8GYw8tK8Yp52rS_gt-886WPtWFogSljoQK6f_BXDS7pe7VFAGyRA8PofTlTm9B-2w_YlHNuxQalaUK4-C_JyRhmTndkZXQUTITyJEVpM3AR3s=w397-h298-k-no""},{""title"":""Concrete"",""image"":""https://lh3.googleusercontent.com/gps-cs-s/AHVAwer6XoXhvLaiLGn46wwGBIExH3lYGEfqmb8a4WXrTPPF0wnJzSC1jMSQKPKo97aGOh0MyEXOBYPcbuywX-p1loV-LoZrOolXjIk6uyPKy60ZJjgtLuhkfhvhBJBQOzHg4oCzJMXA=w397-h298-k-no""},{""title"":""Yard"",""image"":""https://lh3.googleusercontent.com/gps-cs-s/AHVAweqMF6c2t74bcBDH6JzhHHjqQz29ENVCIOjqPxDqiYI5gzJlubb_5hwXcxvTqeYgMyx74OaZqn6YTCMdwVAGwPBw3wsyHt341C2wrNJp3BVRW1t8g7GFr8ggblNigZe7NiFprnkuQw=w397-h298-k-no""},{""title"":""By owner"",""image"":""https://lh3.googleusercontent.com/gps-cs-s/AHVAweoUSGyh5_efgQGNp8fuchr9Y5oZi9qPfva2nrcalXiT187sqK8A5Re_1cgNxtcXltpQ3eZqQfncAO3ZpmWz5L7hNUms2OCYpRp4h1RSInqC7fwsgMMHtJtV8QXFmZOc4kMjjKmrVg=w397-h298-k-no""}]",null,null,"{""link"":"""",""source"":""""}","{""id"":""111010121084095043681"",""name"":""Altın construction (Owner)"",""link"":""https://www.google.com/maps/contrib/111010121084095043681""}","{""borough"":"""",""street"":""Enford Rd"",""city"":""Richmond Hill"",""postal_code"":""L4C 3A2"",""state"":""Ontario"",""country"":""CA""}","[{""id"":""service_options"",""name"":""Service options"",""options"":[{""name"":""Online estimates"",""enabled"":true},{""name"":""Onsite services"",""enabled"":true},{""name"":""Language assistance"",""enabled"":false}]}]","[{""Name"":""Sam S"",""ProfilePicture"":""https://lh3.googleusercontent.com/a/ACg8ocLhqI1L5wHxC312q3J0qjnM27dxv5_QTKFIFYUap1ZVSKv45Q=s120-c-rp-mo-ba2-br100"",""Rating"":5,""Description"":""I remodelled my bathroom through Altin Construction and I have to tell you that they did a phenomenal job.  The workmanship was spot on, and the job was done faster than promised.  I would highly recommend them.  Thanks Hosein and crew."",""Images"":null,""When"":""""},{""Name"":""Devansh Upadhyay"",""ProfilePicture"":""https://lh3.googleusercontent.com/a-/ALV-UjV0R-8yKTKQEpKwU3EmbJnpeKQ8cAwUXO_Z7zpj35mpU7PKbEc=s120-c-rp-mo-br100"",""Rating"":5,""Description"":""Great Work Great People."",""Images"":null,""When"":""""},{""Name"":""Devansh Upadhyay"",""ProfilePicture"":""https://lh3.googleusercontent.com/a-/ALV-UjW4h5BVdh4pttedgJn3Xe6Fy2unAfahomk18U2jIlkD2Bjzw47I=s120-c-rp-mo-ba3-br100"",""Rating"":5,""Description"":"""",""Images"":null,""When"":""""}]",null,
018538ff-ac2c-4357-938d-a3e7cd5d73f1,"https://www.google.com/maps/place/Valnora+Contracting+group+%28Design,+Permit+and+Construction%29/data=!4m7!3m6!1s0x882b2ba1ef1e4e49:0x9e3325277c566dcb!8m2!3d43.8778855!4d-79.4385937!16s%2Fg%2F11w1l50z84!19sChIJSU4e76ErK4gRy21WfCclM54?authuser=0&hl=en&rclk=1","Valnora Contracting group (Design, Permit and Construction)",General contractor,"10271 Yonge St, Richmond Hill, ON L4C 4Y7","{""Friday"":[""9:30 a.m.–5 p.m.""],""Monday"":[""9:30 a.m.–5 p.m.""],""Saturday"":[""9:30 a.m.–5 p.m.""],""Sunday"":[""Closed""],""Thursday"":[""9:30 a.m.–5 p.m.""],""Tuesday"":[""9:30 a.m.–5 p.m.""],""Wednesday"":[""9:30 a.m.–5 p.m.""]}",{},https://www.valnora.ca/,,"VHH6+5H Richmond Hill, Ontario",4,5.000000,"{""1"":0,""2"":0,""3"":0,""4"":0,""5"":4}",43.877885,-79.438594,11399495933324848587,,,,https://streetviewpixels-pa.googleapis.com/v1/thumbnail?panoid=AoZzDHY6cj9tKbNcpp8LNA&cb_client=search.gws-prod.gps&w=408&h=240&yaw=70.07297&pitch=0&thumbfov=100,America/Toronto,,0x882b2ba1ef1e4e49:0x9e3325277c566dcb,ChIJSU4e76ErK4gRy21WfCclM54,"[{""title"":""All"",""image"":""https://streetviewpixels-pa.googleapis.com/v1/thumbnail?panoid=AoZzDHY6cj9tKbNcpp8LNA\u0026cb_client=maps_sv.tactile.gps\u0026w=224\u0026h=298\u0026yaw=70.07297\u0026pitch=0\u0026thumbfov=100""},{""title"":""Street View \u0026 360°"",""image"":""https://streetviewpixels-pa.googleapis.com/v1/thumbnail?panoid=AoZzDHY6cj9tKbNcpp8LNA\u0026cb_client=maps_sv.tactile.gps\u0026w=224\u0026h=298\u0026yaw=70.07297\u0026pitch=0\u0026thumbfov=100""}]",null,null,"{""link"":"""",""source"":""""}","{""id"":""110236518915927924486"",""name"":""Valnora Contracting group (Design, Permit and Construction) (Owner)"",""link"":""https://www.google.com/maps/contrib/110236518915927924486""}","{""borough"":"""",""street"":""10271 Yonge St"",""city"":""Richmond Hill"",""postal_code"":""L4C 4Y7"",""state"":""Ontario"",""country"":""CA""}","[{""id"":""service_options"",""name"":""Service options"",""options"":[{""name"":""Online estimates"",""enabled"":true},{""name"":""Onsite services"",""enabled"":true},{""name"":""Language assistance"",""enabled"":false}]},{""id"":""accessibility"",""name"":""Accessibility"",""options"":[{""name"":""Wheelchair-accessible parking lot"",""enabled"":true}]}]","[{""Name"":""pegah Alavi Taleghani"",""ProfilePicture"":""https://lh3.googleusercontent.com/a-/ALV-UjXZENE_nxj6e0sest61l_44gj3tOu7Y52R_XpXCie9JaN39WDw0=s120-c-rp-mo-br100"",""Rating"":5,""Description"":""We hired Valnora Contracting Group for our basement renovation in Toronto, and the experience was excellent from start to finish. They took care of the design, permits, mechanical drawings, and full construction. The team was very professional, stayed on schedule, and delivered a high-quality finish that completely transformed our basement. If you’re looking for a reliable contractor for basement, kitchen, or home renovations in the GTA, I highly recommend Valnora."",""Images"":null,""When"":""""},{""Name"":""Mojtaba Parvizi"",""ProfilePicture"":""https://lh3.googleusercontent.com/a-/ALV-UjUa_Lp4EKYfwA3_NUhXTFg17Dpe1hDLFclY-BHuvEalGioYxu8=s120-c-rp-mo-br100"",""Rating"":5,""Description"":""Loved Ali! Bunch of great guys! They totally knew what their were doing\n\nI was hesitant at first but I'm glad I went with this company! Ali and his team worked tirelessly and definitely recommend them"",""Images"":null,""When"":""""},{""Name"":""Marzieh Ashrafi"",""ProfilePicture"":""https://lh3.googleusercontent.com/a-/ALV-UjXRYtn4i9KsejGVwRlaw47M-QGFubiz0k2D_on2S4NoFfPlH3o=s120-c-rp-mo-br100"",""Rating"":5,""Description"":""Very professional. Everything was done on time and within budget. They gave fair price for the changes that was added to the project after the initial quote. Totally happy with with the project I’ve done with this company"",""Images"":null,""When"":""""},{""Name"":""Kyle"",""ProfilePicture"":""https://lh3.googleusercontent.com/a-/ALV-UjUcS7zrRdmGq0Q9DX3RrI80l-t3jMicXK3uGnWA0UGLmcTusn4=s120-c-rp-mo-br100"",""Rating"":5,""Description"":"""",""Images"":null,""When"":""""}]",null,
018538ff-ac2c-4357-938d-a3e7cd5d73f1,https://www.google.com/maps/place/Pi+Construction/data=!4m7!3m6!1s0x415ada93b5415a1:0xf0f5dffffc30fa65!8m2!3d43.8894566!4d-79.4183647!16s%2Fg%2F11khqp91sn!19sChIJoRVUO6mtFQQRZfow_P_f9fA?authuser=0&hl=en&rclk=1,Pi Construction,General contractor,"10571 Bayview Ave, Richmond Hill, ON L4C 0M8","{""Friday"":[""8 a.m.–5 p.m.""],""Monday"":[""8 a.m.–5 p.m.""],""Saturday"":[""8 a.m.–5 p.m.""],""Sunday"":[""Closed""],""Thursday"":[""8 a.m.–5 p.m.""],""Tuesday"":[""8 a.m.–5 p.m.""],""Wednesday"":[""8 a.m.–5 p.m.""]}",{},https://www.piconstruction.ca/,(647) 515-4230,"VHQJ+QM Richmond Hill, Ontario",4,5.000000,"{""1"":0,""2"":0,""3"":0,""4"":0,""5"":4}",43.889457,-79.418365,17363030228937538149,,,,https://lh3.googleusercontent.com/gps-cs-s/AHVAwepC-QFwpTiDKsMNvtWY-Lmo5bE56_bqdKcPYwAjZhuM_KZfu4hw2XNpeBYs6TBB9zcHvlbCOg78iDhtxR8w6vAQb1ZST2_MU38g83ntnV0H-f36srtG2_b_w37ULIRp7fXCwW8b=w408-h272-k-no,America/Toronto,,0x415ada93b5415a1:0xf0f5dffffc30fa65,ChIJoRVUO6mtFQQRZfow_P_f9fA,"[{""title"":""All"",""image"":""https://lh3.googleusercontent.com/gps-cs-s/AHVAwepC-QFwpTiDKsMNvtWY-Lmo5bE56_bqdKcPYwAjZhuM_KZfu4hw2XNpeBYs6TBB9zcHvlbCOg78iDhtxR8w6vAQb1ZST2_MU38g83ntnV0H-f36srtG2_b_w37ULIRp7fXCwW8b=w447-h298-k-no""},{""title"":""By owner"",""image"":""https://lh3.googleusercontent.com/gps-cs-s/AHVAweqxoN7-YFs6UbXYHWeIsNU_N_dmQY6tK_UEwdghvUc607iih1s1paF7Kfsa2tI-uYQDqzQqHZU6nf1sQHtjAzgNPw-cqhBds3z7IBA7lNg5z_NxO8ZSPt_0X8c6duEQG-t4SHZS=w451-h298-k-no""},{""title"":""Street View \u0026 360°"",""image"":""https://streetviewpixels-pa.googleapis.com/v1/thumbnail?panoid=mL8vErZBKSpxRJjTSMlkKA\u0026cb_client=maps_sv.tactile.gps\u0026w=224\u0026h=298\u0026yaw=84.46423\u0026pitch=0\u0026thumbfov=100""}]",null,null,"{""link"":"""",""source"":""""}","{""id"":""101588230268698985351"",""name"":""Pi Construction (Owner)"",""link"":""https://www.google.com/maps/contrib/101588230268698985351""}","{""borough"":"""",""street"":""10571 Bayview Ave"",""city"":""Richmond Hill"",""postal_code"":""L4C 0M8"",""state"":""Ontario"",""country"":""CA""}","[{""id"":""service_options"",""name"":""Service options"",""options"":[{""name"":""Online estimates"",""enabled"":true},{""name"":""Onsite services"",""enabled"":true}]},{""id"":""accessibility"",""name"":""Accessibility"",""options"":[{""name"":""Wheelchair-accessible parking lot"",""enabled"":true}]},{""id"":""crowd"",""name"":""Crowd"",""options"":[{""name"":""LGBTQ+ friendly"",""enabled"":true}]}]","[{""Name"":""Y. Ziya Asici"",""ProfilePicture"":""https://lh3.googleusercontent.com/a/ACg8ocLND-j1SKjzJKudL-V-ayHVm-wi0zPHOd1p_xuIpPKOaNVd3hPs=s120-c-rp-mo-ba3-br100"",""Rating"":5,""Description"":""I recently had the pleasure of working with David for my new home renovation project, and I cannot recommend him and his talented team highly enough. From start to finish, this contractor was professional, courteous, and incredibly skilled. They took the time to really understand what I wanted from the renovation and offered valuable insights and suggestions to ensure the final result exceeded my expectations. Throughout the project, they communicated clearly and regularly, keeping me updated on progress and any changes that needed to be made.\n\nThe quality of their work was simply outstanding. The end result was a beautifully crafted space that I am absolutely thrilled with. Their team was punctual, respectful, and always left the workspace clean and tidy at the end of each day."",""Images"":null,""When"":""""},{""Name"":""Kerim Anulur"",""ProfilePicture"":""https://lh3.googleusercontent.com/a/ACg8ocLaGiPtJc0vYiP4VCph8MPUkjsclHHJvwWvBrKKzvtS5Inxng=s120-c-rp-mo-ba2-br100"",""Rating"":5,""Description"":""Pi Construction and its owner David are simply outstanding. From the very first meeting, David's passion for excellence was palpable. He took the time to truly understand our needs, and his attention to detail was unparalleled. With a team of expert contractors at his side, David transformed our vision into a stunning reality.\n\nWhat sets Pi Construction apart from other companies is their unwavering commitment to quality. Every aspect of the project was meticulously planned and executed to perfection, and David's professionalism and expertise were evident every step of the way."",""Images"":null,""When"":""""},{""Name"":""sree priya"",""ProfilePicture"":""https://lh3.googleusercontent.com/a/ACg8ocI9TXdRQiFjM74VnPVocKl6RDoLKJY4Wi2-adcLfG_BCpMUSA=s120-c-rp-mo-br100"",""Rating"":5,""Description"":""I am really impressed with the home renovation work completed by Pi Construction. We could not have chosen a better builder. The entire project came in on-time and on budget. I am extremely happy with my home feeling brand new again. David is very knowledgeable, responsive and  extremely easy to communicate with. I am pleased to recommend David and his team for any work that you are looking to be done at your home."",""Images"":null,""When"":""""},{""Name"":""Yunus dogan"",""ProfilePicture"":""https://lh3.googleusercontent.com/a-/ALV-UjWOlOysX0fkeQfW1X168qb-qJ8kwmfbdxX9a4m9qXsiMPG1RSwE=s120-c-rp-mo-ba2-br100"",""Rating"":5,""Description"":""The employees  was outstanding, and the job quality  was exactly what I was looking for.” “I was so pleased to work With David They went above and beyond to build our home .I was very impressed with the quality of the job highly recommended and %100 guaranteed job."",""Images"":null,""When"":""""}]",null,
