input_id,link,title,category,address,open_hours,popular_times,website,phone,plus_code,review_count,review_rating,reviews_per_rating,latitude,longitude,cid,status,descriptions,reviews_link,thumbnail,timezone,price_range,data_id,place_id,images,reservations,order_online,menu,owner,complete_address,about,user_reviews,user_reviews_extended,emails
ffd001f2-cfc6-4064-b03f-f9635a967d8f,https://www.google.com/maps/place/Kurzawa+Metal+Roofing/data=!4m7!3m6!1s0x421f23500e937a3:0x1fa88db864c412bf!8m2!3d44.2670423!4d-76.5626027!16s%2Fg%2F11ts9ghf1p!19sChIJozfpADXyIQQRvxLEZLiNqB8?authuser=0&hl=en&rclk=1,Kurzawa Metal Roofing,Roofing contractor,"1144 Clyde Ct, Kingston, ON K7P 2E4","{""Friday"":[""9:30 a.m.–3 p.m.""],""Monday"":[""9:30 a.m.–3 p.m.""],""Saturday"":[""Closed""],""Sunday"":[""Closed""],""Thursday"":[""9:30 a.m.–3 p.m.""],""Tuesday"":[""9:30 a.m.–3 p.m.""],""Wednesday"":[""9:30 a.m.–3 p.m.""]}",{},http://www.kmrroofing.ca/,(905) 808-6756,"7C8P+RX Kingston, Ontario",20,4.800000,"{""1"":1,""2"":0,""3"":0,""4"":0,""5"":19}",44.267042,-76.562603,2281229034367226559,,,,https://lh3.googleusercontent.com/gps-cs-s/AHVAweq70lj477DXHecdKSgRG-GZ7o6Vgf4qpUH_fpdAhBvakiWEU2khwm8vsrwlDNNIQm05i6QuFYC-L3Tc0Mm9udpmR180rbrDYuaKxi-8W3l-kGVFDJiXpx4Zngn6CV2t_onvztGdlg=w449-h240-k-no,America/Toronto,,0x421f23500e937a3:0x1fa88db864c412bf,ChIJozfpADXyIQQRvxLEZLiNqB8,"[{""title"":""All"",""image"":""https://lh3.googleusercontent.com/gps-cs-s/AHVAweq70lj477DXHecdKSgRG-GZ7o6Vgf4qpUH_fpdAhBvakiWEU2khwm8vsrwlDNNIQm05i6QuFYC-L3Tc0Mm9udpmR180rbrDYuaKxi-8W3l-kGVFDJiXpx4Zngn6CV2t_onvztGdlg=w557-h298-k-no""},{""title"":""Exterior"",""image"":""https://lh3.googleusercontent.com/gps-cs-s/AHVAwerDb9B2YzThIpIkzeFU1AyXQ7ojHHqe2UEvao4VCFvJy5xRGwohZRNwvalGAtanzsjHH7kXZQyO4LhQxin9du7nKH9Db4i39NZpF1kpEFRXm0RqtBj7ofXWz_qFq_522WvqsiA=w224-h298-k-no""},{""title"":""House"",""image"":""https://lh3.googleusercontent.com/gps-cs-s/AHVAwepKyZd9_LYMbT8PVDJ3zpY9r_u1-Re2yJTwmf-XTSZCETQ8ja61AVxLQeM0RopdMtyN1_ZGvUBeEeNUNK4sXcs_0LrrgK9gEXozu9NLYj9dyLzbpTHKZAI1GnNE94gDNnUwZJuo=w397-h298-k-no""},{""title"":""By owner"",""image"":""https://lh3.googleusercontent.com/gps-cs-s/AHVAwepR8mi6Tjf-dt2jjRVVYDF6gCyxSBIPvTx3h0dyRz05Ogftvu_V_tIr1OkP7c0dXRINhegNamjwAOp0ZaQ890YHEPRgFM-ChVTQJQa0dtTmCe1inshaBsu4V_heA3pnQeKLYZM3=w224-h298-k-no""},{""title"":""Street View \u0026 360°"",""image"":""https://streetviewpixels-pa.googleapis.com/v1/thumbnail?panoid=e7DKFSWBzJxeuCMXlEpwzA\u0026cb_client=maps_sv.tactile.gps\u0026w=224\u0026h=298\u0026yaw=65.501724\u0026pitch=0\u0026thumbfov=100""}]",null,null,"{""link"":"""",""source"":""""}","{""id"":""109552539250013802507"",""name"":""Kurzawa Metal Roofing (Owner)"",""link"":""https://www.google.com/maps/contrib/109552539250013802507""}","{""borough"":""Cataraqui North"",""street"":""1144 Clyde Ct"",""city"":""Kingston"",""postal_code"":""K7P 2E4"",""state"":""Ontario"",""country"":""CA""}","[{""id"":""accessibility"",""name"":""Accessibility"",""options"":[{""name"":""Wheelchair-accessible parking lot"",""enabled"":true}]}]","[{""Name"":""Sara Boukhlit"",""ProfilePicture"":""https://lh3.googleusercontent.com/a/ACg8ocJMNoWTm_LdamWuheGjGSgPyVgJ2D6CxShWHlR2hz90B5fy6w=s120-c-rp-mo-br100"",""Rating"":5,""Description"":""I had an amazing experience with this roofing company! From the first consultation to the final installation, everything was handled professionally and efficiently. The team was punctual, respectful, and extremely knowledgeable about metal roofing options."",""Images"":null,""When"":""""},{""Name"":""Info BIGminiBINS"",""ProfilePicture"":""https://lh3.googleusercontent.com/a/ACg8ocI1Jj97WCKybxXAE0yjWLzedm44Mek8UjsLTVCSNyiHlnm2uVc=s120-c-rp-mo-ba2-br100"",""Rating"":1,""Description"":""Michael does NOT Answer his Phone when BILLS come Due!\nHas an outstanding balance with us, and his cards keep coming up Declined. Instead of listening to the advice from vendors, he tries to do everything on the cheap. Does NOT know how to estimate or price projects correctly!"",""Images"":[""www.google.com/local/imagery/report/?cb_client=maps_sv.tactile\u0026image_key=!1e10!2sCIHM0ogKEICAgIDf1JqtmgE\u0026fid=0x0:0x1fa88db864c412bf""],""When"":""2025-1-4""},{""Name"":""Adam A."",""ProfilePicture"":""https://lh3.googleusercontent.com/a-/ALV-UjXZjNnTM_P5AYabKCNhiqfZCFs3aqSXWXEvYqNT_dCq-YIRuNwn=s120-c-rp-mo-br100"",""Rating"":5,""Description"":""Mike does a great job and cares for all your questions before, during, and after installation. We are beyond grateful for our new metal roof! Very professional and a smooth installation process."",""Images"":[""www.google.com/local/imagery/report/?cb_client=maps_sv.tactile\u0026image_key=!1e10!2sCIHM0ogKEICAgICp9czzBQ\u0026fid=0x0:0x1fa88db864c412bf""],""When"":""2023-8-8""},{""Name"":""E \u0026 J V"",""ProfilePicture"":""https://lh3.googleusercontent.com/a-/ALV-UjX8F7rcHJPDdQMvb7_dmYuFt3uVHyECGjr9wpYquL_jUuiJaGt-=s120-c-rp-mo-ba3-br100"",""Rating"":5,""Description"":""Mike did a great job on our roof.  He was professional, punctual and reliable till the very last screw was in place.  He communicated daily and took great care throughout the project.  So much so, that our neighbor hired him to do their roof even before our project was complete!  I did a considerable amount of research on roofing before deciding to get a metal roof for our home.  I then did a considerable amount of research on the variety of metal roofing available, including all of the advantages and disadvantages of each, before settling on the version that Mike provides.  It has been 3 months and we have had no issues with the project.  The roof was quiet even with very heavy rain falls (I was concerned it may be noisy under such circumstances) because of the unique installation method for this type of roof.  Extremely happy with Mike, his crew and the product.  We have gotten repeated compliments on how great it looks by everyone in the neighborhood.  We highly recommend Mike and his work."",""Images"":null,""When"":""""},{""Name"":""Vyom Vaishnav"",""ProfilePicture"":""https://lh3.googleusercontent.com/a/ACg8ocKeUCtc98id6426jFMmXhge3DkvVGIOA8q7F5xSzkJzlhTlcg=s120-c-rp-mo-br100"",""Rating"":5,""Description"":""Got our new roof from Kurzawa Metal Roofing and love it! The team was friendly, on time, and really knew their stuff. They explained everything clearly and answered all our questions. The installation went smoothly, and they cleaned up everything afterwards. Our metal roof looks great, makes our house look even better, and the prices were great too. Definitely recommend them if you’re thinking about a new metal roof. Thank you Michal."",""Images"":null,""When"":""""},{""Name"":""S H"",""ProfilePicture"":""https://lh3.googleusercontent.com/a/ACg8ocJmIGyQwpWszYFqUYuPa2q4k6jHiVaKHl-ASUj-VlZ5s-UTww=s120-c-rp-mo-br100"",""Rating"":5,""Description"":""Michal and Maks did a wonderful job putting a metal roof on my bunkie. I know they usually do much bigger jobs so I am appreciative that they agreed to do this. They were wonderful to work with and checked with me about my preference for different options. I would recommend Kurzawa Metal Roofing for anyone wanting a great experience getting a metal roof!"",""Images"":null,""When"":""""},{""Name"":""Julia"",""ProfilePicture"":""https://lh3.googleusercontent.com/a/ACg8ocJN4WYyoof_f54ZbsmylfjB56ERr8U-9wUBiV3rebb4yQUjaA=s120-c-rp-mo-br100"",""Rating"":5,""Description"":""Mid-October-Michal Kurzawa (owner of Kurzawa metal roofing known as KMR) and son, Maks provided great workmanship with the replacement of shingled roof on our house with metal.  Actually, the entire crew strived for excellence and eager to please.  We were pleasantly surprised with the cost of the project compared to other quotes from various metal companies in the area.  All questions were answered and emails quickly replied to.  With Michal’s expertise, it made the decision of colour and design much easier.  The roof looks fantastic and have received many compliments.  Michal explained the process from startup day to the final day.  The crew scoured their working  area for any fallen debris and hauled all garbage away..The entire process went smoothly with no issues.  Highly recommend KMR to anyone considering a metal roof.  We met as strangers but departed as friends .\n\nThanks Michal and Maks for a job well done.👍\nT/J"",""Images"":null,""When"":""""},{""Name"":""angelo TURCO"",""ProfilePicture"":""https://lh3.googleusercontent.com/a/ACg8ocK-aMHNqif60AwQnLvg4emOTFygAjdpDZ1i74IKmq7sJmZELw=s120-c-rp-mo-br100"",""Rating"":5,""Description"":""Excellent service and extremely professional job. The work is done efficiently and at a very reasonable price in comparison to others within the roofing industry. I would recommend their services highly to anyone within Ontario that is looking to have their roof done."",""Images"":null,""When"":""""}]",null,
ffd001f2-cfc6-4064-b03f-f9635a967d8f,https://www.google.com/maps/place/Roofers+Kingston/data=!4m7!3m6!1s0x4cd2ac05676fffff:0x416cfbf088caa932!8m2!3d44.2666046!4d-76.5291263!16s%2Fg%2F11jgbxhgcx!19sChIJ__9vZwWs0kwRMqnKiPD7bEE?authuser=0&hl=en&rclk=1,Roofers Kingston,Roofing contractor,"40 Binnington Ct, Kingston, ON K7M 8S3",{},{},http://roofers-kingston.ca/,(613) 331-8728,"7F8C+J8 Kingston, Ontario",0,0.000000,"{""1"":0,""2"":0,""3"":0,""4"":0,""5"":0}",44.266605,-76.529126,4714419920455772466,,,,https://streetviewpixels-pa.googleapis.com/v1/thumbnail?panoid=EL3PBWTutTeJmEjVIGZlIA&cb_client=search.gws-prod.gps&w=408&h=240&yaw=275.6872&pitch=0&thumbfov=100,America/Toronto,,0x4cd2ac05676fffff:0x416cfbf088caa932,ChIJ__9vZwWs0kwRMqnKiPD7bEE,"[{""title"":""All"",""image"":""https://streetviewpixels-pa.googleapis.com/v1/thumbnail?panoid=EL3PBWTutTeJmEjVIGZlIA\u0026cb_client=maps_sv.tactile.gps\u0026w=224\u0026h=298\u0026yaw=275.6872\u0026pitch=0\u0026thumbfov=100""},{""title"":""Street View \u0026 360°"",""image"":""https://streetviewpixels-pa.googleapis.com/v1/thumbnail?panoid=EL3PBWTutTeJmEjVIGZlIA\u0026cb_client=maps_sv.tactile.gps\u0026w=224\u0026h=298\u0026yaw=275.6872\u0026pitch=0\u0026thumbfov=100""}]",null,null,"{""link"":"""",""source"":""""}","{""id"":"""",""name"":""Roofers Kingston (Owner)"",""link"":""""}","{""borough"":""Novelis"",""street"":""40 Binnington Ct"",""city"":""Kingston"",""postal_code"":""K7M 8S3"",""state"":""Ontario"",""country"":""CA""}",null,[],null,
ffd001f2-cfc6-4064-b03f-f9635a967d8f,https://www.google.com/maps/place/Amherst+Roofing+%26+Sheet+Metal/data=!4m7!3m6!1s0x4cd2abc778a18379:0xbc9f6fb8073e9fe!8m2!3d44.2529053!4d-76.4913913!16s%2Fg%2F11b5wcgp40!19sChIJeYOheMer0kwR_ulzgPv2yQs?authuser=0&hl=en&rclk=1,Amherst Roofing & Sheet Metal,Roofing contractor,"177 Hickson Ave, Kingston, ON K7K 2N8","{""Friday"":[""7 a.m.–5 p.m.""],""Monday"":[""7 a.m.–5 p.m.""],""Saturday"":[""Closed""],""Sunday"":[""Closed""],""Thursday"":[""7 a.m.–5 p.m.""],""Tuesday"":[""7 a.m.–5 p.m.""],""Wednesday"":[""7 a.m.–5 p.m.""]}",{},http://www.amherstroofing.com/,(613) 542-0779,"7G35+5C Kingston, Ontario",14,3.000000,"{""1"":6,""2"":0,""3"":1,""4"":2,""5"":5}",44.252905,-76.491391,849481564788353534,,,,https://streetviewpixels-pa.googleapis.com/v1/thumbnail?panoid=TayqM7qRvsbg7DpbdQ7Ndw&cb_client=search.gws-prod.gps&w=408&h=240&yaw=355.96265&pitch=0&thumbfov=100,America/Toronto,,0x4cd2abc778a18379:0xbc9f6fb8073e9fe,ChIJeYOheMer0kwR_ulzgPv2yQs,"[{""title"":""All"",""image"":""https://streetviewpixels-pa.googleapis.com/v1/thumbnail?panoid=TayqM7qRvsbg7DpbdQ7Ndw\u0026cb_client=maps_sv.tactile.gps\u0026w=224\u0026h=298\u0026yaw=355.96265\u0026pitch=0\u0026thumbfov=100""},{""title"":""By owner"",""image"":""https://lh3.googleusercontent.com/gps-cs-s/AHVAwepR32mZ68mLcfw0e9geiR3R0nyM5kryn2pu4zVSheRxT92Wi-z4zIuwK00XWAhDFdgzr7dQq5w03qph-KK2qhOIda1xq-BH9bpRgUCwCzQYFX3IjCf5KDUFP8orE1MwvjcYeefp=w728-h298-k-no""},{""title"":""Street View \u0026 360°"",""image"":""https://streetviewpixels-pa.googleapis.com/v1/thumbnail?panoid=TayqM7qRvsbg7DpbdQ7Ndw\u0026cb_client=maps_sv.tactile.gps\u0026w=224\u0026h=298\u0026yaw=355.96265\u0026pitch=0\u0026thumbfov=100""}]",null,null,"{""link"":"""",""source"":""""}","{""id"":""111588757735942848786"",""name"":""Amherst Roofing \u0026 Sheet Metal (Owner)"",""link"":""https://www.google.com/maps/contrib/111588757735942848786""}","{""borough"":""Rideau Heights"",""street"":""177 Hickson Ave"",""city"":""Kingston"",""postal_code"":""K7K 2N8"",""state"":""Ontario"",""country"":""CA""}",null,"[{""Name"":""Wicked VW’s"",""ProfilePicture"":""https://lh3.googleusercontent.com/a-/ALV-UjVs3_nQ0-2dPbCxLO3YgL9JJ8lg896xNevTFcT_62rHbaXl5g0g=s120-c-rp-mo-ba2-br100"",""Rating"":1,""Description"":""AVOID THIS COMPANY\nCalled 3 or 4 companies for an emergency repair. Amherst Roofing was the first to respond so we went ahead. Rate was $85/hour for 2 men (total of $170 + taxes per hour).  Our bill was for almost $10,000, of which $2500 was for materials. I called to complain and the owner explained that I was paying for the workers to drive to get materials. That's almost $200 per hour (with taxes) for 2 guys to run back and forth for materials.\nTo be reasonable, let's assume that 2 men worked 6 hours per day on site for 4 days = 48 hours. (They did not work that many  hours...We were home. The first day, two men were here for about 2-1/2 hours, then left for materials and didn't return that day. The same sort of thing happened the 2nd day... two men for a few hours than gone.)\nThere was no breakdown of costs whatsoever on the bill...nothing to say how many hours were spent on site; no description of the work done; no list of materials.\nTo be reasonable, let's assume that 2 men worked 6 hours per day on site for 4 days = 48 hours. The bill was for 76 hours. That means that they charged for 2 men for 9-1/2 hours per day for 4 days.\nNow I recently called them back because the problem was not 100% resolved. They arrived, looked up and agreed there was something not quite right. Let's say that visit lasted 30 minutes.\nToday I received a bill for almost $400 for that visit. So let's get this straight... they want $400 to visit and confirm that something is still not right. They want to do the repair in the spring. Well that's not going to happen."",""Images"":null,""When"":""""},{""Name"":""Adam Rayner"",""ProfilePicture"":""https://lh3.googleusercontent.com/a-/ALV-UjUXpsbcNm-Pgi_dp9taY5wQxpajMnxRtZYL2XNACKPgVSMRkVfv=s120-c-rp-mo-ba3-br100"",""Rating"":1,""Description"":""I called twice for a flat roof and never heard back either time about quoting a flat roof project even though they promised they would be out to look at the job, no show, no response means someone else got the job."",""Images"":null,""When"":""""},{""Name"":""Mathieu Hamelin"",""ProfilePicture"":""https://lh3.googleusercontent.com/a-/ALV-UjU_HjCRyC8qigxUlNw6U1agop99Hv8bs7Wzm8luvosTYqJb6riM=s120-c-rp-mo-br100"",""Rating"":1,""Description"":""Disgusting company who leave their garbage all over the propriety"",""Images"":[""www.google.com/local/imagery/report/?cb_client=maps_sv.tactile\u0026image_key=!1e10!2sCIHM0ogKEICAgID6nvGp_wE\u0026fid=0x0:0xbc9f6fb8073e9fe""],""When"":""2021-9-30""},{""Name"":""John Smith"",""ProfilePicture"":""https://lh3.googleusercontent.com/a/ACg8ocLCyfkc2UxcN_0i3Xrrykm-EECrppbzegrZScc1W8dZGJs_8Q=s120-c-rp-mo-br100"",""Rating"":1,""Description"":""To keep it brief the company should be investigated for safety violations considering they work without proper safety equipment and don’t follow health and safety procedures"",""Images"":null,""When"":""""},{""Name"":""Hunter Mcginn"",""ProfilePicture"":""https://lh3.googleusercontent.com/a-/ALV-UjUYx6AZAKGS9PiBycHWveaGcf485dABAqo9UOIvjiJ9ToNs7qW8=s120-c-rp-mo-br100"",""Rating"":5,""Description"":""Great company"",""Images"":null,""When"":""""},{""Name"":""jasON PIMENTEL"",""ProfilePicture"":""https://lh3.googleusercontent.com/a/ACg8ocIuh9FU5eQZt0O7TuU8GXaK0M4K3Jr-UIkfe6pJZ1hdeYpWnw=s120-c-rp-mo-ba2-br100"",""Rating"":1,""Description"":""Sloppy workmanship..old outdated roofing processes."",""Images"":null,""When"":""""},{""Name"":""Laura Moberly"",""ProfilePicture"":""https://lh3.googleusercontent.com/a/ACg8ocIx9I6-SFf2aTz91SjAGiZeeoLouN8dakZPOFbniXBOhQ4c4A=s120-c-rp-mo-br100"",""Rating"":1,""Description"":"""",""Images"":null,""When"":""""},{""Name"":""marnie I"",""ProfilePicture"":""https://lh3.googleusercontent.com/a/ACg8ocIhTyXuXHwyVfXd-yitujQD8prsXxIq9TptHCW0cLVfA4vojv8=s120-c-rp-mo-br100"",""Rating"":5,""Description"":"""",""Images"":null,""When"":""""}]",null,
ffd001f2-cfc6-4064-b03f-f9635a967d8f,https://www.google.com/maps/place/Gable+2+Gable+Renovations+Inc/data=!4m7!3m6!1s0x4cd2ad314226a73f:0x5909a465243b5d34!8m2!3d44.2529462!4d-76.556746!16s%2Fg%2F11ykxcqdbp!19sChIJP6cmQjGt0kwRNF07JGWkCVk?authuser=0&hl=en&rclk=1,Gable 2 Gable Renovations Inc,Roofing contractor,"786 Littlestone Crescent, Kingston, ON K7M 8L6","{""Friday"":[""Open 24 hours""],""Monday"":[""Open 24 hours""],""Saturday"":[""Open 24 hours""],""Sunday"":[""Open 24 hours""],""Thursday"":[""Open 24 hours""],""Tuesday"":[""Open 24 hours""],""Wednesday"":[""Open 24 hours""]}",{},https://www.gable2gable.ca/,(613) 572-3258,"7C3V+58 Kingston, Ontario",10,5.000000,"{""1"":0,""2"":0,""3"":0,""4"":0,""5"":10}",44.252946,-76.556746,6415839898472504628,,,,https://lh3.googleusercontent.com/gps-cs-s/AHVAweqdtYgQA1iM3JhD7Q7S8JIM-H-4k11o2vq24pBHhG9FG-lP16csunBt6ioEB_RrfWIele-gwRus8MtQpAEaAR6yCBCtHIVUqGenjeQW0f7LFSXST9Ggj5LNX_UToLGnHC2U26H82Gj2feEk=w450-h240-k-no,America/Toronto,,0x4cd2ad314226a73f:0x5909a465243b5d34,ChIJP6cmQjGt0kwRNF07JGWkCVk,"[{""title"":""All"",""image"":""https://lh3.googleusercontent.com/gps-cs-s/AHVAweqdtYgQA1iM3JhD7Q7S8JIM-H-4k11o2vq24pBHhG9FG-lP16csunBt6ioEB_RrfWIele-gwRus8MtQpAEaAR6yCBCtHIVUqGenjeQW0f7LFSXST9Ggj5LNX_UToLGnHC2U26H82Gj2feEk=w559-h298-k-no""},{""title"":""House"",""image"":""https://lh3.googleusercontent.com/gps-cs-s/AHVAweoVuFF4U-2FGuOCZWJZsmkmd8MHoSrKHW3hjhRchh_ZNMdgKKd1FwM-xa3xvkoCR9-y-Sr_PKtDbD-GpQem7XVJ5hU2jC2Lud2NzwbTnSTJqkIn180a-oBS83O5cYlTmNESQujqQKzqQ54=w559-h298-k-no""},{""title"":""By owner"",""image"":""https://lh3.googleusercontent.com/gps-cs-s/AHVAweqLT52cdDhkWWUqIxuLg7H1u54emD3LBeI-_Gy9GwBFo0o3cis2wILB7IwkYiC_IDFExMLQf2tQNOizV9Ks9xORHPL90eBZvi2iisRocILZhzaiw9bXzBj89JiNap1Fvtwd2KNrMcn6r5A=w559-h298-k-no""},{""title"":""Street View \u0026 360°"",""image"":""https://streetviewpixels-pa.googleapis.com/v1/thumbnail?panoid=3PWvApKWWIav1IWzjrkUxg\u0026cb_client=maps_sv.tactile.gps\u0026w=224\u0026h=298\u0026yaw=62.21453\u0026pitch=0\u0026thumbfov=100""}]",null,"[{""link"":""https://www.gable2gable.ca/"",""source"":""gable2gable.ca""}]","{""link"":"""",""source"":""""}","{""id"":""110026503248360004633"",""name"":""Gable 2 Gable Renovations Inc (Owner)"",""link"":""https://www.google.com/maps/contrib/110026503248360004633""}","{""borough"":"""",""street"":""786 Littlestone Crescent"",""city"":""Kingston"",""postal_code"":""K7M 8L6"",""state"":""Ontario"",""country"":""CA""}",null,"[{""Name"":""Taro Alps"",""ProfilePicture"":""https://lh3.googleusercontent.com/a/ACg8ocJEufQQwfBHghgqZS4in1w5z49IQE7MtVogwlHgY6YK153Ftw=s120-c-rp-mo-br100"",""Rating"":5,""Description"":""Gable 2 Gable has done excellent work, they did my whole roof and recently fixed \u0026 replaced a fascia. They provide a very competitive quote and show up and do the work exactly when they say they will.  I find their response to be quick and the work done is excellent!  They stand by their work and provide a guarantee on everything they do.\n\nFor any roofing work or issues I will always contact and use Gable 2 Gable as they are very reliable.  Many thanks!!!"",""Images"":null,""When"":""""},{""Name"":""Jeff Smith"",""ProfilePicture"":""https://lh3.googleusercontent.com/a/ACg8ocJW7fyFVgntq3T02hIb5iPLZwh5eZMm0hMtW11YVHDkEpUQWQ=s120-c-rp-mo-ba3-br100"",""Rating"":5,""Description"":""I hired Matthew from Gable 2 Gable to do my roof and the quality of work is fantastic.  They did a great clean up job as well which was much appreciated. Exceptional service and warranty. They have since done my sister, grandmother and friends roof as well. Would definitely recommend their services."",""Images"":null,""When"":""""},{""Name"":""Marc Xuereb"",""ProfilePicture"":""https://lh3.googleusercontent.com/a-/ALV-UjWUdRD_EiSdEI0kcDdfce2XrfUP-bEQB0yioVrEQ4Y48hadyj8=s120-c-rp-mo-ba3-br100"",""Rating"":5,""Description"":""I was lucky to find Matt and G2G Renovations when I was looking to fix my eavestroughs and put gutter guards on them. We had over-the-top sell jobs from other eavestrough companies who claimed only their technology would keep leaves out of our gutters, and who charged big bucks for it. Luckily, Gable 2 Gable came through with a reasonable price and quality work in a very short time. We're very happy with their work."",""Images"":null,""When"":""""},{""Name"":""Jason Mellon"",""ProfilePicture"":""https://lh3.googleusercontent.com/a-/ALV-UjUVOZcTCcmpWrrgSFDSYG8SpksK4unyfKnuRT5UeR8TbX1rWt4=s120-c-rp-mo-br100"",""Rating"":5,""Description"":""Gable 2 Gable made everything so much more tolerable. They provided excellent service and affordable pricing. They were prompt and provided quality service. Our roof is still going strong years later"",""Images"":null,""When"":""""},{""Name"":""Charles Lapointe"",""ProfilePicture"":""https://lh3.googleusercontent.com/a-/ALV-UjXj0dq-U730QUOR4XD-ewRPMUnUS781C_PRoQir0wErFYW6AaM=s120-c-rp-mo-br100"",""Rating"":5,""Description"":""I found Matt and his crew to be knowledgable, dependable, courteous and professional. The prices are within the norm, but where they shine is in execution. Their work is impeccable. Bottom line is that I feel they've given me more than I've paid for. I trust their advice and the scope of work they suggest. Thank you for your service, Matt."",""Images"":null,""When"":""""},{""Name"":""Nathanael Morrison"",""ProfilePicture"":""https://lh3.googleusercontent.com/a-/ALV-UjW1-qoqX7pnZxzL2h6x8ZZ80WpSNhOWCWlSW6B0pFYRHGjgr0Fn=s120-c-rp-mo-br100"",""Rating"":5,""Description"":""Noticed a roof leak from within my attic and contacted Gable 2 Gable to have it looked at. Was extremely impressed with how quickly they were to respond and resolve the issue. They were knowledgeable, friendly and on time."",""Images"":null,""When"":""""},{""Name"":""Sigi Scholten"",""ProfilePicture"":""https://lh3.googleusercontent.com/a-/ALV-UjWzOQTYYOQeKSfUuNn1buoiDoeWnFEQRinaYXXx3DacnI4ed2c=s120-c-rp-mo-br100"",""Rating"":5,""Description"":""Gable to Gable has done a fabulous job - they got quickly back to my request, gave me an honest and fair estimate , communicated well and they have done the job well and promptly. Thank you very much Matt and team!"",""Images"":null,""When"":""""},{""Name"":""Peter V"",""ProfilePicture"":""https://lh3.googleusercontent.com/a/ACg8ocJcZxnd4RO59cRkzt5W8AQHWAUP9jgo0TNQkdNU86yV9lbVuw=s120-c-rp-mo-ba2-br100"",""Rating"":5,""Description"":""Matt and his team did a great job. The house is a historic century home with multiple turrets and a complicated roofline. The work was meticulous, on time and on budget.  Thanks Matt !!"",""Images"":null,""When"":""""}]",null,
