input_id,link,title,category,address,open_hours,popular_times,website,phone,plus_code,review_count,review_rating,reviews_per_rating,latitude,longitude,cid,status,descriptions,reviews_link,thumbnail,timezone,price_range,data_id,place_id,images,reservations,order_online,menu,owner,complete_address,about,user_reviews,user_reviews_extended,emails
018538ff-ac2c-4357-938d-a3e7cd5d73f1,https://www.google.com/maps/place/GTA+Vertical+Roofing+INC/data=!4m7!3m6!1s0x882b2b6bdb28aabb:0xa132e22bf50c8b8e!8m2!3d43.8520942!4d-79.432423!16s%2Fg%2F11j3mvf6ks!19sChIJu6oo22srK4gRjosM9SviMqE?authuser=0&hl=en&rclk=1,GTA Vertical Roofing INC,Roofing contractor,"9205 Yonge St #1301, Richmond Hill, ON L4C 1V5","{""Friday"":[""7 a.m.–7 p.m.""],""Monday"":[""7 a.m.–7 p.m.""],""Saturday"":[""8 a.m.–5 p.m.""],""Sunday"":[""10 a.m.–4 p.m.""],""Thursday"":[""7 a.m.–7 p.m.""],""Tuesday"":[""7 a.m.–7 p.m.""],""Wednesday"":[""7 a.m.–7 p.m.""]}",{},https://verticalroofing.ca/,(437) 985-5575,"VH29+R2 Richmond Hill, Ontario",7,5.000000,"{""1"":0,""2"":0,""3"":0,""4"":0,""5"":7}",43.852094,-79.432423,11615595067364641678,,,,https://lh3.googleusercontent.com/gps-cs-s/AHVAwepz8y35U9f9Rdk8Z4-ZGzZCPqF4RL4cmmIn6BZdnUco-bdQbnNTjuBMXqs-nHGTPiG09VYpmOeIESai8qHRRfnq1V5YRdnF3X-NpzlHE2EVe6ofv-957uBBXuh2JnF2G22DvS_6AEKmFhJ0=w426-h240-k-no,America/Toronto,,0x882b2b6bdb28aabb:0xa132e22bf50c8b8e,ChIJu6oo22srK4gRjosM9SviMqE,"[{""title"":""All"",""image"":""https://lh3.googleusercontent.com/gps-cs-s/AHVAwepz8y35U9f9Rdk8Z4-ZGzZCPqF4RL4cmmIn6BZdnUco-bdQbnNTjuBMXqs-nHGTPiG09VYpmOeIESai8qHRRfnq1V5YRdnF3X-NpzlHE2EVe6ofv-957uBBXuh2JnF2G22DvS_6AEKmFhJ0=w529-h298-k-no""},{""title"":""Exterior"",""image"":""https://lh3.googleusercontent.com/gps-cs-s/AHVAweo_dGWcmdfgYDvTFzAPrLj29bzQQ7PqcYJEo2XnoijmTCAWUoZqn1yGNhTHGRv2d1inpCyCYUzsCHEoJmjUslGmZHu5lkqvWiPtONHYsvLpBVrWmtRqq0yTAaobzzqMAqMvepKlRW2MUuTz=w395-h298-k-no""},{""title"":""Videos"",""image"":""https://lh3.googleusercontent.com/gps-cs-s/AHVAwepILNyQFAfZ9T_PMEhR01ChQaoshh8cSbpkQIpdJgWoUvKvzUQK8CjswgMwFl4TiaNwpIs1F98icYjsFhK2vn_ydZWp9Bdhiqg8Zsw1_X_fSeyCQWQKPbAdS8xAmxoCfhqHddl8ws7atNbA=w224-h398-k-no""},{""title"":""House"",""image"":""https://lh3.googleusercontent.com/gps-cs-s/AHVAweo594MaoKw1w0DlHxXMGU3br5HalQLBDj-86kL8aRMqGGbKY5mDZGGo6o4qP1rEFKjbVU-iRlFiqYYeH8ttSMdxwuBvf3cchYrGuHjAOtPTSIhhjpM3V9n8RLcKb41vOw-j-o13k_1jePUC=w224-h298-k-no""},{""title"":""Roof shingle"",""image"":""https://lh3.googleusercontent.com/gps-cs-s/AHVAwerDT3leUKidaMYJTSzr_4PcfoxYo_J4CEKPd1z2ZoAm7abqv4lSuUqYdIM166QkDe1IHkKgJWLg2L6oNq6CJsFT7Ny-yU76p2vUHQQO7yeK5oXys4WjdkCHp89iJHVDB0Bc5ph4kQ=w224-h298-k-no""},{""title"":""By owner"",""image"":""https://lh3.googleusercontent.com/gps-cs-s/AHVAwern58KMZrp7AoGnTZcrl-IEpxvD4gTkrGlAGoNspppr5zCN4bPrXIV10UqjJdzVfQcDfA8eVIsjjXqSQwlu6FULW3n_xqR4HsG-4YSUNRxTnTtmw7Fja3Od_XauOBlFoZniq1uO=w224-h398-k-no""},{""title"":""Street View \u0026 360°"",""image"":""https://streetviewpixels-pa.googleapis.com/v1/thumbnail?panoid=bfZ7zHWjQZH-vs8IV-3Xwg\u0026cb_client=maps_sv.tactile.gps\u0026w=224\u0026h=298\u0026yaw=94.5579\u0026pitch=0\u0026thumbfov=100""}]",null,null,"{""link"":"""",""source"":""""}","{""id"":""109314778463044917811"",""name"":""GTA Vertical Roofing INC (Owner)"",""link"":""https://www.google.com/maps/contrib/109314778463044917811""}","{""borough"":""Bayview Glen"",""street"":""9205 Yonge St #1301"",""city"":""Richmond Hill"",""postal_code"":""L4C 1V5"",""state"":""Ontario"",""country"":""CA""}","[{""id"":""service_options"",""name"":""Service options"",""options"":[{""name"":""Onsite services"",""enabled"":true}]},{""id"":""accessibility"",""name"":""Accessibility"",""options"":[{""name"":""Wheelchair-accessible parking lot"",""enabled"":true}]}]","[{""Name"":""Alina Yatsentiuk"",""ProfilePicture"":""https://lh3.googleusercontent.com/a-/ALV-UjVu2hmNTbJSO7YznpGvnPfJlXsHPhHDzJQFgeJ8zdbiW2u7eTIBXw=s120-c-rp-mo-ba3-br100"",""Rating"":5,""Description"":""I’ve been working with GTA Vertical Roofing every year for roof maintenance and recently during renovations to install bathroom exhaust vents. Always very happy with the results! They are professional, reliable, and easy to communicate with. Highly recommend them for anyone needing roof repair or replacement in Richmond Hill and the GTA."",""Images"":[""www.google.com/local/imagery/report/?cb_client=maps_sv.tactile\u0026image_key=!1e10!2sCIABIhBMNlWvHIGDi8rx9Vokm4pK\u0026fid=0x0:0xa132e22bf50c8b8e""],""When"":""2025-8-31""},{""Name"":""Jay Mvx"",""ProfilePicture"":""https://lh3.googleusercontent.com/a/ACg8ocJAub2BGrWDdZ5Mmby7AKfbRTwsF1vib1foxra0gtYfu4ZKhA=s120-c-rp-mo-ba3-br100"",""Rating"":5,""Description"":""We recently hired Vertical Roofing to restore the roof at our parents’ home in Thornhill, and the experience was excellent from start to finish. Their roofing team carefully cut out and replaced the damaged, rotten plywood sheathing before installing brand-new shingles. The workmanship was top-notch, and it’s clear they used high-quality materials designed for durability and long-lasting protection.\n\nIf you’re looking for a roof repair or roof replacement company in Thornhill or the GTA, Vertical Roofing is the team to call. They were punctual, professional, and efficient, and they left the property spotless once the project was completed. We now have peace of mind knowing that the home is fully protected with a reliable new roof.\n\nWe highly recommend Vertical Roofing to anyone in Thornhill, Vaughan, Richmond Hill, or across Toronto who needs dependable roofing services. Their expertise, attention to detail, and commitment to customer satisfaction truly set them apart from other roofing contractors."",""Images"":[""www.google.com/local/imagery/report/?cb_client=maps_sv.tactile\u0026image_key=!1e10!2sCIABIhDfdydQaqdPAwfdVtdQV4q0\u0026fid=0x0:0xa132e22bf50c8b8e""],""When"":""2025-8-31""},{""Name"":""Tamara Rozumenko"",""ProfilePicture"":""https://lh3.googleusercontent.com/a/ACg8ocJ2OSLs_s20xjFPMjmFJaGz5qEO9vleyg5pS9q6RCVbIvaMcQ=s120-c-rp-mo-br100"",""Rating"":5,""Description"":""Hello everyone! I just wanted to share about my recent experience with GRA Vertical Roofing.\n\nGTA Vertical Roofing did an amazing job with our roof maintenance, roof repair, and leaf guards installation in Richmond Hill. Their team was professional, friendly, and provided excellent gutter protection at a fair price. We highly recommend them for any roofing services in Richmond Hill and the GTA!"",""Images"":[""www.google.com/local/imagery/report/?cb_client=maps_sv.tactile\u0026image_key=!1e10!2sCIABIhDu1RdDj6ElainNXDCIAk8p\u0026fid=0x0:0xa132e22bf50c8b8e""],""When"":""2025-8-4""},{""Name"":""Andrii Kudlak"",""ProfilePicture"":""https://lh3.googleusercontent.com/a-/ALV-UjVPGcg8bhHfvvxkJjs0z9FkuEfBsmlEov4gckosx_0Ejt2jPFE=s120-c-rp-mo-br100"",""Rating"":5,""Description"":""Thank you to GTA Vertical Roofing for the excellent roof maintenance service and the installation of  leaf guards on our home.\n\nHighly recommend them if you’re looking for roof repair or leaf guard installation. Great service and fair pricing!\nWill definitely call them again for any roofing needs in the future."",""Images"":null,""When"":""""},{""Name"":""NITIN PATEL"",""ProfilePicture"":""https://lh3.googleusercontent.com/a/ACg8ocLfnfb51ai48tT1FDC4a-IPwUmZkdZKWdsEAl_6yZy8fepNZA=s120-c-rp-mo-br100"",""Rating"":5,""Description"":""I have just availed their services for gutter cleaning this morning. Fantastic services from all aspects: prompt, punctual, professional, transparent, fair price and most importantly very reliable services.\n\nDefinitely recommend GTA vertical roofing INC.."",""Images"":null,""When"":""""},{""Name"":""Brad Kitchen"",""ProfilePicture"":""https://lh3.googleusercontent.com/a-/ALV-UjUeVkZ8-cVJMMtQ-vHI77Rzbh0HLgzjTJH60wUW-Cer0RYfpMyE=s120-c-rp-mo-br100"",""Rating"":5,""Description"":""Thanks for the thorough and informative service Vlad!  Will call again when the need arises!"",""Images"":null,""When"":""""},{""Name"":""Westway Group Canada Inc."",""ProfilePicture"":""https://lh3.googleusercontent.com/a-/ALV-UjXkZdf1HTI2qQd2x5kIMwcumzLKCeO5mNVTxlcISUuzYCFPLiGH=s120-c-rp-mo-ba2-br100"",""Rating"":5,""Description"":""Excellent job by professional team. Thank you Vlad !"",""Images"":null,""When"":""""}]",null,
018538ff-ac2c-4357-938d-a3e7cd5d73f1,https://www.google.com/maps/place/Richmond+Hill+Roofing+Inc/data=!4m7!3m6!1s0x882b2a62b11de999:0xd166d4d05e9ed8c9!8m2!3d43.8992373!4d-79.426752!16s%2Fg%2F1thw2sbw!19sChIJmekdsWIqK4gRydieXtDUZtE?authuser=0&hl=en&rclk=1,Richmond Hill Roofing Inc,Roofing contractor,"54 Cougar Ct, Richmond Hill, ON L4S 1H7","{""Friday"":[""7 a.m.–6 p.m.""],""Monday"":[""7 a.m.–6 p.m.""],""Saturday"":[""8 a.m.–4 p.m.""],""Sunday"":[""Closed""],""Thursday"":[""7 a.m.–6 p.m.""],""Tuesday"":[""7 a.m.–6 p.m.""],""Wednesday"":[""7 a.m.–6 p.m.""]}",{},http://www.richmondhillroofing.com/,(905) 883-8673,"VHXF+M7 Richmond Hill, Ontario",21,5.000000,"{""1"":0,""2"":0,""3"":0,""4"":0,""5"":21}",43.899237,-79.426752,15088981592957180105,,,,https://streetviewpixels-pa.googleapis.com/v1/thumbnail?panoid=3BN0BfhaTVl5UvCK9MkN1g&cb_client=search.gws-prod.gps&w=408&h=240&yaw=310.9982&pitch=0&thumbfov=100,America/Toronto,,0x882b2a62b11de999:0xd166d4d05e9ed8c9,ChIJmekdsWIqK4gRydieXtDUZtE,"[{""title"":""All"",""image"":""https://streetviewpixels-pa.googleapis.com/v1/thumbnail?panoid=3BN0BfhaTVl5UvCK9MkN1g\u0026cb_client=maps_sv.tactile.gps\u0026w=224\u0026h=298\u0026yaw=310.9982\u0026pitch=0\u0026thumbfov=100""},{""title"":""Street View \u0026 360°"",""image"":""https://streetviewpixels-pa.googleapis.com/v1/thumbnail?panoid=3BN0BfhaTVl5UvCK9MkN1g\u0026cb_client=maps_sv.tactile.gps\u0026w=224\u0026h=298\u0026yaw=310.9982\u0026pitch=0\u0026thumbfov=100""}]",null,null,"{""link"":"""",""source"":""""}","{""id"":""118213358499769456003"",""name"":""Richmond Hill Roofing Inc (Owner)"",""link"":""https://www.google.com/maps/contrib/118213358499769456003""}","{""borough"":"""",""street"":""54 Cougar Ct"",""city"":""Richmond Hill"",""postal_code"":""L4S 1H7"",""state"":""Ontario"",""country"":""CA""}",null,"[{""Name"":""Joanne Daly-Wilson"",""ProfilePicture"":""https://lh3.googleusercontent.com/a/ACg8ocJiPle_NSrU2mBEbOtaM03MunqgS1C0SmQhqf9w2jwMLxFeyg=s120-c-rp-mo-br100"",""Rating"":5,""Description"":""We had our roof done 20 years ago by Rocky and his team.  They did such a great job that we called them again for our latest job.  Quick and very efficient.  Tarps were placed down to catch all debris and they cleaned up afterwards and wouldn’t have even known they had been.  Highly recommend."",""Images"":null,""When"":""""},{""Name"":""M P"",""ProfilePicture"":""https://lh3.googleusercontent.com/a/ACg8ocIUzfhctdhX0LvFIWIVM5ZpdvXy-ovi3H_NFUqZIYkaBoueFA=s120-c-rp-mo-br100"",""Rating"":5,""Description"":""We had an emergency situation with some damaged roof tiles at our home in North York, and Rocky was incredibly prompt both in responding to our questions over the phone, and visiting our home to assess the work to be completed.\n\nRocky made time to visit us the very next day, and upon looking at our roof, he was able to complete the work right there and then!!!\n\nCost was very, very reasonable, and we were super pleased all around with our experience.\n\nRocky was extremely polite, courteous and informative….. he provided pictures of the work he had done for our records, and we were delighted.\n\nWould recommend Rocky and Richmond Hill Roofing to anyone."",""Images"":null,""When"":""""},{""Name"":""Joan Klaassen"",""ProfilePicture"":""https://lh3.googleusercontent.com/a/ACg8ocI18T42ks6xLfsgC2Ep3zzn22kggLVikYJcAB8wrIWcaVFFrQ=s120-c-rp-mo-br100"",""Rating"":5,""Description"":""We needed a new roof installed on our back split home, but wanted to ensure that we hired a quality professional for the job.  After reading very positive online reviews for Richmond Hill Roofing Inc, my husband and I called them for an estimate.  Rocky, co-owner of the company with his brother Gary, was very prompt to respond to our request, did a detailed inspection of the roof, thoroughly answered all of our questions and provided a detailed quote for the roof install.  Our roof was installed last week and we are very happy with it!  His crew are excellent workers, arrive and finish on time promised, and are very friendly and professional as well (just like Rocky).  We wouldn't hesitate to use their company again!"",""Images"":null,""When"":""""},{""Name"":""Jeff Gastman"",""ProfilePicture"":""https://lh3.googleusercontent.com/a/ACg8ocLT1kCayXxdky0yMUysHzqkhiCKm4x9n5tkNFxBRjnN0j7jhA=s120-c-rp-mo-ba3-br100"",""Rating"":5,""Description"":""Friends of ours put us in touch with Rocky from Richmond Hill Roofing. Rocky came by to have a look at our roof and told my wife our shingles were still in good shape and didn't need to be replaced at this time. It's nice to deal with someone who is honest. Previously, we had another roofer come by to look at the roof, and he said it needed replacement and gave us a very cheap quote, but based on very negative reviews, we decided to get someone else to have a look. Thankfully, it was Rocky, and we can wait a few more years to have the roof done. We will definitely reach out to Rocky when the time comes."",""Images"":null,""When"":""""},{""Name"":""Mike Omalley"",""ProfilePicture"":""https://lh3.googleusercontent.com/a/ACg8ocJVVakl_kkgvzFJaulfMiMNcJfQBZzBq-UuyTYshfI88mexeA=s120-c-rp-mo-ba4-br100"",""Rating"":5,""Description"":""Many thanks to Rocky and his crew, even though we’re in Brampton we reached out to Rocky when our roof started leaking, he came that day and was able to give us a quote, and had the work done in a great turnaround time. His workers were extremely professional and had the entire roof done in 5 hours. Great job and great people would highly recommend them.\nMany thanks Rocky and Richmond Hill Roofing.\nMike \u0026 Kim O’Malley"",""Images"":null,""When"":""""},{""Name"":""Deborah Climans"",""ProfilePicture"":""https://lh3.googleusercontent.com/a/ACg8ocLtrqMxXrO7QntwEv9llN9Bn2sZTPevQXA3nOz6y3JqXqfB0A=s120-c-rp-mo-br100"",""Rating"":5,""Description"":""I highly recommend Rocky, Gary and their team at Richmond Hill Roofing. They did my roof a long time ago, so when it came time to do it again, there was no question in my mind about hiring them. Rocky and Gary are the most honest, hard working guys that I’ve ever met. They and their team did a stellar job. Feel free to contact me if you need any further info. It is rare to find people and a company with this level of expertise and that goes above and beyond to satisfy their customers."",""Images"":null,""When"":""""},{""Name"":""Tina Peach"",""ProfilePicture"":""https://lh3.googleusercontent.com/a-/ALV-UjUPLB71NQrOVXbS52kd33yx1s0Ixw32hGs0B4r2UU2K4mEIifM=s120-c-rp-mo-br100"",""Rating"":5,""Description"":""When our roof was last done 20 years ago by Richmond Hill Roofing, we didn't imagine it would hold up so well for so long, but it definitely did. So when it was time to replace the roof on our house and garage recently, there was never any thought of going with anyone else, even after all these years.  Rocky and his team were fantastic (again) from start to finish. Prompt visit to view \u0026 quote, scheduled very quickly, team arrived early and ready to go. No shortage of hands with a good sized team to ensure the work was not dragged out. Everyone worked extremely hard, and with no shortcuts taken or corners cut,. Ensuring not only was the job completed same day, but that it was done with very high standards. We would never hesitate to recommend Richmond Hill Roofing to anyone, and have actually just done so!"",""Images"":null,""When"":""""},{""Name"":""Einas Karram"",""ProfilePicture"":""https://lh3.googleusercontent.com/a/ACg8ocJ9kRLp5E09fhZGpXMFtUQujT410Z_1xXP2GOrLRZLp0wLALg=s120-c-rp-mo-br100"",""Rating"":5,""Description"":""Thank you so much to the Richmond Hill Roofing Inc. team for providing such wonderful service. I recommend Rocky and his team for anyone needing roof repairs or upgrades, you will be in good hands. The service was fast (same day estimate for eavestrough and shingle repair), and repairs done next day at a very reasonable rate, in addition to being very friendly and professional."",""Images"":null,""When"":""""}]",null,
