input_id,link,title,category,address,open_hours,popular_times,website,phone,plus_code,review_count,review_rating,reviews_per_rating,latitude,longitude,cid,status,descriptions,reviews_link,thumbnail,timezone,price_range,data_id,place_id,images,reservations,order_online,menu,owner,complete_address,about,user_reviews,user_reviews_extended,emails
d44c9849-c073-46d3-8375-af63f1dff00a,https://www.google.com/maps/place/Regan+Roofing+Ltd/data=!4m7!3m6!1s0x548674f0327dcdc5:0x53928bc79929ab79!8m2!3d49.2058516!4d-123.1222123!16s%2Fg%2F1tfqqn3s!19sChIJxc19MvB0hlQReaspmceLklM?authuser=0&hl=en&rclk=1,Regan Roofing Ltd,Roofing contractor,"8838 Heather St, Vancouver, BC V6P 3S8","{""Friday"":[""8 a.m.–6 p.m.""],""Monday"":[""8 a.m.–6 p.m.""],""Saturday"":[""Closed""],""Sunday"":[""Closed""],""Thursday"":[""8 a.m.–6 p.m.""],""Tuesday"":[""8 a.m.–6 p.m.""],""Wednesday"":[""8 a.m.–6 p.m.""]}",{},https://www.reganroofing.ca/,(604) 324-1574,"6V4H+84 Vancouver, British Columbia",11,4.600000,"{""1"":1,""2"":0,""3"":0,""4"":0,""5"":10}",49.205852,-123.122212,6022029341132172153,,,,https://lh3.googleusercontent.com/gps-cs-s/AHVAweq_sYfxvWvTrIGR2J_kpwBwfW6W_8JHKje9WJKAHV-O86A_YtzqWEQz-2gCp3D_1Es-jLfHueAMRvVisq8y_Nr5v4VXUKasPdZatsFSasx5LSfI6lw6mom55ra3XZflhRg3hnVP=w609-h240-k-no,America/Vancouver,,0x548674f0327dcdc5:0x53928bc79929ab79,ChIJxc19MvB0hlQReaspmceLklM,"[{""title"":""All"",""image"":""https://lh3.googleusercontent.com/gps-cs-s/AHVAweq_sYfxvWvTrIGR2J_kpwBwfW6W_8JHKje9WJKAHV-O86A_YtzqWEQz-2gCp3D_1Es-jLfHueAMRvVisq8y_Nr5v4VXUKasPdZatsFSasx5LSfI6lw6mom55ra3XZflhRg3hnVP=w756-h298-k-no""},{""title"":""Exterior"",""image"":""https://lh3.googleusercontent.com/gps-cs-s/AHVAweqmLGu2f0uEs-RAZc0gB1SNdYa1C9qNz_OhkId1QHNlXZrmh5M7KkzFYc7Hjniz5S5C5bD_KKSj87026kf9j4VEcKZMd4L8iwebJ4Uh-i8OsIkqRPI8ixchiJPo9l0-xLTfrPI4=w224-h298-k-no""},{""title"":""House"",""image"":""https://lh3.googleusercontent.com/gps-cs-s/AHVAweowUPnkio2khat-RDSM5TwRAqLuwqxqxfvIVjvnc9DIrlBZmIRYHnkT3ocr64KGfBZXjT9V9bSmE6wPuTJmDCeknOnnubFyXudnHs8VOsUoc3feeKtqevFxUGHNisbay0qIpdqU=w397-h298-k-no""},{""title"":""Roof shingle"",""image"":""https://lh3.googleusercontent.com/gps-cs-s/AHVAwer35uQIPbV7dl5WRWHZMaTCIQFUuF4wcQtQ19QeSsqGnAt4Bz4cBZSHQ34VirbY9S3r-qSrnqOdi0WrRhM4oNbdY0DKahWaOf1rvuNPgViSUlgeQdjJ0A9wWOoHCdRXs1zHx2ce=w397-h298-k-no""},{""title"":""By owner"",""image"":""https://lh3.googleusercontent.com/gps-cs-s/AHVAweqD9MAggiHBMu_NSzGWd4MD2VyjiyJCCm-a2nv58YdRUljcY7bsT1bLCMJFKpuextTD6Ykfq7yNTOtv7VOCXevFKC65XNhKS6aGULMhaWFb8frsgf6v5FZUHs7InzmoJplfDnAb=w224-h298-k-no""},{""title"":""Street View \u0026 360°"",""image"":""https://streetviewpixels-pa.googleapis.com/v1/thumbnail?panoid=aLYmtbgpkm76LfXn-nFYow\u0026cb_client=maps_sv.tactile.gps\u0026w=224\u0026h=298\u0026yaw=159.82831\u0026pitch=0\u0026thumbfov=100""}]",null,null,"{""link"":"""",""source"":""""}","{""id"":""111991593987979576374"",""name"":""Regan Roofing Ltd (Owner)"",""link"":""https://www.google.com/maps/contrib/111991593987979576374""}","{""borough"":""South Vancouver"",""street"":""8838 Heather St"",""city"":""Vancouver"",""postal_code"":""V6P 3S8"",""state"":""British Columbia"",""country"":""CA""}",null,"[{""Name"":""Helen Spiegelman"",""ProfilePicture"":""https://lh3.googleusercontent.com/a-/ALV-UjVJ1PCGKSa0pwNEKQax_cgt57oIAPKbQDQm4kqi9IU1pVvl2QyX=s120-c-rp-mo-br100"",""Rating"":5,""Description"":""This is the third house that we've had re-roofed by Regan Roofing. If we live long enough to have another house that needs a roof done, it will be by Regan Roofing. This company should give lessons. They were fitted out with impressive safety gear -- climbing harnesses and good boots. They started with an emergency visit before Christmas, sealing up a leak with a temporary tarp, and then they came back as soon as the snow cleared and did the job start to finish.  They did a complete job, scaling off the rotten tiles, catching them on tarps and stowing them in a bin. Then a layer of plywood, a layer of black waterproofing paper and the top layer of asphalt tiles. The crew was headed up by the owner, son of the founder who did our first roof. They were cheerful and friendly and worked long, hard and carefully every day until the job was done. The didn't quit until sunset and then did a meticulous clean-up in the dark! Hard work, well done! Thanks, guys!"",""Images"":[""www.google.com/local/imagery/report/?cb_client=maps_sv.tactile\u0026image_key=!1e10!2sCIHM0ogKEICAgICdtOyRAQ\u0026fid=0x0:0x53928bc79929ab79""],""When"":""2024-2-12""},{""Name"":""The Bigcheese"",""ProfilePicture"":""https://lh3.googleusercontent.com/a-/ALV-UjVnx-haaPT7IWsfNkX6yW1bYFs2IIIg8cMwssje27kQ0W-RpE4=s120-c-rp-mo-ba2-br100"",""Rating"":5,""Description"":""Excellent experience. Quote was very accurate. Tom (Project Manager) was very effieicent, friendly and communicative. The workers always arrived on time, were very pleasant and hard working. The job was completed within the estimated time frame. The job site was always left clean and tidy at the end of the day.\nWe were extremely pleased with Regan Roofing and would most highly recommend them."",""Images"":null,""When"":""""},{""Name"":""Thomas Hui"",""ProfilePicture"":""https://lh3.googleusercontent.com/a/ACg8ocJUNukCHfrpZmCUZhGvbb_5zum2m2-ZDQuJJ6RRiDurQcEU8g=s120-c-rp-mo-ba3-br100"",""Rating"":5,""Description"":""I have never post a review of a company I have not used their service, but I am already impressed with them.  I emailed Regan yesterday regarding my desire to have my clay tile roof repaired or replaced as some of the clay tiles are broken.  Tom Brown called me this morning, telling me that a clay tile roof should last forever so only a repair is necessary, and he recommended a roofing company specializing in it.  I am truly impressed with his professionalism."",""Images"":null,""When"":""""},{""Name"":""Jonathan Collins"",""ProfilePicture"":""https://lh3.googleusercontent.com/a/ACg8ocLwKx9MHAQ2-YvSVqGm6LwPbKrsjchnWtkwz9WZ8wXMfh2htA=s120-c-rp-mo-br100"",""Rating"":5,""Description"":""Regan Roofing was recommended to us by a neighbour, himself a respected figure in the construction business. I genuinely could not have been more delighted with our choice: Tyler was incredibly helpful, informative and responsive during the pre-installation phase, and he and his crew worked with an efficiency and dedication that got the entire project completed on budget and ahead of time. What's more, they were a real pleasure to be around whilst on site, and they accommodated a number of 'bespoke' requests such as a difficult custom blind installation with excellent results and zero hassle. Above all, we appreciated their almost forensic attention to tidiness: we genuinely wouldn't have known they'd been on site each day had we not seen them hard at work, such was the meticulousness of the clean-up operation each evening. Thank you so much Tyler, Richie and Gord; we really appreciated your hard work!"",""Images"":null,""When"":""""},{""Name"":""Brian Watts"",""ProfilePicture"":""https://lh3.googleusercontent.com/a-/ALV-UjVlVUhrXuck6zRMeJaTVurbrSukkTpK6UFoL4jSkj8Dbt2luzI=s120-c-rp-mo-br100"",""Rating"":5,""Description"":""I was delighted with Regan Roofing's work and responsiveness in assisting with a recent repair. The company replaced our roof in 2001 and it has been problem free until a minor leak this year. We received a quote and I followed up with Tyler on a Friday to schedule the work as heavy rains were expected. He contacted me the next day and came by on Saturday afternoon to repair the leak. Great service."",""Images"":null,""When"":""""},{""Name"":""Doug Kilburn"",""ProfilePicture"":""https://lh3.googleusercontent.com/a/ACg8ocLObix41-Vg1DrKypK2usB2bspMrQTaTbLMjypr1jEzgWGPFQ=s120-c-rp-mo-br100"",""Rating"":5,""Description"":""Regan Roofing did a first class job on our roof.  Tyler and his men worked flat out on our roof for three days. They cleaned up after each day's work, were very considerate of our needs.  They were great to have around and caused no damage to the garden. The roof looks fantastic!\n\nDoug and Jan Kilburn"",""Images"":null,""When"":""""},{""Name"":""D. Gibson"",""ProfilePicture"":""https://lh3.googleusercontent.com/a-/ALV-UjUSXQtOXEPf24iCSG5TPyKQsmVevqy_cigkRMwKhbNXrvS27u51=s120-c-rp-mo-ba2-br100"",""Rating"":5,""Description"":""Full disclosure, Tyler and Matt of Regan Roofing are acquaintances from high school. That being said, I would not have written this review if I was dissatisfied with their work.\n\nWe had Regan Roofing redo our ancient, leaky roof this summer. They are prompt and honest. The final cost was almost identical as the quote, which is not always the case with other contractors.\n\nTyler and Matt run a quality business and I would recommend them to anyone looking for a new roof."",""Images"":null,""When"":""""},{""Name"":""Trevor A"",""ProfilePicture"":""https://lh3.googleusercontent.com/a-/ALV-UjUIJl1Yj0y5JJWKMJIFP4aHEIcauB49lhEM0eqeZO-7svcnDb9i=s120-c-rp-mo-ba4-br100"",""Rating"":5,""Description"":""Regan Roofing was recommended to us by our neighbour, who'd used them a few years ago for roof repairs and were very impressed. I asked them to come for a roof inspection and was similarly impressed! Very professional and helpful."",""Images"":null,""When"":""""}]",null,
d44c9849-c073-46d3-8375-af63f1dff00a,https://www.google.com/maps/place/Continental+Roofing/data=!4m7!3m6!1s0x548675c5b54f3113:0xd70f97a2478bd8d2!8m2!3d49.130842!4d-123.016962!16s%2Fg%2F11bv6pbhqw!19sChIJEzFPtcV1hlQR0tiLR6KXD9c?authuser=0&hl=en&rclk=1,Continental Roofing,Roofing contractor,"7464 Hume Ave, Delta, BC V4G 1C5","{""Friday"":[""Open 24 hours""],""Monday"":[""Open 24 hours""],""Saturday"":[""Open 24 hours""],""Sunday"":[""Open 24 hours""],""Thursday"":[""Open 24 hours""],""Tuesday"":[""Open 24 hours""],""Wednesday"":[""Open 24 hours""]}",{},http://www.continentalroofing.com/,(604) 946-3011,"4XJM+86 Delta, British Columbia",36,3.800000,"{""1"":9,""2"":1,""3"":1,""4"":2,""5"":23}",49.130842,-123.016962,15496771566046009554,,,,https://lh3.googleusercontent.com/gps-cs-s/AHVAweqOYM6WohrXGYHDaUFkLOZMGE2136Y9cAULnk-OLaHgmCjSF8OnyhW9QDVShi5jFC4L_PYMoZ8o3-AEboZFZ6ioxTvcPhJtc-IZRVa0xpCBVs6gt1k5GSHpKqMKfvM3O1fzdPa-=w408-h306-k-no,America/Vancouver,,0x548675c5b54f3113:0xd70f97a2478bd8d2,ChIJEzFPtcV1hlQR0tiLR6KXD9c,"[{""title"":""All"",""image"":""https://lh3.googleusercontent.com/gps-cs-s/AHVAweqOYM6WohrXGYHDaUFkLOZMGE2136Y9cAULnk-OLaHgmCjSF8OnyhW9QDVShi5jFC4L_PYMoZ8o3-AEboZFZ6ioxTvcPhJtc-IZRVa0xpCBVs6gt1k5GSHpKqMKfvM3O1fzdPa-=w397-h298-k-no""}]",null,null,"{""link"":"""",""source"":""""}","{""id"":""101184681936960285093"",""name"":""Continental Roofing (Owner)"",""link"":""https://www.google.com/maps/contrib/101184681936960285093""}","{""borough"":"""",""street"":""7464 Hume Ave"",""city"":""Delta"",""postal_code"":""V4G 1C5"",""state"":""British Columbia"",""country"":""CA""}","[{""id"":""service_options"",""name"":""Service options"",""options"":[{""name"":""Onsite services"",""enabled"":true}]},{""id"":""accessibility"",""name"":""Accessibility"",""options"":[{""name"":""Wheelchair-accessible entrance"",""enabled"":true},{""name"":""Wheelchair-accessible parking lot"",""enabled"":true}]}]","[{""Name"":""Sarah McDonagh"",""ProfilePicture"":""https://lh3.googleusercontent.com/a-/ALV-UjUWYwhPwGqyZwyo1yGIu8Q5w0DTU8W_ZjuiKEaCbjjuw-wAfi9C=s120-c-rp-mo-br100"",""Rating"":1,""Description"":""One of their drivers nearly caused an accident trying to brake check me on Jan 20 at 630am at King George Blvd right before he turned right onto 112 Ave. I was already going above the speed limit and was braking because the car in front of me was slowing down. He swerved around me, sped up aggressively, cut in front of me, and then immediately slammed on his brakes to turn right. There was nothing wrong with my driving or the person's in front of me - It was rush hour on a very busy road! Get it together sir, you're going to get someone hurt, and there was no \""point\"" to be made here!!! I was going to call and complain privately but after seeing the rest of these reviews of their driving, seems like people need to know."",""Images"":null,""When"":""""},{""Name"":""Taylor"",""ProfilePicture"":""https://lh3.googleusercontent.com/a-/ALV-UjXIqI_EFBNXZ7OMIkduWyY5bjEsRr13nCsvdl_k_mAuRx5Bq6Dl=s120-c-rp-mo-ba2-br100"",""Rating"":1,""Description"":""Driver of van 57 gets a big thumbs down 👎🏻\nNo reason I should be getting tailgated while I’m in the right lane…..go around maybe?\nObviously this company is known for its awful driving, wrote this before reading all the other reviews lol\n*Coming back to edit this after the owner has replied*\nWhat is leaving it with you going to do Will?\nClearly this is an on-going issue with your people that isn’t going to be fixed. I hope your drivers start getting reported to the RCMP for dangerous driving. Leaving it with you clearly doesn’t do anything."",""Images"":null,""When"":""""},{""Name"":""Mi Hsu"",""ProfilePicture"":""https://lh3.googleusercontent.com/a/ACg8ocKDHEvLgXj5I1w4vcwkxGVj4iDh-OSqsz3OoSQYtmTJw58fJw=s120-c-rp-mo-ba3-br100"",""Rating"":1,""Description"":""Agree with all the bad reviews about their driving attitude. They drove in the neighbourhood with fast speed and when one of the neighbors told him to slow down because kids were playing out on the street. The driver angrily escerlated and drove off. This company doesnt deserve any businesses."",""Images"":null,""When"":""""},{""Name"":""Anna Morrow"",""ProfilePicture"":""https://lh3.googleusercontent.com/a/ACg8ocIwRGLl-WNcXh_fsI86_cxI4O9p3UHM1ZT7tDKtX2NbGc7XKg=s120-c-rp-mo-br100"",""Rating"":5,""Description"":""Great service!! Kind workers, the gentleman will was very professional and had had great communication."",""Images"":null,""When"":""""},{""Name"":""Daniel Griffin"",""ProfilePicture"":""https://lh3.googleusercontent.com/a-/ALV-UjWO6LaCGnZvcXPQRsXkvEFDaq4bOATGIv2SS1j_0nGeQm8ZM1BptA=s120-c-rp-mo-ba3-br100"",""Rating"":1,""Description"":""Continental roofing driver nearly caused a major accident making an illegal turn into me while driving down Oak. If I had not swerved he would have destroyed the right side of my car with my girlfriend in the passenger seat. Nice going 👍"",""Images"":[""www.google.com/local/imagery/report/?cb_client=maps_sv.tactile\u0026image_key=!1e10!2sCIHM0ogKEICAgIDZ_KuzEg\u0026fid=0x0:0xd70f97a2478bd8d2""],""When"":""2023-9-26""},{""Name"":""Barry ---"",""ProfilePicture"":""https://lh3.googleusercontent.com/a-/ALV-UjU7w9lOZdpI_JJrG7tsj_BF4aqaUmXHv1GXs1hLY3N061lodfJa=s120-c-rp-mo-ba4-br100"",""Rating"":1,""Description"":""Jan 13 2024\nAs others have mentioned, we also experienced their bad driving. Don’t tailgate and speed, but for sure don’t in a company truck at 6:30am on Hwy1 WB HOV.\n\nHope they take more care with their work."",""Images"":null,""When"":""""},{""Name"":""navpreet sandhu"",""ProfilePicture"":""https://lh3.googleusercontent.com/a/ACg8ocIp1Adss9o5WrTekZHlB_SYei90K9dyS9IGbTV58aCPa6uFCQ=s120-c-rp-mo-br100"",""Rating"":1,""Description"":""Driver tried to brake check me on a highway after going slower then then posted speed truck number #86"",""Images"":null,""When"":""""},{""Name"":""Frank Leung"",""ProfilePicture"":""https://lh3.googleusercontent.com/a-/ALV-UjV3UGcImNRU2W05dau_uze6wVcTEhTFFJ8b4I7EI3KguobLkisn=s120-c-rp-mo-br100"",""Rating"":2,""Description"":""I live in a 5 years old row home with a narrow roof.  One day I got a leak from the ceiling of my upper level bathroom.  Contacted my strata who sent 2 contractors from Continential Roofing.  They came and decided the roof was too frosty to climb onto.  So they sat around in the parking lot and played on their phone while waiting.  After 2 hours or so, they started their inspection by climbing up onto the roof, and into the attic.  The whole process took less than an hour.  They couldn't find any problem and no repair work was done.  I was backcharged for almost $550 for the job.  I don't understand why it is so expensive.  There is no repair work done at all.  One of the two guys sent did absolutely nothing.  The actual work was completed in less than an hour.   If they charge for travel time, the company was not far from our home.  They chose to come at that time when there was frost on the roof.  They chose to stick around and wait for the frost to melt.  Why am I paying so much for \u003c1hr of actual work?"",""Images"":null,""When"":""""}]",null,
d44c9849-c073-46d3-8375-af63f1dff00a,https://www.google.com/maps/place/3+King%27s+Roofing+and+Renovations+Inc.+-+Roofing+Contractor+Vancouver/data=!4m7!3m6!1s0x548675629d05c3c3:0x59d2234bbada569c!8m2!3d49.2462017!4d-123.0804477!16s%2Fg%2F11h7p7nlyf!19sChIJw8MFnWJ1hlQRnFbauksj0lk?authuser=0&hl=en&rclk=1,3 King's Roofing and Renovations Inc. - Roofing Contractor Vancouver,Roofing contractor,"4323 Inverness St, Vancouver, BC V5V 4X1","{""Friday"":[""Open 24 hours""],""Monday"":[""Open 24 hours""],""Saturday"":[""Open 24 hours""],""Sunday"":[""Open 24 hours""],""Thursday"":[""Open 24 hours""],""Tuesday"":[""Open 24 hours""],""Wednesday"":[""Open 24 hours""]}",{},https://www.roofing-vancouver.ca/,(778) 868-1906,"6WW9+FR Vancouver, British Columbia",57,4.600000,"{""1"":5,""2"":0,""3"":1,""4"":3,""5"":48}",49.246202,-123.080448,6472274422649214620,,,,https://lh3.googleusercontent.com/gps-cs-s/AHVAweqY1_kQJ70i61Y2Caay7-4REKX1IH6V9vWNR09S5fwUu4WNJbDpETKPczXjyHxviIGs8AHcYb69vy59JYVtGrnSQz5TadzZ3AS0QSad5I6iJ4bMiJwTg0BDJxQrYpUML1Y9RlUK=w408-h544-k-no,America/Vancouver,,0x548675629d05c3c3:0x59d2234bbada569c,ChIJw8MFnWJ1hlQRnFbauksj0lk,"[{""title"":""All"",""image"":""https://lh3.googleusercontent.com/gps-cs-s/AHVAweqY1_kQJ70i61Y2Caay7-4REKX1IH6V9vWNR09S5fwUu4WNJbDpETKPczXjyHxviIGs8AHcYb69vy59JYVtGrnSQz5TadzZ3AS0QSad5I6iJ4bMiJwTg0BDJxQrYpUML1Y9RlUK=w224-h298-k-no""},{""title"":""Latest"",""image"":""https://lh3.googleusercontent.com/gps-cs-s/AHVAweqcPb1tTa7eMyWGdAgJQtXICOl_qqzI6yKrU-Tcr-e60vXGgZp9RvHEWEnNcjOorwRK-2mH-xwQ5qEzg4WzAuSeffzVdqK8xW2A4QwiYeyWk1lsvAJ2XEJVyVb-1rcFtmRjfA3z8rVuJtxB=w397-h298-k-no""},{""title"":""Inside"",""image"":""https://lh3.googleusercontent.com/gps-cs-s/AHVAweqe6t_NLn7IEkD9cyb3QXPuo2jQKib-rG1txYTVxJSjUOHbqfYFlmw0GHW_0kV9N_CMlmsbhM9fEjksd82r_7EhbFAN3uwpleOSDt34e02XmJgjpZLt_WaFytd6fqyM0bZBfIfCtg=w224-h298-k-no""},{""title"":""House"",""image"":""https://lh3.googleusercontent.com/gps-cs-s/AHVAweq6M4a8k7c_k6NYK6BBCq_AIyt-dAtj0Ozvu8vfTZcaXj38tAfoQJG8l4tzuqLTF4HuTKQKT3nPT4VwrBz_y0siliIqQNeDPz1unfGk2ThzVTzYc8m268zXRbpIkA2AaDAV7T1p=w397-h298-k-no""},{""title"":""Roof shingle"",""image"":""https://lh3.googleusercontent.com/gps-cs-s/AHVAweoTxELR0eNgAYy7RIJo7XCk0t--CIGgPTH-IzVkUTH8Q37gtfvJWZuXOFdtIshNd2PDlx3cWMTufI8yhb7UViR4g-GqoqPw7IJQ5IotpwfQm1MCx8j0Rgiy9S8s175m7PJZbwDQ0g=w224-h298-k-no""},{""title"":""By owner"",""image"":""https://lh3.googleusercontent.com/gps-cs-s/AHVAwerRHhzZSMy_gFkg6rmVSknZiMn_r7g5uEjVu6dy0URxyRe-JcZTZi1ZvK33kEOEdYSd5JMHImPOzRzGayn57gIIQ01gcoMrJv4prlBCLOqsVPevrQ8KUC22lb9qRRUC4gYO0K2N=w298-h298-k-no""},{""title"":""Street View \u0026 360°"",""image"":""https://streetviewpixels-pa.googleapis.com/v1/thumbnail?panoid=gdALi_T4fXrhqfxrXs4akg\u0026cb_client=maps_sv.tactile.gps\u0026w=224\u0026h=298\u0026yaw=274.7219\u0026pitch=0\u0026thumbfov=100""}]",null,null,"{""link"":"""",""source"":""""}","{""id"":""114605738000944029053"",""name"":""3 King's Roofing and Renovations Inc. - Roofing Contractor Vancouver (Owner)"",""link"":""https://www.google.com/maps/contrib/114605738000944029053""}","{""borough"":""Knight"",""street"":""4323 Inverness St"",""city"":""Vancouver"",""postal_code"":""V5V 4X1"",""state"":""British Columbia"",""country"":""CA""}","[{""id"":""service_options"",""name"":""Service options"",""options"":[{""name"":""Online estimates"",""enabled"":true},{""name"":""Onsite services"",""enabled"":true}]},{""id"":""crowd"",""name"":""Crowd"",""options"":[{""name"":""LGBTQ+ friendly"",""enabled"":true},{""name"":""Transgender safe space"",""enabled"":true}]}]","[{""Name"":""Laraine Davey"",""ProfilePicture"":""https://lh3.googleusercontent.com/a-/ALV-UjWqjsLrCFaSx1I7aPni_Z0xYQG9B-Cnobadoia_va7BBYOZ2_UW=s120-c-rp-mo-br100"",""Rating"":5,""Description"":""3 Kings recently replaced our roof on our 100 year old home. Previously shake roof was replaced with duroid shingles. They did a fantastic job. Extremely punctual, efficient, professional and very fair pricing and completed on time. They have followed up to ensure everything was completed to our satisfaction. We could not be happier and would highly recommend them for any roofing job that is planned."",""Images"":null,""When"":""""},{""Name"":""Wilda Takeuchi"",""ProfilePicture"":""https://lh3.googleusercontent.com/a/ACg8ocLx0Z1iV1oXGYU1whPTGmxmyDg3gEw9gd3BLuC_bNQwzgn96A=s120-c-rp-mo-br100"",""Rating"":5,""Description"":""We used 3 Kings when we replaced the roof of our duplex. They did an excellent job and were very reasonably priced. They were very professional and clean. I highly recommend them and will be more than willing to have them come back to do more renovations in the future"",""Images"":[""www.google.com/local/imagery/report/?cb_client=maps_sv.tactile\u0026image_key=!1e10!2sCIABIhDYHiY0wjnPlq3R5dE2An3F\u0026fid=0x0:0x59d2234bbada569c""],""When"":""2025-6-20""},{""Name"":""A Ko"",""ProfilePicture"":""https://lh3.googleusercontent.com/a/ACg8ocKsoICKd_2tuhZvPsqFMivdgmuJaHpFEuDnmj1Mrf_rc-XgXg=s120-c-rp-mo-br100"",""Rating"":5,""Description"":""3 Kings Roofing, quoted a fair price for an older home with a steep roof pitch, they did quality work in the expected time period and invoiced the work as quoted. I would  recommend 3 Kings Roofing and I definitely would use them again."",""Images"":null,""When"":""""},{""Name"":""Zaid Maiter"",""ProfilePicture"":""https://lh3.googleusercontent.com/a-/ALV-UjWJd9IMivwMLJ5DKuZ7_Cx1F4NXAwskxZfZUXnvKs4TkL1_rS52Og=s120-c-rp-mo-ba2-br100"",""Rating"":5,""Description"":""The team at 3 King's were so very helpful at a time when it was needed most. Leaky roof on a rainy day, they arrived quickly, assessed and tarped to get it under control, returning a couple weeks later to properly repair and asses the rest of the roof. Great team, highly recommended. Thank you!"",""Images"":null,""When"":""""},{""Name"":""TP"",""ProfilePicture"":""https://lh3.googleusercontent.com/a/ACg8ocKEKpL8b0kjAxwNswARia4iOCluGD_77gYJldt8iPSHqUQyfuwn=s120-c-rp-mo-ba3-br100"",""Rating"":1,""Description"":""3 Kings Roofing did very poor quality work on our deck (see photos). They came back and said they would fix their sloppy work, and to give them 2 months. This was back in May 2021- it is now August and they have not reached out nor answered our calls. Do not recommend."",""Images"":[""www.google.com/local/imagery/report/?cb_client=maps_sv.tactile\u0026image_key=!1e10!2sCIHM0ogKEICAgIDa0obhIA\u0026fid=0x0:0x59d2234bbada569c""],""When"":""2021-8-17""},{""Name"":""Shand Lawrence"",""ProfilePicture"":""https://lh3.googleusercontent.com/a-/ALV-UjW-xYpVZtdXozI2fgcFAynr_-6BASvhjleeSiJP8s7Cn_51J30=s120-c-rp-mo-br100"",""Rating"":5,""Description"":""From the initial quote stage, right through to the final cleanup stage, I could not be happier with the work (new roof deck and shingles to replace old cedar shake roof) performed by the hard working, professional (and very personable) 3 KINGS crew. I would not hesitate to recommend 3 KINGS, Jeffrey, and his team  - for any project, big or small. A first class operation delivering great value.\n\nLawrence, West Vancouver, Caulfeild, May 2021"",""Images"":[""www.google.com/local/imagery/report/?cb_client=maps_sv.tactile\u0026image_key=!1e10!2sCIHM0ogKEICAgICqmMzLgQE\u0026fid=0x0:0x59d2234bbada569c""],""When"":""2021-5-25""},{""Name"":""David Tam"",""ProfilePicture"":""https://lh3.googleusercontent.com/a/ACg8ocJK0gN1J-ibBw16PfMYm2FpaefWtqUUQ6WV6HUQqPGPSocd0g=s120-c-rp-mo-br100"",""Rating"":5,""Description"":""I needed to replace a broken ventilation cap on our roof and to have the gutters cleaned. The guys work quickly and are honest and reliable. Their pricing is very reasonable. Great bunch of guys. I will call them again if I need any other work done in the future."",""Images"":null,""When"":""""},{""Name"":""Al J"",""ProfilePicture"":""https://lh3.googleusercontent.com/a-/ALV-UjXzLb-1IEGMz0HLjS4kZJfsfzvRfmlpWZrU0-tqjtP7v5eDPJii=s120-c-rp-mo-ba3-br100"",""Rating"":5,""Description"":""very quick response and professional installation, excellent work done for my skylights--clean \u0026 shining:))\n\nThey also helped me fix the few cracked tiles and a little roof repair with no extra charges. Definitely would recommend them to my friends!"",""Images"":[""www.google.com/local/imagery/report/?cb_client=maps_sv.tactile\u0026image_key=!1e10!2sCIHM0ogKEICAgICci9vJ5gE\u0026fid=0x0:0x59d2234bbada569c""],""When"":""2020-4-8""}]",null,
