input_id,link,title,category,address,open_hours,popular_times,website,phone,plus_code,review_count,review_rating,reviews_per_rating,latitude,longitude,cid,status,descriptions,reviews_link,thumbnail,timezone,price_range,data_id,place_id,images,reservations,order_online,menu,owner,complete_address,about,user_reviews,user_reviews_extended,emails
d70687ae-2e93-4bc8-b9a0-eca95d21fe38,https://www.google.com/maps/place/Sea+to+Sky+Power+Washing+Inc/data=!4m7!3m6!1s0x54866b8aeb74f2e3:0xb0d3e2da45d51091!8m2!3d49.3076114!4d-123.0173306!16s%2Fg%2F1thk8fj5!19sChIJ4_J064prhlQRkRDVRdri07A?authuser=0&hl=en&rclk=1,Sea to Sky Power Washing Inc,Pressure washing service,"314 Seymour River Pl, North Vancouver, BC V7H 1S8",{},{},http://www.seatoskypowerwashing.com/,(604) 312-5497,"8X5M+23 North Vancouver, British Columbia",92,4.800000,"{""1"":4,""2"":0,""3"":0,""4"":1,""5"":87}",49.307611,-123.017331,12741777197863604369,,,,https://lh3.googleusercontent.com/gps-cs-s/AHVAweqGPYrxnkDIF3hwi0BfOC81SIltYd5Y3LoHCHhDeABxf9F6tpKWg7HCbZmwsQX2YCR5Jyv4B2S-cwobQb-6dqgLgLA7Sp2gjI2SxiLeEdrU9dRBfy4WeZ5zNaswGanUdflJCiSR=w408-h725-k-no,America/Vancouver,,0x54866b8aeb74f2e3:0xb0d3e2da45d51091,ChIJ4_J064prhlQRkRDVRdri07A,"[{""title"":""All"",""image"":""https://lh3.googleusercontent.com/gps-cs-s/AHVAweqGPYrxnkDIF3hwi0BfOC81SIltYd5Y3LoHCHhDeABxf9F6tpKWg7HCbZmwsQX2YCR5Jyv4B2S-cwobQb-6dqgLgLA7Sp2gjI2SxiLeEdrU9dRBfy4WeZ5zNaswGanUdflJCiSR=w224-h398-k-no""},{""title"":""Exterior"",""image"":""https://lh3.googleusercontent.com/gps-cs-s/AHVAweq1771uwY_9Rn1iD__xLKIoANTgwkBCMQRx_sEyhmTRwkRERT40Sg1etmvxYas_cVo0FI034LrdX98Cwi0QbuA84mc8Tlh8U3b41o73bZyqdAmA-jeTOkANu-aPDO9_kslEM4z1=w529-h298-k-no""},{""title"":""Videos"",""image"":""https://lh3.googleusercontent.com/gps-cs-s/AHVAweqGPYrxnkDIF3hwi0BfOC81SIltYd5Y3LoHCHhDeABxf9F6tpKWg7HCbZmwsQX2YCR5Jyv4B2S-cwobQb-6dqgLgLA7Sp2gjI2SxiLeEdrU9dRBfy4WeZ5zNaswGanUdflJCiSR=w224-h398-k-no""},{""title"":""Home"",""image"":""https://lh3.googleusercontent.com/gps-cs-s/AHVAwepfNhl3C6Hz0qCF_pQGDfh-R2Gfh6EfOttCUJJVMbMmQULgsG7hQYcOJlxckvRSXJj88BPs4gNcdHLqTfEzrPV_kbf_zrjamSrjz7z0cAtT0X3d-6tt4RXyVgs9F4jBBpXTbeH_=w298-h298-k-no""},{""title"":""By owner"",""image"":""https://lh3.googleusercontent.com/gps-cs-s/AHVAweo3eagVjFpROVGFWna4ipBSogG8Ow-loIn2g3qDF2MdTsVbNrXvdLEDM-XNJoyFDnDloUMKti-cFCdP5GhqTs6BId6m1_tuZyy0NE8zC-MU9jJbtmRbiMxVbcguSajCq_SPj20=w224-h298-k-no""},{""title"":""Street View \u0026 360°"",""image"":""https://streetviewpixels-pa.googleapis.com/v1/thumbnail?panoid=F3KBYxxRVEwASe5v5IEIjA\u0026cb_client=maps_sv.tactile.gps\u0026w=224\u0026h=298\u0026yaw=102.60394\u0026pitch=0\u0026thumbfov=100""}]",null,"[{""link"":""https://clienthub.getjobber.com/hubs/f6bd5a48-8197-4f7c-94d8-7d4b08300934/public/requests/2276129/new?rwg_token=AFd1xnE5yIvy5oEYoj7JWuidO3B6dKlSTzpIOmtDfz0eTScwvGylnqHjsC8L58aYg8XKjTJ5Ykz_BFwVWwTlQzXJxWr5x8SFAQ%3D%3D"",""source"":""getjobber.com""}]","{""link"":"""",""source"":""""}","{""id"":""115280851624132808966"",""name"":""Sea to Sky Power Washing Inc (Owner)"",""link"":""https://www.google.com/maps/contrib/115280851624132808966""}","{""borough"":"""",""street"":""314 Seymour River Pl"",""city"":""North Vancouver"",""postal_code"":""V7H 1S8"",""state"":""British Columbia"",""country"":""CA""}","[{""id"":""service_options"",""name"":""Service options"",""options"":[{""name"":""Online estimates"",""enabled"":false},{""name"":""Onsite services"",""enabled"":false}]}]","[{""Name"":""Derek Smith"",""ProfilePicture"":""https://lh3.googleusercontent.com/a/ACg8ocL0DuCad_IzVK9gtSBmB6Vp9PQDZCabwA7XKsqZBjMFrYtbVQ=s120-c-rp-mo-br100"",""Rating"":5,""Description"":""This is our third time using Sea to Sky Power Washing, and the service has been excellent every time. Professional, reliable, and high‑quality work. Highly recommend."",""Images"":[""www.google.com/local/imagery/report/?cb_client=maps_sv.tactile\u0026image_key=!1e10!2sCIABIhAp4zpX7by3eIDA_nM1HIxg\u0026fid=0x0:0xb0d3e2da45d51091""],""When"":""2026-2-27""},{""Name"":""Anne Watson"",""ProfilePicture"":""https://lh3.googleusercontent.com/a/ACg8ocLxF-KJm1To6BSvJ-Ne7nCWQGlSN5wU2rb50YTFvGHFZba02g=s120-c-rp-mo-br100"",""Rating"":5,""Description"":""Sea to Sky has done our windows for a couple of years. They do an excellent job inside and out. I especially appreciate that they clean the insides of our 9 skylights never leaving a drip down the walls or on the floor."",""Images"":null,""When"":""""},{""Name"":""Alana Hornby-Smith"",""ProfilePicture"":""https://lh3.googleusercontent.com/a-/ALV-UjU4VpN6idW3YPiO5kXOwa3P1KgYeXSR2sRYAwmXpV1720jXREU=s120-c-rp-mo-ba2-br100"",""Rating"":5,""Description"":""We’ve used Sea to Sky Power Washing a few times now; they are easy to communicate with, professional, and provide quality work. The crew did an amazing job cleaning our gutters and roof, and they even made sure to clean the debris and leaves on our driveway and lawn. Top notch!"",""Images"":null,""When"":""""},{""Name"":""Emily V"",""ProfilePicture"":""https://lh3.googleusercontent.com/a-/ALV-UjX30VFmEDWNOgaAFjVOlwIUVU__x07C4FZ68sldj2v-rPWgMYvAkg=s120-c-rp-mo-br100"",""Rating"":5,""Description"":""Marco fit us into his schedule after we told him we had an emergency issue with our gutters. He did an amazing, thorough job, and we were so pleased with his work. He even recommended a roofer when he found a leak, and that roofer contacted us immediately. Thank you, Marco!"",""Images"":null,""When"":""""},{""Name"":""juan De Los Andes"",""ProfilePicture"":""https://lh3.googleusercontent.com/a-/ALV-UjVBtMTBAKI6eXl1ElScDPeA9MO_5Co7qJ5we5YWOEp4i7tslXg=s120-c-rp-mo-br100"",""Rating"":5,""Description"":""Best power washing company in all of Vancouver!!!!! They came in, looked at the job, gave a really reasonable quote. When they came to do the work, they were very efficient and actually power washed my stairs and my elderly moms stairs that lives next door for free!!! Fantastic people I highly recommend them!!!!"",""Images"":null,""When"":""""},{""Name"":""Paulette Fishman"",""ProfilePicture"":""https://lh3.googleusercontent.com/a/ACg8ocJ8KbB9PjP29eRb5Jxw9UgQaeY14MmZgIajfpnGgd2fR3a3Vw=s120-c-rp-mo-br100"",""Rating"":5,""Description"":""Marco was very personable and professional.\nThe workers were punctual polite and did an awesome job! The building looks like it has been given a new coat of paint it’s so clean!\nThank you so much.\nI highly recommend the company"",""Images"":null,""When"":""""},{""Name"":""Sue McArthur"",""ProfilePicture"":""https://lh3.googleusercontent.com/a/ACg8ocIDkvRZpwRs3fGNObV2Gdt316v8P4JBt4BKUPnW59EM0aNLIg=s120-c-rp-mo-br100"",""Rating"":5,""Description"":""What a wonderful job was done on my patios and awnings.  Everyone was so helpful and respectful.  Do not hesitate use Sea to Sky…. They are prompt professionals and really organized.   Thanks guys!"",""Images"":null,""When"":""""},{""Name"":""Lucy Cochrane"",""ProfilePicture"":""https://lh3.googleusercontent.com/a/ACg8ocKTko7ALSeP7G6AHdW55siiW-ApKvAL_-V6wCELL0frFzEF4A=s120-c-rp-mo-br100"",""Rating"":5,""Description"":""Marco always do a great job in power washing, very well-detailed, and made my home looks anew.  Whenever there is something needs to be attended, Marco would inform me the details and the solution he would do, i.e., moss, etc. What is more important is his response to my appointment when I need his service."",""Images"":null,""When"":""""}]",null,
d70687ae-2e93-4bc8-b9a0-eca95d21fe38,https://www.google.com/maps/place/Greater+Vancouver+Roofing+Inc./data=!4m7!3m6!1s0x548671acd8b76b2f:0xb07d88350d957a60!8m2!3d49.285226!4d-122.977033!16s%2Fg%2F11q342g_8f!19sChIJL2u32KxxhlQRYHqVDTWIfbA?authuser=0&hl=en&rclk=1,Greater Vancouver Roofing Inc.,Roofing contractor,"75 N Stratford Ave, Burnaby, BC V5B 4P1","{""Friday"":[""Open 24 hours""],""Monday"":[""Open 24 hours""],""Saturday"":[""Open 24 hours""],""Sunday"":[""Open 24 hours""],""Thursday"":[""Open 24 hours""],""Tuesday"":[""Open 24 hours""],""Wednesday"":[""Open 24 hours""]}",{},http://gvrdroofer.ca/,(604) 783-8553,"72PF+35 Burnaby, British Columbia",1,5.000000,"{""1"":0,""2"":0,""3"":0,""4"":0,""5"":1}",49.285226,-122.977033,12717470684206692960,,,,https://streetviewpixels-pa.googleapis.com/v1/thumbnail?panoid=YQlpPYZtDRDyP2s-E-u8zw&cb_client=search.gws-prod.gps&w=408&h=240&yaw=272.92615&pitch=0&thumbfov=100,America/Vancouver,,0x548671acd8b76b2f:0xb07d88350d957a60,ChIJL2u32KxxhlQRYHqVDTWIfbA,"[{""title"":""All"",""image"":""https://streetviewpixels-pa.googleapis.com/v1/thumbnail?panoid=YQlpPYZtDRDyP2s-E-u8zw\u0026cb_client=maps_sv.tactile.gps\u0026w=224\u0026h=298\u0026yaw=272.92615\u0026pitch=0\u0026thumbfov=100""},{""title"":""House"",""image"":""https://lh3.googleusercontent.com/gps-cs-s/AHVAweqENaEOVNpNJFo281F8f_zCC-uHDP0WqtstXXJpM9g1qhb_STHWHd5hGpGaR7myUArrLaZrC3VpafsHKR8bRwJee1kdcCFv68D3f0c3nG-UDS5vGJAbIikjjnBVSSpjP_XxuifaqEpX9ecI=w355-h298-k-no""},{""title"":""By owner"",""image"":""https://lh3.googleusercontent.com/gps-cs-s/AHVAwerForNYYjQkoQiG3sF1iohvG3Zmlj4WbFuu0pue6IhY_4N_rwRiVqCPUN8qZgK2EYi1tp9-ep1_ztSUwHMh7b404pHNIuff-4g54W5MtL68lbo07m72jTx7Nll0kTPltfdN-AEX=w601-h298-k-no""},{""title"":""Street View \u0026 360°"",""image"":""https://streetviewpixels-pa.googleapis.com/v1/thumbnail?panoid=YQlpPYZtDRDyP2s-E-u8zw\u0026cb_client=maps_sv.tactile.gps\u0026w=224\u0026h=298\u0026yaw=272.92615\u0026pitch=0\u0026thumbfov=100""}]",null,null,"{""link"":"""",""source"":""""}","{""id"":""102758723953121944481"",""name"":""Greater Vancouver Roofing Inc. (Owner)"",""link"":""https://www.google.com/maps/contrib/102758723953121944481""}","{""borough"":"""",""street"":""75 N Stratford Ave"",""city"":""Burnaby"",""postal_code"":""V5B 4P1"",""state"":""British Columbia"",""country"":""CA""}","[{""id"":""service_options"",""name"":""Service options"",""options"":[{""name"":""Onsite services"",""enabled"":true},{""name"":""Online estimates"",""enabled"":false}]}]","[{""Name"":""Sam Campbell"",""ProfilePicture"":""https://lh3.googleusercontent.com/a-/ALV-UjVIcEnof5ycw9kpix1zarm0E3JVpd7NjvCe1NoJ2dPNpC0JELQ7=s120-c-rp-mo-ba3-br100"",""Rating"":5,""Description"":""Steven did a great job on our roof. We needed someone to help us mitigate issues with venting and he took care of that as well. We never had any issues with the price. He didn't try to give us a hard sell on using expensive or unnecessary products. He got the job done on time so that we could get our insurance approved as they required a new roof to insure the house.  I would definitely recommend him."",""Images"":null,""When"":""""}]",null,
d70687ae-2e93-4bc8-b9a0-eca95d21fe38,https://www.google.com/maps/place/A1+Kahlon+Construction/data=!4m7!3m6!1s0x54866fdda18eaaab:0xf38e84d4e9da369b!8m2!3d49.3464454!4d-123.0915018!16s%2Fg%2F11rgh762jf!19sChIJq6qOod1vhlQRmzba6dSEjvM?authuser=0&hl=en&rclk=1,A1 Kahlon Construction,Contractor,"920 Wavertree Rd, North Vancouver, BC V7R 1S3",{},{},,,,9,4.100000,"{""1"":2,""2"":0,""3"":0,""4"":0,""5"":7}",49.346445,-123.091502,17550110847900726939,,,,https://lh3.googleusercontent.com/gps-cs-s/AHVAweogaS1bIqlb9buIIf5AhjMgS08avUMQNlTMoXOg8TmhZIBpy6z7RD71yCt-ukrmZ--9cqoxUh6a1b33yPBR1tUmFu64HmdB3ace1Bhn7Sp341xv7BpFxCZqHUnWodJe5nQEnRJN=w408-h256-k-no,America/Vancouver,,0x54866fdda18eaaab:0xf38e84d4e9da369b,ChIJq6qOod1vhlQRmzba6dSEjvM,"[{""title"":""All"",""image"":""https://lh3.googleusercontent.com/gps-cs-s/AHVAweogaS1bIqlb9buIIf5AhjMgS08avUMQNlTMoXOg8TmhZIBpy6z7RD71yCt-ukrmZ--9cqoxUh6a1b33yPBR1tUmFu64HmdB3ace1Bhn7Sp341xv7BpFxCZqHUnWodJe5nQEnRJN=w473-h298-k-no""},{""title"":""Street View \u0026 360°"",""image"":""https://streetviewpixels-pa.googleapis.com/v1/thumbnail?panoid=8jdzODZ4_hSe6xstqcS08Q\u0026cb_client=maps_sv.tactile.gps\u0026w=224\u0026h=298\u0026yaw=5.812054\u0026pitch=0\u0026thumbfov=100""}]",null,null,"{""link"":"""",""source"":""""}","{""id"":"""",""name"":""A1 Kahlon Construction (Owner)"",""link"":""""}","{""borough"":"""",""street"":"""",""city"":"""",""postal_code"":"""",""state"":"""",""country"":""""}",null,"[{""Name"":""Shadow"",""ProfilePicture"":""https://lh3.googleusercontent.com/a-/ALV-UjXjnjfTPblU0tibhjkjhohsgBDu0ZMukNjSRSbdB_5ShhoRxg0=s120-c-rp-mo-br100"",""Rating"":5,""Description"":""Loved his work done a great job he fixed my old roof and done renovation to our house for a low price"",""Images"":null,""When"":""""},{""Name"":""Shawn"",""ProfilePicture"":""https://lh3.googleusercontent.com/a-/ALV-UjXWnksl05fe3emKI9W29AEXpaI6vBZeksyFR9JwelI_QgVlJYM=s120-c-rp-mo-br100"",""Rating"":5,""Description"":""Great service nice are flexible with price on time he fixed my roof and did an awsome job"",""Images"":null,""When"":""""},{""Name"":""Shawn"",""ProfilePicture"":""https://lh3.googleusercontent.com/a-/ALV-UjXJEEWa7GN5HyxSWWCWBh53KEQs1hFe58zgYbFE2W2_YlxT0sk=s120-c-rp-mo-br100"",""Rating"":5,""Description"":""Great work he fixed my patio for a good price"",""Images"":null,""When"":""""},{""Name"":""John JeetSingh"",""ProfilePicture"":""https://lh3.googleusercontent.com/a-/ALV-UjVmHkW_bQByLwy1WP1Gv0QXhwUEMAcNUs6CXXo5s5a0q8cbDn6L=s120-c-rp-mo-ba2-br100"",""Rating"":5,""Description"":""A1 Khalon Number 1 . He fixed my pipe leak then fixed my hockey net . That's a Khalsa , That's a real Sikh !!"",""Images"":[""www.google.com/local/imagery/report/?cb_client=maps_sv.tactile\u0026image_key=!1e10!2sCIHM0ogKEICAgIDvtPrxvgE\u0026fid=0x0:0xf38e84d4e9da369b""],""When"":""2024-12-18""},{""Name"":""KD"",""ProfilePicture"":""https://lh3.googleusercontent.com/a-/ALV-UjVaWPtACVEKXpWW-gt-VbUp4SF0tEfxmbwpHfaFh4gPLO5xJ421Vw=s120-c-rp-mo-br100"",""Rating"":1,""Description"":""Used bus lane all the way to Stanley park and aggressively cut me off. Zero Stars"",""Images"":null,""When"":""""},{""Name"":""Pav K"",""ProfilePicture"":""https://lh3.googleusercontent.com/a/ACg8ocIQvpCaPpGeU93MI1enu9rc5KQNCcgcd5I8psqHBL1No74LYvU=s120-c-rp-mo-br100"",""Rating"":5,""Description"":""Great Service and goof pricing!"",""Images"":null,""When"":""""},{""Name"":""Michael Yeh"",""ProfilePicture"":""https://lh3.googleusercontent.com/a-/ALV-UjW3d1vzB-VblcvbON4YWg0KrsTAL78a7jNZuREmnoSSCAeUkOYt=s120-c-rp-mo-br100"",""Rating"":1,""Description"":""I Don't recommend this place. Very bad service and they will charge you for other jobs that you did not tell them to do."",""Images"":null,""When"":""""},{""Name"":""jass dhillon"",""ProfilePicture"":""https://lh3.googleusercontent.com/a-/ALV-UjWltzKIWqqQkyKEI3wzp6Wz6D-Bog_ceY67t4MhsZL7F0-Lgphm=s120-c-rp-mo-br100"",""Rating"":5,""Description"":"""",""Images"":null,""When"":""""}]",null,
d70687ae-2e93-4bc8-b9a0-eca95d21fe38,https://www.google.com/maps/place/Fraserview+Roofing/data=!4m7!3m6!1s0x5486741790ef19bb:0x9e780f65e080eb93!8m2!3d49.230609!4d-123.0787602!16s%2Fg%2F11cn2_q1g6!19sChIJuxnvkBd0hlQRk-uA4GUPeJ4?authuser=0&hl=en&rclk=1,Fraserview Roofing,Roofing contractor,"5907 Culloden St, Vancouver, BC V5W 3S3","{""Friday"":[""7 a.m.–5 p.m.""],""Monday"":[""7 a.m.–5 p.m.""],""Saturday"":[""7 a.m.–5 p.m.""],""Sunday"":[""7 a.m.–5 p.m.""],""Thursday"":[""7 a.m.–5 p.m.""],""Tuesday"":[""7 a.m.–5 p.m.""],""Wednesday"":[""7 a.m.–5 p.m.""]}",{},http://www.fraserviewroofing.com/,(604) 897-3614,"6WJC+6F Vancouver, British Columbia",28,4.900000,"{""1"":1,""2"":0,""3"":0,""4"":0,""5"":27}",49.230609,-123.078760,11418893785430551443,,,,https://lh3.googleusercontent.com/gps-cs-s/AHVAwepcaij3P9uJ0XXljSCDAufiv2IiHcY2v_mlbQc--Kbz_JGOs214jDLFJESIhlupEixdd-4RYK8U2pncNvbOMXqwrwd5_OpGlMbAojQDhVZyOE1XL6TVRMSmjDqPQDl3BHL17zKWLQ=w408-h376-k-no,America/Vancouver,,0x5486741790ef19bb:0x9e780f65e080eb93,ChIJuxnvkBd0hlQRk-uA4GUPeJ4,"[{""title"":""All"",""image"":""https://lh3.googleusercontent.com/gps-cs-s/AHVAwepcaij3P9uJ0XXljSCDAufiv2IiHcY2v_mlbQc--Kbz_JGOs214jDLFJESIhlupEixdd-4RYK8U2pncNvbOMXqwrwd5_OpGlMbAojQDhVZyOE1XL6TVRMSmjDqPQDl3BHL17zKWLQ=w323-h298-k-no""},{""title"":""Inside"",""image"":""https://lh3.googleusercontent.com/gps-cs-s/AHVAwepifiVgc6oKCHqjIvU8t-F1MlN8T3pQrAH7Pt4tvO5zPxsoB0R_rUl3i-F9Yrjed1b8DX4IyOhtsde-kGaK-pTsAycDQLHXGzX2aiPaou3JR5z6Ya-jZ5n5DvdvU9V94jc3mrbDIw=w762-h298-k-no""},{""title"":""House"",""image"":""https://lh3.googleusercontent.com/gps-cs-s/AHVAweq7xroxopYckogM6zjHu_lsMr_x3CHnf44A_BEN_8PMq1MWXQ2UotPI6e-ZatApUaOSvxU3bM7EQKvMURE96eCOBQF8DJo8u9ssuYPeBWejN-JfNnIpSak1M8mbA-10Ic9TlVnA=w396-h298-k-no""},{""title"":""By owner"",""image"":""https://lh3.googleusercontent.com/gps-cs-s/AHVAweonab4nj5OJ50PQXZYbFLdJxGRzudEVCmsACd335N48JQ5d84kC1n5QfQqGDLKE8AllkLaniyTuU4b8Mm-wk5od55phd20Lf2bxZMQBoYd2akkwao5-w6heuD-EUiODST-F5nQ-=w397-h298-k-no""},{""title"":""Street View \u0026 360°"",""image"":""https://streetviewpixels-pa.googleapis.com/v1/thumbnail?panoid=t8msomdSSGHryE1zUsMBhQ\u0026cb_client=maps_sv.tactile.gps\u0026w=224\u0026h=298\u0026yaw=254.463\u0026pitch=0\u0026thumbfov=100""}]",null,"[{""link"":""https://fraserviewroofing.com/contact-us/"",""source"":""fraserviewroofing.com""}]","{""link"":"""",""source"":""""}","{""id"":""117187178897589204456"",""name"":""Fraserview Roofing (Owner)"",""link"":""https://www.google.com/maps/contrib/117187178897589204456""}","{""borough"":""South Vancouver"",""street"":""5907 Culloden St"",""city"":""Vancouver"",""postal_code"":""V5W 3S3"",""state"":""British Columbia"",""country"":""CA""}","[{""id"":""service_options"",""name"":""Service options"",""options"":[{""name"":""Online estimates"",""enabled"":true},{""name"":""Onsite services"",""enabled"":true}]}]","[{""Name"":""Richard Huang"",""ProfilePicture"":""https://lh3.googleusercontent.com/a-/ALV-UjUsOHDoG0udDnUHKw_rSMkgpTDfIIp9bh0-BgmGTCUIo3O_yZhU=s120-c-rp-mo-br100"",""Rating"":5,""Description"":""Gary’s company helped us renovating the roof (first after 20 years). He finished on time, with a very reasonable price but most importantly it was great work. I highly recommend this team"",""Images"":[""www.google.com/local/imagery/report/?cb_client=maps_sv.tactile\u0026image_key=!1e10!2sCIABIhA0IYHZQclma_OJzck--9lt\u0026fid=0x0:0x9e780f65e080eb93""],""When"":""2025-8-24""},{""Name"":""melissa franz"",""ProfilePicture"":""https://lh3.googleusercontent.com/a/ACg8ocLa9aWuyzCRUspU4rG143PPIuCgCnN2vveTKaCuHbkCyURFhQ=s120-c-rp-mo-ba2-br100"",""Rating"":5,""Description"":""Mr Gary and Mr Josh we’re amazing! We had a few quotes from other “recommended businesses”, but Mr Gary knew exactly what needed to be done and gave us great suggestions adding onto our design ideas. His team did an exceptional job and all the workers were very friendly! Both Mr Gary and Mr Josh we’re very helpful and informative with all the questions we had. Both were very efficient and accommodating with changes and inquiries we had. Neighbors have, and still are, complimenting how nice our home renovations are and how modern the house now looks. I would highly recommend this company!"",""Images"":null,""When"":""""},{""Name"":""Shiv Taggar"",""ProfilePicture"":""https://lh3.googleusercontent.com/a/ACg8ocJGmH89ePtW1rpVVzQdG5AEQSbL-GYwKv0kiZibZdfdXWU7TA=s120-c-rp-mo-br100"",""Rating"":5,""Description"":""Garry the owner of the company FRASERVIEW Roofiing is a very nice guy , finished job on time and clean up the area, I would recommend him to anyone, very reasonable, good job 👍"",""Images"":null,""When"":""""},{""Name"":""Anthony Than"",""ProfilePicture"":""https://lh3.googleusercontent.com/a/ACg8ocJ35sO488c0YyTcdB4Y-oGZauPTjJTTRlSfwVWZ4-vjjRGZoA=s120-c-rp-mo-br100"",""Rating"":5,""Description"":""Recently had a new roof installed at our place in Kits.  Very pleased with the work that was done. Both Gary and Josh whom I dealt with, as well as their staff ,performed high quality work at VERY competitive prices .  The work was done meticulously and everything was cleaned up very nicely once the job was completed.    I would most definitely recommend them to friends and family in a heartbeat.  Am very glad my friend recommended me to them."",""Images"":null,""When"":""""},{""Name"":""Soo Woo"",""ProfilePicture"":""https://lh3.googleusercontent.com/a-/ALV-UjWcwxrWHO41w5uU4grXed1JUQSXpGnlx9ob8pISsyT_Oh6XSNNKfQ=s120-c-rp-mo-ba2-br100"",""Rating"":5,""Description"":""Josh and Gary and his team did great work and they kept promise on the quote (all items talked on the quote were done and the final price was as promised on the quote). Especially both Josh and Gary were very sincere toward their work and customer. Thank you."",""Images"":null,""When"":""""},{""Name"":""Jason Yin"",""ProfilePicture"":""https://lh3.googleusercontent.com/a-/ALV-UjUZFr51N69YCcQdr5u04wV_cQQYC3vH86GXLzAazqvGCg_xvI8=s120-c-rp-mo-ba2-br100"",""Rating"":5,""Description"":""THESE GUYS are awesome! and they have really decent price compared to others, just recently had a new roof, and Gary has been really professional, and had tried his best to accommodate almost every demand of mine! would go for them again if needed in the future."",""Images"":null,""When"":""""},{""Name"":""Stephen Burns"",""ProfilePicture"":""https://lh3.googleusercontent.com/a-/ALV-UjUG_yVBcLqzV3mB_wboqjNGH8QE0gMci51LCICvuiN2J1qlODo=s120-c-rp-mo-br100"",""Rating"":5,""Description"":""We hired Fraserview Roofing to replace the roof on our house.\n\nIt was quite a big job as there was 4 layers of previous roof to remove before the new shingles could be applied but Fraserview Roofing got the job done quickly and at a good value price.\n\nThey started on a Wednesday and had the roof just about complete by Friday afternoon.  They also did a very good job of the clean up after the roof was complete.\n\nI recommend them for any roofing work you may need."",""Images"":null,""When"":""""},{""Name"":""Rylan Ng"",""ProfilePicture"":""https://lh3.googleusercontent.com/a/ACg8ocL4DT6i9G1tBr0jEzgUm46hVbuojqPXboQKzU2LRlDm7dFGqg=s120-c-rp-mo-br100"",""Rating"":1,""Description"":""Stay away. These guys did torch on for my roof deck. 12 months later, tons of water and air bubbles causing leaks. Overall an extremely poor job. Gary is trash. Won't stand behind his work and will completely ghost you w promises to fix. Stay away from fraserview roofing."",""Images"":null,""When"":""""}]",null,
