input_id,link,title,category,address,open_hours,popular_times,website,phone,plus_code,review_count,review_rating,reviews_per_rating,latitude,longitude,cid,status,descriptions,reviews_link,thumbnail,timezone,price_range,data_id,place_id,images,reservations,order_online,menu,owner,complete_address,about,user_reviews,user_reviews_extended,emails
7e765dbb-146f-4c34-9165-3f3284ca3f5a,https://www.google.com/maps/place/Robinson+Roof+Solutions/data=!4m7!3m6!1s0x54867f7240e20053:0x7114ae31b9984896!8m2!3d49.2421199!4d-122.7554073!16s%2Fg%2F11c2pjx02x!19sChIJUwDiQHJ_hlQRlkiYuTGuFHE?authuser=0&hl=en&rclk=1,Robinson Roof Solutions,Roofing contractor,"1485 Coast Meridian Rd #100, Port Coquitlam, BC V3C 5P1","{""Friday"":[""Open 24 hours""],""Monday"":[""Open 24 hours""],""Saturday"":[""Open 24 hours""],""Sunday"":[""Open 24 hours""],""Thursday"":[""Open 24 hours""],""Tuesday"":[""Open 24 hours""],""Wednesday"":[""Open 24 hours""]}",{},https://www.robinsonroofsolutions.com/,(604) 500-7663,"66RV+RR Port Coquitlam, British Columbia",48,4.600000,"{""1"":4,""2"":0,""3"":1,""4"":0,""5"":43}",49.242120,-122.755407,8148329154410465430,,,,https://lh3.googleusercontent.com/gps-cs-s/AHVAwepd9MZi7Z1l2xN8HPNV2NgdIVLGoZZgVEgWYBs1qqHuebHBCp3W3-MFcVShDuvwo3v7rZBtglELDDRHFXZRZcGNXpj2jNG-xr6MRmozfDNKjbFH7OWpPHvSczO7dux0e3_1H0dIzkAXF7wR=w408-h272-k-no,America/Vancouver,,0x54867f7240e20053:0x7114ae31b9984896,ChIJUwDiQHJ_hlQRlkiYuTGuFHE,"[{""title"":""All"",""image"":""https://lh3.googleusercontent.com/gps-cs-s/AHVAwepd9MZi7Z1l2xN8HPNV2NgdIVLGoZZgVEgWYBs1qqHuebHBCp3W3-MFcVShDuvwo3v7rZBtglELDDRHFXZRZcGNXpj2jNG-xr6MRmozfDNKjbFH7OWpPHvSczO7dux0e3_1H0dIzkAXF7wR=w447-h298-k-no""},{""title"":""Exterior"",""image"":""https://lh3.googleusercontent.com/gps-cs-s/AHVAweryIfWXNYNZIKqe-O21soDCuouuCky9v0wFIjTldhc7Uk819fFsEtyqoWI_yZ-rjrvIPa7TtJo5YHpMGPWhEx2dWkiuvRlbPNSfzc_pDwrDMr-2qQrJH-m14qLjZ99OMlv8twwbAQ=w397-h298-k-no""},{""title"":""House"",""image"":""https://lh3.googleusercontent.com/gps-cs-s/AHVAweq9ES6LYZ_Vb2eqRykIFZELWjjTz3UkQiDat6voxoQwQ3JU2_JcQZPQMed95Q8n1r5yi7oGeUj3rOU-VTx-P7au0fjPx5-ARmkJvggby7yziNdlT9u_0XOwz0FkF-mOSNqB7WZ1=w224-h298-k-no""},{""title"":""By owner"",""image"":""https://lh3.googleusercontent.com/gps-cs-s/AHVAweoJaxdT2O1KsEc2jkIfJ0fFkOYu4AL7187QSl96ARaE57WjJNfnmWOsrcyiK6uLCZSXYQNtM9qBsQwZ_BFKoa-BqoZf4Ha5rKM6eSsb8jRMMKkQqWewukuk-FVhAaOZDO31CepC=w224-h298-k-no""},{""title"":""Street View \u0026 360°"",""image"":""https://streetviewpixels-pa.googleapis.com/v1/thumbnail?panoid=_sDrwlKAIS5roPqcQ4yI-g\u0026cb_client=maps_sv.tactile.gps\u0026w=224\u0026h=298\u0026yaw=323.78812\u0026pitch=0\u0026thumbfov=100""}]",null,null,"{""link"":"""",""source"":""""}","{""id"":""114757305311386141823"",""name"":""Robinson Roof Solutions (Owner)"",""link"":""https://www.google.com/maps/contrib/114757305311386141823""}","{""borough"":"""",""street"":""1485 Coast Meridian Rd #100"",""city"":""Port Coquitlam"",""postal_code"":""V3C 5P1"",""state"":""British Columbia"",""country"":""CA""}","[{""id"":""accessibility"",""name"":""Accessibility"",""options"":[{""name"":""Wheelchair-accessible parking lot"",""enabled"":true}]}]","[{""Name"":""Steve DC"",""ProfilePicture"":""https://lh3.googleusercontent.com/a-/ALV-UjUOUQjwaRb1FsWbpZVqhySaqdBmd6ysguyVV_0tl8rWky_yOME=s120-c-rp-mo-br100"",""Rating"":5,""Description"":""Our 69 unit strata townhouse complex has been dealing with Robinson since we switched management companies about 2 years ago!\n\nWe have found the staff very friendly, flexible and their pricing fair and last but not least, to the best of my knowledge they always give you an honest opinion and feedback!\n\nThank you to Yana, Mike, JP , Richard to name a few. They always do their best to go above and beyond!"",""Images"":null,""When"":""""},{""Name"":""Elliot Hamilton"",""ProfilePicture"":""https://lh3.googleusercontent.com/a-/ALV-UjUUz0CxnjFKlKgwog2YlawhRJQlH1BPTN74ygakO7VPVBjtfXGM=s120-c-rp-mo-br100"",""Rating"":5,""Description"":""We contracted Robinson to perform repairs and annual maintenance on our 35 story condo high rise. They provided excellent communication, fair pricing, and high-quality workmanship. There was one call-back deficiency and it was dealt with quickly and with professionalism. Recommended contractor."",""Images"":null,""When"":""""},{""Name"":""Heather Timmer"",""ProfilePicture"":""https://lh3.googleusercontent.com/a/ACg8ocLblOGi1XXOP6sBezZn1PIjbXuTWOKGOknP3JUDFVqk_gIz0g=s120-c-rp-mo-br100"",""Rating"":5,""Description"":""Paul and Jake responded to a request to check a leak in my home and they quickly identified the root cause. I really appreciate how respectful and professional they were and how quickly they identified both the problem and also the solution."",""Images"":null,""When"":""""},{""Name"":""Mike and Jaime Inch"",""ProfilePicture"":""https://lh3.googleusercontent.com/a/ACg8ocIDt2Lzhi92sYlaWBVCSLcDXsNQuOrAwALQ4vDKt9_6WZt_YQ=s120-c-rp-mo-br100"",""Rating"":5,""Description"":""I have worked with Robinson Roofing on a couple of buildings I manage and thoroughly enjoy working with them.   Councils, as well as myself, are always impressed with how detailed their reports are but also their customer service.  They are always able and willing to answer any questions for clarification.   I would highly recommend them for your roofing needs!"",""Images"":null,""When"":""""},{""Name"":""Robert Marshal"",""ProfilePicture"":""https://lh3.googleusercontent.com/a-/ALV-UjWb-VxQD7orAVgsBd7P8LGtf5YXjnLWuXQCF1DRLKSN5OWfbc7obA=s120-c-rp-mo-ba3-br100"",""Rating"":5,""Description"":""I've had the pleasure of working with Robinson Roofing for my portfolio of buildings. I'm pleased to say that they provide exceptional service and professionalism. As a property manager, I value fast and reliable service above all else, and Yana and her team at Robinson Roofing have consistently gone above and beyond to meet and exceed my expectations.\n\nFrom the initial consultation to the completion of the projects on site, the team pay meticulous attention to detail, ensuring that every aspect of the roofing projects is handled with care and precision.\nIt's  gratifying , at the end of the service, to see how my clients speak highly of the Robinson team after witnessing the outstanding results firsthand. Good job !"",""Images"":null,""When"":""""},{""Name"":""Uday Sandhu"",""ProfilePicture"":""https://lh3.googleusercontent.com/a/ACg8ocLH_7cMYLlT6NJWGvPQQwv__J5HP1S6vEqF610C7rEWu3bBsQ=s120-c-rp-mo-br100"",""Rating"":5,""Description"":""I recently had the pleasure of working with Robinson Roofing for a roofing project at our strata property, and I couldn't be more impressed with their services. From the initial consultation to the completion of the project, the entire process was handled with the utmost professionalism and efficiency.\n\nThe team at Robinson Roofing demonstrated exceptional expertise and attention to detail. They were punctual, reliable, and communicated clearly throughout the project, ensuring that we were always informed about the progress and any potential issues. Their commitment to quality workmanship was evident in every aspect of the job.\n\nOne of the standout aspects of working with Robinson Roofing was their dedication to customer satisfaction. They took the time to address all of our concerns and provided valuable advice on the best roofing solutions for our property. Their friendly and approachable demeanor made the entire experience pleasant and stress-free.\n\nOverall, I highly recommend Robinson Roofing to anyone in need of roofing services. Their professionalism, quality of work, and excellent customer service make them a top choice in the industry. Thank you!!"",""Images"":null,""When"":""""},{""Name"":""Christina G"",""ProfilePicture"":""https://lh3.googleusercontent.com/a-/ALV-UjXPdzXGfJ8cBc1XIsOzNCtWguQmhXBiviuC-Q-JAQkGPjggZg2g=s120-c-rp-mo-ba3-br100"",""Rating"":5,""Description"":""I am a strata manager and work with Robinson Roofing at many of my buildings. I highly recommend this company; they are a pleasure to work with. Efficient, communicative, and customer-service oriented, miles above the rest! Their investigations and reports are thorough, providing a detailed breakdown of critical, recommended, and maintenance work to be done, giving councils/owners options to work within their budgets. Yana and the team have exceeded my expectations and make my job so much easier!"",""Images"":null,""When"":""""},{""Name"":""Deborah Buttar"",""ProfilePicture"":""https://lh3.googleusercontent.com/a/ACg8ocJTMjYafmIUg_P84Yr_dehJb0fJMP95SYCD6i7kFzwSnHy95w=s120-c-rp-mo-br100"",""Rating"":5,""Description"":""Great, friendly service! Very professional and helpful. Highly recommend Robinson Roof Solutions."",""Images"":null,""When"":""""}]",null,
7e765dbb-146f-4c34-9165-3f3284ca3f5a,https://www.google.com/maps/place/R.J+roofing/data=!4m7!3m6!1s0x5485d5f574f138f5:0xc8ee22f2f42d22de!8m2!3d49.2141934!4d-122.6418265!16s%2Fg%2F11j8h1xjmb!19sChIJ9TjxdPXVhVQR3iIt9PIi7sg?authuser=0&hl=en&rclk=1,R.J roofing,Roofing contractor,"11690 209 St, Maple Ridge, BC V2X 7S4","{""Friday"":[""6 a.m.–5 p.m.""],""Monday"":[""6 a.m.–5 p.m.""],""Saturday"":[""Closed""],""Sunday"":[""Closed""],""Thursday"":[""6 a.m.–5 p.m.""],""Tuesday"":[""6 a.m.–5 p.m.""],""Wednesday"":[""6 a.m.–5 p.m.""]}",{},,(604) 831-2522,"6975+M7 Maple Ridge, British Columbia",2,5.000000,"{""1"":0,""2"":0,""3"":0,""4"":0,""5"":2}",49.214193,-122.641826,14478548278916752094,,,,https://lh3.googleusercontent.com/gps-cs-s/AHVAwepGOqsqwDCthURe4DrbaaEJBZPVKZHVoiyuR-CapZgHoKC1eJglhTyGL2kkJvCNPn5-LGDafD1TKoVgW1gCLPxaYU-gUapL3BWHieRGWUSIXrSEtbrxlmTDqSqyFlk151uooZtR=w425-h240-k-no,America/Vancouver,,0x5485d5f574f138f5:0xc8ee22f2f42d22de,ChIJ9TjxdPXVhVQR3iIt9PIi7sg,"[{""title"":""All"",""image"":""https://lh3.googleusercontent.com/gps-cs-s/AHVAwepGOqsqwDCthURe4DrbaaEJBZPVKZHVoiyuR-CapZgHoKC1eJglhTyGL2kkJvCNPn5-LGDafD1TKoVgW1gCLPxaYU-gUapL3BWHieRGWUSIXrSEtbrxlmTDqSqyFlk151uooZtR=w528-h298-k-no""},{""title"":""House"",""image"":""https://lh3.googleusercontent.com/gps-cs-s/AHVAwepfYo6IV3L8Hp0fmjrPVWgPoKtXtdHvOF7i2aUKwEn9B_FZ26kcNKi6bSdqzlmmcqW6oTin3WHFjCZb12C4ngAdgzYw0860sS8w1QgSUZrw5Jox7GBLHqmqjKiyKidyeLloletOVQ=w402-h298-k-no""},{""title"":""By owner"",""image"":""https://lh3.googleusercontent.com/gps-cs-s/AHVAweojobXT-UhdrNh1_A5coJwizYjEJ9EHguI6IL9_ojsD0C-A8A-l1g8EUTMMNih1cWfjM4C413yzI_ut8g5pWr4OUGVNfpYV4lKhvoZO2YCu91ELAaxssfqbnskgl09WpCW-J12whA=w411-h298-k-no""},{""title"":""Street View \u0026 360°"",""image"":""https://streetviewpixels-pa.googleapis.com/v1/thumbnail?panoid=p2_60JM3OqIpwz0h9zFVtQ\u0026cb_client=maps_sv.tactile.gps\u0026w=224\u0026h=298\u0026yaw=88.30402\u0026pitch=0\u0026thumbfov=100""}]",null,null,"{""link"":"""",""source"":""""}","{""id"":""117153697837800053107"",""name"":""R.J roofing (Owner)"",""link"":""https://www.google.com/maps/contrib/117153697837800053107""}","{""borough"":""Hammond"",""street"":""11690 209 St"",""city"":""Maple Ridge"",""postal_code"":""V2X 7S4"",""state"":""British Columbia"",""country"":""CA""}",null,"[{""Name"":""Paul Levesque"",""ProfilePicture"":""https://lh3.googleusercontent.com/a-/ALV-UjVVvLtgLWZridfpU1u9BJcRIIh2Ku9F4OdXXv7_Fi-N_aGcNdc=s120-c-rp-mo-br100"",""Rating"":5,""Description"":"""",""Images"":null,""When"":""""},{""Name"":""Gurbir Singh"",""ProfilePicture"":""https://lh3.googleusercontent.com/a/ACg8ocL2ioN8dmHTrge8fz56Z0DrtS33kupJ0eF5QIa1Kdy17qH_eq4=s120-c-rp-mo-br100"",""Rating"":5,""Description"":"""",""Images"":null,""When"":""""}]",null,
7e765dbb-146f-4c34-9165-3f3284ca3f5a,https://www.google.com/maps/place/Spartan+Roofing+Ltd/data=!4m7!3m6!1s0x5485d1981660b5bd:0x4aef9a794929fa4f!8m2!3d49.2308375!4d-122.5932812!16s%2Fg%2F11rstlt08m!19sChIJvbVgFpjRhVQRT_opSXma70o?authuser=0&hl=en&rclk=1,Spartan Roofing Ltd,Roofing contractor,"22797 Balabanian Cir, Maple Ridge, BC V2X 8Z5","{""Friday"":[""Open 24 hours""],""Monday"":[""Open 24 hours""],""Saturday"":[""Open 24 hours""],""Sunday"":[""Open 24 hours""],""Thursday"":[""Open 24 hours""],""Tuesday"":[""Open 24 hours""],""Wednesday"":[""Open 24 hours""]}",{},https://spartanroofingbc.com/,(778) 957-7663,"6CJ4+8M Maple Ridge, British Columbia",68,5.000000,"{""1"":0,""2"":1,""3"":0,""4"":0,""5"":67}",49.230837,-122.593281,5399704323949722191,,,,https://lh3.googleusercontent.com/gps-cs-s/AHVAweprYm_qxmp5iGi5Zr5c4iibgJk7gkoxKJTvPo30eF7aaBKhqfUALZ0f6D4l7YTXHzn59WA2iPZJw8Q2rOg7RNeKactt8llozoMEUKz-O5E_GGSXx_sjLZM8cV-9MIxgXVSPz8Tf=w408-h544-k-no,America/Vancouver,,0x5485d1981660b5bd:0x4aef9a794929fa4f,ChIJvbVgFpjRhVQRT_opSXma70o,"[{""title"":""All"",""image"":""https://lh3.googleusercontent.com/gps-cs-s/AHVAweprYm_qxmp5iGi5Zr5c4iibgJk7gkoxKJTvPo30eF7aaBKhqfUALZ0f6D4l7YTXHzn59WA2iPZJw8Q2rOg7RNeKactt8llozoMEUKz-O5E_GGSXx_sjLZM8cV-9MIxgXVSPz8Tf=w224-h298-k-no""},{""title"":""House"",""image"":""https://lh3.googleusercontent.com/gps-cs-s/AHVAwerRkAHPz5EZPZTwDadGYRE-Mg7V2mNZ9HSFpF-NFP4YUlKUDQdEh0nJHDTi5RZse5ZvRSkcN3YgZyf3iyFa115B8axgBlM29XK73K0jKicsMc-mGMKDI6ZG3bWj--vqx-ebd6g=w224-h298-k-no""},{""title"":""Videos"",""image"":""https://lh3.googleusercontent.com/gps-cs-s/AHVAweqSydwLnfeDdO5vMafERpYvemRKxU3ZWKcgpr7SNh112W5oy12vLBfiAlyOnpBKMiZBNedBKYJFmQ2_u-LWGnNeWoM5n7mTFQ838qoxK4AMuJ3yMi9viwpY8IqmTFOXlhHmXp4aql304apm=w224-h398-k-no""},{""title"":""By owner"",""image"":""https://lh3.googleusercontent.com/gps-cs-s/AHVAwep-zQmZ642l8xLaS60zxqlMKeu7X8fDJFhWhqmWTFQfoUDZLBaXVaDEbOfCgXvq5wRqDOGoQhhRkt7VoXYKUKxHR7d5IFtXAwh99jKgMPkwdjP36kPuwuTPKb6uGxQ96_IkgGx4mA=w397-h298-k-no""},{""title"":""Street View \u0026 360°"",""image"":""https://streetviewpixels-pa.googleapis.com/v1/thumbnail?panoid=pG-LXmuvGeZ3W0M0BaElPw\u0026cb_client=maps_sv.tactile.gps\u0026w=224\u0026h=298\u0026yaw=192.87349\u0026pitch=0\u0026thumbfov=100""}]",null,null,"{""link"":"""",""source"":""""}","{""id"":""100672165892743842328"",""name"":""Spartan Roofing Ltd (Owner)"",""link"":""https://www.google.com/maps/contrib/100672165892743842328""}","{""borough"":"""",""street"":""22797 Balabanian Cir"",""city"":""Maple Ridge"",""postal_code"":""V2X 8Z5"",""state"":""British Columbia"",""country"":""CA""}","[{""id"":""accessibility"",""name"":""Accessibility"",""options"":[{""name"":""Wheelchair-accessible entrance"",""enabled"":true},{""name"":""Wheelchair-accessible parking lot"",""enabled"":true}]}]","[{""Name"":""Monica Tse"",""ProfilePicture"":""https://lh3.googleusercontent.com/a/ACg8ocJI910uRousncvmQy1De9ME2B3LLxj0a_4pJyzNvzwztbL6=s120-c-rp-mo-ba2-br100"",""Rating"":5,""Description"":""Michael and his crew completed and replaced the roof and skylight on my mom's house back in the spring of 2023. They did a great job. He and his crew were professional and completed the job thoroughly. When my mom asked him back again two years later for a supposed leak, Michael came the next day and looked at it. It wasn't from the roof but something else. I highly recommend this company. Competitive pricing, easy communication and after almost three years with this new roof, no issues. Would highly recommend Michael and his crew."",""Images"":null,""When"":""""},{""Name"":""KR Travel"",""ProfilePicture"":""https://lh3.googleusercontent.com/a/ACg8ocL8K7LS2D3v9JDlNiSii9qm-g6IkkxO8Ev-RH04-kZ5NFNkzQ=s120-c-rp-mo-ba2-br100"",""Rating"":5,""Description"":""If you are looking to have your roof replaced look no further.\nWe had Michael and his crew replace our roof in June. They are very professional and competitively priced. Crews showed up on time and respected our property. Landscaping was protected and our property was cleaned and swept for nails with a magnet daily.  Don’t hesitate to contract to this company. You won’t be disappointed."",""Images"":null,""When"":""""},{""Name"":""Len Milford"",""ProfilePicture"":""https://lh3.googleusercontent.com/a-/ALV-UjXAKJLyqS1Y8pBkxl2oYkLL1saerVA4CaAmVAK-Vq2XJobDleo-=s120-c-rp-mo-br100"",""Rating"":5,""Description"":""I normally do not do many reviews but felt this one was well deserved. Spartan roofing just replaced the shingles on our roof this past week. What a great team! It was a pleasure to have Michael’s crew here doing the work for us. They were very efficient , polite, and , professional. At the end of each day they walked around the house as well as checking the neighbours property for any debris.  We had watched Spartan do a couple of roofs in the neighborhood and we were very impressed. The finished project is fantastic. I would highly recommend Spartan for any of your roofing needs. Thanks again Michael , and thanks to your well trained team. Len"",""Images"":[""www.google.com/local/imagery/report/?cb_client=maps_sv.tactile\u0026image_key=!1e10!2sCIHM0ogKEOuw6dn-iJ3VEw\u0026fid=0x0:0x4aef9a794929fa4f""],""When"":""2025-5-5""},{""Name"":""Ellie"",""ProfilePicture"":""https://lh3.googleusercontent.com/a/ACg8ocKBYLYqF4of3fgxUCmbDyKXBtnskjjcSmunD_KRWLnLtYHJvw=s120-c-rp-mo-ba3-br100"",""Rating"":5,""Description"":""Spartan is your trustworthy, go-to local roofing company that delivers top-notch service.\n\nThe entire experience with Michael was pleasant and hassel-free. Michael was quick to respond to my urgent request and was able to come over for inspection on the same day. He was professional, honest and even offered to do a minor repair at no charge!\n\nI will definitely come back to Michael for my future roof replacement/repair need. Highly recommend!"",""Images"":[""www.google.com/local/imagery/report/?cb_client=maps_sv.tactile\u0026image_key=!1e10!2sCIHM0ogKEICAgIDbzIKIEQ\u0026fid=0x0:0x4aef9a794929fa4f""],""When"":""2024-8-2""},{""Name"":""Joy B"",""ProfilePicture"":""https://lh3.googleusercontent.com/a-/ALV-UjUc16yVB4puC4QQtDxzGu4zVgrSjsbs5W28GTlxeCne6g-3q79N=s120-c-rp-mo-ba2-br100"",""Rating"":5,""Description"":""We recently had our roof replaced. Michael and his team are fast and professional. Curtis was great at managing the crew and answering our questions.\nFor a complete roof replacement, I was surprised at how clean they kept the site. Highly recommend."",""Images"":[""www.google.com/local/imagery/report/?cb_client=maps_sv.tactile\u0026image_key=!1e10!2sCIHM0ogKEICAgIDbo5Lu2QE\u0026fid=0x0:0x4aef9a794929fa4f""],""When"":""2024-8-8""},{""Name"":""Dragos Stefanescu"",""ProfilePicture"":""https://lh3.googleusercontent.com/a-/ALV-UjX0rjKJzvG-jdZK3OZi0fSsjEOHqxdsDnPNI0DNGxgD5U5XpfzU=s120-c-rp-mo-ba2-br100"",""Rating"":5,""Description"":""Michael and his team have done an exceptional job. We have a large house in West Vancouver with a very complex roof on three levels. We wanted a metal roof and the complexity increased significantly as a result. Michael has very strong technical knowledge, and made valuable recommendations including a layer of material for sound proofing. Michael has been up on the roof every single day with his team was laser focused on every detail. And above all, this team has a great attitude and their pricing is very competitive. Give them a chance and you will not be disappointed."",""Images"":null,""When"":""""},{""Name"":""Alex MISIUKEVICH"",""ProfilePicture"":""https://lh3.googleusercontent.com/a/ACg8ocKNe0AwxC4bYJ4ovSZvSbxMS7WY_mRnKbUFwydFUzV2jyue=s120-c-rp-mo-br100"",""Rating"":5,""Description"":""Found Spartan roofing on FB and decided to meet to get their  estimate. Mike was really good and explained everything I needed. Offered to consider a few options to make sure that I'm fully confident and satisfied.  The price was really good too. Everything happened as promised from early morning arrival to the moment when everything was completed. Mike came next day just to make sure that there was no nails or garbage missed. Great sign of respect and responsibility. Really appreciated. This company is solid. All guys are super friendly, professional and experienced. I'm hiring them for my new gutters. This company you can trust your business and any issues with your  roof. Highly recommend."",""Images"":[""www.google.com/local/imagery/report/?cb_client=maps_sv.tactile\u0026image_key=!1e10!2sCIHM0ogKEICAgIChh_f-wQE\u0026fid=0x0:0x4aef9a794929fa4f""],""When"":""2023-2-23""},{""Name"":""Jack Nickel"",""ProfilePicture"":""https://lh3.googleusercontent.com/a-/ALV-UjXQjnQqhYbFQvkIWYDWSt3S6XOnhEN1rko4qClcyw2nuquXvGx-=s120-c-rp-mo-br100"",""Rating"":5,""Description"":""My roof was 24 years old and I knew that the cladding on my two chimney chases was in bad shape. I contacted several roofing companies but Michael at Spartan was the only one willing to do the whole job. Before making a final decision I spoke with an individual who had his roof replaced by Michael. He told me he was very happy with the work and the only problem he had was chasing Michael down to pay him. This individual also mentioned that Spartan had replaced a roof across the street and that the work had originally been contracted to Penfolds but that they had subcontracted the work to Spartan. I had also been talking to Penfolds but their quote was roughly 50% higher than Spartan's for the roof portion alone. Spartan was clearly the best choice.\n\nI decided to go with the Landmark PRO shingles and I am glad I did. They are a heavier shingle as evidenced by the difficulty in cutting them. I was impressed with the work ethic of the crew. It was difficult to get them to take a break even though it was quite hot.\n\nThe main chimney chase was clad in channel cedar and was roughly 25 feet high. The original builder had not flashed the top of the chimney and when Michael pulled the bottom siding off it was clear that the base structure was totally rotted and that all the plywood and siding on two sides had to be replaced. He dove right in, fortified the structure and replaced the plywood and siding and ensured that it had proper flashing so the problem would not happen again. All of this was done by ladder from sloped ground - truly amazing!\n\nI am very happy with the quality of work done and I have no reservation in recommending Michael and Spartan to my friends and family. I feel lucky to have found him."",""Images"":[""www.google.com/local/imagery/report/?cb_client=maps_sv.tactile\u0026image_key=!1e10!2sCIHM0ogKEICAgICJqsjfPw\u0026fid=0x0:0x4aef9a794929fa4f""],""When"":""2023-6-24""}]",null,
