input_id,link,title,category,address,open_hours,popular_times,website,phone,plus_code,review_count,review_rating,reviews_per_rating,latitude,longitude,cid,status,descriptions,reviews_link,thumbnail,timezone,price_range,data_id,place_id,images,reservations,order_online,menu,owner,complete_address,about,user_reviews,user_reviews_extended,emails
2fd3d115-6db8-4e9d-84d7-88ecad1b679d,https://www.google.com/maps/place/Rhino+Exteriors+Ltd./data=!4m7!3m6!1s0x5488a3b99fb2bab3:0x10ec817b9bbf4a72!8m2!3d49.1629446!4d-123.9831845!16s%2Fg%2F11vx1v1gnc!19sChIJs7qyn7mjiFQRckq_m3uB7BA?authuser=0&hl=en&rclk=1,Rhino Exteriors Ltd.,Siding contractor,"311 Dorchester Pl, Nanaimo, BC V9R 1M5","{""Friday"":[""8 a.m.–6 p.m.""],""Monday"":[""8 a.m.–6 p.m.""],""Saturday"":[""9 a.m.–5 p.m.""],""Sunday"":[""Closed""],""Thursday"":[""8 a.m.–6 p.m.""],""Tuesday"":[""8 a.m.–6 p.m.""],""Wednesday"":[""8 a.m.–6 p.m.""]}",{},https://www.rhinoexterior.ca/,(236) 238-1955,"5278+5P Nanaimo, British Columbia",9,4.600000,"{""1"":1,""2"":0,""3"":0,""4"":0,""5"":8}",49.162945,-123.983184,1219491967004527218,,,,https://lh3.googleusercontent.com/gps-cs-s/AHVAwepsdVq1-Cwxfv67MWT6UCGbHDpZkhGpqj8lrOuaLj8CNddozfPunQCAnauImFyXCAHi_iwlPQRUYVlo52b7uqMlPe9MSvgDn3ERUm41taFIg0PG8zWu6tEVDm9N0cetdjCJQXfg=w408-h306-k-no,America/Vancouver,,0x5488a3b99fb2bab3:0x10ec817b9bbf4a72,ChIJs7qyn7mjiFQRckq_m3uB7BA,"[{""title"":""All"",""image"":""https://lh3.googleusercontent.com/gps-cs-s/AHVAwepsdVq1-Cwxfv67MWT6UCGbHDpZkhGpqj8lrOuaLj8CNddozfPunQCAnauImFyXCAHi_iwlPQRUYVlo52b7uqMlPe9MSvgDn3ERUm41taFIg0PG8zWu6tEVDm9N0cetdjCJQXfg=w397-h298-k-no""},{""title"":""Home"",""image"":""https://lh3.googleusercontent.com/gps-cs-s/AHVAweo1HY0Q1sXNNCiN11EtFsMoJxvci65Op_ykQ2ZBK0RPrxVRh09Ul5watzytIz-0PmYd9PwcqAR1PK6ZKtf_aQ4fU1YqJUVTIjKadxTS_AhJ6rRxVbDt8eA-a-eCX-B8rrTsbWKJ=w224-h298-k-no""},{""title"":""By owner"",""image"":""https://lh3.googleusercontent.com/gps-cs-s/AHVAwepe4KheHvYeKJYHyYrdS36viFwuLviOdYDeeRq-AWlVGZr-yfAXAFrgNqSHVhfjZqUNbzBeSrH3CgCMMfZO52vI2lZSxSShcLapg6kuw-MubM3A7QdoC6Wm5ymVTNOlbrd2FwFxfg=w397-h298-k-no""},{""title"":""Street View \u0026 360°"",""image"":""https://streetviewpixels-pa.googleapis.com/v1/thumbnail?panoid=fp2WBwlhjxNB9NIwPf3-lQ\u0026cb_client=maps_sv.tactile.gps\u0026w=224\u0026h=298\u0026yaw=336.69498\u0026pitch=0\u0026thumbfov=100""}]",null,null,"{""link"":"""",""source"":""""}","{""id"":""115946393702407727945"",""name"":""Rhino Exteriors Ltd. (Owner)"",""link"":""https://www.google.com/maps/contrib/115946393702407727945""}","{""borough"":"""",""street"":""311 Dorchester Pl"",""city"":""Nanaimo"",""postal_code"":""V9R 1M5"",""state"":""British Columbia"",""country"":""CA""}","[{""id"":""accessibility"",""name"":""Accessibility"",""options"":[{""name"":""Wheelchair-accessible parking lot"",""enabled"":true}]}]","[{""Name"":""Shahid Kazi"",""ProfilePicture"":""https://lh3.googleusercontent.com/a-/ALV-UjXdu_N0TRQavspA5n40cnfrCpukdVRzQb3PaeTgxjMIA36sVFky=s120-c-rp-mo-br100"",""Rating"":5,""Description"":""Lucky and his crew were here the day they planned to start. They were not the cheapest, but they were not the most expensive by any means. Lucky gave us a detailed breakdown of all the different options for our home as we had no idea where to start. We valued his opinion and he was honest which we appreciated. The crew that showed up were so happy, no matter the weather they always had their game face on. They kept the site extremely clean \u0026 always kept us in the loop with how things were going. Our home is hardly recognizable, I cannot believe they were able to make our home look so beautiful. They even came in under budget with no surprises at the end. We would use rhino Exteriors again in a heartbeat. Thank you so much lucky ,sukh , aman \u0026 Harman 🤗❤️"",""Images"":null,""When"":""""},{""Name"":""GulamJilani Vahora"",""ProfilePicture"":""https://lh3.googleusercontent.com/a-/ALV-UjXNMR_Sx8b2d6TmHkqtlD5YWFI276EhWJEdO-Q8xYk_MGHr1zU=s120-c-rp-mo-br100"",""Rating"":5,""Description"":""Excellent service and quality finish thanks the team sent by Rhino Siding. The team delivered on every promise and they did a fantastic job and kept me upto date with what they were doing on a daily basis. Highly recommend Rhino Exteriors ltd."",""Images"":null,""When"":""""},{""Name"":""Saifu Vahora"",""ProfilePicture"":""https://lh3.googleusercontent.com/a/ACg8ocJQPGJj_0b-vRwfyS-VOTUCd3q-efzuGVllEaiGY4hwE4rVGw=s120-c-rp-mo-br100"",""Rating"":5,""Description"":""Hard working professionals.\nDedicated and quality work.\nVery competitive.\nWere right on time for scheduled work and was COMPLETED ON TIME(must have for me as a builder). I have been dealing with various construction guys for last 10+ years but believe me when I say he is the most humble person I have ever met. Additionally, they fixed problems with two of my earlier projects with very competitive pricing and again QUALITY WORK.\n\nI would have rated them 10 starts if google allows."",""Images"":null,""When"":""""},{""Name"":""Keyur Brahmbhatt"",""ProfilePicture"":""https://lh3.googleusercontent.com/a-/ALV-UjVCMjzo6oZzm0AwzQxW6r4ODB7xvZaiSAhN53BAln-xfhl8Eu03YA=s120-c-rp-mo-ba3-br100"",""Rating"":5,""Description"":""Rhino exteriors did a fantastic job on my siding, exceeding all my expectations. Their attention to detail was remarkable, and they displayed professionalism, excellent organization, and a genuinely friendly approach throughout the project.\nHard working team 💪🤗\nThank you so much guys 🥰"",""Images"":null,""When"":""""},{""Name"":""Palpreet Samra"",""ProfilePicture"":""https://lh3.googleusercontent.com/a-/ALV-UjXKEJnT4fKHMfzkNzyZeLlQUxa2fCcQmyvye3HOSNq7WYDFPN4=s120-c-rp-mo-br100"",""Rating"":5,""Description"":""The team at Rhino exteriors is awesome! I had some tricky requests but they did a fantastic job! I’m really pleased with the final result and wouldn’t hesitate to use them again! Thanks Lucky."",""Images"":null,""When"":""""},{""Name"":""pardeep Gill"",""ProfilePicture"":""https://lh3.googleusercontent.com/a/ACg8ocL5Y6F46tQ8eFnXUQ4fL9U6M6i3nREH8-EpSwhBbsIdOeqUig=s120-c-rp-mo-br100"",""Rating"":5,""Description"":""Impressive Siding Replacement by Rhino Exterior\n\nI had a fantastic experience with Rhino Exterior for my home's siding replacement. Their team was highly professional and knowledgeable. They provided exceptional customer service, guiding me through the process with clarity and expertise. The installation was efficient and done with great attention to detail. The quality of workmanship exceeded my expectations, and my home looks amazing. I highly recommend Rhino Exterior for anyone looking for a reliable and skilled siding company."",""Images"":null,""When"":""""},{""Name"":""Jason Adelborg"",""ProfilePicture"":""https://lh3.googleusercontent.com/a-/ALV-UjWn5eXmASb1-s3lXTUFfEcTsiEk_aAfIWcoUx9rgbb_qBwN7x8=s120-c-rp-mo-ba2-br100"",""Rating"":1,""Description"":""Terrible company. Shop elsewhere unless your last resort on this planet. Untrustworthy compared to multiple other siding companies here in Nanaimo. Shop shop and keep shopping."",""Images"":[""www.google.com/local/imagery/report/?cb_client=maps_sv.tactile\u0026image_key=!1e10!2sCIABIhAZdqHjgt6jpy7SuoUSp1kZ\u0026fid=0x0:0x10ec817b9bbf4a72""],""When"":""2025-8-28""},{""Name"":""Tejpal"",""ProfilePicture"":""https://lh3.googleusercontent.com/a/ACg8ocJwFZ_PkBD8yLQ3vSobtvzrRj3lXDI-OY4HhPQUPmvdj5Fq-Q=s120-c-rp-mo-br100"",""Rating"":5,""Description"":""Great job, did the work efficiently and properly without issues."",""Images"":null,""When"":""""}]",null,
2fd3d115-6db8-4e9d-84d7-88ecad1b679d,https://www.google.com/maps/place/Paramount+Exteriors+ltd./data=!4m7!3m6!1s0xa8f461782e08aefb:0xdd1c2750e9a59415!8m2!3d49.197153!4d-124.0047893!16s%2Fg%2F11ry9rmfmc!19sChIJ-64ILnhh9KgRFZSl6VAnHN0?authuser=0&hl=en&rclk=1,Paramount Exteriors ltd.,Construction company,"2353 Mandalik Pl, Nanaimo, BC V9T 0C6","{""Friday"":[""8 a.m.–6 p.m.""],""Monday"":[""8 a.m.–6 p.m.""],""Saturday"":[""10 a.m.–5 p.m.""],""Sunday"":[""Closed""],""Thursday"":[""8 a.m.–6 p.m.""],""Tuesday"":[""8 a.m.–6 p.m.""],""Wednesday"":[""8 a.m.–6 p.m.""]}",{},https://paramountexteriors.ca/,(236) 330-7165,"5XWW+V3 Nanaimo, British Columbia",19,5.000000,"{""1"":0,""2"":0,""3"":0,""4"":0,""5"":19}",49.197153,-124.004789,15932652810200781845,,,,https://lh3.googleusercontent.com/gps-cs-s/AHVAwerpamQkd7kNa7PSi9SqMixKSZjzZy8dxMWWhsasZJuXHckTo2-EKRzuF_3jwjddOmlFGFAO_hi5IMzetocLL6hVrJEqJeMo3kPmty31ol7UIyssyGrYw7A58LrCoqvn2noEpBJl=w408-h305-k-no,America/Vancouver,,0xa8f461782e08aefb:0xdd1c2750e9a59415,ChIJ-64ILnhh9KgRFZSl6VAnHN0,"[{""title"":""All"",""image"":""https://lh3.googleusercontent.com/gps-cs-s/AHVAwerpamQkd7kNa7PSi9SqMixKSZjzZy8dxMWWhsasZJuXHckTo2-EKRzuF_3jwjddOmlFGFAO_hi5IMzetocLL6hVrJEqJeMo3kPmty31ol7UIyssyGrYw7A58LrCoqvn2noEpBJl=w397-h298-k-no""},{""title"":""Exterior"",""image"":""https://lh3.googleusercontent.com/gps-cs-s/AHVAwerpamQkd7kNa7PSi9SqMixKSZjzZy8dxMWWhsasZJuXHckTo2-EKRzuF_3jwjddOmlFGFAO_hi5IMzetocLL6hVrJEqJeMo3kPmty31ol7UIyssyGrYw7A58LrCoqvn2noEpBJl=w397-h298-k-no""},{""title"":""Inside"",""image"":""https://lh3.googleusercontent.com/gps-cs-s/AHVAweo8kTyzfUWaPzSaR3FzIHDPaR4lAMBOVGww6GdjWal3Siq3DAfwo6ygm7c8kTjK2lSPIhXjRT4gv3GN5L2OIf0_dFknQYYGuxCV_OJdhstveNG9a-mKeuQXf0gx47KlWlwvJTjX=w397-h298-k-no""},{""title"":""By owner"",""image"":""https://lh3.googleusercontent.com/gps-cs-s/AHVAweoJf0VoEJ_algvZ7CrfJHAKX1hrPaYrQZFL-1bDDA01Ze45uGPeXcw-3preL15TFwrT8KAWxkg3Hh1RvcEu2QkHPISWki9DfDeeWT_5viV_V_vyTG8qVscHXrIXna8sS5PXZe0d=w444-h298-k-no""},{""title"":""Street View \u0026 360°"",""image"":""https://streetviewpixels-pa.googleapis.com/v1/thumbnail?panoid=gdqXoHwRWAgF0ML-eKS06g\u0026cb_client=maps_sv.tactile.gps\u0026w=224\u0026h=298\u0026yaw=274.74884\u0026pitch=0\u0026thumbfov=100""}]",null,null,"{""link"":"""",""source"":""""}","{""id"":""101368254316663672950"",""name"":""Paramount Exteriors ltd. (Owner)"",""link"":""https://www.google.com/maps/contrib/101368254316663672950""}","{""borough"":"""",""street"":""2353 Mandalik Pl"",""city"":""Nanaimo"",""postal_code"":""V9T 0C6"",""state"":""British Columbia"",""country"":""CA""}","[{""id"":""accessibility"",""name"":""Accessibility"",""options"":[{""name"":""Wheelchair-accessible parking lot"",""enabled"":true}]}]","[{""Name"":""prabhdyal singh Buttar"",""ProfilePicture"":""https://lh3.googleusercontent.com/a/ACg8ocLZhIJEBXYDPpToJls0xIlSi08zk_bHh1CIztQgI6ulPcvFkg=s120-c-rp-mo-br100"",""Rating"":5,""Description"":""Hard working professionals.\nDedicated and quality work.\nVery competitive.\nWere right on time for scheduled work and was COMPLETED ON TIME(must have for me as a builder). I have been dealing with various construction guys for last 10+ years but believe me when I say he is the most humble person I have ever met. Additionally, they fixed problems with two of my earlier projects with very competitive pricing and again QUALITY WORK.\n\nI would have rated them 10 starts if google allows."",""Images"":null,""When"":""""},{""Name"":""Kb Singh"",""ProfilePicture"":""https://lh3.googleusercontent.com/a-/ALV-UjWLoY_ojzBni7SoF6IrBFnambLpzUYX2dR1fxGWPsrVB4rC4ii1=s120-c-rp-mo-br100"",""Rating"":5,""Description"":""Very hard working,skilful and motivated people. I got my house renovated and these guys went above and beyond to get the work done way faster then expected. So, overall very impressed with their service. I highly recommend their work👍"",""Images"":null,""When"":""""},{""Name"":""Guninder Gill"",""ProfilePicture"":""https://lh3.googleusercontent.com/a/ACg8ocIcQ1qE5gHV91RaGBJMaBT6AR6Fz62fdIrVfqcebDla8moOVw=s120-c-rp-mo-br100"",""Rating"":5,""Description"":""These guys are punctual, honest, and do an excellent job. I have used them for two sites and their quality, timeliness, cost, and communication are excellent. Highly recommended."",""Images"":null,""When"":""""},{""Name"":""harman aman"",""ProfilePicture"":""https://lh3.googleusercontent.com/a/ACg8ocL3FeRzCyz1mp1mdGEnn6Nvxmr3kNdBp_ALKWb0O_SUDQOHKw=s120-c-rp-mo-br100"",""Rating"":5,""Description"":""These guys are awesome. Top quality finishing. They worked at my house very polite \u0026 humble boys. Always on time. I recommend Paramount Exterior to all my friends."",""Images"":null,""When"":""""},{""Name"":""Sukh Dusanj"",""ProfilePicture"":""https://lh3.googleusercontent.com/a/ACg8ocJRXqF1qaCeFQ9fSNMkHvhw-Q2OPqEQZLa8gdSbEZ1dvRHhEbg=s120-c-rp-mo-ba3-br100"",""Rating"":5,""Description"":""I  got work done from these guys really hard workers great quality work recommend them to anyone.. try it out"",""Images"":null,""When"":""""},{""Name"":""Lakhwinder Sangha"",""ProfilePicture"":""https://lh3.googleusercontent.com/a/ACg8ocLxmA_DgSOBFPpLCo2MsdvYwzO5isZ8SWn85LzahgBcXfXljw=s120-c-rp-mo-br100"",""Rating"":5,""Description"":""Great company  working very hard on reasonable  price ..very humble guys ,I always recommend  this one  to all my friends and family.."",""Images"":null,""When"":""""},{""Name"":""Takdeer Boora"",""ProfilePicture"":""https://lh3.googleusercontent.com/a/ACg8ocLSoOL9XZfjssI2M6WdenWXNUKXM5RE5OffMoSX6qGoSJKZUA=s120-c-rp-mo-br100"",""Rating"":5,""Description"":""I got done my railing work is amazing … highly recommend to try them 👍"",""Images"":null,""When"":""""},{""Name"":""ravi chahal"",""ProfilePicture"":""https://lh3.googleusercontent.com/a/ACg8ocKlhELTp8KBA2LhEeK3PU8sqPOTb9PnO-Xyk6nAhgVYKhRp3w=s120-c-rp-mo-br100"",""Rating"":5,""Description"":""Really good quality work .finished on time .very nice to deal With .very friendly"",""Images"":null,""When"":""""}]",null,
2fd3d115-6db8-4e9d-84d7-88ecad1b679d,https://www.google.com/maps/place/ArcRom+Contracting/data=!4m7!3m6!1s0x5488a344f962ab13:0xe3bd87a6f739f8c!8m2!3d49.1661781!4d-123.9463877!16s%2Fg%2F11x7cqmbfw!19sChIJE6ti-USjiFQRjJ9zb3rYOw4?authuser=0&hl=en&rclk=1,ArcRom Contracting,Construction company,"207 Milton St, Nanaimo, BC V9R 2K5","{""Friday"":[""9 a.m.–4:30 p.m.""],""Monday"":[""9 a.m.–4:30 p.m.""],""Saturday"":[""Closed""],""Sunday"":[""Closed""],""Thursday"":[""9 a.m.–4:30 p.m.""],""Tuesday"":[""9 a.m.–4:30 p.m.""],""Wednesday"":[""9 a.m.–4:30 p.m.""]}",{},http://www.arcromcontracting.com/,(250) 327-9374,"5383+FC Nanaimo, British Columbia",7,4.400000,"{""1"":1,""2"":0,""3"":0,""4"":0,""5"":6}",49.166178,-123.946388,1025651360524377996,,,,https://lh3.googleusercontent.com/gps-cs-s/AHVAweoQwyGC1_e5QTN5tGKvYNdIe9uYdHzP2-AvFRwAouDdNgFuvzAzTb0fZmLvTtuRGv4H_lrpVzcowbazWY9SulLt0haQV9zzLuP6DzPlPL7eMABogA4pMzOUYUvgo6twUP9CE07MJiXfzEFq=w408-h510-k-no,America/Vancouver,,0x5488a344f962ab13:0xe3bd87a6f739f8c,ChIJE6ti-USjiFQRjJ9zb3rYOw4,"[{""title"":""All"",""image"":""https://lh3.googleusercontent.com/gps-cs-s/AHVAweoQwyGC1_e5QTN5tGKvYNdIe9uYdHzP2-AvFRwAouDdNgFuvzAzTb0fZmLvTtuRGv4H_lrpVzcowbazWY9SulLt0haQV9zzLuP6DzPlPL7eMABogA4pMzOUYUvgo6twUP9CE07MJiXfzEFq=w238-h298-k-no""},{""title"":""Inside"",""image"":""https://lh3.googleusercontent.com/gps-cs-s/AHVAwep8lZRT0L3uIvIJlYAXvhEwnO5g4kHTOTNGs9Ic3qSBmztri7683qOIE_2An0qnfNcYVq-FHWqUrKKGOtLo447ZO0KticluYAwlNTW4aRUMiSWswRdq9FLV5TZc5aPIGyOCZh3ecSZ8Hm1z=w451-h298-k-no""},{""title"":""Concrete"",""image"":""https://lh3.googleusercontent.com/gps-cs-s/AHVAweq3EbHBZZfPAplp3ViQY8MBryqQMhODkZ9_xxh_CaHUXNjTyEQV8TGykA9gx9ILgkRdvEwVe9F0yPZa9F4F4W4LVKF56a3b-vWj9pRTRjittdAMMXRFfB9wOc7e4H4JuD1tjX-q=w224-h298-k-no""},{""title"":""By owner"",""image"":""https://lh3.googleusercontent.com/gps-cs-s/AHVAweoJMCtD8HkoktjMLS7wyKHD4xsTLx_aq92jSfZ6m1bhW3yG4v5U7v9sX5gC3ARAkDYySogdL7af73y4qi2kCo2IdmQab60gB5NfgdTZ5ADympi4TNl6i68HtdUoH6uZPlwLTKqiO27EAOMU=w235-h298-k-no""},{""title"":""Street View \u0026 360°"",""image"":""https://streetviewpixels-pa.googleapis.com/v1/thumbnail?panoid=0mK87A2-BwD9FMIA7aD4DQ\u0026cb_client=maps_sv.tactile.gps\u0026w=224\u0026h=298\u0026yaw=254.76067\u0026pitch=0\u0026thumbfov=100""}]",null,null,"{""link"":"""",""source"":""""}","{""id"":""100852549962178641265"",""name"":""ArcRom Contracting (Owner)"",""link"":""https://www.google.com/maps/contrib/100852549962178641265""}","{""borough"":"""",""street"":""207 Milton St"",""city"":""Nanaimo"",""postal_code"":""V9R 2K5"",""state"":""British Columbia"",""country"":""CA""}",null,"[{""Name"":""Ashley Zelinski"",""ProfilePicture"":""https://lh3.googleusercontent.com/a-/ALV-UjVbpcst6yjbvFpO0V2rfzmFmleqNMBgdp5FxBpEhWEZpbR5g6w=s120-c-rp-mo-ba2-br100"",""Rating"":5,""Description"":""Joey from ArcRom Contracting built a beautiful and safe balcony for my family home, and I couldn't be happier with the result. As a new homeowner, I bought a house that needed some renovations—top of the list was replacing a very unstable balcony. Joey and his team confirmed it was unsafe and at risk of collapsing. Before I had even committed to hiring them, they installed temporary support beams right away, just to make sure my family would be safe. That level of care and integrity really stood out.\n\nThe final result was fantastic. The work was solid, clean, and done with great attention to detail. You can see the transformation in the before and after photos—such a huge improvement. I highly recommend ArcRom Contracting for anyone needing quality, reliable work on their home."",""Images"":[""www.google.com/local/imagery/report/?cb_client=maps_sv.tactile\u0026image_key=!1e10!2sCIHM0ogKEICAgMCowtvLQw\u0026fid=0x0:0xe3bd87a6f739f8c""],""When"":""2025-4-15""},{""Name"":""Matt Sterling"",""ProfilePicture"":""https://lh3.googleusercontent.com/a-/ALV-UjXY16KbHhECLGV5BpBQX0op1HuXSqWjOop07GGuzX-SmL04WvX5=s120-c-rp-mo-br100"",""Rating"":5,""Description"":""Working with Joey at ArcRom Contracting has been a great experience. He genuinely cares about the details and takes pride in making sure everything is done properly. As an excavation crew, that level of professionalism makes a big difference. It’s always a pleasure being involved in his builds."",""Images"":null,""When"":""""},{""Name"":""C Schneider"",""ProfilePicture"":""https://lh3.googleusercontent.com/a-/ALV-UjWh1J3xyTYdJHBGmpcyzzvm6aFiUmR7oCYScjMghBgur73EY8Btkw=s120-c-rp-mo-br100"",""Rating"":5,""Description"":""Joey and his team were great to work with. They built us a beautiful pergola deck and we are still very happy with it two years later. Our original design had to be tweaked and we could not be happier with their changes. I highly recommend them for their professionalism, integrity and expertise."",""Images"":null,""When"":""""},{""Name"":""Jill Dee"",""ProfilePicture"":""https://lh3.googleusercontent.com/a/ACg8ocLNEF-RDXxuRmTFGazJkBrfuA8XEd_nSxBuN-1AGWGdiJdhZw=s120-c-rp-mo-br100"",""Rating"":1,""Description"":""I wish I could leave ZERO stars! At our 2nd meeting in May 2025, Joey arrived with a contract and a request for a $5,000 deposit without having previously mentioned either. My bank would only allow an etransfer of $3,000 so that’s what he got.\n\nHe took measurements for kitchen cabinets and vanities. Two weeks later, the first cabinet design was received but was missing the pantry units I’d requested. Joey told me that couldn’t be done as they were “custom” which seemed odd to me as they are very similar in size to the existing pantry units sold by the company.\n\nI then received an updated kitchen design but they’d moved my stove, dishwasher and sink. I asked him how that could happen and he said it usually takes about a dozen renditions to get the design correct – hard to believe!\n\nI contacted the cabinet co. to get the design right. When I got in contact with the designer, she asked about the plan she’d done on June 10, however, Joey never sent that one to me.  So here it was a month later and I was just learning about it. She also stated “I am working with Joey Hansen for several kitchen plans” which I found concerning.  My pantry units were definitely doable and the design was finalized in less than 48hours.\n\nI had to request window, electrical and plumbing quotes but only got the window one. He then ghosted me and wouldn’t reply for 5 weeks so I requested a refund of the unspent part of my deposit which was $1600. No reply or refund in a week so I told him I would leave negative reviews everywhere I could. Three days later, still no reply so I told him he had until the following morning to refund the money or I would lodge a complaint with the BBB and leave negative reviews all over Facebook. The money was refunded that night.\n\nJoey wasted my money, my time and my opportunity - he knew I’d wanted to get the reno done during the summer while my 4 dogs and I could be outside and out of the way. I stated the foregoing to him and told him that I really should have gotten all my money back as he was the one to pull the plug and not me. Had I been the one to back out, of course, I would not have expected to receive any money back as it would have been my fault. But not the case here!  Anyway, he gave me $500 more back but I still ended up wasting $900 of my money on him.  He told me if I wanted any more, I would have to go before the civil resolution tribunal.  I’m really, really glad I never gave him the $5,000 he’d wanted!\n\nIn the end, Joey said the contract allowed for either party to end the contract and that is what he did.  But he didn’t even have the decency to tell me that and instead just ghosted me until I got fed up and angry and asked for my money back! Is that how a reputable contractor does business???  He is not an ethical person and I am certain had it not been for the potential of negative reviews everywhere hanging over his head, I never would have seen a cent returned!\n\nI have concluded that he most likely didn’t intend to ever do the reno and quite likely is stringing people like me along and cherry-picking which job pays the most and is the most high-profile. And as result of what he did, I am stuck until next summer.  PS – he’s a tiler who got into general contracting!"",""Images"":null,""When"":""""},{""Name"":""Julien Prevost"",""ProfilePicture"":""https://lh3.googleusercontent.com/a-/ALV-UjWT-9n8HYx7YX-oldLjwp0ut5t_aHmjotKTypQS5p9fmRB3uouG=s120-c-rp-mo-ba3-br100"",""Rating"":5,""Description"":""Great contractor to deal with in Nanaimo.  I have personally used them for a renovation and have also had clients pleased with the work."",""Images"":null,""When"":""""},{""Name"":""ken witala"",""ProfilePicture"":""https://lh3.googleusercontent.com/a/ACg8ocLTMTHbVj2aNESs_VPiHbaYHaV9MKRvBodQZfzH1uwSHesn6Q=s120-c-rp-mo-br100"",""Rating"":5,""Description"":""Would not hesitate to contact Joey at ArcRom Contracting for any renovations that need to be done.  Joey has a keen eye for what you are looking for and the end results are amazing."",""Images"":null,""When"":""""},{""Name"":""Brad Woods"",""ProfilePicture"":""https://lh3.googleusercontent.com/a-/ALV-UjWZAy6Sb-HF6Y2BVoAdUuZNe19NGVrOd7NnmSzNkLmectZbu8h0=s120-c-rp-mo-ba2-br100"",""Rating"":5,""Description"":""Great guy excellent work. Recommend"",""Images"":null,""When"":""""}]",null,
