input_id,link,title,category,address,open_hours,popular_times,website,phone,plus_code,review_count,review_rating,reviews_per_rating,latitude,longitude,cid,status,descriptions,reviews_link,thumbnail,timezone,price_range,data_id,place_id,images,reservations,order_online,menu,owner,complete_address,about,user_reviews,user_reviews_extended,emails
2fd3d115-6db8-4e9d-84d7-88ecad1b679d,https://www.google.com/maps/place/Earth+to+Sky+Contracting/data=!4m7!3m6!1s0x8fad08297d79e613:0x329e9e248248d133!8m2!3d49.1780019!4d-123.937012!16s%2Fg%2F11y3zzg3pr!19sChIJE-Z5fSkIrY8RM9FIgiSenjI?authuser=0&hl=en&rclk=1,Earth to Sky Contracting,Contractor,,{},{},https://earthtosky.ca/,(250) 951-4915,,7,5.000000,"{""1"":0,""2"":0,""3"":0,""4"":0,""5"":7}",49.178002,-123.937012,3647526627858501939,,,,https://lh3.googleusercontent.com/gps-cs-s/AHVAweoyTP8ick8FAa7S9TBQjBMfc0qLE9EodZCp_93vtq3WfQrZNoSFNDzSKj6zJgn_wML9i3D_bAhL4qHFnnU-IQuOQZDkAu1SRtWS2oS3oswrQ7A5pkvkRKOM5ML7mw-PURTfL3xT5LBUYrvZ=w408-h306-k-no,America/Vancouver,,0x8fad08297d79e613:0x329e9e248248d133,ChIJE-Z5fSkIrY8RM9FIgiSenjI,"[{""title"":""All"",""image"":""https://lh3.googleusercontent.com/gps-cs-s/AHVAweoyTP8ick8FAa7S9TBQjBMfc0qLE9EodZCp_93vtq3WfQrZNoSFNDzSKj6zJgn_wML9i3D_bAhL4qHFnnU-IQuOQZDkAu1SRtWS2oS3oswrQ7A5pkvkRKOM5ML7mw-PURTfL3xT5LBUYrvZ=w397-h298-k-no""},{""title"":""Inside"",""image"":""https://lh3.googleusercontent.com/gps-cs-s/AHVAwepmTvx7HJxuGsXyiCUgY4iqdljm8NqRFGAiQg8WjnDt78PaDF9VqTBgXKLFTkiMAL2NiRioR0tIoq1DqJzbpvc9C6mos1F_9c71Est9sTKsmziBpqWh8qhg464PVDs2I985nzi5f1OJWB0=w224-h298-k-no""},{""title"":""By owner"",""image"":""https://lh3.googleusercontent.com/gps-cs-s/AHVAweqYXPCEeZwjguM3lJuaJrQy-BhoFvDT7I1r8CtC1Xxe9lQJlV_93qni3lIqumYS6vuYvElw_b1gNKrXwaKB5fdg-1orIA_PTGTGueeYOAZ_mG6jA3HKPy-PAXaK0Ek4wjMNUfxrXO65cuk=w397-h298-k-no""}]",null,null,"{""link"":"""",""source"":""""}","{""id"":""108201659466489762227"",""name"":""Earth to Sky Contracting (Owner)"",""link"":""https://www.google.com/maps/contrib/108201659466489762227""}","{""borough"":"""",""street"":"""",""city"":"""",""postal_code"":"""",""state"":"""",""country"":""""}",null,"[{""Name"":""Emmerson"",""ProfilePicture"":""https://lh3.googleusercontent.com/a/ACg8ocI72Hg0PqtvvSK6mbBWrZUSkWCp4DX-mcWohtS2twUKMv1P=s120-c-rp-mo-br100"",""Rating"":5,""Description"":""I had the pleasure of hiring Patrick recently for soffits and roofing, and I couldn't be happier with the results! From the initial quote to the finished project, everything was top-notch.\nHere's what impressed me:\n* Fair Pricing: Patrick's rates were very reasonable and competitive.\n* Excellent Workmanship: The quality of his work was outstanding – clean, precise, and clearly done with a high level of skill.\n* Reliability: Patrick was punctual and dependable, showing up exactly when he said he would.\nI wouldn't hesitate to hire Patrick again in the future and highly recommend him to anyone"",""Images"":[""www.google.com/local/imagery/report/?cb_client=maps_sv.tactile\u0026image_key=!1e10!2sCIHM0ogKEICAgIC_uPuZugE\u0026fid=0x0:0x329e9e248248d133""],""When"":""2025-1-12""},{""Name"":""Gayle Brisley"",""ProfilePicture"":""https://lh3.googleusercontent.com/a/ACg8ocK62Fcxx6Ll-5XBSJgoiSZRQyHKciG2VNS1b188zCEEZfRvnw=s120-c-rp-mo-br100"",""Rating"":5,""Description"":""We highly recommend Earth to Sky Contracting.  Patrick is very experienced, skilled and detail oriented.  He listened to our requests and provided helpful suggestions where required.  We won’t hesitate to hire him again for future projects"",""Images"":null,""When"":""""},{""Name"":""Bobby"",""ProfilePicture"":""https://lh3.googleusercontent.com/a-/ALV-UjUk0OtOEisJ_ry-q18_IK9GBg2od5vj-JWIBMIvupJrPAmZEUEvTg=s120-c-rp-mo-ba2-br100"",""Rating"":5,""Description"":""Patrick was extremely friendly, punctual and very professional. He assessed the problem and helped us find a quick solution despite the fact that we called him at short notice and truly exceeded our expectations. Would recommend anytime for any furniture fixing needs."",""Images"":null,""When"":""""},{""Name"":""Canada"",""ProfilePicture"":""https://lh3.googleusercontent.com/a-/ALV-UjXN8DycrMsW1r_3b4eK3Ght-O5hT_-TB_z6Pa9wOL-Nc3AvThgN=s120-c-rp-mo-ba3-br100"",""Rating"":5,""Description"":""Patrick is efficient, timely, and personable. What more could you ask for! I have had numerous dealings with Earth to Sky Contracting and my experiences have been delightful at every turn. Thank you for exceptional service — I look forward to doing business in the future."",""Images"":null,""When"":""""},{""Name"":""Nikki McMillan"",""ProfilePicture"":""https://lh3.googleusercontent.com/a/ACg8ocKxbAOmCJATgAF-Ts1RbTLzAZxDKES-7rbexNIjoGkw0KXp8Q=s120-c-rp-mo-ba2-br100"",""Rating"":5,""Description"":""Patrick has done a number of small jobs for me. From creating planter boxes, building window fittings for my AC unit, landscaping and maintenence, assembling furniture to cleaning my gutters. He is quick, professional and always has my needs in mind. Thank you Earth to Sky Contracting!"",""Images"":null,""When"":""""},{""Name"":""Gord Roney"",""ProfilePicture"":""https://lh3.googleusercontent.com/a/ACg8ocK-MIvMiQZCI8CibKsHL5jtqg6ZYYdTSPEY6ZTCFyMnIFiFaA=s120-c-rp-mo-br100"",""Rating"":5,""Description"":""Patrick was amazing.  He did the job to perfection. I would definitely hire him again and recommend him to my friends."",""Images"":null,""When"":""""},{""Name"":""Chad Holtum"",""ProfilePicture"":""https://lh3.googleusercontent.com/a-/ALV-UjWrLM3HMNCOe89C7WmIZXujq3ZuVtw4F514jkMrgqGcYiTctDs=s120-c-rp-mo-br100"",""Rating"":5,""Description"":""Patrick is excellent.  A strong communicator, timely responses and quality work.  I would highly recommend him!"",""Images"":null,""When"":""""}]",null,
2fd3d115-6db8-4e9d-84d7-88ecad1b679d,https://www.google.com/maps/place/Alair+Homes+Nanaimo/data=!4m7!3m6!1s0x5488a2326c08ff8b:0x54e6634e2c172070!8m2!3d49.168844!4d-123.941667!16s%2Fg%2F1tcv5_vv!19sChIJi_8IbDKiiFQRcCAXLE5j5lQ?authuser=0&hl=en&rclk=1,Alair Homes Nanaimo,Custom home builder,"96 Wallace St, Nanaimo, BC V9R 0E2","{""Friday"":[""Closed""],""Monday"":[""8:30 a.m.–4:30 p.m.""],""Saturday"":[""Closed""],""Sunday"":[""Closed""],""Thursday"":[""8:30 a.m.–4:30 p.m.""],""Tuesday"":[""8:30 a.m.–4:30 p.m.""],""Wednesday"":[""8:30 a.m.–4:30 p.m.""]}",{},http://www.alairhomes.ca/nanaimo,(250) 754-5500,"5395+G8 Nanaimo, British Columbia",39,4.900000,"{""1"":1,""2"":0,""3"":0,""4"":1,""5"":37}",49.168844,-123.941667,6117686331227709552,,,,https://lh3.googleusercontent.com/gps-cs-s/AHVAwerNI1vCWRcqsGu6Oa0MGVuT7vENa9R6eMHYZFQLvoMGShn15XmZ8cIzV2zKrJCp02fMH4rIXgAVO4NJ4V7si876h_35LnWt14mQ3oBTtVnssS026dXWy_wRDTDwqfWglauGJEs9eMgDRIf6=w408-h272-k-no,America/Vancouver,,0x5488a2326c08ff8b:0x54e6634e2c172070,ChIJi_8IbDKiiFQRcCAXLE5j5lQ,"[{""title"":""All"",""image"":""https://lh3.googleusercontent.com/gps-cs-s/AHVAwerNI1vCWRcqsGu6Oa0MGVuT7vENa9R6eMHYZFQLvoMGShn15XmZ8cIzV2zKrJCp02fMH4rIXgAVO4NJ4V7si876h_35LnWt14mQ3oBTtVnssS026dXWy_wRDTDwqfWglauGJEs9eMgDRIf6=w447-h298-k-no""},{""title"":""Latest"",""image"":""https://lh3.googleusercontent.com/gps-cs-s/AHVAweo65SiSTmohMPG93jQ5-4y1m3BRUQ3LvVog3u-miH-He5pN1CGJPHa6zBTDFLYqIAIS3PKxX0wo7-U5eVLmI41uRT2DiDLUjdUUWePgyBpHcHvyICCPdeEr4U5taBefu_ho7wEVfoy-6b6v=w397-h298-k-no""},{""title"":""Inside"",""image"":""https://lh3.googleusercontent.com/gps-cs-s/AHVAweomZc3bM4S28XsFQ5AmE2_ObQljDYts7KyPglxrJ3P2Nj7KCH9RWCFGq06GA0jqURvRp-y9wNhhzy7-0zCk7lotJ4-Cr5vLzp1CGvHEPmleeX8GDoVrFfP2mVd-4S2Pks1H6SZ7Vm64YX_N=w461-h298-k-no""},{""title"":""By owner"",""image"":""https://lh3.googleusercontent.com/gps-cs-s/AHVAweql5zx_94SJR0yhKYSROVcaKkfNU9IsEhkmhiN7ojmV5755SGl1Y7IJFwPljPIzmzIZewSWNv6S3YU5Q6kqolXqEovtUg_Tw2jUq5fGSBdUP0-yO3072oTTLysyTELc7zwlnfI1y4abJD4=w447-h298-k-no""},{""title"":""Street View \u0026 360°"",""image"":""https://streetviewpixels-pa.googleapis.com/v1/thumbnail?panoid=ds-Af5F7XYGR2GtZylLvtg\u0026cb_client=maps_sv.tactile.gps\u0026w=224\u0026h=298\u0026yaw=143.56813\u0026pitch=0\u0026thumbfov=100""}]",null,null,"{""link"":"""",""source"":""""}","{""id"":""111347956484712852644"",""name"":""Alair Homes Nanaimo (Owner)"",""link"":""https://www.google.com/maps/contrib/111347956484712852644""}","{""borough"":"""",""street"":""96 Wallace St"",""city"":""Nanaimo"",""postal_code"":""V9R 0E2"",""state"":""British Columbia"",""country"":""CA""}",null,"[{""Name"":""Russell Tabata"",""ProfilePicture"":""https://lh3.googleusercontent.com/a/ACg8ocKQQrev0XhWicBqUF92H7ApvMcacRX2cNqe6m8ZFSLmCZv3LQ=s120-c-rp-mo-ba2-br100"",""Rating"":5,""Description"":""Alair Homes did a renovation of our house in 2025.   It was a front room addition and back covered patio addition.   We could not be happier with the end result.    All the sub-contractors that Alair uses are top notch and they care about the quality and workmanship of their work.  Both additions integrate seamlessly with our existing house (which Alair also built).   Simply spectacular!"",""Images"":[""www.google.com/local/imagery/report/?cb_client=maps_sv.tactile\u0026image_key=!1e10!2sCIABIhCcb-2cx8Rb4j3RHyVmMwQO\u0026fid=0x0:0x54e6634e2c172070""],""When"":""2026-3-5""},{""Name"":""Classic Kitchens"",""ProfilePicture"":""https://lh3.googleusercontent.com/a/ACg8ocLMpXsRo4QpFFR6bFrkzVWdnkNs8nYiJwPMz7oDWh0M9qqufg=s120-c-rp-mo-br100"",""Rating"":5,""Description"":""We've had the pleasure of working with Alair Homes Nanaimo on a range of residential projects over the years. From custom new-builds to renovations, and the experience has consistently been excellent.\n\nTheir team is organized, professional, and genuinely committed to taking care of their clients. Job sites are always tidy and well-managed, which speaks volumes about their attention to detail. Alair is a fantastic company to collaborate with, and we highly recommend them.\n\n- Classic Kitchens \u0026 Design"",""Images"":null,""When"":""""},{""Name"":""Stan \u0026 Frankie Galbraith"",""ProfilePicture"":""https://lh3.googleusercontent.com/a/ACg8ocIyluvd9zxz07Ai76xxhr9bOMLOptPbfbOdcDTti6zc4DJP7Q=s120-c-rp-mo-br100"",""Rating"":5,""Description"":""We had a reno done in 2025 by this company.  The project manager was Danielle and she was incredible.  The entire team was efficient, professional, timely and Danielle was an excellent  communicator with an impressive base of knowledge in this field.  The reno also even came in under budget.  We could not be more pleased with the conduct of Danielle and all of the exceptional trades, and the franchise owner, Matt.  With the extra space we are enjoying our home even more now.  The reno has been complete for a few months and we have not had any problems.    Thanks again to Alair Homes Nanaimo."",""Images"":null,""When"":""""},{""Name"":""Adrienne Miller"",""ProfilePicture"":""https://lh3.googleusercontent.com/a/ACg8ocKczi7GvgZro1svY4m9BhbE__mR4gkwwufo_PCoL6Gr0ZYJZw=s120-c-rp-mo-ba3-br100"",""Rating"":5,""Description"":""We built our home with Chiara from Alair and are very satisfied with our experience. She was thorough, transparent, helpful, timely, and kind. The entire process was fantastic and we can’t say enough great things about our experience. We met with a few builders, and I can’t imagine having gone with anyone else. Everything was clear and upfront from the beginning. All of our questions were answered in such a helpful manner. We were first timers and we couldn’t have asked for a better experience! Highly recommend!"",""Images"":[""www.google.com/local/imagery/report/?cb_client=maps_sv.tactile\u0026image_key=!1e10!2sCIHM0ogKEICAgIChiqDVnQE\u0026fid=0x0:0x54e6634e2c172070""],""When"":""2023-2-9""},{""Name"":""Jennifer Hillier"",""ProfilePicture"":""https://lh3.googleusercontent.com/a/ACg8ocLs-UqPium4FIhMLEs2shZfLj-qhDVzSmHWdk4p8AatibgaUg=s120-c-rp-mo-ba2-br100"",""Rating"":5,""Description"":""Most homeowners have a renovation story. This one has a happy ending. For context, our reno was all interior and mostly cosmetic, but extensive. We updated every surface of the home including a redesigned kitchen and primary bathroom and added several architectural details.\nReno’s take time and usually run over budget.  It’s impossible to know all the challenges you will face until you see what’s behind the walls, ceiling and floors. Add to this, the challenge of getting the trades you need, precisely when you need them. While  not easy to manage, as home owners we still expect good quality workmanship completed in a timely manner.\nOur project turned out beautifully with Alair Homes.  Yes, it took extra time to complete but there were contributing factors including changes to the scope by us. From start to finish we had strong confidence in the people and process of Alair.  Stu Hopewell and his team have a talented network of subtrades. They kept an open and honest dialogue with us throughout the project.  The Alair process includes real-time access to the project spend and transparent view of each sub trade and supplier invoice which provided further comfort.  Alair also took full accountability when a couple things didn’t go as promised and were very reasonable in resolving them to our satisfaction.\nNo renovation or contractor is perfect but this is our 5th major Reno and we can confidently say Alair has been one of the best.\nIt comes down to the people. Stu and his team are skilled and trustworthy - the two most critical requirements for any home renovation project. If you are considering a Reno, we highly recommend Alair."",""Images"":[""www.google.com/local/imagery/report/?cb_client=maps_sv.tactile\u0026image_key=!1e10!2sCIHM0ogKEICAgIDL8-quCA\u0026fid=0x0:0x54e6634e2c172070""],""When"":""2024-6-30""},{""Name"":""Bill MacGougan"",""ProfilePicture"":""https://lh3.googleusercontent.com/a/ACg8ocIJBabQDClluK_ZWJBF-mwjyX2ajpLbTQXOkoM6erMBGgDBRuts=s120-c-rp-mo-ba3-br100"",""Rating"":5,""Description"":""I would recommend Alair. We had a new deck built and timber frame structure, re and re siding (vinyl to Hardie), and a bunch of smaller things. It was not perfect and took a long time but almost all of that was out of Alair’s control and they handled it all very well. When they made an error, they did not hesitate to take responsibility and address it. I think it was a challenging job - but the final product is excellent.\nEffective communications from start to finish and a steadfast commitment to understand and deliver what we wanted. Thank you Trevor (and Chris et al)."",""Images"":[""www.google.com/local/imagery/report/?cb_client=maps_sv.tactile\u0026image_key=!1e10!2sCIHM0ogKEICAgIC1nO6KHQ\u0026fid=0x0:0x54e6634e2c172070""],""When"":""2023-12-25""},{""Name"":""Norma Oshynko"",""ProfilePicture"":""https://lh3.googleusercontent.com/a/ACg8ocKrVDVg7o4pJRkwNVJm-gpfKsF5Ve51AoxsGnT69Bp1fFG30Q=s120-c-rp-mo-br100"",""Rating"":5,""Description"":""We have had a great experience with Alair. They do quality work and really stand behind their work. Very reliable, responsive and trustworthy!  We have enjoyed working with the team on the first phase of our renovation so much that we decided to hire them for additional work.\n\nUpdate: We had the team back for the second phase of our renovations. They updated our sunroom and rebuilt our decks. Project Manager Trevor made sure the work was done on time and under budget! Working with Alair was a great experience and I wouldn’t hesitate to recommend them."",""Images"":null,""When"":""""},{""Name"":""shirley mcdonald"",""ProfilePicture"":""https://lh3.googleusercontent.com/a/ACg8ocLp9j9rQuLWWsOHWDO_Qiy_b9Mlz5Pxj5Cnkl3nWscH9gZ-dg=s120-c-rp-mo-ba2-br100"",""Rating"":5,""Description"":""We met with Stu Hopewell to discuss building a new home. We found him to be knowledgeable, professional and straightforward. We explored our options on a new build and toured sites and one of his completed homes in Nanaimo. The workmanship was outstanding down to the smallest detail. As we were not able to find the right lot in our desired area, we were not able to proceed with a new home build with Stu. We would not hesitate to recommend Stu for any building or renovation needs."",""Images"":null,""When"":""""}]",null,
2fd3d115-6db8-4e9d-84d7-88ecad1b679d,https://www.google.com/maps/place/Roofmart/data=!4m7!3m6!1s0x5488a219f40af32b:0x6aa7aa6b95554c03!8m2!3d49.202467!4d-124.007713!16s%2Fg%2F1tdr2_nr!19sChIJK_MK9BmiiFQRA0xVlWuqp2o?authuser=0&hl=en&rclk=1,Roofmart,Roofing supply store,"2549 Kenworth Rd., Nanaimo, BC V9T 3M4","{""Friday"":[""7 a.m.–4 p.m.""],""Monday"":[""7 a.m.–4 p.m.""],""Saturday"":[""Closed""],""Sunday"":[""Closed""],""Thursday"":[""7 a.m.–4 p.m.""],""Tuesday"":[""7 a.m.–4 p.m.""],""Wednesday"":[""7 a.m.–4 p.m.""]}",{},http://www.roofmart.ca/,(250) 758-7606,"6X2R+XW Nanaimo, British Columbia",56,4.600000,"{""1"":2,""2"":0,""3"":3,""4"":8,""5"":43}",49.202467,-124.007713,7685298668174658563,,,,https://lh3.googleusercontent.com/gps-cs-s/AHVAweqOkl1gyRfySdn_bLvycmA2s0qMZE27AbtNx2UFEvu3nHlvy2he8yPxhkMXdoXH-Z_zW7RAoPeY7TIk6xHpBaCNIDEBPxc6XHtAxxju3Jw4cHTTUD-TeWkJYFk9zISVr12F_cgviw=w430-h240-k-no,America/Vancouver,,0x5488a219f40af32b:0x6aa7aa6b95554c03,ChIJK_MK9BmiiFQRA0xVlWuqp2o,"[{""title"":""All"",""image"":""https://lh3.googleusercontent.com/gps-cs-s/AHVAweqOkl1gyRfySdn_bLvycmA2s0qMZE27AbtNx2UFEvu3nHlvy2he8yPxhkMXdoXH-Z_zW7RAoPeY7TIk6xHpBaCNIDEBPxc6XHtAxxju3Jw4cHTTUD-TeWkJYFk9zISVr12F_cgviw=w534-h298-k-no""},{""title"":""By owner"",""image"":""https://lh3.googleusercontent.com/gps-cs-s/AHVAweqOkl1gyRfySdn_bLvycmA2s0qMZE27AbtNx2UFEvu3nHlvy2he8yPxhkMXdoXH-Z_zW7RAoPeY7TIk6xHpBaCNIDEBPxc6XHtAxxju3Jw4cHTTUD-TeWkJYFk9zISVr12F_cgviw=w534-h298-k-no""},{""title"":""Street View \u0026 360°"",""image"":""https://streetviewpixels-pa.googleapis.com/v1/thumbnail?panoid=hZ0jlOrKJj_Up05126XoRg\u0026cb_client=maps_sv.tactile.gps\u0026w=224\u0026h=298\u0026yaw=191.42593\u0026pitch=0\u0026thumbfov=100""}]",null,null,"{""link"":"""",""source"":""""}","{""id"":""112279208333442708146"",""name"":""Roofmart (Owner)"",""link"":""https://www.google.com/maps/contrib/112279208333442708146""}","{""borough"":"""",""street"":""2549 Kenworth Rd."",""city"":""Nanaimo"",""postal_code"":""V9T 3M4"",""state"":""British Columbia"",""country"":""CA""}","[{""id"":""service_options"",""name"":""Service options"",""options"":[{""name"":""Delivery"",""enabled"":true},{""name"":""In-store pickup"",""enabled"":true},{""name"":""In-store shopping"",""enabled"":true},{""name"":""Onsite services"",""enabled"":true}]},{""id"":""accessibility"",""name"":""Accessibility"",""options"":[{""name"":""Wheelchair-accessible entrance"",""enabled"":true},{""name"":""Wheelchair-accessible parking lot"",""enabled"":true}]},{""id"":""planning"",""name"":""Planning"",""options"":[{""name"":""Quick visit"",""enabled"":true}]},{""id"":""payments"",""name"":""Payments"",""options"":[{""name"":""Credit cards"",""enabled"":true},{""name"":""Debit cards"",""enabled"":true},{""name"":""NFC mobile payments"",""enabled"":true},{""name"":""Credit cards"",""enabled"":false}]}]","[{""Name"":""nathan fuchs"",""ProfilePicture"":""https://lh3.googleusercontent.com/a/ACg8ocI0qm_eqFNqLjc0_VPAFaRg0xU6tFbFgqiXW_aOk8QN04puJA=s120-c-rp-mo-ba3-br100"",""Rating"":5,""Description"":""What a place. When so many home improvement places have no idea about their products, this place is a breath of fresh air. Also better prices!"",""Images"":null,""When"":""""},{""Name"":""Mike virtanen"",""ProfilePicture"":""https://lh3.googleusercontent.com/a-/ALV-UjXL3JHtONMR73DRSeMp_mlaOJvQCXe8fC6x4vEfKKzoeNcsRTbL=s120-c-rp-mo-br100"",""Rating"":5,""Description"":""Very helpful staff with all your roofing needs."",""Images"":null,""When"":""""},{""Name"":""B\u0026M Exteriors Inc."",""ProfilePicture"":""https://lh3.googleusercontent.com/a-/ALV-UjV0YIjDDj7-doDDa_FVCI902jsRqE99Ia5W7As1doxAhXCrnGc=s120-c-rp-mo-br100"",""Rating"":5,""Description"":""My go to roofing supplier, great staff and excellent roof top delivery service. Highly recommend using roofmart!"",""Images"":[""www.google.com/local/imagery/report/?cb_client=maps_sv.tactile\u0026image_key=!1e10!2sCIHM0ogKEICAgICps4nN8gE\u0026fid=0x0:0x6aa7aa6b95554c03""],""When"":""2023-8-10""},{""Name"":""Elaine Honsberger"",""ProfilePicture"":""https://lh3.googleusercontent.com/a/ACg8ocKUhiChKRcog0RlxorbY4YIZPXX9PSj3ru61vt2RCKUxjzHkQ=s120-c-rp-mo-br100"",""Rating"":5,""Description"":""I recently was on the hunt for the ideal shingle colour for my home (no I don’t want a black roof), and I was advised to check in with Roofmart. I was so impressed and appreciative of the customer service I received from Michelle and Abram. Michelle directed me to multiple different places where I could see specific shingle colours already installed, and Abram was quick to seek out several in-store samples so that I could take them home for further review. I successfully landed on a colour choice given all the assistance they provided. The staff at Roofmart were outstanding, and I highly recommend this company as a go-to source for any roofing inquiries you may have."",""Images"":null,""When"":""""},{""Name"":""Brian Delany"",""ProfilePicture"":""https://lh3.googleusercontent.com/a/ACg8ocKjnPq2Lxy6yMcXx4jHIvJ168o4Rg0VhGzF4BQY6iAPst2G-AI=s120-c-rp-mo-ba2-br100"",""Rating"":5,""Description"":""Each staff member I dealt with from the front counter staff to the warehouse and yard staff were extremely helpful and friendly.  As a DIYer they were patient, knowledgeable and made sure I had the right components for my first metal roof installation.  When I went to pick up my order, I went in and talked to the ladies at the counter about a few more items.  When I was done, I asked where I go to load my order and was advised that it was already loaded in my truck for me.  I was also able to cut some longer lengths of the roofing to length on site.  I had the saw and they gladly provided a spot and an extension cord for me!\nI don’t recall ever leaving a Google review but I felt this place was truly great to deal with and deserving of the time it takes to leave a review.  I highly recommend this location!  Great staff!  Thanks again!"",""Images"":null,""When"":""""},{""Name"":""Grant Crabtree"",""ProfilePicture"":""https://lh3.googleusercontent.com/a/ACg8ocJxBMgsqpO4Jz6arTRQAz7Yv_jAnWzcUiIY_bcYvUAMd4BI3A=s120-c-rp-mo-br100"",""Rating"":5,""Description"":""Roofmart Nanaimo is excellent. Its a great environment, happy and knowledgeable workers. Everyone wants to help you. Im not a roofer and dont know what I need but staff takes the time to make sure you get the right product. I highly recommend Roofmart Nanaimo"",""Images"":null,""When"":""""},{""Name"":""Tami \u0026 Mark Fisher"",""ProfilePicture"":""https://lh3.googleusercontent.com/a/ACg8ocJ0YVlFTLG5NavI6islpfH8Acpr6bFrafrxrktCUGdQWznV8Q=s120-c-rp-mo-br100"",""Rating"":5,""Description"":""Had to put a new roof on recently and could not have had a better experience dealing with the good folks at Roof Mart. James,Denis,Amanda,Joe \u0026 Jayson and yard staff all of who were most helpful, providing fast and friendly customer service above and beyond expectations."",""Images"":null,""When"":""""},{""Name"":""Whelm King"",""ProfilePicture"":""https://lh3.googleusercontent.com/a-/ALV-UjV4MYcVRQgIpSsdF0dbBg97RI3v9cYlzYldI9EXpFyJzTgCk7ft=s120-c-rp-mo-ba3-br100"",""Rating"":5,""Description"":""By far the best source for roofing materials in the Nanaimo area. As an owner builder they consistently offer me exceptional service, great advice, and the widest variety of roofing options of any local store. I cannot recommend Roofmart highly enough."",""Images"":null,""When"":""""}]",null,
