input_id,link,title,category,address,open_hours,popular_times,website,phone,plus_code,review_count,review_rating,reviews_per_rating,latitude,longitude,cid,status,descriptions,reviews_link,thumbnail,timezone,price_range,data_id,place_id,images,reservations,order_online,menu,owner,complete_address,about,user_reviews,user_reviews_extended,emails
d70687ae-2e93-4bc8-b9a0-eca95d21fe38,https://www.google.com/maps/place/Naikoon+Contracting+Ltd./data=!4m7!3m6!1s0x54867023bb358231:0x3c6588f4a60c371e!8m2!3d49.307887!4d-123.0712003!16s%2Fg%2F1t_kg6cf!19sChIJMYI1uyNwhlQRHjcMpvSIZTw?authuser=0&hl=en&rclk=1,Naikoon Contracting Ltd.,Construction company,"350 Esplanade E #302, North Vancouver, BC V7L 1A4","{""Friday"":[""Closed""],""Monday"":[""8 a.m.–4:30 p.m.""],""Saturday"":[""Closed""],""Sunday"":[""Closed""],""Thursday"":[""8 a.m.–4:30 p.m.""],""Tuesday"":[""8 a.m.–4:30 p.m.""],""Wednesday"":[""8 a.m.–4:30 p.m.""]}",{},https://naikoon.ca/,(778) 340-1566,"8W5H+5G North Vancouver, British Columbia",34,4.900000,"{""1"":1,""2"":0,""3"":0,""4"":0,""5"":33}",49.307887,-123.071200,4352035199262668574,,,,https://lh3.googleusercontent.com/gps-cs-s/AHVAweplK4nmQSa7K_h6m5vvUEBQrZ3iZd_dceOsJKGuSiciDtGyPKmc6hfZ4f7RvitMr50w3a9jS5XZXYK38NuGkKnGdETHVquPjdbcHEcZ80xo8bgQDtw37GyGYJBSa5WJuATS5-My=w408-h392-k-no,America/Vancouver,,0x54867023bb358231:0x3c6588f4a60c371e,ChIJMYI1uyNwhlQRHjcMpvSIZTw,"[{""title"":""All"",""image"":""https://lh3.googleusercontent.com/gps-cs-s/AHVAweplK4nmQSa7K_h6m5vvUEBQrZ3iZd_dceOsJKGuSiciDtGyPKmc6hfZ4f7RvitMr50w3a9jS5XZXYK38NuGkKnGdETHVquPjdbcHEcZ80xo8bgQDtw37GyGYJBSa5WJuATS5-My=w309-h298-k-no""},{""title"":""Inside"",""image"":""https://lh3.googleusercontent.com/gps-cs-s/AHVAweog5QxOrI6GWHziW37yUOJFj71w5aOi1jfxZ8zr3Oor4_UN0MNCuUuzDY3SJu_SAVmNdpeopfr6BUxuNNG5ys5Zi58jEsgTEkEgDc1UfffVZXCwQ2OCY41anHxsfQXgcxvWljDs=w447-h298-k-no""},{""title"":""Concrete"",""image"":""https://lh3.googleusercontent.com/gps-cs-s/AHVAweqqBSvZe_zx0MZHLqXTFv4CpnjvbpLa2tDK4cDgt8HbAv8v2dDkZO4wRna2vHgBBKmKBoXMpEXTUcyxeV1FimRLvtdIO1U3dgSb1IagkbTAb2KxDLBvnvQvimZsHXWKn765l4ROaA=w397-h298-k-no""},{""title"":""Construction"",""image"":""https://lh3.googleusercontent.com/gps-cs-s/AHVAwepNgPMTbtp-puFqfTWLSVqMjmNakLU73QI4uLd8MR3QQmv-5Z0B6rWFhdir8l6607DR-kG79n5m2EFT0PYTiHY4aUuDMryC3OEWiQX-THauNAy4GfIMJ11v4wFeWvfPxPJA7Us=w397-h298-k-no""},{""title"":""By owner"",""image"":""https://lh3.googleusercontent.com/gps-cs-s/AHVAweo118gt1X0aD3YGQ-wjjvc4Ml4GNO1MB6JpmCyTBuQpykkpMuf6rFkSQHadmRBc6tuEmTV17yVWV3MKtEMSLWEUBjMqDQo1R90KxY-IblO3yQiPG-WJcPiwtvOB9ucsdEd8Um7kvw=w422-h298-k-no""},{""title"":""Street View \u0026 360°"",""image"":""https://streetviewpixels-pa.googleapis.com/v1/thumbnail?panoid=HD4AbTr7zPNc_G3vD-XcVQ\u0026cb_client=maps_sv.tactile.gps\u0026w=224\u0026h=298\u0026yaw=28.971704\u0026pitch=0\u0026thumbfov=100""}]",null,null,"{""link"":"""",""source"":""""}","{""id"":""113501503263602950796"",""name"":""Naikoon Contracting Ltd. (Owner)"",""link"":""https://www.google.com/maps/contrib/113501503263602950796""}","{""borough"":"""",""street"":""350 Esplanade E #302"",""city"":""North Vancouver"",""postal_code"":""V7L 1A4"",""state"":""British Columbia"",""country"":""CA""}","[{""id"":""accessibility"",""name"":""Accessibility"",""options"":[{""name"":""Wheelchair-accessible parking lot"",""enabled"":true}]}]","[{""Name"":""Kettle River Timberworks"",""ProfilePicture"":""https://lh3.googleusercontent.com/a-/ALV-UjU_W45yfkqNKlqOmJmOpJdN21LHaqzgrhtTf9XNi7TToXCGftqKkg=s120-c-rp-mo-ba3-br100"",""Rating"":5,""Description"":""We are a high end timber frame company.  We were hired to install complicated timber and steel on a net zero house that Naikoon was building.  I highly recommend these guys for any complicated, high end project.  They were great to collaborate with and had a real attention to detail and teamwork."",""Images"":[""www.google.com/local/imagery/report/?cb_client=maps_sv.tactile\u0026image_key=!1e10!2sCIHM0ogKEICAgICW-5yXTw\u0026fid=0x0:0x3c6588f4a60c371e""],""When"":""2022-3-7""},{""Name"":""Peter Cheng"",""ProfilePicture"":""https://lh3.googleusercontent.com/a-/ALV-UjVUCPHgv0GFKooe2avI_JKkjiowliTNKXzKG49sqM-_FTaWBN8j=s120-c-rp-mo-br100"",""Rating"":5,""Description"":""Joe and his team have revolutionized the contracting industry. Make no mistake, they are pioneers. My wife and I were blessed to have the ability to design and build our dream home, but all I've known, and heard from first hand accounts from friends about the contracting industry is that contractors are slow, unreliable, untrustworthy, difficult to work with, and so on. Let me just tell you right now, Naikoon is the exact opposite. They have a high proficiency (and prioritize) project management, customer care, on top of the actual craft of building structures. Joe did his homework on what we wanted even before our very first consultation meeting and presented an incredible proposal..we were blown away by the kind of intentionality they put into what we wanted, and its that intent about what we want (not what they want), that cornerstoned the success of our dream home. The team finished our house in 11 months, and structurally it is top notch..and we had updates from the site managers every single day on an app, photos and videos included. My wife and I can't recommend them enough. To my knowledge, there is no one like them in the Lower Mainland. 10 stars out of 5."",""Images"":[""www.google.com/local/imagery/report/?cb_client=maps_sv.tactile\u0026image_key=!1e10!2sCIHM0ogKEICAgICa6tju0gE\u0026fid=0x0:0x3c6588f4a60c371e""],""When"":""2021-7-28""},{""Name"":""EDAN MARSHALL"",""ProfilePicture"":""https://lh3.googleusercontent.com/a-/ALV-UjVCZ7wvbA0MZW1fvUwv6TpoNEfwrmJYlTo5EoqcTOGP8qG6t04t=s120-c-rp-mo-ba2-br100"",""Rating"":5,""Description"":""Joe and his team at Naikoon are quite simply elevating the local construction game. They are organized, professional, collaborative, and consistently aim for the best possible outcome -and achieve it."",""Images"":[""www.google.com/local/imagery/report/?cb_client=maps_sv.tactile\u0026image_key=!1e10!2sCIHM0ogKEICAgIDqqcvytAE\u0026fid=0x0:0x3c6588f4a60c371e""],""When"":""2021-7-12""},{""Name"":""Mark Ritchie"",""ProfilePicture"":""https://lh3.googleusercontent.com/a/ACg8ocJzThRLg3Roauftj1Kwe_JCd_fz_G0kZhT-OAS0S05SAi-uVyVy=s120-c-rp-mo-br100"",""Rating"":5,""Description"":""We have just completed a modern home with Niakoon. The team where great to work with from start to finish.  The workmanship was of the best standard and we were particularly impressed with the on-site supervision, problem solving on the go and level of understanding and engagement in the design concept and overall vision.  A real pleasure to work with and we are really looking forward to the next collaboration."",""Images"":null,""When"":""""},{""Name"":""Shay Cascade"",""ProfilePicture"":""https://lh3.googleusercontent.com/a/ACg8ocJPGc_9kNpkZ4AOpbbacNUaYOnVBcloBjXiIagA0gMsOOEV5Q=s120-c-rp-mo-br100"",""Rating"":5,""Description"":""We chose Naikoon to built our new home after interviewing other builders. We couldn't have been more satisfied with our decision. The team was helpful and very professional throughout the entire process. They have a great project planning, budgeting and construction management process. They use modelling and other communication applications which kept us updated on the daily progress and project timelines.  The workflow internally at Naikoon is first class - from project management, subs and vendor sourcing and management, site management, billing and Post build Client Satisfaction- very well coordinated. Post construction- the Team was very helpful and responsive in any followups. Kudo's to everyone that worked on my home project!!! Joe, Shawn, Dan, Ash, Victor, Yan, Janice and the rest of the Naikoon Team!"",""Images"":null,""When"":""""},{""Name"":""Erica Lau"",""ProfilePicture"":""https://lh3.googleusercontent.com/a-/ALV-UjVodcBeM1cVhiHQwWVhu8AqmLPoqupgBVCfhC0JUozjjCIFDiPg=s120-c-rp-mo-br100"",""Rating"":5,""Description"":""We engaged Naikoon for the renovation/rebuild of our home.  Joe and his team, particularly Simon and Shawn, were a pleasure to work with—highly professional, organized, knowledgeable and thorough.  We especially appreciated the quality of their work, attention to detail, and collaborative approach.  We are very happy with the construction of our home and would not hesitate to recommend Naikoon."",""Images"":null,""When"":""""},{""Name"":""Justin Bennett"",""ProfilePicture"":""https://lh3.googleusercontent.com/a-/ALV-UjWDx5Y31b2BdNMSWbvVlHwPNEwQfKqnna1KL2Tp_aPqwtVNaOnR1g=s120-c-rp-mo-br100"",""Rating"":5,""Description"":""Our design team at Urban West Architecture worked closely with Naikoon Contracting on the design and construction of a complex custom single family residence located in North Vancouver. The residence received both Passive House and Net Zero Certification.  Naikoon is one the best single family home builders that we have worked with over the past 20 years in the industry. Their team is professional and incredibly knowledgeable about all aspects of custom home design. As an Architect they made our job easier by collaborating with us during the design process and coming up with innovative solutions that met our design intent and satisfied the client’s objectives all while keeping a close eye on the project budget. We worked directly with senior project manager Simon Wong - he was resourceful, highly organised and a pleasure to work with. Naikoon’s commitment to great design and impeccable craftsmanship shines through in all of their projects. We look forward to collaborating on another project with them in the future."",""Images"":null,""When"":""""},{""Name"":""Don Murray"",""ProfilePicture"":""https://lh3.googleusercontent.com/a-/ALV-UjWMJVGUmg43khhdFBVL-6NXROOEW-Hu8nXDWrEeUzSFT3PmYC_--w=s120-c-rp-mo-br100"",""Rating"":5,""Description"":""We had the pleasure of working with Naikoon when we built our new home.   The project and the team at Naikoon were all highly skilled and a real pleasure to work with.  I can't imagine a better team. I highly recommend Naikoon and if I ever have another construction project I would be reaching out to Naikoon first."",""Images"":null,""When"":""""}]",null,
d70687ae-2e93-4bc8-b9a0-eca95d21fe38,https://www.google.com/maps/place/Raise+the+Roof+Roofing+%26+Repair+Ltd./data=!4m7!3m6!1s0x5485d1e5120a24a7:0xd529026b4fd25f5c!8m2!3d49.2737547!4d-123.0683959!16s%2Fg%2F11fmh822tp!19sChIJpyQKEuXRhVQRXF_ST2sCKdU?authuser=0&hl=en&rclk=1,Raise the Roof Roofing & Repair Ltd.,Roofing contractor,"1750 William St, Vancouver, BC V5L 2R4","{""Friday"":[""Open 24 hours""],""Monday"":[""Open 24 hours""],""Saturday"":[""Open 24 hours""],""Sunday"":[""Closed""],""Thursday"":[""Open 24 hours""],""Tuesday"":[""Open 24 hours""],""Wednesday"":[""Open 24 hours""]}",{},http://raisetheroofroofing.com/,(778) 385-9585,"7WFJ+GJ Vancouver, British Columbia",45,4.700000,"{""1"":3,""2"":0,""3"":0,""4"":0,""5"":42}",49.273755,-123.068396,15359810664047730524,,,,https://lh3.googleusercontent.com/gps-cs-s/AHVAwepxSqd48DmpxoCnW3aBW-5ZYXHCc_bTAP58ZmjNumt6BzV2-1O7_YGYmS9T2GLgahSKLKPlC5Fsj4hjNABL1JdYOdON9y2CvaqU8BABtTpp5pRVNqORYsYtC2d7-dJw0VDf3kAv4nZWSr6I=w426-h240-k-no,America/Vancouver,,0x5485d1e5120a24a7:0xd529026b4fd25f5c,ChIJpyQKEuXRhVQRXF_ST2sCKdU,"[{""title"":""All"",""image"":""https://lh3.googleusercontent.com/gps-cs-s/AHVAwepxSqd48DmpxoCnW3aBW-5ZYXHCc_bTAP58ZmjNumt6BzV2-1O7_YGYmS9T2GLgahSKLKPlC5Fsj4hjNABL1JdYOdON9y2CvaqU8BABtTpp5pRVNqORYsYtC2d7-dJw0VDf3kAv4nZWSr6I=w529-h298-k-no""},{""title"":""House"",""image"":""https://lh3.googleusercontent.com/gps-cs-s/AHVAwerE_9SG1bOaBVj4Vzi6ZUCsZvyd4bZ-VCUslKcD-2ooOM-r-1O65TE0eR1N7m4_HSm2kSzUHnCerd-U6EfVKTAonuU76iE1C37bHzbfmRHKc7Goo-puujnGyVYfPJtyPAjmY0-fvR1ThS8=w397-h298-k-no""},{""title"":""By owner"",""image"":""https://lh3.googleusercontent.com/gps-cs-s/AHVAweo0fikHffogXbRSB5n6V6JQ-0XR-hkGvYSrNJ5rledDjakgUOA2GlNTIem3IDCHkC39nBcTaGrU-RohLUVsDAwLaT_AdNXZZDvy0V9QpGRpfLrAQx9tZ_xZfdf0EOYaJkqBvTM5=w397-h298-k-no""},{""title"":""Street View \u0026 360°"",""image"":""https://streetviewpixels-pa.googleapis.com/v1/thumbnail?panoid=x_5ZhxXq62qUJUEwLfdzcQ\u0026cb_client=maps_sv.tactile.gps\u0026w=224\u0026h=298\u0026yaw=172.8814\u0026pitch=0\u0026thumbfov=100""}]",null,null,"{""link"":"""",""source"":""""}","{""id"":""106056636412747594949"",""name"":""Raise the Roof Roofing \u0026 Repair Ltd. (Owner)"",""link"":""https://www.google.com/maps/contrib/106056636412747594949""}","{""borough"":""East Vancouver"",""street"":""1750 William St"",""city"":""Vancouver"",""postal_code"":""V5L 2R4"",""state"":""British Columbia"",""country"":""CA""}",null,"[{""Name"":""Alex Castaneda"",""ProfilePicture"":""https://lh3.googleusercontent.com/a-/ALV-UjW5rT_E7NP7uB4bjOzNQej-EZMvKshQki8Q8tY4OkiAVy2g8ZVo=s120-c-rp-mo-br100"",""Rating"":5,""Description"":""People always question great reviews given to any company that provides services. Naturally we all wonder if they are by legit costumers writing those comments; are they being honest and accurate. I own a house in Hasting-Sunrise neibourhood in East Vancouver. The most important part of any house is without a doubt the roof. It protects your family and belonging from the ever changing west coast weather and it's because of that we should do our diligent work when choosing the right people that we are trusting to keep our home protected from mother nature's harsh elements. I called 3 different companies to get a quote and I quickly settled with this one. When I first met John and Paul, I immediately felt at ease with them; we went up on the roof and they inspected all areas (including the gutters) and they took proper measurements in order to provide an accurate quote and not just something pulled out of a hat. They'd explained me in detail what the work process was going to be and provided me with a timeline; they listed the types of materials they were using and offered solutions with different budget options. All of their work was conducted in a clean and respectful manner without impacting the environment around our garden. They cover and protected all the areas around the house that could have been impacted when removing the old roof. They also installed new venting outlets to improve the air circulation of the attic at no extra cost. When the roof-work was completed Paul was so kind to help me fixed a DIY project that I had done on my garage-roof at no extra cost. These 2 brothers get a 5-star review simply because they exceeded my expectations, they were budget friendly, honest and provided quality workmanship in a timely manner...and it comes with warranty.  Give these guys a chance, you won be sorry!"",""Images"":[""www.google.com/local/imagery/report/?cb_client=maps_sv.tactile\u0026image_key=!1e10!2sCIABIhCCLPYdZ1GZrbRINv9B0uL_\u0026fid=0x0:0xd529026b4fd25f5c""],""When"":""2025-9-25""},{""Name"":""Jason Margolis"",""ProfilePicture"":""https://lh3.googleusercontent.com/a-/ALV-UjXFmR0BRtT6h8AtCyGuoZHyemFlPqWP5IjLOpINvBPrO61X9BRu=s120-c-rp-mo-br100"",""Rating"":5,""Description"":""We highly recommend Raise the Roof Roofing. John and his brother are diligent, professional, knowledgeable and genuinely friendly. They provided clear and patient communication about available options and scheduling, making the entire process feel smooth and well managed. Our roof looks significantly better than before, and the improvements they made to the ventilation have our home feeling healthier and fresher. They also did an exceptional job with cleanup, which was so thorough that you’d hardly know they had been here. It’s truly an indication to the quality of their work that we’re now seeing neighbors hire them for their own roofing projects."",""Images"":null,""When"":""""},{""Name"":""Tara Nelson"",""ProfilePicture"":""https://lh3.googleusercontent.com/a-/ALV-UjU_u3k5zHwrK8ZH4JzenMhxnEUTjDqjyy1IUa_enskF1oVQHbOX=s120-c-rp-mo-ba2-br100"",""Rating"":5,""Description"":""My roof started leaking water into my kitchen at night! John and his crew came the next morning and got everything fixed right away, for a very reasonable price. He was professional and courteous and I am so glad I called them."",""Images"":null,""When"":""""},{""Name"":""Jordan Whitlow"",""ProfilePicture"":""https://lh3.googleusercontent.com/a/ACg8ocJjN1HM09Ov40lHW79_wJpXrKbE2pbxYDAONvvkbVBjDNGWtA=s120-c-rp-mo-br100"",""Rating"":5,""Description"":""John and his brother were very professional and great to work with. They clearly communicated with us throughout the process and were flexible with our needs. I appreciated the extra care they put into cleaning up and following up with us after the roof was completed."",""Images"":null,""When"":""""},{""Name"":""Maria"",""ProfilePicture"":""https://lh3.googleusercontent.com/a/ACg8ocIQ4-z9SFEtXPuX0VeyVX3qC34rrknvFm9hJtlrUcNQEyljvfY=s120-c-rp-mo-ba2-br100"",""Rating"":5,""Description"":""We had a roof leak and needed emergency repairs. Peter, John, and Paul did an amazing job on our roof. Everyone was very respectful and the job was completed in a jiffy. I would recommend them to any of my friends and family."",""Images"":null,""When"":""""},{""Name"":""Pezh"",""ProfilePicture"":""https://lh3.googleusercontent.com/a/ACg8ocIrXbjHtieKIXf1gvyfOywf_Den7VwyChDRYdsyiHiIbzb2zQ=s120-c-rp-mo-br100"",""Rating"":5,""Description"":""Excellent team and outstanding workmanship.very professional, organized, and respectful throughout the entire process. Very punctual, and their overall attitude, professionalism and depth of knowledge really stood out. Highly recommend working with this team."",""Images"":null,""When"":""""},{""Name"":""Anna Richards"",""ProfilePicture"":""https://lh3.googleusercontent.com/a-/ALV-UjUnzOFmVa4_qFG2lAxcIFSx0C7BWMOBuasFl5zD8ZhFGGHQUQ9Z=s120-c-rp-mo-br100"",""Rating"":5,""Description"":""I saw John and Paul working on a house in the neighbourhood and before I knew it they were replacing my roof. They were super respectful with the neighbours, they kept their worksite clean and delivered as promised on budget and on time. Couldn't be happier. Roof looks great."",""Images"":null,""When"":""""},{""Name"":""Glenn K"",""ProfilePicture"":""https://lh3.googleusercontent.com/a-/ALV-UjWqeFjS25hFTLbH5P144hfd5aMXn3-vKku-JJrBOpEFsQ8l7ft8=s120-c-rp-mo-ba3-br100"",""Rating"":5,""Description"":""John from Raise the Roof did an amazing job replacing my old cedar roof on my garden shed!  He removed the old, rotting shingles, and installed plywood \u0026 new 30 year shingles.  He guarantees his work!  I would not hesitate to use his company again!  Fast and efficient!"",""Images"":[""www.google.com/local/imagery/report/?cb_client=maps_sv.tactile\u0026image_key=!1e10!2sCIHM0ogKEICAgIDxvpCT-gE\u0026fid=0x0:0xd529026b4fd25f5c""],""When"":""2023-6-9""}]",null,
d70687ae-2e93-4bc8-b9a0-eca95d21fe38,https://www.google.com/maps/place/NORTHVAN+ROOFING/data=!4m7!3m6!1s0x5486704b07489f95:0xb00ee7c0c0fb216c!8m2!3d49.2883054!4d-123.0614468!16s%2Fg%2F11b6ckny9x!19sChIJlZ9IB0twhlQRbCH7wMDnDrA?authuser=0&hl=en&rclk=1,NORTHVAN ROOFING,Roofing contractor,,{},{},http://northvanroofing.com/,(604) 999-5953,,2,5.000000,"{""1"":0,""2"":0,""3"":0,""4"":0,""5"":2}",49.288305,-123.061447,12686332015406686572,,,,https://lh3.googleusercontent.com/gps-cs-s/AHVAwerdBAE_bozYOLoteSQrixSAfKx3PWvhbpDx3wwoh-OyWah2Lb7C_mixA-QbTToknhhuhe-_fUSd5CW31HdKCJgEIljc31ZHq8GaSc5L7F6IP8rLROl390CYHStF91p19x9HWU-L=w408-h270-k-no,America/Vancouver,,0x5486704b07489f95:0xb00ee7c0c0fb216c,ChIJlZ9IB0twhlQRbCH7wMDnDrA,"[{""title"":""All"",""image"":""https://lh3.googleusercontent.com/gps-cs-s/AHVAwerdBAE_bozYOLoteSQrixSAfKx3PWvhbpDx3wwoh-OyWah2Lb7C_mixA-QbTToknhhuhe-_fUSd5CW31HdKCJgEIljc31ZHq8GaSc5L7F6IP8rLROl390CYHStF91p19x9HWU-L=w448-h298-k-no""},{""title"":""Exterior"",""image"":""https://lh3.googleusercontent.com/gps-cs-s/AHVAwepYvjrPz197qABVE6MS8N0Ce6BPU_DQwlFTm6djdUOCv5cMP6FYxTEzZFA6K9X7y9ezNdItoBR2lsbxaLxJ9HXac37zUBKYtMkiQE40kE6IeaaThZSzz9cz10tavyJX5KHBnQcE=w449-h298-k-no""},{""title"":""Inside"",""image"":""https://lh3.googleusercontent.com/gps-cs-s/AHVAwerdBAE_bozYOLoteSQrixSAfKx3PWvhbpDx3wwoh-OyWah2Lb7C_mixA-QbTToknhhuhe-_fUSd5CW31HdKCJgEIljc31ZHq8GaSc5L7F6IP8rLROl390CYHStF91p19x9HWU-L=w448-h298-k-no""},{""title"":""House"",""image"":""https://lh3.googleusercontent.com/gps-cs-s/AHVAwepKOUITs46kntJICpDKGFXzflKGl2WkdF_S2d1lRL768XltBdaJ2J3yd5tDXIeqCS7__O2RZZQ_gF1YGqZPNPo3-9wMOzsrOqdjplGKa6Ew32UN5Y3GZtA-i5MEkX9lnY9ZwuXV=w447-h298-k-no""},{""title"":""Roof shingle"",""image"":""https://lh3.googleusercontent.com/gps-cs-s/AHVAweqqAxoNkRk1QPU25Qpngu6GeJXBYj_Yyf0uFpnw58xMz4DJierzZbm9zNkqC4upGk5sEusMGuclTNV7meOaH9l6Fgc-uZior3ihlmls7GHdFIXPFdmF-_2NLBYiMCoF1OG5_9M=w455-h298-k-no""},{""title"":""By owner"",""image"":""https://lh3.googleusercontent.com/gps-cs-s/AHVAweqvPUlyfjVqASOowAqLkq98fSshiO-uyR_t8X_nEHi4HVFl6OBZAw4ZEZ731v8NIBdF3-iyrDFJNPrtMURyqcWo_OD3ls1VoYAednE0umKx1b_fNwfBOD8-Rb7EZKGPQsaPAQpb=w436-h298-k-no""}]",null,null,"{""link"":"""",""source"":""""}","{""id"":""110514378485253744858"",""name"":""NORTHVAN ROOFING (Owner)"",""link"":""https://www.google.com/maps/contrib/110514378485253744858""}","{""borough"":"""",""street"":"""",""city"":"""",""postal_code"":"""",""state"":"""",""country"":""""}",null,"[{""Name"":""Terence Woo"",""ProfilePicture"":""https://lh3.googleusercontent.com/a-/ALV-UjULQN8DNH_oKSWaJB6UzvNk7R5Y8fU5NDei-0tcVZiq6BNStPA=s120-c-rp-mo-br100"",""Rating"":5,""Description"":""As part of a larger renovation 2 years ago, Dale patched several areas of our roof including a large hole where a chimney was removed. The job was well done, completed quickly, and provided at a very fair price.\n\nWe recently attached a patio cover to the roof and I asked Dale to come inspect it. He provided good advice to ensure we won't have any issues in the future."",""Images"":null,""When"":""""},{""Name"":""Malena McGrogan"",""ProfilePicture"":""https://lh3.googleusercontent.com/a/ACg8ocIpi8vy_2VGmxk03g1rEARjxsJ8yeaNxQ3BJmXlwMbVAso_Eg=s120-c-rp-mo-br100"",""Rating"":5,""Description"":""I called North Van Roofing late one rainy afternoon in December since my roof was leaking.  Mike offered to come out as early at 7:15 the next morning to assess the damage before I had to leave for work.  He was early to arrive the next morning, assessed the damage from inside and out and did the work right away.\n\nThe guys were professional, polite and delivered what they promised.  They even painted my chimney since they noticed it was rusty once they were up on the roof.  My roof is no longer leaky and I now have peace of mind that the next storm will not be felt inside my home.\n\nI will certainly call them back next time I have a roofing problem!\nthanks guys!"",""Images"":null,""When"":""""}]",null,
