input_id,link,title,category,address,open_hours,popular_times,website,phone,plus_code,review_count,review_rating,reviews_per_rating,latitude,longitude,cid,status,descriptions,reviews_link,thumbnail,timezone,price_range,data_id,place_id,images,reservations,order_online,menu,owner,complete_address,about,user_reviews,user_reviews_extended,emails
d44c9849-c073-46d3-8375-af63f1dff00a,https://www.google.com/maps/place/Swift+Roofing+Contractor/data=!4m7!3m6!1s0x54860b21543572e3:0x1ee72aa20060022c!8m2!3d49.1720192!4d-123.1920176!16s%2Fg%2F11sf7s71y9!19sChIJ43I1VCELhlQRLAJgAKIq5x4?authuser=0&hl=en&rclk=1,Swift Roofing Contractor,Roofing contractor,"5759 Musgrave Crescent, Richmond, BC V7C 5N6","{""Friday"":[""Open 24 hours""],""Monday"":[""Open 24 hours""],""Saturday"":[""Open 24 hours""],""Sunday"":[""Open 24 hours""],""Thursday"":[""Open 24 hours""],""Tuesday"":[""Open 24 hours""],""Wednesday"":[""Open 24 hours""]}",{},https://leadshaw.io/,,"5RC5+R5 Richmond, British Columbia",0,0.000000,"{""1"":0,""2"":0,""3"":0,""4"":0,""5"":0}",49.172019,-123.192018,2226795416037360172,,,,https://lh3.googleusercontent.com/gps-cs-s/AHVAwepS-n1oSbuYIOu6Y168dxy0aKNR5JwoZDk1tftLhdruZE-05hXOdYpyzZf2m5sOsf-bqdzyV7-sOOiKZbv-3sRyHpLBYuvHcH5f5LJcLoIyItGfUurhtBHgIeXfjKl5HhwF85HA=w408-h306-k-no,America/Vancouver,,0x54860b21543572e3:0x1ee72aa20060022c,ChIJ43I1VCELhlQRLAJgAKIq5x4,"[{""title"":""All"",""image"":""https://lh3.googleusercontent.com/gps-cs-s/AHVAwepS-n1oSbuYIOu6Y168dxy0aKNR5JwoZDk1tftLhdruZE-05hXOdYpyzZf2m5sOsf-bqdzyV7-sOOiKZbv-3sRyHpLBYuvHcH5f5LJcLoIyItGfUurhtBHgIeXfjKl5HhwF85HA=w397-h298-k-no""},{""title"":""House"",""image"":""https://lh3.googleusercontent.com/gps-cs-s/AHVAwepWdVR_23nCI12uWobefNygGhEABIxc_aDbRdipAObHR8XowPP-RpuCHIuQKfDEah4tLovwf-0o4RWj0cMVKln6gC3uUF3UpqyYUap25keeFOfSjbKWYfUX5-ZDWXlWKstTNlRw=w526-h298-k-no""},{""title"":""Videos"",""image"":""https://lh3.googleusercontent.com/gps-cs-s/AHVAwerneY6CIUjlxx0nsst56ERFTUHWG4Ja6slx4uD5-5V4jVl3MiHeTFz99QC_p8zisVA1yS-jeuInsODCCx1wCQxGg3DjREwkkC2B3k-_VdmS9PlQag2xCJ8aR8-TGbXLBaXsLDI=w526-h298-k-no""},{""title"":""By owner"",""image"":""https://lh3.googleusercontent.com/gps-cs-s/AHVAwerLQVwBGx3ec5ffSXZywPsvJT9Ud5L6vUootrNumNKlWx7YKOg6ltxkZCr8pCVOHf3op3ti0hOYEkwe0YHo1e2dLVGTjCyYIcRWI_463cUAhE1TVu6FV21qni_0Y7thzvHQccRY=w447-h298-k-no""},{""title"":""Street View \u0026 360°"",""image"":""https://streetviewpixels-pa.googleapis.com/v1/thumbnail?panoid=qcLKG5w5O7FnI3BoRDEImA\u0026cb_client=maps_sv.tactile.gps\u0026w=224\u0026h=298\u0026yaw=260.58047\u0026pitch=0\u0026thumbfov=100""}]",null,null,"{""link"":"""",""source"":""""}","{""id"":""114400606736256490593"",""name"":""Swift Roofing Contractor (Owner)"",""link"":""https://www.google.com/maps/contrib/114400606736256490593""}","{""borough"":"""",""street"":""5759 Musgrave Crescent"",""city"":""Richmond"",""postal_code"":""V7C 5N6"",""state"":""British Columbia"",""country"":""CA""}","[{""id"":""service_options"",""name"":""Service options"",""options"":[{""name"":""Online estimates"",""enabled"":true},{""name"":""Onsite services"",""enabled"":true}]},{""id"":""accessibility"",""name"":""Accessibility"",""options"":[{""name"":""Wheelchair accessible seating"",""enabled"":true},{""name"":""Wheelchair-accessible parking lot"",""enabled"":true},{""name"":""Wheelchair-accessible washroom"",""enabled"":true}]}]",[],null,
d44c9849-c073-46d3-8375-af63f1dff00a,https://www.google.com/maps/place/Black+Bear+Maintenance/data=!4m7!3m6!1s0x54860bc69eebf55f:0x46d6127d9743f890!8m2!3d49.1716572!4d-123.1542165!16s%2Fg%2F11rq0qr46v!19sChIJX_XrnsYLhlQRkPhDl30S1kY?authuser=0&hl=en&rclk=1,Black Bear Maintenance,Property maintenance,"6631 Westminster Hwy #160, Richmond, BC V7C 5C2","{""Friday"":[""8 a.m.–5 p.m.""],""Monday"":[""8 a.m.–5 p.m.""],""Saturday"":[""10 a.m.–4 p.m.""],""Sunday"":[""Closed""],""Thursday"":[""8 a.m.–5 p.m.""],""Tuesday"":[""8 a.m.–5 p.m.""],""Wednesday"":[""8 a.m.–5 p.m.""]}",{},https://www.blackbearmaintenance.ca/?utm_source=google&utm_medium=gmb,(778) 800-2001,"5RCW+M8 Richmond, British Columbia",66,5.000000,"{""1"":0,""2"":0,""3"":0,""4"":1,""5"":65}",49.171657,-123.154216,5104287558289062032,,,,https://lh3.googleusercontent.com/gps-cs-s/AHVAwerAE5NSAXBn4y1d2bk0Xthi5jpjlk_cwQdw9K3ysno_MqGFckLYrnVqHeFy8fLtvoXJ6tJxflsAeoS8I8nlawL0VH8RFXIDAlHaYoQeOmfewwCV1kkncuTcyie0_v9tDYclrJx5iUjnXLO3=w408-h883-k-no,America/Vancouver,,0x54860bc69eebf55f:0x46d6127d9743f890,ChIJX_XrnsYLhlQRkPhDl30S1kY,"[{""title"":""All"",""image"":""https://lh3.googleusercontent.com/gps-cs-s/AHVAwerAE5NSAXBn4y1d2bk0Xthi5jpjlk_cwQdw9K3ysno_MqGFckLYrnVqHeFy8fLtvoXJ6tJxflsAeoS8I8nlawL0VH8RFXIDAlHaYoQeOmfewwCV1kkncuTcyie0_v9tDYclrJx5iUjnXLO3=w224-h484-k-no""},{""title"":""By owner"",""image"":""https://lh3.googleusercontent.com/gps-cs-s/AHVAwerDt-ThRtSaog8kydpry7wImpZhrC6hvbr9mCIYVKcx99OtLoHq7kxPNZO93WaY1vCegytV8NhJPlFxb21HfFfOJAJFKN6yBl0ikwMySAZyBSS3Ssd1K1rIH80g_6wiNFYKzZqgQg=w224-h298-k-no""},{""title"":""Street View \u0026 360°"",""image"":""https://streetviewpixels-pa.googleapis.com/v1/thumbnail?panoid=Eq1O-N1Gwe0RQ3dccCioRw\u0026cb_client=maps_sv.tactile.gps\u0026w=224\u0026h=298\u0026yaw=112.43446\u0026pitch=0\u0026thumbfov=100""}]",null,null,"{""link"":"""",""source"":""""}","{""id"":""105275580025422314586"",""name"":""Black Bear Maintenance (Owner)"",""link"":""https://www.google.com/maps/contrib/105275580025422314586""}","{""borough"":"""",""street"":""6631 Westminster Hwy #160"",""city"":""Richmond"",""postal_code"":""V7C 5C2"",""state"":""British Columbia"",""country"":""CA""}",null,"[{""Name"":""Erwin Bueckert"",""ProfilePicture"":""https://lh3.googleusercontent.com/a/ACg8ocIZZpviyUAiwi0mmg42vi3yANsQaZu0SvWDhmqtRTQnd7ee2w=s120-c-rp-mo-ba2-br100"",""Rating"":5,""Description"":""I highly recommend Black Bear Maintenance. Cam was professional, provided a prompt and detailed quote, and maintained clear communication throughout the project. I’ve had the opportunity to work alongside him on several projects and truly appreciated his positive attitude and solution-oriented approach to problem solving."",""Images"":null,""When"":""""},{""Name"":""Trish Pineau"",""ProfilePicture"":""https://lh3.googleusercontent.com/a-/ALV-UjWzc48-kz_pGnIiD9IGklZs9rM7lcRxTD5-ER-PtAOBtHuesrKJ=s120-c-rp-mo-ba2-br100"",""Rating"":5,""Description"":""As a Property Manager, I rely heavily on trusted vendors to maintain and repair our properties. Black Bear Maintenance consistently completes projects on time, offers very reasonable pricing, and communicates clearly throughout the entire process. They perform a wide range of services across our portfolio of properties, and every project is handled with a high level of professionalism. Our owners are consistently pleased with the results, and we highly recommend their services."",""Images"":null,""When"":""""},{""Name"":""Paolo Davarda"",""ProfilePicture"":""https://lh3.googleusercontent.com/a-/ALV-UjXZYwEA7ni-CCkrvlFIxL5oXH6VUUcSSFM1CmWcZXucyhP8RPU=s120-c-rp-mo-br100"",""Rating"":5,""Description"":""I can’t recommend  Black Bear Maintenance enough! From the very first call, their professionalism and attention to detail stood out. They arrived on time, came fully prepared, and tackled every job on my list with skill and efficiency. What impressed me most was how they went the extra mile—explaining what they were doing, offering helpful tips for future maintenance, and leaving everything spotless when they finished. It’s rare to find a company that combines quality craftsmanship with such friendly and reliable service. If you need a handyman you can truly trust, look no further than Black Bear!"",""Images"":null,""When"":""""},{""Name"":""Maggie Burgess"",""ProfilePicture"":""https://lh3.googleusercontent.com/a-/ALV-UjUkv623g3t8FbT8iIauDX6o05IcpsYhv7yEbngw0UWNe8GUUTM=s120-c-rp-mo-ba2-br100"",""Rating"":5,""Description"":""We recently hired Black Bear Maintenance to clean our gutters. The team was thorough and efficient, and took care of any and all issues quickly and effectively. Would recommend."",""Images"":null,""When"":""""},{""Name"":""Sam Barudin"",""ProfilePicture"":""https://lh3.googleusercontent.com/a-/ALV-UjXyjjq023rmZJXsEFkdN-o2ZSmIiyru-M1UZJ-6rBX_ncrSS6tv=s120-c-rp-mo-br100"",""Rating"":5,""Description"":""Cameron the owner has excellent customer service and great pricing.  He makes you feel relaxed while you explain your problem and then offers you some cost effective solutions.  Thanks for your help Cameron.  Cheers."",""Images"":null,""When"":""""},{""Name"":""Lynn A"",""ProfilePicture"":""https://lh3.googleusercontent.com/a/ACg8ocIsMhMNExyVLtEu-GR2dkW1vmoYP0QVENnGGyY9TcTXVp4qgg=s120-c-rp-mo-br100"",""Rating"":5,""Description"":""We recently hired this company for regrouting and electrical work on our house, and we are very happy with the results. Cameron was a great communicator from the beginning and his team was professional, efficient, and completed on schedule. Highly recommended."",""Images"":null,""When"":""""},{""Name"":""Jason Bowe"",""ProfilePicture"":""https://lh3.googleusercontent.com/a/ACg8ocI3jvFQZt8KlsfZWeeXLwpXVSVUP3wDMJ6hp6GeihwW6ZwKUA=s120-c-rp-mo-br100"",""Rating"":5,""Description"":""We used Black Bear Maintenance to pressure wash and clean my parents property before listing it for sale. The quote we received was competitive and the customer service from Cameron was top notch. On the day, the workers were extremely thorough and brought the property back to brand new condition all the way from the pavement to the gutters. Needless to say, I highly recommend this company to anyone looking for a professional and most importantly friendly and genuine people around your home who love what they do. Thank you!"",""Images"":[""www.google.com/local/imagery/report/?cb_client=maps_sv.tactile\u0026image_key=!1e10!2sCIHM0ogKEICAgIDW7ZORYg\u0026fid=0x0:0x46d6127d9743f890""],""When"":""2022-4-1""},{""Name"":""Joseph Smallwood"",""ProfilePicture"":""https://lh3.googleusercontent.com/a/ACg8ocJvOCMvE11mVi3z6A7492Z47bZa90nYXbvPfiNtSNlYbMif=s120-c-rp-mo-ba2-br100"",""Rating"":5,""Description"":""Cameron and his team at Black Bear Maintenance are great! They are communicative, reasonable and go above and beyond. Black Bear Maintenance provided window cleaning service for our three storey strata building and they did a phenomenal job. Great customer service, along with efficient and excellent work. Highly recommend them for your strata needs."",""Images"":null,""When"":""""}]",null,
d44c9849-c073-46d3-8375-af63f1dff00a,https://www.google.com/maps/place/Dignity+Roofing+%26+Exteriors/data=!4m7!3m6!1s0x548675d624585b73:0xeabe3ddc3b6df61!8m2!3d49.1714044!4d-123.1319628!16s%2Fg%2F11nrvcgtfw!19sChIJc1tYJNZ1hlQRYd-2w93jqw4?authuser=0&hl=en&rclk=1,Dignity Roofing & Exteriors,Roofing contractor,"South Tower, 5811 Cooney Rd. Suite 305, Richmond, BC V6X 3M1","{""Friday"":[""9 a.m.–6 p.m.""],""Monday"":[""9 a.m.–6 p.m.""],""Saturday"":[""Closed""],""Sunday"":[""Closed""],""Thursday"":[""9 a.m.–6 p.m.""],""Tuesday"":[""9 a.m.–6 p.m.""],""Wednesday"":[""9 a.m.–6 p.m.""]}",{},http://dignityroofing.ca/,(604) 330-9903,"5VC9+H6 Richmond, British Columbia",78,5.000000,"{""1"":0,""2"":0,""3"":0,""4"":0,""5"":78}",49.171404,-123.131963,1057189079159332705,,,,https://lh3.googleusercontent.com/gps-cs-s/AHVAwerb9zbZh7u9evm2a2NFsE-sE7oLyUkXlMxXMNE6XA1m-pKGJvl3Hhv-gABYG3CGuRRuMXSYuF-UOIrQcKSq-KIOstHe6U-xwRHs8nXCZdoV5-wi1guoxZQXN6dePZ-M-pgMlPh0=w426-h240-k-no,America/Vancouver,,0x548675d624585b73:0xeabe3ddc3b6df61,ChIJc1tYJNZ1hlQRYd-2w93jqw4,"[{""title"":""All"",""image"":""https://lh3.googleusercontent.com/gps-cs-s/AHVAwerb9zbZh7u9evm2a2NFsE-sE7oLyUkXlMxXMNE6XA1m-pKGJvl3Hhv-gABYG3CGuRRuMXSYuF-UOIrQcKSq-KIOstHe6U-xwRHs8nXCZdoV5-wi1guoxZQXN6dePZ-M-pgMlPh0=w529-h298-k-no""},{""title"":""Latest"",""image"":""https://lh3.googleusercontent.com/gps-cs-s/AHVAwepFp5pJ6vl0qJn1Gzno5YVS0ud9TafVKruTJru5vr93nFQ3L2hbcVP0qheYd3zy7n6uMaFyS-7Z9Cu0LfQY-N5ImKxr8scB8jALwLxraFLO6rIrc0OBWtSkbOts9z9nwnAv566HA7up2OGu=w397-h298-k-no""},{""title"":""Videos"",""image"":""https://lh3.googleusercontent.com/gps-cs-s/AHVAwerQySG3bYaRPgzqLE_diFYH2OZ2vBY-vT-ZGjzJC1OB63-agZmFzBwu6aLfDUjGHcjCZ3XBZUkSeDsSmpv7wPJz9Wit5pzXK3KTf4wDGEzXbIoSGyPM69gAbxh7FFVtp0ZgpAAj2ZQAb8P7=w224-h398-k-no""},{""title"":""House"",""image"":""https://lh3.googleusercontent.com/gps-cs-s/AHVAwerYQ6EQNTD0U8bSlr0z2KBYvj5VQeAyb9O8Z_g4mYyMJQD1jFMYp93X9lmHsl1fDDXIfoQn71EdfjBGcqIjyxfC6y4srOF-ErA4DFb2Z13hTyCil-wg8mAiiO9ytYmRfC-PCReRwm49pi9x=w224-h398-k-no""},{""title"":""By owner"",""image"":""https://lh3.googleusercontent.com/gps-cs-s/AHVAwermupwYF74Vrw-kUvvAhDWafNjnzksKxYvg2VKPwS2TaGwvUEBFTa61MS23JJH4We4Ruln2pT5RKGe9LCJh7HQCwZcrcD_QWq67YIRtfEs5FPd8999p2xPfphIhAhic7rvkHdecoytWpp68=w397-h298-k-no""},{""title"":""Street View \u0026 360°"",""image"":""https://streetviewpixels-pa.googleapis.com/v1/thumbnail?panoid=TBiI08DfZLJavnKNNyFHwA\u0026cb_client=maps_sv.tactile.gps\u0026w=224\u0026h=298\u0026yaw=266.60406\u0026pitch=0\u0026thumbfov=100""}]",null,"[{""link"":""https://www.dignityroofing.ca/contact"",""source"":""dignityroofing.ca""}]","{""link"":"""",""source"":""""}","{""id"":""101992477874378985342"",""name"":""Dignity Roofing \u0026 Exteriors (Owner)"",""link"":""https://www.google.com/maps/contrib/101992477874378985342""}","{""borough"":"""",""street"":""South Tower, 5811 Cooney Rd. Suite 305"",""city"":""Richmond"",""postal_code"":""V6X 3M1"",""state"":""British Columbia"",""country"":""CA""}","[{""id"":""service_options"",""name"":""Service options"",""options"":[{""name"":""Online estimates"",""enabled"":true},{""name"":""Onsite services"",""enabled"":true}]}]","[{""Name"":""Tim B"",""ProfilePicture"":""https://lh3.googleusercontent.com/a-/ALV-UjVl1w6d2WOVD2dkaIS9eUeaB1KvU1eYJ9uxuNWDrDoMijxEbC4KDg=s120-c-rp-mo-ba3-br100"",""Rating"":5,""Description"":""I had a very pleasant experience with Dignity Roofing \u0026 Exteriors. I initially reached out to them in the Fall to inquire about a roof inspection as my insurance company required it. Dignity Roofing had the most competitive price so my neighbours and I decided to sign a contract with them. Roof replacement finished in the early summer, just in time before the rainy season starts. Their team kept us well informed regarding material delivery and any schedule changes.\n\nCrew did a tremendous job - very good workmanship. The project was completed as planned, without any cost overruns. I highly recommend Dignity Roofing \u0026 Exteriors. If you are looking for a roofer, do not hesitate to at least give them a call."",""Images"":null,""When"":""""},{""Name"":""easyjazzplease"",""ProfilePicture"":""https://lh3.googleusercontent.com/a/ACg8ocLPIkcE3lugOdbLh5o5Ufc6M9ChJ9G_4q5WcJ8UI-Ry-JVWag=s120-c-rp-mo-br100"",""Rating"":5,""Description"":""Very happy with the quality, professionalism and attention to detail taken with the new installation. The gutter and downspout look great and well secured. What's more, Eric went above and beyond expectation. After removing the old gutter, it was clear the fascia board would need repainting after the new gutter was installed. Not fun! Thank you Eric for painting and sanding where needed that fascia board before installing the gutter. I am so appreciative!  I highly recommend Dignity. They are great."",""Images"":null,""When"":""""},{""Name"":""Coach"",""ProfilePicture"":""https://lh3.googleusercontent.com/a/ACg8ocKaWvdizZm-ELhZ4KSw9tK6dKUU5tskL2f-ehE-IQ2qjihuJw=s120-c-rp-mo-br100"",""Rating"":5,""Description"":""I couldn't be happier with the experience I had with Dignity Roofing! From the very beginning, they were prompt—showing up on time for both the estimate and the actual work. Their team was incredibly professional, courteous, and easy to communicate with throughout the entire process.\n\nThe work itself was detailed and top-quality. They took the time to explain everything, answered all my questions, and ensured the job was done right. What impressed me most was the clean-up afterward—you’d hardly know major roof work had just been done.\n\nHighly recommend them to anyone looking for roofing work done with care and integrity!"",""Images"":null,""When"":""""},{""Name"":""Emily Chang"",""ProfilePicture"":""https://lh3.googleusercontent.com/a-/ALV-UjWdmbilVO4KIT4cO4xoAY6mzyW1kmaUHMPEaKPf5uwhd_sgCNQQ=s120-c-rp-mo-ba3-br100"",""Rating"":5,""Description"":""The moment I spoke to Oskar, who came 15 min early for his house visit, I could tell that this is a very honest and hardworking man and he is very proud of his team's work. We had many quotes from different companies for replacing our shingle and gutters. Only Dignity Roofing's Oskar was able to tell me that our gutters do not need replacing because they look like they are within 5 years old. We had just moved in to this house so we are so grateful for this information. Oskar also answered all of my questions with detail and care. He provided all samples on the spot and gave his honest suggestions.\n\nOur project manager, Ramil, along with his team of experienced roofers arrived to our home punctually and finished our roofing job in 2 days. They cleaned up the debris that went on our sunroom roof and all surrounding areas. We are so happy with the look of Iko Dynasty Atlantic Blue shingles on our roof. So many neighbours have been complimenting our new roof!"",""Images"":null,""When"":""""},{""Name"":""Clement Ng"",""ProfilePicture"":""https://lh3.googleusercontent.com/a-/ALV-UjVmxCtWKPXq-PycD_0syMMTcUR-Qhx2vhRuYJIyXN2jgMDssAJi=s120-c-rp-mo-br100"",""Rating"":5,""Description"":""I had my 20-year-old roof replaced by Dignity Roofing \u0026 Exteriors, and I couldn't be happier with the results! From start to finish, their team was professional, efficient, and highly skilled. The entire process was smooth, and they kept me informed every step of the way. The new roof looks amazing, and I have peace of mind knowing it was installed with quality craftsmanship. I highly recommend Dignity Roofing \u0026 Exteriors."",""Images"":null,""When"":""""},{""Name"":""Edward Lee"",""ProfilePicture"":""https://lh3.googleusercontent.com/a-/ALV-UjXzpCCaKqlLicVT9Pkd_6KE4SUAJxY6UJHqMZtNEDyru9TaprA=s120-c-rp-mo-br100"",""Rating"":5,""Description"":""We just recently did our roof with Dignity Roofing and they did an amazing job. Oskar , Ramil and the rest of the team were very punctual and was a pleasure to work with. The quote that was given is good value for the work provided.\n\nPs. We even got compliments the day after the roof was complete"",""Images"":null,""When"":""""},{""Name"":""Tsai Tim"",""ProfilePicture"":""https://lh3.googleusercontent.com/a/ACg8ocK5gYKf5_0Z3Y7CEDqkA2l8Fpkd_IprCKRpGvayMELoeE6VEA=s120-c-rp-mo-br100"",""Rating"":5,""Description"":""Dignity Roofing did an excellent job on reroofing our house. Oskar and Ramil were both very professional, courteous, honest and upfront about potential costs. They provided updates along the way and their team finished the job in a very reasonable time. Would definitely recommend!"",""Images"":null,""When"":""""},{""Name"":""Grace Marifosque"",""ProfilePicture"":""https://lh3.googleusercontent.com/a-/ALV-UjXt4t9Junfe86VIDsywnRl86wUI0Mbei8UPh78jIztyQKR7XhwRoA=s120-c-rp-mo-br100"",""Rating"":5,""Description"":""Job well done, Ramil! I can't thank you enough for the work you just did. You guy's are awesome. Repairing our gutter that was leaking and installed a new one. It looks neat and awesome. Highly recommended!!!"",""Images"":[""www.google.com/local/imagery/report/?cb_client=maps_sv.tactile\u0026image_key=!1e10!2sCIHM0ogKEICAgICO3uG1tAE\u0026fid=0x0:0xeabe3ddc3b6df61""],""When"":""2022-6-11""}]",null,
