input_id,link,title,category,address,open_hours,popular_times,website,phone,plus_code,review_count,review_rating,reviews_per_rating,latitude,longitude,cid,status,descriptions,reviews_link,thumbnail,timezone,price_range,data_id,place_id,images,reservations,order_online,menu,owner,complete_address,about,user_reviews,user_reviews_extended,emails
d70687ae-2e93-4bc8-b9a0-eca95d21fe38,https://www.google.com/maps/place/Revel+Built+Inc./data=!4m7!3m6!1s0x54867722d27b8383:0xdf670b6952e0dd2f!8m2!3d49.2049054!4d-122.9746345!16s%2Fg%2F1tjs4mrp!19sChIJg4N70iJ3hlQRL93gUmkLZ98?authuser=0&hl=en&rclk=1,Revel Built Inc.,General contractor,,{},{},https://revelbuilt.ca/,(778) 384-7959,,28,4.800000,"{""1"":1,""2"":0,""3"":0,""4"":1,""5"":26}",49.204905,-122.974634,16097847940049067311,,,,https://lh3.googleusercontent.com/gps-cs-s/AHVAweqG_Ljg8phCAsyi6xygwWEwSxul9OYZOy54W_yD6avrWK-XtXCKJslvVR7-XDLPZ392gl9fv3eDk67uEkFkjQHys0TCvP2yGT6fx_d4MTwcYqJhZgiODGemh8Nqi5ofAopf8J8x8g=w408-h272-k-no,America/Vancouver,,0x54867722d27b8383:0xdf670b6952e0dd2f,ChIJg4N70iJ3hlQRL93gUmkLZ98,"[{""title"":""All"",""image"":""https://lh3.googleusercontent.com/gps-cs-s/AHVAweqG_Ljg8phCAsyi6xygwWEwSxul9OYZOy54W_yD6avrWK-XtXCKJslvVR7-XDLPZ392gl9fv3eDk67uEkFkjQHys0TCvP2yGT6fx_d4MTwcYqJhZgiODGemh8Nqi5ofAopf8J8x8g=w446-h298-k-no""},{""title"":""Inside"",""image"":""https://lh3.googleusercontent.com/gps-cs-s/AHVAwepE_EmWOymNzZ5jqoWfCHCNtzfhyuKmRyGbdD9o_pe3tNKe5PwtZqr1Q37I75nGRLL6SExGp-hCRnY66C0aPtzY5SjNZHhBNjUbtgTccFNmWwycK7gqSt3KmqdrXMfDt8fm790T7w=w447-h298-k-no""},{""title"":""Videos"",""image"":""https://lh3.googleusercontent.com/gps-cs-s/AHVAweqGuTv19mVmA_VLpoVj4uP_hy7DStCaYw8Rhx3or4N03nLdXGYLJ5RtKRHF8uPsNg7qMJCQQ_cHytUhS0DchJbRRDIoO1Pp50qJKyt7BisU9F-8E9GPQrpmmIYVIt6JnDRKgclW=w529-h298-k-no""},{""title"":""By owner"",""image"":""https://lh3.googleusercontent.com/gps-cs-s/AHVAweobq8hkpzkNKYW9e0n2cCGViLA2pZAnPhUMLC67sHYPPh-kJIzzqqT6p8LkOc6ze-lqV-MALQF0jPSHL1F7vhoh3Ax_pQtrT5AmyM2VCydjPTR6Lt0sJGYWu9nDNrsFhHwFtv6Lnw=w529-h298-k-no""}]",null,null,"{""link"":"""",""source"":""""}","{""id"":""102790371357470231342"",""name"":""Revel Built Inc. (Owner)"",""link"":""https://www.google.com/maps/contrib/102790371357470231342""}","{""borough"":"""",""street"":"""",""city"":"""",""postal_code"":"""",""state"":"""",""country"":""""}","[{""id"":""service_options"",""name"":""Service options"",""options"":[{""name"":""Online estimates"",""enabled"":true}]}]","[{""Name"":""Wissam Kamel"",""ProfilePicture"":""https://lh3.googleusercontent.com/a/ACg8ocI0fIXgdwgC2pJ8KggF0h_sqkv1Qc1d056aS20y9oT3WsDVZQ=s120-c-rp-mo-br100"",""Rating"":5,""Description"":""Revel Built Inc. did an outstanding job remodeling our bathroom. Their craftsmanship and professionalism were top-notch. They listened to our ideas, offered valuable suggestions, and delivered a design that perfectly aligned with our style and needs. The materials used were of high quality, and the attention to detail was impeccable. They managed the project efficiently, adhered to the timeline, and communicated effectively. Our home was treated with respect, and the team left the space clean and tidy. We highly recommend Revel Built Inc. for your bathroom remodeling needs."",""Images"":[""www.google.com/local/imagery/report/?cb_client=maps_sv.tactile\u0026image_key=!1e10!2sCIHM0ogKEICAgICJycbJMA\u0026fid=0x0:0xdf670b6952e0dd2f""],""When"":""2023-6-29""},{""Name"":""Penny Deck"",""ProfilePicture"":""https://lh3.googleusercontent.com/a/ACg8ocIZqRVAIVz1rj-xmW_HV71B84bf984ItWUTfD6c9PX4avlJbNI=s120-c-rp-mo-br100"",""Rating"":5,""Description"":""Working with Revel Built is a pleasure from start to finish on my kitchen renovation. Excellent communication throughout the project and I absolutely love my dream kitchen. I highly recommend."",""Images"":null,""When"":""""},{""Name"":""Reza Heshami"",""ProfilePicture"":""https://lh3.googleusercontent.com/a/ACg8ocKy7nkpz2ttQCcxe8LwQ7pIaGX5_q5SaRVUWqT21tT2GmYmDg=s120-c-rp-mo-br100"",""Rating"":5,""Description"":""Revel Build did an exceptional job renovating our bathrooms. From start to finish, their team was professional, punctual, and highly organized. They communicated clearly throughout the entire process, keeping us updated on timelines and progress. The quality of the workmanship exceeded our expectations, with great attention to detail in every aspect of the renovation. They also kept the worksite clean and respected our home, which we really appreciated. We’re happy with the final result and wouldn’t hesitate to work with them again. Highly recommended!"",""Images"":null,""When"":""""},{""Name"":""Tony C"",""ProfilePicture"":""https://lh3.googleusercontent.com/a/ACg8ocJloRJ7wY7-5VDK7DvkiDPaLG6Tx4IjTPWJBY-RAYF_QhbmGUU=s120-c-rp-mo-ba3-br100"",""Rating"":5,""Description"":""Fantastic Experience in working with Accel Construction. We had them renovate three of our bathrooms and re-tiled our ground floor.\n\nAccel were very professional and articulate in scheduling and working within our timeline and budget. Overall they were very respectful, clean, and over exceeded our expectations.\n\nOur renovation finished ahead of schedule and on budget. We wished we use them in our previous renovation.\n\nHighly recommend them for future renovations and for the amazing craftsmanship."",""Images"":[""www.google.com/local/imagery/report/?cb_client=maps_sv.tactile\u0026image_key=!1e10!2sCIHM0ogKEICAgICk7Mi-Ag\u0026fid=0x0:0xdf670b6952e0dd2f""],""When"":""2017-11-22""},{""Name"":""Erin Belsito"",""ProfilePicture"":""https://lh3.googleusercontent.com/a/ACg8ocLkJReMxxDlkPJ3TKCOBm_qS1CiOtIwcnEgGy3zUITh3NzG=s120-c-rp-mo-br100"",""Rating"":5,""Description"":""We had a great experience working with Revel Built with a large renovation of our home. Their team demonstrate a positive attitude, are trustworthy, and deliver very high quality work. Their project manager was very responsive and available through design or budget concerns when they came up. We do not hesitate to recommend Revel."",""Images"":null,""When"":""""},{""Name"":""Lynn Marsh"",""ProfilePicture"":""https://lh3.googleusercontent.com/a/ACg8ocLIOkVYDt35k62zoYB6VEYDFmlXVuO4v71drKNV4Xk70DL0Rg=s120-c-rp-mo-br100"",""Rating"":5,""Description"":""We hired Revel Built to renovate our ensuite and guest bathrooms.  They turned out exactly as we envisioned them, thanks to the designer.   All of the tradesman were friendly, respectful and a pleasure to be around.  Their work was excellent.  The person in charge of the project was very reponsive to our emails and questions.  I would certainly recommend Revel Built to anyone.  I am planning on doing more work in our home and will certainly hire them again."",""Images"":null,""When"":""""},{""Name"":""Grant Arnold"",""ProfilePicture"":""https://lh3.googleusercontent.com/a-/ALV-UjUP2lLBhm9OUYNC6j9Kr6bV1A-0zWEFW4Q4uskp92S-mnp7Ajg9=s120-c-rp-mo-ba3-br100"",""Rating"":5,""Description"":""We hired Revelbuilt to build a new garage on our property replacing a very old one. From design to construction Revelbuilt had excellent communication. The project manager kept us up to date on what was being worked on and what was upcoming. The foreman on site was a super nice guy who was excellent and had passion for his work. The project was large, but somehow wasn't as stressful as other projects we have done. Revelbuilt did a great job seeing the project through to completion. Everyone I interacted with at Revelbuilt was great. I will definitely be using them for any future home renovation needs."",""Images"":null,""When"":""""},{""Name"":""John Westerhof"",""ProfilePicture"":""https://lh3.googleusercontent.com/a/ACg8ocK0owKS-sJvZSgNGVLTxL5Y2JcYzaJO3vEsxtboHiCz4WENuQ=s120-c-rp-mo-br100"",""Rating"":5,""Description"":""Our kitchen was 39 years old and beside a sunken family room.   The space felt dated, cramped and awkward to work in.   We decided to renovate and got quotes from various companies including Revel Built, whom we had heard of through a family member.  We weren’t sure of what we wanted and they helped us explore various options and the associated costs.     Brad was the main contact and impressed us with his knowledge and patience.\nWe eventually decided to completely renovate the kitchen and family room,  including raising the sunken floor and replacing the fireplace.   The price was competitive and fair.   The  work started on the promised date and stayed very close to schedule and budget.    All the trades and people involved were very professional, friendly and courteous.    We were very happy with the quality of the work and any minor issues were quickly resolved.\nOur new kitchen and family room looks great, feels much bigger and is way more functional.  We  highly recommend the Revel team."",""Images"":null,""When"":""""}]",null,
d70687ae-2e93-4bc8-b9a0-eca95d21fe38,https://www.google.com/maps/place/Beyond+Landscaping/data=!4m7!3m6!1s0x548671c559f8e20d:0x1affd4d350a63c9c!8m2!3d49.3169871!4d-123.0922035!16s%2Fg%2F11g6j7d0kb!19sChIJDeL4WcVxhlQRnDymUNPU_xo?authuser=0&hl=en&rclk=1,Beyond Landscaping,Landscaper,"712 Copping St, North Vancouver, BC V7M 3G3","{""Friday"":[""7 a.m.–8 p.m.""],""Monday"":[""7 a.m.–8 p.m.""],""Saturday"":[""7 a.m.–3 p.m.""],""Sunday"":[""7 a.m.–3 p.m.""],""Thursday"":[""7 a.m.–8 p.m.""],""Tuesday"":[""7 a.m.–8 p.m.""],""Wednesday"":[""7 a.m.–8 p.m.""]}",{},https://beyondltd.ca/?utm_campaign=gmb,(778) 907-1541,"8W85+Q4 North Vancouver, British Columbia",402,4.900000,"{""1"":3,""2"":0,""3"":1,""4"":34,""5"":364}",49.316987,-123.092203,1945507568103603356,,,,https://lh3.googleusercontent.com/gps-cs-s/AHVAweoKPTlj9pKFOqpXSDNu6yje9tBIbbRoQarp5Hcm3RANrGhlJFCDCJeNT65YuPhFf9Fxppmc8uLE3HT8Jq7PITjRjhC0Sr8_UGxiRnjwi0o_QEld_7bIGnhJN8_5UTrzxBXQ-k8__I-o0vrC=w426-h240-k-no,America/Vancouver,,0x548671c559f8e20d:0x1affd4d350a63c9c,ChIJDeL4WcVxhlQRnDymUNPU_xo,"[{""title"":""All"",""image"":""https://lh3.googleusercontent.com/gps-cs-s/AHVAweoKPTlj9pKFOqpXSDNu6yje9tBIbbRoQarp5Hcm3RANrGhlJFCDCJeNT65YuPhFf9Fxppmc8uLE3HT8Jq7PITjRjhC0Sr8_UGxiRnjwi0o_QEld_7bIGnhJN8_5UTrzxBXQ-k8__I-o0vrC=w530-h298-k-no""},{""title"":""Exterior"",""image"":""https://lh3.googleusercontent.com/gps-cs-s/AHVAwer_0VJ0IgLLiEOTRk49ZBuYOoNcgef1v7Ur9euhIn-EHtopgtnVPV4a25_MMfp8C9GHVe3b9mqcez1fUFyIAJeeNiJ-JI-AM-RXzDgoaa78mcolZO3wu0Octcmyjjmk7E9rPEFaFg=w224-h298-k-no""},{""title"":""Videos"",""image"":""https://lh3.googleusercontent.com/gps-cs-s/AHVAweo1DZ4WQgSzs9Mcra7vwecxOOTqra3pHAZWJb1antEcf06ty6w4R6KOuWTOR5TqoOr3u-XhcckAZY2C4aRtxj_lR0aHNiIddrx9QN8N4o-MMDr61WPjDieuACQWlmZwCExji6zj1Q=w529-h298-k-no""},{""title"":""By owner"",""image"":""https://lh3.googleusercontent.com/gps-cs-s/AHVAwerV4twh2LX17iKl2oVfbYRCSBV5izjLgsvBFNt72lSs1wITYXHzPpjFgry8nX0R_GSBWvRkALHUK97Xaf-1rysYhNSstKu6FplPzh6Rwxth_xP_DBZZiBEimMN9-fXib5VOFapUFQ=w529-h298-k-no""},{""title"":""Street View \u0026 360°"",""image"":""https://streetviewpixels-pa.googleapis.com/v1/thumbnail?panoid=o1uBctP7deRkzjY2p0KJCg\u0026cb_client=maps_sv.tactile.gps\u0026w=224\u0026h=298\u0026yaw=35.899975\u0026pitch=0\u0026thumbfov=100""}]",null,null,"{""link"":"""",""source"":""""}","{""id"":""108331796480972933661"",""name"":""Beyond Landscaping (Owner)"",""link"":""https://www.google.com/maps/contrib/108331796480972933661""}","{""borough"":"""",""street"":""712 Copping St"",""city"":""North Vancouver"",""postal_code"":""V7M 3G3"",""state"":""British Columbia"",""country"":""CA""}","[{""id"":""service_options"",""name"":""Service options"",""options"":[{""name"":""Online estimates"",""enabled"":true},{""name"":""Onsite services"",""enabled"":true},{""name"":""Language assistance"",""enabled"":false}]},{""id"":""accessibility"",""name"":""Accessibility"",""options"":[{""name"":""Wheelchair accessible seating"",""enabled"":true},{""name"":""Wheelchair-accessible parking lot"",""enabled"":true},{""name"":""Wheelchair-accessible washroom"",""enabled"":true}]},{""id"":""amenities"",""name"":""Amenities"",""options"":[{""name"":""Gender-neutral washroom"",""enabled"":true}]},{""id"":""crowd"",""name"":""Crowd"",""options"":[{""name"":""LGBTQ+ friendly"",""enabled"":true},{""name"":""Transgender safe space"",""enabled"":true}]},{""id"":""parking"",""name"":""Parking"",""options"":[{""name"":""Free parking lot"",""enabled"":true},{""name"":""On-site parking"",""enabled"":true}]}]","[{""Name"":""Shogo Kobey"",""ProfilePicture"":""https://lh3.googleusercontent.com/a-/ALV-UjWqTaAQE8m9vhpVk4mbWpKHOIcvSHb8Pqn9YGyCvY3CR63fqK9gIQ=s120-c-rp-mo-ba4-br100"",""Rating"":5,""Description"":""They did a great job trimming our overgrown cedar hedge. Thank you to Jeff and Paudie for the excellent work, and also to Gavin and Grace for their prompt and clear communication. We are very satisfied and will definitely recommend this company to others."",""Images"":[""www.google.com/local/imagery/report/?cb_client=maps_sv.tactile\u0026image_key=!1e10!2sCIHM0ogKEICAgMDwscvW-gE\u0026fid=0x0:0x1affd4d350a63c9c""],""When"":""2025-3-26""},{""Name"":""Marta Hart"",""ProfilePicture"":""https://lh3.googleusercontent.com/a/ACg8ocIiusKHTG_fCTsXrnX40OZImOFrGh6Fqp0BE8SE3OAGj1iqhQ=s120-c-rp-mo-br100"",""Rating"":5,""Description"":""We have hired Beyond Landscaping for our annual garden maintenance and love the work they do. Gavin is efficient and thorough with his quote and came in competitively priced. Cassie sends follow-up emails  after each job to be sure I was pleased. The crews are knowledgeable, polite and professional, with a fine attention to detail. They communicate well, arrive on time and work quickly as a team."",""Images"":null,""When"":""""},{""Name"":""F B"",""ProfilePicture"":""https://lh3.googleusercontent.com/a-/ALV-UjUcSYsx_zQgmdaa_F49JuUs6dEJ7RU_nQ2ve34IjvduSvYwy7MI=s120-c-rp-mo-br100"",""Rating"":5,""Description"":""Max and Paula did an amazing job in my garden! They trimmed back all the blackberry bushes (which were very overgrown), cleaned up all the weeds, and pruned the fig trees beautifully. The garden looks so much better now. They worked hard, were very thorough, and I’m really happy with the results. I strongly recommend the company !"",""Images"":null,""When"":""""},{""Name"":""Karin Evans"",""ProfilePicture"":""https://lh3.googleusercontent.com/a/ACg8ocI1qGLiIawxSXERtRiu8iYBdkTXNXe004a9jJnpH6hPSytiDQ=s120-c-rp-mo-br100"",""Rating"":5,""Description"":""I use beyond landscaping twice a year for my spring and fall cleanup. As always, it felt like Christmas coming home to my perfectly clean garden beds, trees trimmed and the mountains of wet leaves gone. I am very impressed with the work done by Rein and Anastasiia. I am always impressed with the responsiveness of Cassie and Gavin. It is honestly the best money I spend given the peace of mind of coming home to a perfect yard."",""Images"":null,""When"":""""},{""Name"":""Nish Singh"",""ProfilePicture"":""https://lh3.googleusercontent.com/a/ACg8ocJorK4Z9HYIEZjwT1SBanIiDhn_gwxTrcmvZIZ_vwKpn8n1Mw=s120-c-rp-mo-br100"",""Rating"":5,""Description"":""My front yard was in rough shape when I bought the home. Before photo attached.\n\nAfter calling Beyond I was blown away at the transformation their team had on my yard. I am forever grateful and thanks for them I have a space to spend time with my energetic 7 year old son."",""Images"":[""www.google.com/local/imagery/report/?cb_client=maps_sv.tactile\u0026image_key=!1e10!2sCIHM0ogKEICAgICH58fONg\u0026fid=0x0:0x1affd4d350a63c9c""],""When"":""2024-9-9""},{""Name"":""Shabomi"",""ProfilePicture"":""https://lh3.googleusercontent.com/a/ACg8ocJrFMTB0SJhQdv_6yvr-c_7PcMV_XVVYfSRsMOgWzdHgvAXZg=s120-c-rp-mo-br100"",""Rating"":5,""Description"":""Fran and Lia arrived bright and early to clean up our overgrown front and back yards. They knew about all of the different varieties of shrubs, plants, flowers and yes - weeds and knew how best to deal with them. They listened to my concerns and to my wishes and did their best to make them all come true - advising me when one or two of my ideas really wasn’t so good. I appreciated that too. They are experts. I am not. I highly recommend this company whom we have used several times over the years, and this team of Fran and Lia. Many thanks!! joy and David"",""Images"":null,""When"":""""},{""Name"":""Alyssa Wells"",""ProfilePicture"":""https://lh3.googleusercontent.com/a/ACg8ocIokxdmgHTX6HQ8fBl1S3dZ90LF5q-tAqi9DhFMLJDbb-aBvA=s120-c-rp-mo-br100"",""Rating"":5,""Description"":""Fast and efficient from quote to completion! I couldn't be happier with my experience with Beyond Landscaping. Ben, Evan and Gavin were fantastic!"",""Images"":null,""When"":""""},{""Name"":""Elcia Clara Almeida"",""ProfilePicture"":""https://lh3.googleusercontent.com/a-/ALV-UjWmcgKiVDDxG0_fHkCCNcEAxynfaNP3WkJ-sz6fHnutk3sYtCHF=s120-c-rp-mo-br100"",""Rating"":5,""Description"":""Paudie and Paula were very proactive and did an excellent job trimming my cedar trees. They gave the trees a great shape and made them look amazing. They also cleaned everything up afterward, leaving my yard spotless. Highly recommend their work!"",""Images"":null,""When"":""""}]",null,
d70687ae-2e93-4bc8-b9a0-eca95d21fe38,https://www.google.com/maps/place/Remoda+Construction/data=!4m7!3m6!1s0x20f6d88834e968f1:0x69fac8b67995fbbd!8m2!3d49.3266756!4d-123.0941183!16s%2Fg%2F11vs98szlk!19sChIJ8WjpNIjY9iARvfuVebbI-mk?authuser=0&hl=en&rclk=1,Remoda Construction,Construction company,"808 19th St W, North Vancouver, BC V7P 1Z6","{""Friday"":[""9 a.m.–5 p.m.""],""Monday"":[""9 a.m.–5 p.m.""],""Saturday"":[""9 a.m.–5 p.m.""],""Sunday"":[""9 a.m.–5 p.m.""],""Thursday"":[""9 a.m.–5 p.m.""],""Tuesday"":[""9 a.m.–5 p.m.""],""Wednesday"":[""9 a.m.–5 p.m.""]}",{},,(778) 652-1555,"8WG4+M9 North Vancouver, British Columbia",2,5.000000,"{""1"":0,""2"":0,""3"":0,""4"":0,""5"":2}",49.326676,-123.094118,7636636804209572797,,,,https://lh3.googleusercontent.com/gps-cs-s/AHVAwepEGXl7QUwGdHWdOe-N1nt1IMCamqX90OXnHYzlR1rdRGUvxAB9UC0kVuzFJLajbF2Ukt0WRzlpn4T0UfQt5HbsW5xC4HXntG28el_XhVer-3z3tgKvAwSfMSfLhfwzvBYQhuFUNg=w408-h266-k-no,America/Vancouver,,0x20f6d88834e968f1:0x69fac8b67995fbbd,ChIJ8WjpNIjY9iARvfuVebbI-mk,"[{""title"":""All"",""image"":""https://lh3.googleusercontent.com/gps-cs-s/AHVAwepEGXl7QUwGdHWdOe-N1nt1IMCamqX90OXnHYzlR1rdRGUvxAB9UC0kVuzFJLajbF2Ukt0WRzlpn4T0UfQt5HbsW5xC4HXntG28el_XhVer-3z3tgKvAwSfMSfLhfwzvBYQhuFUNg=w457-h298-k-no""},{""title"":""Inside"",""image"":""https://lh3.googleusercontent.com/gps-cs-s/AHVAwercEzzhLw8_ocVRN3G9X4dzx4na_VHPisqeDXAC4wlq7K0wRUaJMO-_EnVDmoXfC1ZiT7h1gjI5MQdsOVikozp-KjBzY5GPs9nidGzsnDz-iOGfjtCc8_wxPvhq4q6uFaieqoU-eQ=w447-h298-k-no""},{""title"":""By owner"",""image"":""https://lh3.googleusercontent.com/gps-cs-s/AHVAweoDD78VFhPuTLAPlyeTfPcC1Tjwh2aQ1tpxWIGtrZeAPUiIXt2zozD9g14CF0bRar8B95tFkRDTK5hAsbHLJpDo5bcQKUVOZZ86WYuoN1et2iz6bDuL5bZvhcT4ThgENuQp5eC8=w413-h298-k-no""},{""title"":""Street View \u0026 360°"",""image"":""https://streetviewpixels-pa.googleapis.com/v1/thumbnail?panoid=vKwSPhOyyaYNsAILMMFy1w\u0026cb_client=maps_sv.tactile.gps\u0026w=224\u0026h=298\u0026yaw=354.34058\u0026pitch=0\u0026thumbfov=100""}]",null,null,"{""link"":"""",""source"":""""}","{""id"":""114863968563297050447"",""name"":""Remoda Construction (Owner)"",""link"":""https://www.google.com/maps/contrib/114863968563297050447""}","{""borough"":"""",""street"":""808 19th St W"",""city"":""North Vancouver"",""postal_code"":""V7P 1Z6"",""state"":""British Columbia"",""country"":""CA""}","[{""id"":""service_options"",""name"":""Service options"",""options"":[{""name"":""Online estimates"",""enabled"":true},{""name"":""Language assistance"",""enabled"":false}]}]","[{""Name"":""Dallas Gilray"",""ProfilePicture"":""https://lh3.googleusercontent.com/a/ACg8ocKSzl8bUYea1iSF8URh3CzgrCNY4tq-HdLRkiO-4FqLXVzfjQ=s120-c-rp-mo-br100"",""Rating"":5,""Description"":""Remoda made my bathroom remodel a breeze! Great people to work with and amazing finished product."",""Images"":null,""When"":""""},{""Name"":""Lance Prahalad"",""ProfilePicture"":""https://lh3.googleusercontent.com/a/ACg8ocIjw-8UYu_gB1qGAtrSQWkEjoXFr8CFbESGLtCNh_WHAafTJQ=s120-c-rp-mo-br100"",""Rating"":5,""Description"":""Great craftsmanship and done quickly , highly recommend this company!"",""Images"":null,""When"":""""}]",null,
