input_id,link,title,category,address,open_hours,popular_times,website,phone,plus_code,review_count,review_rating,reviews_per_rating,latitude,longitude,cid,status,descriptions,reviews_link,thumbnail,timezone,price_range,data_id,place_id,images,reservations,order_online,menu,owner,complete_address,about,user_reviews,user_reviews_extended,emails
2fd3d115-6db8-4e9d-84d7-88ecad1b679d,https://www.google.com/maps/place/Nanaimo+Seamless/data=!4m7!3m6!1s0x5488a22c1a0019ad:0x99b4abb5b3e1f8d9!8m2!3d49.1880591!4d-123.9818696!16s%2Fg%2F1tf86sgk!19sChIJrRkAGiyiiFQR2fjhs7WrtJk?authuser=0&hl=en&rclk=1,Nanaimo Seamless,Gutter Cleaning Service,"1839 Meredith Rd, Nanaimo, BC V9S 2M6",{},{},http://www.nanaimoseamless.com/,(250) 758-0767,"52Q9+67 Nanaimo, British Columbia",13,4.400000,"{""1"":2,""2"":0,""3"":0,""4"":0,""5"":11}",49.188059,-123.981870,11075666180506253529,,,,https://lh3.googleusercontent.com/gps-cs-s/AHVAwepBOh-ViQ_NFPf2i4hIfmpyp_L1KcnGMqlF5vaHoPaIDLMsgZ_YGt8jDlIbNDC8BAzPQ1Ahg-zRMXhxmdi7Cg3U1pt7Npm2k-AX4AVBO2viB6TPKDO_T3wfqhglY_wU-uIKV9ya=w426-h240-k-no,America/Vancouver,,0x5488a22c1a0019ad:0x99b4abb5b3e1f8d9,ChIJrRkAGiyiiFQR2fjhs7WrtJk,"[{""title"":""All"",""image"":""https://lh3.googleusercontent.com/gps-cs-s/AHVAwepBOh-ViQ_NFPf2i4hIfmpyp_L1KcnGMqlF5vaHoPaIDLMsgZ_YGt8jDlIbNDC8BAzPQ1Ahg-zRMXhxmdi7Cg3U1pt7Npm2k-AX4AVBO2viB6TPKDO_T3wfqhglY_wU-uIKV9ya=w529-h298-k-no""},{""title"":""Street View \u0026 360°"",""image"":""https://streetviewpixels-pa.googleapis.com/v1/thumbnail?panoid=quEndwsiJ1AuoVPVST7N0w\u0026cb_client=maps_sv.tactile.gps\u0026w=224\u0026h=298\u0026yaw=180.45493\u0026pitch=0\u0026thumbfov=100""}]",null,null,"{""link"":"""",""source"":""""}","{""id"":""100220451752341745818"",""name"":""Nanaimo Seamless (Owner)"",""link"":""https://www.google.com/maps/contrib/100220451752341745818""}","{""borough"":"""",""street"":""1839 Meredith Rd"",""city"":""Nanaimo"",""postal_code"":""V9S 2M6"",""state"":""British Columbia"",""country"":""CA""}",null,"[{""Name"":""Ambre Music"",""ProfilePicture"":""https://lh3.googleusercontent.com/a-/ALV-UjWjBQ_wZ4RmSx-NYLT9AOK8pHO0KXBELzMI9VTRbuQM-DZeTe6b=s120-c-rp-mo-ba3-br100"",""Rating"":5,""Description"":""They do my gutters every October with friendliness and care!  Old school trades attitude where they actually care and do quality work and don’t overcharge you.  They also added a spout for me as the spout was on the high side of gutter (!?)  so now it drains properly/no pooling on the low side.  Thank you Larry and team you guys are the best!!!"",""Images"":null,""When"":""""},{""Name"":""Steve Hall"",""ProfilePicture"":""https://lh3.googleusercontent.com/a/ACg8ocLVR6BP4sOiRgxPqZtUt1Qix-rTzqKp4GYDq6c9CHW1JgapsA=s120-c-rp-mo-br100"",""Rating"":5,""Description"":""Very quick to respond for a quote and great communication.  They did a great job of removing old and installing new gutters and downspout on my home.  Highly recommend."",""Images"":null,""When"":""""},{""Name"":""Chang Lin"",""ProfilePicture"":""https://lh3.googleusercontent.com/a/ACg8ocIKeyRDHn4PEO2_4oTOnI3GYqmGei_HZJF7sAaYygfjCOzPSw=s120-c-rp-mo-br100"",""Rating"":1,""Description"":""I have made an appointment since last Oct with them for the gutter cleaning service. Every time they would guarantee they will do “the end of next week” but when the time comes, they said “I do apologize and I have many things to do”. Now is almost Feb. I totally understand life is hard, but if you cannot perform our appointment, please let your customers know and they can make another plan."",""Images"":null,""When"":""""},{""Name"":""cheryl Johnson (ladylacasse)"",""ProfilePicture"":""https://lh3.googleusercontent.com/a/ACg8ocLCX3vZIa3fqM0TFZC7Ij-Pibbks0xjqsxgrWISSjWOj4Lk4-wo=s120-c-rp-mo-ba4-br100"",""Rating"":5,""Description"":""I Had Nanaimo Seamless install Gutters on my brand new mobile home,This company did an outstanding job! And the Price can't be beat!\nQuality,professionalism, fast friendly service.Is what we recieved.\nThank-You\nHIGHLY HIGHLY RECOMEND!!"",""Images"":null,""When"":""""},{""Name"":""David Schadt"",""ProfilePicture"":""https://lh3.googleusercontent.com/a-/ALV-UjXSIEPlr5OJp1lYixIQ_tdeYu4t5UD_PmjP6x5hzbWqnt-CCxY=s120-c-rp-mo-ba2-br100"",""Rating"":5,""Description"":""Very high response and quality. Really enjoyed having them do my gutters."",""Images"":[""www.google.com/local/imagery/report/?cb_client=maps_sv.tactile\u0026image_key=!1e10!2sCIHM0ogKEICAgID4h-KvWA\u0026fid=0x0:0x99b4abb5b3e1f8d9""],""When"":""2019-4-6""},{""Name"":""daniel fel"",""ProfilePicture"":""https://lh3.googleusercontent.com/a-/ALV-UjUjmIJgbCxj8fAycNxa27fukd8F9gFl7SKrJQtAu6lhryLrmDps=s120-c-rp-mo-ba4-br100"",""Rating"":5,""Description"":""Super fast response, very fair pricing, very friendly service. Had gutter repair completed and was very happy using this company. Will absolutely use again the future when needed!"",""Images"":null,""When"":""""},{""Name"":""Criss Smith"",""ProfilePicture"":""https://lh3.googleusercontent.com/a/ACg8ocLApe2PqOEGRvbyz_O3_ksxCnacyWa6x_GWTKObPG1wOKBVtw=s120-c-rp-mo-br100"",""Rating"":5,""Description"":""Larry has been around for lots of years he prides him self in his work and dose a job that can’t be beat buy anyone else workmanship and price he’s a very honest super nice guy and I’m glad to have met him and have work done buy him 5 star ⭐️ review for this guy"",""Images"":null,""When"":""""},{""Name"":""Sina Radmard"",""ProfilePicture"":""https://lh3.googleusercontent.com/a/ACg8ocItB8Y6WymcJ6S8-2pD-0eeEqSDJWVuoG0Z0YmETGMhgEiAjA=s120-c-rp-mo-ba3-br100"",""Rating"":5,""Description"":""They did a great job in putting new gutter and downspout on my roof with the most decent price out there."",""Images"":null,""When"":""""}]",null,
2fd3d115-6db8-4e9d-84d7-88ecad1b679d,https://www.google.com/maps/place/PRIMO+Exterior+Cleaning/data=!4m7!3m6!1s0x5488a3503a1b4a8d:0xd0e1fec14003f161!8m2!3d49.1897055!4d-123.9760135!16s%2Fg%2F11kj90b1w2!19sChIJjUobOlCjiFQRYfEDQMH-4dA?authuser=0&hl=en&rclk=1,PRIMO Exterior Cleaning,Pressure washing service,"2149 Duggan Rd, Nanaimo, BC V9S 5N9","{""Friday"":[""8 a.m.–6 p.m.""],""Monday"":[""8 a.m.–6 p.m.""],""Saturday"":[""Closed""],""Sunday"":[""Closed""],""Thursday"":[""8 a.m.–6 p.m.""],""Tuesday"":[""8 a.m.–6 p.m.""],""Wednesday"":[""8 a.m.–6 p.m.""]}",{},http://www.primocleaning.ca/,(250) 740-1564,"52QF+VH Nanaimo, British Columbia",31,5.000000,"{""1"":0,""2"":0,""3"":0,""4"":1,""5"":30}",49.189705,-123.976013,15051591535605051745,,,,https://lh3.googleusercontent.com/gps-cs-s/AHVAwepVjOQjQydLkE7IEKdLK64nu2EPguX_oEpykdiLcjz87KdGioPT-rU693VbM17ZaHuo4Hogqk2PJxyNXIE7hrBce548OqVjjWVwo_gvuLdWwpjefJQcZFsuNuZbzJMCXuCJLCYk=w408-h306-k-no,America/Vancouver,,0x5488a3503a1b4a8d:0xd0e1fec14003f161,ChIJjUobOlCjiFQRYfEDQMH-4dA,"[{""title"":""All"",""image"":""https://lh3.googleusercontent.com/gps-cs-s/AHVAwepVjOQjQydLkE7IEKdLK64nu2EPguX_oEpykdiLcjz87KdGioPT-rU693VbM17ZaHuo4Hogqk2PJxyNXIE7hrBce548OqVjjWVwo_gvuLdWwpjefJQcZFsuNuZbzJMCXuCJLCYk=w397-h298-k-no""},{""title"":""Latest"",""image"":""https://lh3.googleusercontent.com/gps-cs-s/AHVAweq32TRiPQBsRmicGzJbj-MGATzPmkTszKk3c6eYHBIeUV9iPbNwe4YLM8zosMN4XIq0ai2ywSUGkYtxB6dq5oKtUHWNVkVHIKrCpeZvWhdc56IniP0ztmd9Ic8LEsIbLHT-JNCq0hPHZXdG=w298-h298-k-no""},{""title"":""Exterior"",""image"":""https://lh3.googleusercontent.com/gps-cs-s/AHVAwep_kTMxGhLER_jDfYEYULj9I8c06XV1c2XC9hCnhk35GzSm6F6K5r66yYc9m_StnfhhQ5BmN5O_ZyJrA9qzZil8bbw_dyeyH0qsAJGNG6KVnDgi0YYRdPOED9eqJzpndyQY2YrQDA=w397-h298-k-no""},{""title"":""Inside"",""image"":""https://lh3.googleusercontent.com/gps-cs-s/AHVAweqmsFZhqDm6r5FOAkWvQMuz7-9g451jHaTV1qQLPECGAGs7AwNfcN4d1KrUFL5QMggHVFP_z_xWbtP7pAJY0aJnKvA2Q8HtWF7Qcj3xuM1aFp3N6h-4GpOVM-CacMwAb75KFWE=w397-h298-k-no""},{""title"":""By owner"",""image"":""https://lh3.googleusercontent.com/gps-cs-s/AHVAweqcB6beF77TNqKCSdBACXUz77h6tvX06DKfveh9xRi4kaUomh9P9s0ENoii30yjU_vPwgbTyqsqeYvMZlPFib7xgopl4Oc7tnITS0TFQhahWK1TuNHyuVNSGMC1bZZqIgCExUQDnr9ZoVlM=w397-h298-k-no""},{""title"":""Street View \u0026 360°"",""image"":""https://streetviewpixels-pa.googleapis.com/v1/thumbnail?panoid=JUjiD7jX_C4CZT2XjY2ERg\u0026cb_client=maps_sv.tactile.gps\u0026w=224\u0026h=298\u0026yaw=274.05957\u0026pitch=0\u0026thumbfov=100""}]",null,null,"{""link"":"""",""source"":""""}","{""id"":""108026195581684491724"",""name"":""PRIMO Exterior Cleaning (Owner)"",""link"":""https://www.google.com/maps/contrib/108026195581684491724""}","{""borough"":"""",""street"":""2149 Duggan Rd"",""city"":""Nanaimo"",""postal_code"":""V9S 5N9"",""state"":""British Columbia"",""country"":""CA""}",null,"[{""Name"":""Judy Dunbar"",""ProfilePicture"":""https://lh3.googleusercontent.com/a/ACg8ocKEX17ohYPg3FTNmUtXTrDXLhp7OL2aNBj1DvoI8sxgyqg8wQ=s120-c-rp-mo-br100"",""Rating"":5,""Description"":""Joel is very personable and offers  reasonable pricing . Accommodates whatever your needs are.  We were thoroughly pleased with his work. We have had him to our house twice this past year. Once to power wash the front  of our house that retained 7 yrs worth of pollen that stained the wood  and then we had Joel clean the gutters . He even went above and beyond and  removed debris from the skylight over our kitchen that had collected and was pooled with water and dripping into our kitchen ceiling and leaking onto  the kitchen floor . He did this with no extra cost. We appreciate his hard work and understanding that elderly people are unable to do this maintenance to keep up their homes .\nThanks Joel"",""Images"":null,""When"":""""},{""Name"":""Rosemary Quinlan"",""ProfilePicture"":""https://lh3.googleusercontent.com/a-/ALV-UjVYebB8LfYsb-N4EfbIjUmojGlNIGznb8GPgxA3Oy77R8TnjXc=s120-c-rp-mo-br100"",""Rating"":5,""Description"":""Primo Exterior Cleaning did an excellent job on our roof. There was quite a bit of moss and it looks like new, even passing insurance coverage and it is over 25 years old. Joel was very informed and professional and addressed all our concerns. I would definitely call him again..also the price was reasonable for the work that was done."",""Images"":[""www.google.com/local/imagery/report/?cb_client=maps_sv.tactile\u0026image_key=!1e10!2sCIHM0ogKEICAgIDzvcDb7AE\u0026fid=0x0:0xd0e1fec14003f161""],""When"":""2024-6-11""},{""Name"":""Stacy Elliott"",""ProfilePicture"":""https://lh3.googleusercontent.com/a/ACg8ocJsgC0btGzsQSmjC85PVZMm4B6sIkg69bdl2bwXGc2dQ9KR6Q=s120-c-rp-mo-br100"",""Rating"":5,""Description"":""Joel was fast , efficient and made my place look like new! Best of all he was honest and kept in touch with me regarding problems he encountered. Very professional thanks!"",""Images"":null,""When"":""""},{""Name"":""Kevin Crowley"",""ProfilePicture"":""https://lh3.googleusercontent.com/a/ACg8ocJJn6hsJBxV1MM4a57ISfLIneOnbijMBkN97wSh5Up2_nJb7g=s120-c-rp-mo-br100"",""Rating"":5,""Description"":""Joel at Primo Exterior Cleaning did a fantastic job on our metal roof. Very professional, thorough and hard working. Would highly recommend him."",""Images"":[""www.google.com/local/imagery/report/?cb_client=maps_sv.tactile\u0026image_key=!1e10!2sCIABIhBwdrHfgPhaId579RjFK9tB\u0026fid=0x0:0xd0e1fec14003f161""],""When"":""2025-6-23""},{""Name"":""Max Sudik"",""ProfilePicture"":""https://lh3.googleusercontent.com/a-/ALV-UjVUC_FCtjjBv7jeAWgGkdk0tmpaCCm9JEeHYaRfuv3lLRzQaiDBbQ=s120-c-rp-mo-ba2-br100"",""Rating"":5,""Description"":""I like the speed the job was done.\nCalled them, next day in the morning the gutters were cleaned. Compared to a lot of other services, that didn't even pickup the phone when I called, this one was very responsive, reasonable price and fast execution.\nAs extra, the person cleaned gutters on the garage as a complementary service!\nI was very impressed.\n\nThank you Joel"",""Images"":[""www.google.com/local/imagery/report/?cb_client=maps_sv.tactile\u0026image_key=!1e10!2sCIHM0ogKEICAgIDvvum0SA\u0026fid=0x0:0xd0e1fec14003f161""],""When"":""2024-12-20""},{""Name"":""Catherine Woodward"",""ProfilePicture"":""https://lh3.googleusercontent.com/a/ACg8ocJL6OppaJtnb5_eP_uUdXp4UkbyWO4Yl3EzoUMditJoCespcw=s120-c-rp-mo-br100"",""Rating"":5,""Description"":""Joel did a wonderful job of cleaning the gutters and roof of a very high cottage/studio on my property. Fast, efficient and friendly. Much gratitude for a job well done."",""Images"":null,""When"":""""},{""Name"":""Doug Worden"",""ProfilePicture"":""https://lh3.googleusercontent.com/a/ACg8ocJPW_WGVy8uzJt4799pldPspK2SFZraFAfKALEq0V2u2fDKeA=s120-c-rp-mo-br100"",""Rating"":5,""Description"":""Highly recommended.  On time and on budget, Joel did a great job of roof and gutter cleaning.  Will get him for further cleaning for sure."",""Images"":null,""When"":""""},{""Name"":""Vic Araujo"",""ProfilePicture"":""https://lh3.googleusercontent.com/a-/ALV-UjViNoCnKxq_6ba6JFTITuTQ3hYYxPmbQKzOLJ4dmNx5mwHPADw=s120-c-rp-mo-ba4-br100"",""Rating"":5,""Description"":""Joel is a true professional! He is punctual, explains the nature and scope of his work clearly and gets to the job right away. He takes great effort in keeping the premises clean when he is finished, and is very thorough with the task to be done. I have nothing but high praise for him. Thanks for a job well done!"",""Images"":null,""When"":""""}]",null,
2fd3d115-6db8-4e9d-84d7-88ecad1b679d,https://www.google.com/maps/place/Rising+Tide+Gutters/data=!4m7!3m6!1s0x5488a55bedd24401:0x2f88b7ca4c215ebd!8m2!3d49.0831079!4d-123.8879134!16s%2Fg%2F11y32lc3c4!19sChIJAUTS7VuliFQRvV4hTMq3iC8?authuser=0&hl=en&rclk=1,Rising Tide Gutters,Construction company,"2510 S Wellington Rd, Nanaimo, BC V9X 1S5","{""Friday"":[""7:30 a.m.–4:30 p.m.""],""Monday"":[""7:30 a.m.–6 p.m.""],""Saturday"":[""9 a.m.–5 p.m.""],""Sunday"":[""10 a.m.–2 p.m.""],""Thursday"":[""7:30 a.m.–6 p.m.""],""Tuesday"":[""7:30 a.m.–6 p.m.""],""Wednesday"":[""7:30 a.m.–6 p.m.""]}",{},https://risingtidegutters.com/,(250) 713-8939,"34M6+6R Nanaimo, British Columbia",8,5.000000,"{""1"":0,""2"":0,""3"":0,""4"":0,""5"":8}",49.083108,-123.887913,3425189596103794365,,,,https://streetviewpixels-pa.googleapis.com/v1/thumbnail?panoid=h9NVHxfMYqa6cT3S5bJynw&cb_client=search.gws-prod.gps&w=408&h=240&yaw=67.5899&pitch=0&thumbfov=100,America/Vancouver,,0x5488a55bedd24401:0x2f88b7ca4c215ebd,ChIJAUTS7VuliFQRvV4hTMq3iC8,"[{""title"":""All"",""image"":""https://streetviewpixels-pa.googleapis.com/v1/thumbnail?panoid=h9NVHxfMYqa6cT3S5bJynw\u0026cb_client=maps_sv.tactile.gps\u0026w=224\u0026h=298\u0026yaw=67.5899\u0026pitch=0\u0026thumbfov=100""},{""title"":""By owner"",""image"":""https://lh3.googleusercontent.com/gps-cs-s/AHVAwerTJR-rCBl0KZem0uBpU6HVBjRIGExpiKqxgWcSCAAL5u5rwpCGP1qQQsDLGyvsJNgKXTnf_q2j3JyOb8jwWtXGarEObNtuuoyCvQfS2TxhymIaecPX8evPyIh7fnQ07z46h-W0=w224-h298-k-no""},{""title"":""Street View \u0026 360°"",""image"":""https://streetviewpixels-pa.googleapis.com/v1/thumbnail?panoid=h9NVHxfMYqa6cT3S5bJynw\u0026cb_client=maps_sv.tactile.gps\u0026w=224\u0026h=298\u0026yaw=67.5899\u0026pitch=0\u0026thumbfov=100""}]",null,null,"{""link"":"""",""source"":""""}","{""id"":""100232807852986675161"",""name"":""Rising Tide Gutters (Owner)"",""link"":""https://www.google.com/maps/contrib/100232807852986675161""}","{""borough"":"""",""street"":""2510 S Wellington Rd"",""city"":""Nanaimo"",""postal_code"":""V9X 1S5"",""state"":""British Columbia"",""country"":""CA""}","[{""id"":""service_options"",""name"":""Service options"",""options"":[{""name"":""Onsite services"",""enabled"":true},{""name"":""Language assistance"",""enabled"":false}]}]","[{""Name"":""Alix Wadeson"",""ProfilePicture"":""https://lh3.googleusercontent.com/a/ACg8ocLPgbd3dHmNicKU6S7EUhaqRCjnxFTmP-mxH5e_TY9uOufMQg=s120-c-rp-mo-br100"",""Rating"":5,""Description"":""I had a great experience with Rising Tides Gutters. Geordie handled a project and several tasks at my home over the past month at short notice and provided efficient, high-quality work as well as being very responsive and helpful - above and beyond.  I highly recommend Geordie and his team and will definitely be using their services again for any of my home repair, maintenance and renovation needs. Thank you!"",""Images"":null,""When"":""""},{""Name"":""Shaun McKenzie"",""ProfilePicture"":""https://lh3.googleusercontent.com/a-/ALV-UjUdEgBwXCkYx5o-bFpB5j8d4sDuTGS5dxQwwW4_7FtDOVzFptQ=s120-c-rp-mo-br100"",""Rating"":5,""Description"":""Fast, friendly, efficient and on quote! The new gutters look amazing. Highly recommend Geordie and crew."",""Images"":null,""When"":""""},{""Name"":""Tony Domovich"",""ProfilePicture"":""https://lh3.googleusercontent.com/a-/ALV-UjVJLyRtgRIy0NH-dNCFdtFOu3y1UergIPdOpY2Y7JJjvlWP76AOXQ=s120-c-rp-mo-br100"",""Rating"":5,""Description"":""Great job done on time and on budget!"",""Images"":null,""When"":""""},{""Name"":""Thomas Dance"",""ProfilePicture"":""https://lh3.googleusercontent.com/a/ACg8ocI467PS6d8zpIqQORABuSngHVaK5JaNdWihw2HM-HwpaO88Cw=s120-c-rp-mo-br100"",""Rating"":5,""Description"":""Outstanding locally owned business to work with, very professional and great at what they do."",""Images"":null,""When"":""""},{""Name"":""Wayne Recker"",""ProfilePicture"":""https://lh3.googleusercontent.com/a/ACg8ocL44oPYLwACtHvm6ymdgCfm89YdRVOpqKA5G0YQUzhlNhKyeQ=s120-c-rp-mo-br100"",""Rating"":5,""Description"":""Great service One day all gutters were changed. Fast efficient."",""Images"":null,""When"":""""},{""Name"":""Pam Ahl"",""ProfilePicture"":""https://lh3.googleusercontent.com/a-/ALV-UjV5nF8mwcwjofY7bj5fO92-0rNwNsJ5T68_l_AkI_lJjoTZrKtj=s120-c-rp-mo-br100"",""Rating"":5,""Description"":""Always quick to respond, and does excellent work!"",""Images"":null,""When"":""""},{""Name"":""shannon dubroy"",""ProfilePicture"":""https://lh3.googleusercontent.com/a-/ALV-UjWHvhp7wUvu03Vf3Y3aT4mmom5Xf7pNfyCnoJY8aXN77DJs59Y=s120-c-rp-mo-br100"",""Rating"":5,""Description"":""Efficient, good, work!"",""Images"":null,""When"":""""},{""Name"":""Michael Flaviani"",""ProfilePicture"":""https://lh3.googleusercontent.com/a/ACg8ocK_zJ7MmIPJJfjmbRZW9kQDhfbM9CwciFWuDzsOKIz0yXdmCA=s120-c-rp-mo-br100"",""Rating"":5,""Description"":"""",""Images"":null,""When"":""""}]",null,
2fd3d115-6db8-4e9d-84d7-88ecad1b679d,https://www.google.com/maps/place/Home+Saver+Depot/data=!4m7!3m6!1s0x5488a3a6e0bdd3b3:0xa7d4768c8e68237a!8m2!3d49.1618493!4d-123.93845!16s%2Fg%2F11xcwr8pv3!19sChIJs9O94KajiFQReiNojox21Kc?authuser=0&hl=en&rclk=1,Home Saver Depot,Home improvement store,"451 Albert St, Nanaimo, BC V9R 2V9","{""Friday"":[""9 a.m.–5 p.m.""],""Monday"":[""9 a.m.–5 p.m.""],""Saturday"":[""9:30 a.m.–4 p.m.""],""Sunday"":[""Closed""],""Thursday"":[""9 a.m.–5 p.m.""],""Tuesday"":[""9 a.m.–5 p.m.""],""Wednesday"":[""9 a.m.–5 p.m.""]}",{},http://www.homesaverdepot.ca/,(250) 714-1494,"5366+PJ Nanaimo, British Columbia",12,4.800000,"{""1"":0,""2"":1,""3"":0,""4"":0,""5"":11}",49.161849,-123.938450,12093421245453312890,,,,https://lh3.googleusercontent.com/gps-cs-s/AHVAwepECl1g4PaHuKs3v1OVN1v7s0_baw6jQTpiK41m5k6RuMrzM1QM70_aTGXPiRkmmI0AOWmr9VQPE1OfjYum5L6ZeMtgZGgnRzqj5nBcVXzqmJrekLIr25CQTfSuDl56fM0eycqsSD0uZnoq=w408-h306-k-no,America/Vancouver,,0x5488a3a6e0bdd3b3:0xa7d4768c8e68237a,ChIJs9O94KajiFQReiNojox21Kc,"[{""title"":""All"",""image"":""https://lh3.googleusercontent.com/gps-cs-s/AHVAwepECl1g4PaHuKs3v1OVN1v7s0_baw6jQTpiK41m5k6RuMrzM1QM70_aTGXPiRkmmI0AOWmr9VQPE1OfjYum5L6ZeMtgZGgnRzqj5nBcVXzqmJrekLIr25CQTfSuDl56fM0eycqsSD0uZnoq=w397-h298-k-no""},{""title"":""Inside"",""image"":""https://lh3.googleusercontent.com/gps-cs-s/AHVAwepxUwrGqwkLhXe9gtOpLxf9_vWZn44W5elluUHk6gXKdRL2PSouaefS8Zf8MClJz4LDL22i1P-xA3Jf5u4KoAWClHPQXhyAl4umjQ_KdkxWUJbhvv_ZNnE-rvRBhz_-Ckp2ZXE3DIeVXMfF=w397-h298-k-no""},{""title"":""By owner"",""image"":""https://lh3.googleusercontent.com/gps-cs-s/AHVAwepXdPNEBnvB9vJkXseYvuYBPB3ywPODbMDvgQNlW9P45rHSyi-UPeNPMyDjQUw_6L6H_1XZW9CCdyaGt1RlovIEsKJjONJRq2k-4-1Djn08j-8EPwxRjS4KKc6r3nhlAFVMcrUERrTYqFaU=w397-h298-k-no""},{""title"":""Street View \u0026 360°"",""image"":""https://streetviewpixels-pa.googleapis.com/v1/thumbnail?panoid=-BTAlzQgSNPE14UUDBXXTg\u0026cb_client=maps_sv.tactile.gps\u0026w=224\u0026h=298\u0026yaw=112.78896\u0026pitch=0\u0026thumbfov=100""}]",null,null,"{""link"":"""",""source"":""""}","{""id"":""100744750823297645184"",""name"":""Home Saver Depot (Owner)"",""link"":""https://www.google.com/maps/contrib/100744750823297645184""}","{""borough"":"""",""street"":""451 Albert St"",""city"":""Nanaimo"",""postal_code"":""V9R 2V9"",""state"":""British Columbia"",""country"":""CA""}","[{""id"":""service_options"",""name"":""Service options"",""options"":[{""name"":""Curbside pickup"",""enabled"":true},{""name"":""Delivery"",""enabled"":true},{""name"":""In-store pickup"",""enabled"":true},{""name"":""In-store shopping"",""enabled"":true},{""name"":""Onsite services"",""enabled"":true}]},{""id"":""accessibility"",""name"":""Accessibility"",""options"":[{""name"":""Wheelchair accessible seating"",""enabled"":true},{""name"":""Wheelchair-accessible entrance"",""enabled"":true},{""name"":""Wheelchair-accessible parking lot"",""enabled"":true},{""name"":""Wheelchair-accessible washroom"",""enabled"":true}]},{""id"":""amenities"",""name"":""Amenities"",""options"":[{""name"":""Gender-neutral washroom"",""enabled"":true}]},{""id"":""crowd"",""name"":""Crowd"",""options"":[{""name"":""LGBTQ+ friendly"",""enabled"":true},{""name"":""Transgender safe space"",""enabled"":true}]},{""id"":""planning"",""name"":""Planning"",""options"":[{""name"":""Quick visit"",""enabled"":true}]},{""id"":""payments"",""name"":""Payments"",""options"":[{""name"":""Checks"",""enabled"":true},{""name"":""Credit cards"",""enabled"":true},{""name"":""Debit cards"",""enabled"":true},{""name"":""Credit cards"",""enabled"":false}]},{""id"":""parking"",""name"":""Parking"",""options"":[{""name"":""Free parking lot"",""enabled"":true},{""name"":""Free street parking"",""enabled"":true},{""name"":""On-site parking"",""enabled"":true}]}]","[{""Name"":""maj mohajer"",""ProfilePicture"":""https://lh3.googleusercontent.com/a-/ALV-UjUXAV5fqZPtXVWUFkQJxj_uqKWzPjYOZWEIGjugx0D-Iiu9Q8bUug=s120-c-rp-mo-br100"",""Rating"":5,""Description"":""I got my cabinets from here and absolutely loved them! The quality is excellent, the design is beautiful, and the prices are very reasonable. They’re new in town but already offer a great selection of tiles and other building materials. Definitely worth checking out 😎 highly recommended! ✌🏻"",""Images"":[""www.google.com/local/imagery/report/?cb_client=maps_sv.tactile\u0026image_key=!1e10!2sCIABIhCGSFh6uc3JWsipI_ozJhnm\u0026fid=0x0:0xa7d4768c8e68237a""],""When"":""2025-7-3""},{""Name"":""Ron Mikhail"",""ProfilePicture"":""https://lh3.googleusercontent.com/a-/ALV-UjWOY-5rr6TKs3tTskgIHmg1yz8Wo9hWkJ2-ajAQSRMejnuW_P4=s120-c-rp-mo-ba3-br100"",""Rating"":5,""Description"":""Great store. Friendly/helpful staff.\nGreat value on great materials and tools."",""Images"":null,""When"":""""},{""Name"":""Tanis Ridout"",""ProfilePicture"":""https://lh3.googleusercontent.com/a-/ALV-UjUYSY9VFeKUIE4_c8z9m4l9WnQmLiajQpvFMpx2-Y6qxNIc9JeHFg=s120-c-rp-mo-ba3-br100"",""Rating"":2,""Description"":""I live in the area and was happy to see a hardware store opened up. The google reviews say keys can be cut here: that is incorrect.\nA fellow customer helped me find the item I was looking for as the gentleman operating the checkout seemed frazzled.\nI understand it's a new business and I will try them out again, but my first experience wasn't good."",""Images"":null,""When"":""""},{""Name"":""Hossein Yaghini"",""ProfilePicture"":""https://lh3.googleusercontent.com/a-/ALV-UjUF5TxYL67BLx-6RNAutxRcLz_wB5wwruH_E4-IiUKRNVQ9wuDa=s120-c-rp-mo-br100"",""Rating"":5,""Description"":""Really love this place! Prices are awesome, and it’s great to finally have a store like this around here. I got tiles for the bathroom, some vinyl flooring, and a vanity — everything’s good quality and the service was great too."",""Images"":null,""When"":""""},{""Name"":""Brian Cross"",""ProfilePicture"":""https://lh3.googleusercontent.com/a-/ALV-UjVTpsEnSrRosoN7jbGUf5fJwT2uBCbGOsklfbMN9U2Jka6a5lbVuA=s120-c-rp-mo-ba4-br100"",""Rating"":5,""Description"":""Friendly service, Good prices, flooring, cabinet and countertop seems to be there specialty...they also rent U-Haul."",""Images"":null,""When"":""""},{""Name"":""Poorya Bayani"",""ProfilePicture"":""https://lh3.googleusercontent.com/a/ACg8ocIg5BkYtb8B0gUt9tQqwNjDK4h9InzbppT0LS6FUF9NxjPVeQ=s120-c-rp-mo-br100"",""Rating"":5,""Description"":""I was just looking for some tiles but ended up buying everything needed for a full Bathroom and kitchen reno! I was surprised by their complete selection and unbelievable prices.\n\nGreat selection, amazing quality and unbelievable prices! top that with great costumer service and on time delivery and I couldn't possibly ask for more! This is my new favorite store in town and would definitely do business again!"",""Images"":null,""When"":""""},{""Name"":""Randy Collins"",""ProfilePicture"":""https://lh3.googleusercontent.com/a-/ALV-UjXT0UMkqrooeioPXAT0RB3jlwKZ0ZdtN32gTD0Q9OB0YLxGk1r3hQ=s120-c-rp-mo-br100"",""Rating"":5,""Description"":""Mo was super helpful and the prices were good. One recommendation: Get some spray paint in stock 🤙"",""Images"":[""www.google.com/local/imagery/report/?cb_client=maps_sv.tactile\u0026image_key=!1e10!2sCIABIhCjnhKK1fzWgkAkiYYoUCTR\u0026fid=0x0:0xa7d4768c8e68237a""],""When"":""2025-8-10""},{""Name"":""Norm Shokal"",""ProfilePicture"":""https://lh3.googleusercontent.com/a/ACg8ocLQHvd1J-9toHm5YAllbG198G399oFLmchsFingjpCqFtVheA=s120-c-rp-mo-ba7-br100"",""Rating"":5,""Description"":""Buy local Great staff Great price"",""Images"":[""www.google.com/local/imagery/report/?cb_client=maps_sv.tactile\u0026image_key=!1e10!2sCIABIhBQLY9dqZatn5pFQQLCRcyl\u0026fid=0x0:0xa7d4768c8e68237a""],""When"":""2025-8-28""}]",null,
