input_id,link,title,category,address,open_hours,popular_times,website,phone,plus_code,review_count,review_rating,reviews_per_rating,latitude,longitude,cid,status,descriptions,reviews_link,thumbnail,timezone,price_range,data_id,place_id,images,reservations,order_online,menu,owner,complete_address,about,user_reviews,user_reviews_extended,emails
d70687ae-2e93-4bc8-b9a0-eca95d21fe38,https://www.google.com/maps/place/Standard+Building+Supplies/data=!4m7!3m6!1s0x548671b5a36110e5:0x87151d8fbc54789d!8m2!3d49.3166008!4d-123.0911856!16s%2Fg%2F1thf87vn!19sChIJ5RBho7VxhlQRnXhUvI8dFYc?authuser=0&hl=en&rclk=1,Standard Building Supplies,Building materials store,"22 Bewicke Ave, North Vancouver, BC V7M 3B5","{""Friday"":[""6 a.m.–5 p.m.""],""Monday"":[""6 a.m.–5 p.m.""],""Saturday"":[""8 a.m.–4 p.m.""],""Sunday"":[""Closed""],""Thursday"":[""6 a.m.–5 p.m.""],""Tuesday"":[""6 a.m.–5 p.m.""],""Wednesday"":[""6 a.m.–5 p.m.""]}","{""Friday"":{""10"":64,""11"":61,""12"":82,""13"":69,""14"":63,""15"":47,""16"":34,""17"":0,""18"":0,""19"":0,""20"":0,""21"":0,""22"":0,""5"":0,""6"":68,""7"":100,""8"":94,""9"":76},""Monday"":{""10"":70,""11"":89,""12"":87,""13"":81,""14"":61,""15"":49,""16"":32,""17"":0,""18"":0,""19"":0,""20"":0,""21"":0,""22"":0,""5"":0,""6"":47,""7"":51,""8"":49,""9"":62},""Saturday"":{""10"":30,""11"":31,""12"":47,""13"":52,""14"":54,""15"":42,""16"":0,""17"":0,""18"":0,""19"":0,""20"":0,""21"":0,""22"":0,""23"":0,""6"":0,""7"":0,""8"":28,""9"":29},""Sunday"":{},""Thursday"":{""10"":84,""11"":72,""12"":75,""13"":67,""14"":58,""15"":45,""16"":38,""17"":0,""18"":0,""19"":0,""20"":0,""21"":0,""22"":0,""5"":0,""6"":57,""7"":63,""8"":70,""9"":76},""Tuesday"":{""10"":85,""11"":91,""12"":96,""13"":81,""14"":84,""15"":64,""16"":63,""17"":0,""18"":0,""19"":0,""20"":0,""21"":0,""22"":0,""5"":0,""6"":69,""7"":88,""8"":87,""9"":80},""Wednesday"":{""10"":88,""11"":88,""12"":88,""13"":69,""14"":54,""15"":41,""16"":48,""17"":0,""18"":0,""19"":0,""20"":0,""21"":0,""22"":0,""5"":0,""6"":49,""7"":75,""8"":82,""9"":80}}",https://www.standardbuildingsupplies.ca/,(604) 985-4411,"8W85+JG North Vancouver, British Columbia",267,4.700000,"{""1"":4,""2"":1,""3"":7,""4"":34,""5"":221}",49.316601,-123.091186,9733718672808376477,,,,https://lh3.googleusercontent.com/gps-cs-s/AHVAwepyrB_7aT8kJd-nhY63ashbEi-HB0REsGL_Ncrwu8Eh_JU-LBgqRQxSjVJ5AiDniK7jjOLUteQ8prlhLuFQcyXGpNu-6x8B_CGyZFqmXj5H76ZCNdmQoanzlWSZjKw4DrXvYJJ_=w408-h544-k-no,America/Vancouver,,0x548671b5a36110e5:0x87151d8fbc54789d,ChIJ5RBho7VxhlQRnXhUvI8dFYc,"[{""title"":""All"",""image"":""https://lh3.googleusercontent.com/gps-cs-s/AHVAwepyrB_7aT8kJd-nhY63ashbEi-HB0REsGL_Ncrwu8Eh_JU-LBgqRQxSjVJ5AiDniK7jjOLUteQ8prlhLuFQcyXGpNu-6x8B_CGyZFqmXj5H76ZCNdmQoanzlWSZjKw4DrXvYJJ_=w224-h298-k-no""},{""title"":""Inside"",""image"":""https://lh3.googleusercontent.com/gps-cs-s/AHVAwerkBN6pEMgVYnJV7jL2j6vw6lBCHfaJWWSu0anVwJq2R_1M17jPoANlcduIjlVKmg_Nxrc-YK1JHF32DievmT5CucLarz3DiYrfDr5wekycC6T5hYfwNhvyhIciWJFpgQtEeriwhtKfTBgp=w397-h298-k-no""},{""title"":""Street View \u0026 360°"",""image"":""https://lh3.googleusercontent.com/gps-cs-s/AHVAweq7JLdyCqZtKVRsYCsBB74FMQj2DctuIIFDF_n5-Cb9ksOjBZ41oORLgWL2N91kVZ5hAEfqOSLUciRbVpPxxcB4AMgpPtfZYjipgpzxACDABDzpEC-2E9NGPf13TiWdvxNPMMc=w224-h298-k-no-pi-0-ya121.42477-ro-0-fo100""}]",null,null,"{""link"":"""",""source"":""""}","{""id"":""116215899303512463044"",""name"":""Standard Building Supplies (Owner)"",""link"":""https://www.google.com/maps/contrib/116215899303512463044""}","{""borough"":"""",""street"":""22 Bewicke Ave"",""city"":""North Vancouver"",""postal_code"":""V7M 3B5"",""state"":""British Columbia"",""country"":""CA""}","[{""id"":""service_options"",""name"":""Service options"",""options"":[{""name"":""Delivery"",""enabled"":true},{""name"":""In-store pickup"",""enabled"":true},{""name"":""In-store shopping"",""enabled"":true},{""name"":""Onsite services"",""enabled"":true}]},{""id"":""accessibility"",""name"":""Accessibility"",""options"":[{""name"":""Wheelchair-accessible entrance"",""enabled"":true},{""name"":""Wheelchair-accessible parking lot"",""enabled"":true}]},{""id"":""planning"",""name"":""Planning"",""options"":[{""name"":""Quick visit"",""enabled"":true}]},{""id"":""payments"",""name"":""Payments"",""options"":[{""name"":""Credit cards"",""enabled"":true},{""name"":""Debit cards"",""enabled"":true},{""name"":""NFC mobile payments"",""enabled"":true},{""name"":""Credit cards"",""enabled"":false}]}]","[{""Name"":""Mark V. Sinclair"",""ProfilePicture"":""https://lh3.googleusercontent.com/a-/ALV-UjW6ve_wQQ4uxBt3cYQW8cTfAQRrRZkQ44mckIfxzATcnSTXi0wz=s120-c-rp-mo-ba6-br100"",""Rating"":5,""Description"":""Exceptional destination on the Northshore for wide array of all manner of building + construction  materials. The outdoor lot is absolutely massive/stacked, and inside you'll find a very good range of hardware supplies for your project needs.  The staff at Standard Building Supplies are undoubtedly the \""icing on the cake.\"" The atmosphere/vibe is calm and professional, with an almost old-fashioned level of polite attentiveness.  Very glad to have found this invaluable source of building + hardware products on the Northshore!"",""Images"":[""www.google.com/local/imagery/report/?cb_client=maps_sv.tactile\u0026image_key=!1e10!2sCIABIhBXQ4KrU7rCcPX7yMxKvujw\u0026fid=0x0:0x87151d8fbc54789d""],""When"":""2025-8-15""},{""Name"":""Mason Zeinali"",""ProfilePicture"":""https://lh3.googleusercontent.com/a-/ALV-UjU4ap7i2wxfmZLk6pVgA1oSeEm8un1IeanPJ3nivRb7c3QhitAg=s120-c-rp-mo-br100"",""Rating"":5,""Description"":""Very nice and professional staff. I have ordered everything needed for our job site from this supplier."",""Images"":[""www.google.com/local/imagery/report/?cb_client=maps_sv.tactile\u0026image_key=!1e10!2sCIABIhDCwovCypXJefEXNEcBoxqt\u0026fid=0x0:0x87151d8fbc54789d""],""When"":""2025-9-25""},{""Name"":""Mark Baumert-Samson"",""ProfilePicture"":""https://lh3.googleusercontent.com/a-/ALV-UjV0gnKzbXvgavNYWPsH2bo5rM4KVmBtTogQ0hQb_uGILcPeIR4yew=s120-c-rp-mo-ba2-br100"",""Rating"":5,""Description"":""Great suppliers, have been using them for years with my Contracting business. Used them with companies I worked for before starting my own business. Always reliable, good with returns. Great drivers for deliveries. Rod is the best sales guy. Will usually email me a quote the same day. Tons of selection on a wide array of products. If they don’t have anything in stock it usually gets sent over from their Burnaby store in a day or two."",""Images"":null,""When"":""""},{""Name"":""Danial C"",""ProfilePicture"":""https://lh3.googleusercontent.com/a-/ALV-UjVVICMqNSEfXWINKzLsEXqb3wLZnAFVCtS_-q-gG6O6FkskKXqg=s120-c-rp-mo-ba4-br100"",""Rating"":3,""Description"":""Ppl are great! Some of the labeling on the items all over the site inside and out in the yard is inconsistent. Needs to be revisited. Small example of what I'm talking about in photo. This has been going on for along time... More than a year?"",""Images"":[""www.google.com/local/imagery/report/?cb_client=maps_sv.tactile\u0026image_key=!1e10!2sCIABIhA0codz-cm7BOC6deKvIwU2\u0026fid=0x0:0x87151d8fbc54789d""],""When"":""2025-12-9""},{""Name"":""Ralph Essinger"",""ProfilePicture"":""https://lh3.googleusercontent.com/a/ACg8ocIh95hmW-L0Z_8E1lMWaA8NTS5F9e7tsEi16u6P4e8jePfMpw=s120-c-rp-mo-ba3-br100"",""Rating"":5,""Description"":""I’m embarrassed to say this was my first time at Standard Building Supplies. Prices are great, store is immaculately clean and organized but most surprisingly was the staff. The employee at the front entrance was welcoming, patient and professional. Happy to say, like Home Hardware this store is a truly Canadian owned company unlike Home Depot, Rona and Dick’s that are owned by the US. Yes Rona and Dick’s are American.\n\nI was just in to pick up some gypsum waste bags but I have a big home project coming up and this will, without hesitation, be my go-to store."",""Images"":null,""When"":""""},{""Name"":""Judy Jacobs"",""ProfilePicture"":""https://lh3.googleusercontent.com/a/ACg8ocKuNqz3cS3zrTEjuPjVZxmADkTnUwKJLE7SX5bUTGSEavbocw=s120-c-rp-mo-br100"",""Rating"":5,""Description"":""I love this place. I was particularly impressed with Jose, a young salesman who was impeccable in his knowledge, demeanor, efficiency and who had a sharp, professional appearance. The store was calm, organized, and clean.  The pricing was very competitive. Even the delivery guy was happy and helpful at 7 am. He spoke so highly of his company and how it was managed. Everyone looks happy at STANDARD."",""Images"":null,""When"":""""},{""Name"":""Bruce Wilson"",""ProfilePicture"":""https://lh3.googleusercontent.com/a/ACg8ocJb6zjb6RUPsYOlPYZB7U0sbefveRlko_Wdvda6RYjMlE3AgQ=s120-c-rp-mo-br100"",""Rating"":5,""Description"":""Great team service from Burnaby to Whistler. With snow. A special thanks to Dean (Burnaby)\nThanks guys"",""Images"":[""www.google.com/local/imagery/report/?cb_client=maps_sv.tactile\u0026image_key=!1e10!2sCIABIhDDqjuEjGflNmi-5gfw56TJ\u0026fid=0x0:0x87151d8fbc54789d""],""When"":""2025-12-19""},{""Name"":""Bob Clendenan"",""ProfilePicture"":""https://lh3.googleusercontent.com/a-/ALV-UjVoJvp6BgEcGqlWyNfP584MWibgUFdH8LK235UsfZ36yt_tKCbv=s120-c-rp-mo-br100"",""Rating"":5,""Description"":""Excellent experience. Was too tired to be there late in the day. Samir was exceptionally patient and helpful.  Products were well laid out in yard and stacks well maintained."",""Images"":null,""When"":""""}]",null,
d70687ae-2e93-4bc8-b9a0-eca95d21fe38,https://www.google.com/maps/place/Eco+Exteriors+Roofing+and+Solar+Ltd./data=!4m7!3m6!1s0x5486703ec165359f:0x7b7cd1189f5accac!8m2!3d49.3264713!4d-123.0702352!16s%2Fg%2F1tfbbvj5!19sChIJnzVlwT5whlQRrMxanxjRfHs?authuser=0&hl=en&rclk=1,Eco Exteriors Roofing and Solar Ltd.,Roofing contractor,"144 19th St E, North Vancouver, BC V7L 2Y8","{""Friday"":[""8 a.m.–5 p.m.""],""Monday"":[""8 a.m.–5 p.m.""],""Saturday"":[""Closed""],""Sunday"":[""Closed""],""Thursday"":[""8 a.m.–5 p.m.""],""Tuesday"":[""8 a.m.–5 p.m.""],""Wednesday"":[""8 a.m.–5 p.m.""]}",{},http://ecoexteriors.com/,(604) 985-4326,"8WGH+HW North Vancouver, British Columbia",52,4.800000,"{""1"":2,""2"":1,""3"":0,""4"":0,""5"":49}",49.326471,-123.070235,8898216867460205740,,,,https://lh3.googleusercontent.com/gps-cs-s/AHVAwepeYWj8vVdPMURxaqTPcr8TOfdPdEF2ANI8ZSlVbH8j_ZPs3rB7dOTcL66l7pIyiFhXcGupNCBGc7uyKsywKJi7HFEovwMoCqZM3X0VPI5O4r06pLj46tVOJ2M_k6p3mdMQ5IozEZuCVYw=w426-h240-k-no,America/Vancouver,,0x5486703ec165359f:0x7b7cd1189f5accac,ChIJnzVlwT5whlQRrMxanxjRfHs,"[{""title"":""All"",""image"":""https://lh3.googleusercontent.com/gps-cs-s/AHVAwepeYWj8vVdPMURxaqTPcr8TOfdPdEF2ANI8ZSlVbH8j_ZPs3rB7dOTcL66l7pIyiFhXcGupNCBGc7uyKsywKJi7HFEovwMoCqZM3X0VPI5O4r06pLj46tVOJ2M_k6p3mdMQ5IozEZuCVYw=w529-h298-k-no""},{""title"":""Latest"",""image"":""https://lh3.googleusercontent.com/gps-cs-s/AHVAwepNF1om-Jqv63gY77joj5GtHKDuM5GSDezy5B3bNtBK6nhj0yc2YMoPBc_Pc0yqwlLiIi6CxAaAXkzzFarcy881KuzKs7cV9afbtzPtRM4SDahHS936O9pCmSQNG8wam3YLr1IGXCBHx1Q=w224-h298-k-no""},{""title"":""Videos"",""image"":""https://lh3.googleusercontent.com/gps-cs-s/AHVAwerAuH8cL1V1cXWIEx5KePSvZg7d9lDEsqNmWgXCp3ZtFeH_eh1H9dVy_nllRrndU8HPIyOqvmsNsTivWPCz_A6RPW_crsa-4BrrCwFd8gP1mMp--hHtBSakZ_3fIYb25rwxpyW7=w224-h398-k-no""},{""title"":""House"",""image"":""https://lh3.googleusercontent.com/gps-cs-s/AHVAwerrpZTA79fWkc9Kwp3Jvpov5EGDDTnrhPmYJ7yuA_7J1J_9F6L6aU2cLZtKtzplrBuwUt_ok57XKXwS83n1YlQhdGSYVUNWwOHUYPU_IV24yPNiCm33UVPoPG8LavIcUPJ-3pjK=w397-h298-k-no""},{""title"":""By owner"",""image"":""https://lh3.googleusercontent.com/gps-cs-s/AHVAwerAuH8cL1V1cXWIEx5KePSvZg7d9lDEsqNmWgXCp3ZtFeH_eh1H9dVy_nllRrndU8HPIyOqvmsNsTivWPCz_A6RPW_crsa-4BrrCwFd8gP1mMp--hHtBSakZ_3fIYb25rwxpyW7=w224-h398-k-no""},{""title"":""Street View \u0026 360°"",""image"":""https://streetviewpixels-pa.googleapis.com/v1/thumbnail?panoid=YX5KzUK-7ONMyzLZNEGTnA\u0026cb_client=maps_sv.tactile.gps\u0026w=224\u0026h=298\u0026yaw=5.820622\u0026pitch=0\u0026thumbfov=100""}]",null,"[{""link"":""https://ecoexteriors.com/offices"",""source"":""ecoexteriors.com""}]","{""link"":"""",""source"":""""}","{""id"":""102209356255640758750"",""name"":""Eco Exteriors Roofing and Solar Ltd. (Owner)"",""link"":""https://www.google.com/maps/contrib/102209356255640758750""}","{""borough"":"""",""street"":""144 19th St E"",""city"":""North Vancouver"",""postal_code"":""V7L 2Y8"",""state"":""British Columbia"",""country"":""CA""}","[{""id"":""service_options"",""name"":""Service options"",""options"":[{""name"":""Online estimates"",""enabled"":true},{""name"":""Onsite services"",""enabled"":true},{""name"":""Language assistance"",""enabled"":false}]},{""id"":""accessibility"",""name"":""Accessibility"",""options"":[{""name"":""Assistive hearing loop"",""enabled"":false}]},{""id"":""crowd"",""name"":""Crowd"",""options"":[{""name"":""LGBTQ+ friendly"",""enabled"":true},{""name"":""Transgender safe space"",""enabled"":true}]},{""id"":""parking"",""name"":""Parking"",""options"":[{""name"":""Free street parking"",""enabled"":true}]}]","[{""Name"":""Eoin Brennan"",""ProfilePicture"":""https://lh3.googleusercontent.com/a-/ALV-UjUuU7yPDhqTm-J2ZD9jnjMTr8PkrfzMm_qakEf93l7W7DPjEGB8pw=s120-c-rp-mo-br100"",""Rating"":5,""Description"":""Top quality craftsmanship by an friendly and competent team.\n\nThe affect a new roof has on the curb appeal of your house is enormous, not to mention the comfort you gain knowing that everything is watertight for the oncoming winter - you need the installation done right.   Doug, Rada and team were awesome from beginning to end - from clear details of what was being installed in the quote to how they protected the rest of the house and deck during demolition and installation - they went the extra mile.\n\nThey easily dealt with some curveballs we threw to them too. They removed our leaky (and now unused) chimneys above the roofline, giving the home a much cleaner look and installed snow guards.\n\nDoug took time to work through a water egress issue that was not related to the roof installation - including helping me cut drywall open! - determined to find a solution the issue. Which we did.\nWe also required some more specialized carpentry work. Doug leveraged his own network to get us somebody to complete it.\n\nIt's not easy to find a company that that you can trust with such competitive pricing and such high quality craftsmanship on such a project. I feel fortunate to have worked with Doug, Rada and the team at Eco Exteriors.\n\nThe metal roof has really given the home a transformative look. And the new gutters were really the cherry on top. My photographs attached don't truly show how transformative it is.\n\nA great team and great company!"",""Images"":[""www.google.com/local/imagery/report/?cb_client=maps_sv.tactile\u0026image_key=!1e10!2sCIABIhDxspgriABMH3NDDwk-qvIV\u0026fid=0x0:0x7b7cd1189f5accac""],""When"":""2025-11-7""},{""Name"":""James Troutman"",""ProfilePicture"":""https://lh3.googleusercontent.com/a/ACg8ocLHJ3OXj5p6JZGAFkgYc6VJa_mmbbj0UHVtGNFtmstHXCIXyg=s120-c-rp-mo-br100"",""Rating"":5,""Description"":""Having had Eco Exteriors Roofing and Solar complete a few of my projects i am happy to recommend them to others. The team was knowledgeable, courteous and committed to doing the job right. I highly recommend Eco for anyone looking for a top tier roofing service.\n\nJames"",""Images"":null,""When"":""""},{""Name"":""Scott Antifave"",""ProfilePicture"":""https://lh3.googleusercontent.com/a/ACg8ocLA1YRTarlIhUqrQcYkecfXV-vKf4vF_GFst8_oK_RSsOIl3A=s120-c-rp-mo-br100"",""Rating"":5,""Description"":""Contacted Eco Exteriors for a quote, Doug the owner was super pleasant to work with, offered quick service and I felt really confident going into the job based on his extensive knowledge and solid team.\nWholeheartedly recommend working with them if you need roofing work."",""Images"":null,""When"":""""},{""Name"":""Dave B Galloway GM"",""ProfilePicture"":""https://lh3.googleusercontent.com/a-/ALV-UjUYP9rlVGzqJ-ttDvfyR_DaVbS5jexjV11NvavdTarDS2Wom7M=s120-c-rp-mo-br100"",""Rating"":5,""Description"":""Just had our somewhat complex roof completed. Very nice job. They took great care not to damage any plants. Pleasant, professional and friendly crew. Fully branded trucks (professional) and experienced crew.  2100 sq ft (3 structures) - all done in 4 days.  Best quote from 4 vendors. Definitely recommend."",""Images"":[""www.google.com/local/imagery/report/?cb_client=maps_sv.tactile\u0026image_key=!1e10!2sCIHM0ogKEICAgICrmZKxqAE\u0026fid=0x0:0x7b7cd1189f5accac""],""When"":""2024-7-9""},{""Name"":""alborz hakimi"",""ProfilePicture"":""https://lh3.googleusercontent.com/a/ACg8ocKqj5ZdW-J6oSplTZFn4zdsDVYVIrKqESl-Jer-1grsp5Jr3w=s120-c-rp-mo-ba2-br100"",""Rating"":5,""Description"":""Doug and team did an incredible job on my roofing and solar project. Super professional and accommodating. Very responsive. I would highly recommend them to anyone looking without reservation."",""Images"":null,""When"":""""},{""Name"":""Darin Boileau"",""ProfilePicture"":""https://lh3.googleusercontent.com/a-/ALV-UjVFgUisnb0T97X3QrN_PqflOBokDC9hUqpENvO35yzhWP94JtSX1g=s120-c-rp-mo-br100"",""Rating"":5,""Description"":""We had a great experience working with Eco Exteriors on a large residential renovation with a metal roof and gutters. Quality and attention to detail was outstanding. Good communication and scheduling."",""Images"":null,""When"":""""},{""Name"":""Brian W"",""ProfilePicture"":""https://lh3.googleusercontent.com/a/ACg8ocJnP8hpFJnu3aoEVLrJ8VUm9BP761ybw-Sz1Ur8acKFNbrC7w=s120-c-rp-mo-ba3-br100"",""Rating"":2,""Description"":""After taking the morning off work, I was called 45 mins before the appointment and was told he couldn't make it because it was raining and it was too dangerous to go on the roof.  He then asked if we could book for the next day - without any concern about the weather.  Hmmmm.\n\n1.  If I was told this, I would have looked at the weather before making the appointment.  2.  I called two other roofing companies and both showed up had no problem going on the roof in the rain.\n\nHe gets two stars because he actually called to cancel.  (The bar is set low with trades these days.)"",""Images"":null,""When"":""""},{""Name"":""Mohsen Sadatsafavi"",""ProfilePicture"":""https://lh3.googleusercontent.com/a/ACg8ocLabK6IHFpRVx0Gwp8lIEZTUC0IQYrl1pbN78x4-RNwhhsqhA=s120-c-rp-mo-ba3-br100"",""Rating"":5,""Description"":""We had an amazing experience with this company. We perceive them as honest, objective, and comprehensive in their initial assessment for our roofing project and the range of options they provided. Doug went out of his way to make sure we will make an informed decision and get the best deal. He kept us posted about the timeline. When the project started, it went quite smoothly. The onsite team was professional, on time, responsive to our queries, and very tidy. They would clean up the yard every evening after they were done for the day. They kept us constantly up-to-date about the progress, ran onsite decisions with us, and informed us of the next steps. When they finished, they thoroughly cleaned up. We have a beautiful metal roof now and are very happy with Eco Exteriors for the overall experience. One of the most professional contractors we have ever worked with."",""Images"":null,""When"":""""}]",null,
