input_id,link,title,category,address,open_hours,popular_times,website,phone,plus_code,review_count,review_rating,reviews_per_rating,latitude,longitude,cid,status,descriptions,reviews_link,thumbnail,timezone,price_range,data_id,place_id,images,reservations,order_online,menu,owner,complete_address,about,user_reviews,user_reviews_extended,emails
63b1df2b-1929-4db6-9f85-05cba8710af4,https://www.google.com/maps/place/Red+Maple+Roofing/data=!4m7!3m6!1s0x633a121a5f3b48c3:0xf6b4ee48fbe13cb4!8m2!3d49.2966602!4d-122.7436724!16s%2Fg%2F11yldnrhsb!19sChIJw0g7XxoSOmMRtDzh-0jutPY?authuser=0&hl=en&rclk=1,Red Maple Roofing,Roofing contractor,"3519 Princeton Ave, Coquitlam, BC V3E 0K3","{""Friday"":[""8 a.m.–9 p.m.""],""Monday"":[""8 a.m.–9 p.m.""],""Saturday"":[""8 a.m.–9 p.m.""],""Sunday"":[""8 a.m.–9 p.m.""],""Thursday"":[""8 a.m.–9 p.m.""],""Tuesday"":[""8 a.m.–9 p.m.""],""Wednesday"":[""8 a.m.–9 p.m.""]}",{},http://www.redmapleroofingbc.com/,(778) 239-1701,"77W4+MG Coquitlam, British Columbia",8,5.000000,"{""1"":0,""2"":0,""3"":0,""4"":0,""5"":8}",49.296660,-122.743672,17777095626369088692,,,,https://lh3.googleusercontent.com/gps-cs-s/AHVAwepgT5kLVzdZMMAZ5DFJx8d6zUl9TGCZZr6cKQ1ydwBa0OVFbI726zYL6Vp6_dlp_ZR6Hd_kVTsS2TyCaoiw2gSy2mvPuTisoDPf4ZZBjPPWn2x5d_mYTOaMBdQ4BGdXY-4aKobyz6ilBKs=w426-h240-k-no,America/Vancouver,,0x633a121a5f3b48c3:0xf6b4ee48fbe13cb4,ChIJw0g7XxoSOmMRtDzh-0jutPY,"[{""title"":""All"",""image"":""https://lh3.googleusercontent.com/gps-cs-s/AHVAwepgT5kLVzdZMMAZ5DFJx8d6zUl9TGCZZr6cKQ1ydwBa0OVFbI726zYL6Vp6_dlp_ZR6Hd_kVTsS2TyCaoiw2gSy2mvPuTisoDPf4ZZBjPPWn2x5d_mYTOaMBdQ4BGdXY-4aKobyz6ilBKs=w529-h298-k-no""},{""title"":""Latest"",""image"":""https://lh3.googleusercontent.com/gps-cs-s/AHVAwer3s627i_sXiwpWwVPomlsgDPVMcIgiZRnjiMEjAGrmuags93HqmQV6MX_2NF5Aw9U9-hitD-DI0Eg1EV8wj7Qd87q_8u7nCuvw8Gbwpodwe2By42qvfa7T-ehw1-W1FKLp_l1aSElaE-28=w397-h298-k-no""},{""title"":""House"",""image"":""https://lh3.googleusercontent.com/gps-cs-s/AHVAwerz8_n3RuBjgftjZ37mMmaFl1kT7a1S9ZykVu0HR8N3WheFepT7EAnkGVlPs_b8i3cxjCqUGgBJsV58H1rIKmkoNWHilIACeo5W8ZQ1mRZpQ9-OVWyqtiMEd_NjPJawDYDVZ83Fg_Z8ISav=w397-h298-k-no""},{""title"":""By owner"",""image"":""https://lh3.googleusercontent.com/gps-cs-s/AHVAweooeV7ZV-idBXHcw4Gw12gGPhrFjoANt6STRdLoiGsXXJSjMCAa-IS1IsGtt1HUppdelLXOohZAPvQv2EV57lI7iVC6zZZDxWgEp7P3QCemdG2mYIeHVno0p6Uc3ksUoxNV7fc-Wh-8Xw8I=w397-h298-k-no""},{""title"":""Street View \u0026 360°"",""image"":""https://streetviewpixels-pa.googleapis.com/v1/thumbnail?panoid=tURrsWw1cQtgWev2pksL1A\u0026cb_client=maps_sv.tactile.gps\u0026w=224\u0026h=298\u0026yaw=40.744843\u0026pitch=0\u0026thumbfov=100""}]",null,null,"{""link"":"""",""source"":""""}","{""id"":""109455528393222158088"",""name"":""Red Maple Roofing (Owner)"",""link"":""https://www.google.com/maps/contrib/109455528393222158088""}","{""borough"":""Burke Mountain"",""street"":""3519 Princeton Ave"",""city"":""Coquitlam"",""postal_code"":""V3E 0K3"",""state"":""British Columbia"",""country"":""CA""}","[{""id"":""service_options"",""name"":""Service options"",""options"":[{""name"":""Online estimates"",""enabled"":true},{""name"":""Language assistance"",""enabled"":false}]}]","[{""Name"":""Sherry Chen"",""ProfilePicture"":""https://lh3.googleusercontent.com/a-/ALV-UjWAvDQqEDehyeB4lsd23_ToW6IKCDi4vISdxFgd9QR7-z09YUtP=s120-c-rp-mo-br100"",""Rating"":5,""Description"":""Rasheed’s service is amazing. He is friendly and dependent. Willing to go above and beyond to make sure your roof is properly installed. Highly recommend him to all your roofing needs."",""Images"":null,""When"":""""},{""Name"":""Greg Lehoux"",""ProfilePicture"":""https://lh3.googleusercontent.com/a/ACg8ocIdgGyysJ4UVvjZWyBtv1bEmLgLLySvRnoS62osDPWUsNBE=s120-c-rp-mo-br100"",""Rating"":5,""Description"":""Rasheed completed a needed replacement of the pipe flashing on my roof at a reasonable rate. The job was tidy, and he was punctual and pleasant to do business with."",""Images"":null,""When"":""""},{""Name"":""Nancy Gratham"",""ProfilePicture"":""https://lh3.googleusercontent.com/a/ACg8ocJE4kaI03O7v7Et7xgrUw10JNQe3hGT-HutRPW6HVCzljJCUA=s120-c-rp-mo-br100"",""Rating"":5,""Description"":""Rasheed was friendly, helpful and transparent.  He fixed what needed to be fixed, recommended against spending money on what didn’t, and patiently explained his recommendations with the help of pictures from my roof.  I’m happy to have found my reliable go-to guy for all things roof!"",""Images"":null,""When"":""""},{""Name"":""A2Z AUTO SALES"",""ProfilePicture"":""https://lh3.googleusercontent.com/a-/ALV-UjXJy3p9YeqIzy3CCj2ULV3WWAHeBkRsnnKLqgB-d9Hj8C39CmGR=s120-c-rp-mo-ba4-br100"",""Rating"":5,""Description"":""Rasheed is a very honest, dedicated professional person they just finished my backyard balcony in a staircase and they did a fantastic five star job. I am extremely happy with both their pricing and performance.  They charge a reasonable amount of money and the type of Service that they deliver is fantastic. I would strongly suggest anyone out there looking for a good reliable contractor to give these guys a try."",""Images"":null,""When"":""""},{""Name"":""Laurie Blimkie"",""ProfilePicture"":""https://lh3.googleusercontent.com/a/ACg8ocInQfR9KoZv4564UBy91l7luMJf9yCqyyqB-xaOQvZng1-cGQ=s120-c-rp-mo-br100"",""Rating"":5,""Description"":""Quality work.  Arrived promptly on agreed time.  Competitive pricing.  Took time to answer any questions.  Would use for future roofing work."",""Images"":null,""When"":""""},{""Name"":""Parkcrest Properties Inc."",""ProfilePicture"":""https://lh3.googleusercontent.com/a/ACg8ocJiywTIvwiSGNYvOZi1mmGUoPj_6HJpvNs8DbSp2P2BiYrrWw=s120-c-rp-mo-br100"",""Rating"":5,""Description"":""Rasheed showed up and did exactly what was negotiated and promised. No BS. I would use him again."",""Images"":null,""When"":""""},{""Name"":""Mike"",""ProfilePicture"":""https://lh3.googleusercontent.com/a/ACg8ocI2FthFRXjjiN2CWhy1V3AIce_y0ap8G6n7nFLpO6uWLMEGAQ=s120-c-rp-mo-br100"",""Rating"":5,""Description"":""Rasheed of Red Maple Roofing together with Brayden of Rebel Roofing completed my roof replacement on Mar 14 2026.  Both Rasheed and Brayden were courteous, professional and extremely knowledgeable. Most importantly they care about the quality of work to ensure their customer was satisfied. I would strongly recommend Thanks from Linda and Mike"",""Images"":null,""When"":""""},{""Name"":""Bob Shenouda"",""ProfilePicture"":""https://lh3.googleusercontent.com/a/ACg8ocJUwT3c5Xv2-d-UMQHVt1GMSnfUIOEOAkK6Ttzg4KX5vES37A=s120-c-rp-mo-br100"",""Rating"":5,""Description"":"""",""Images"":null,""When"":""""}]",null,
63b1df2b-1929-4db6-9f85-05cba8710af4,https://www.google.com/maps/place/Applied+Roofing+Science+Inc./data=!4m7!3m6!1s0x5485d76d93472d9d:0xc48e7671ed651d16!8m2!3d49.2322687!4d-122.8387586!16s%2Fg%2F11smhtfy10!19sChIJnS1Hk23XhVQRFh1l7XF2jsQ?authuser=0&hl=en&rclk=1,Applied Roofing Science Inc.,Building inspector,"2071 Concord Ave, Coquitlam, BC V3K 1K4","{""Friday"":[""9 a.m.–5 p.m.""],""Monday"":[""9 a.m.–5 p.m.""],""Saturday"":[""Closed""],""Sunday"":[""Closed""],""Thursday"":[""9 a.m.–5 p.m.""],""Tuesday"":[""9 a.m.–5 p.m.""],""Wednesday"":[""9 a.m.–5 p.m.""]}",{},https://appliedroofingscience.com/,(778) 859-9939,"65J6+WF Coquitlam, British Columbia",17,4.800000,"{""1"":0,""2"":1,""3"":0,""4"":0,""5"":16}",49.232269,-122.838759,14163388109812997398,,,,https://lh3.googleusercontent.com/gps-cs-s/AHVAweqtb4ut6M4Ncow4TvUen2rxmKOzvB_nEvItih87EaSz7ztc0Z-zfZAEJyotURaFsQkwy-Yzd6yJhvHmfuqDdjw0dJQMhXGTk6_BPK4MH3aeMsbVi0CRYjyvz8ek17i5Ai1RPrda=w408-h306-k-no,America/Vancouver,,0x5485d76d93472d9d:0xc48e7671ed651d16,ChIJnS1Hk23XhVQRFh1l7XF2jsQ,"[{""title"":""All"",""image"":""https://lh3.googleusercontent.com/gps-cs-s/AHVAweqtb4ut6M4Ncow4TvUen2rxmKOzvB_nEvItih87EaSz7ztc0Z-zfZAEJyotURaFsQkwy-Yzd6yJhvHmfuqDdjw0dJQMhXGTk6_BPK4MH3aeMsbVi0CRYjyvz8ek17i5Ai1RPrda=w397-h298-k-no""},{""title"":""Exterior"",""image"":""https://lh3.googleusercontent.com/gps-cs-s/AHVAwerMsTIjnjTQ0scOaA9AmsfBTPpFHtuPgGQgR1BICjcsMzAP9qhMr840Wqfpl9o-K9HDPQq_L-oeQCuAVJ7bijd36RaUb7dKOZ0OkOHlbg2WSX30WiwzLWT40In_Ou9M31rl1ClA=w397-h298-k-no""},{""title"":""By owner"",""image"":""https://lh3.googleusercontent.com/gps-cs-s/AHVAwer_AdC4nDxqaxREUlbiPa8LkE3FMF1YfKMSqIWARJQaKWDjnjpVCUWgZAGQdc5U0E3b8DON1DLdIR-RBhTSM-1MR24ACkK4dQibqjZsmKSYBVvUpC5TqBB-hxa6ZLy1bSqIwjUi=w397-h298-k-no""},{""title"":""Street View \u0026 360°"",""image"":""https://streetviewpixels-pa.googleapis.com/v1/thumbnail?panoid=IRDufyCNi3JKmrQj8ar4eA\u0026cb_client=maps_sv.tactile.gps\u0026w=224\u0026h=298\u0026yaw=32.933662\u0026pitch=0\u0026thumbfov=100""}]",null,null,"{""link"":"""",""source"":""""}","{""id"":""116098947284183083423"",""name"":""Applied Roofing Science Inc. (Owner)"",""link"":""https://www.google.com/maps/contrib/116098947284183083423""}","{""borough"":"""",""street"":""2071 Concord Ave"",""city"":""Coquitlam"",""postal_code"":""V3K 1K4"",""state"":""British Columbia"",""country"":""CA""}","[{""id"":""service_options"",""name"":""Service options"",""options"":[{""name"":""Online appointments"",""enabled"":false},{""name"":""Onsite services"",""enabled"":false}]},{""id"":""accessibility"",""name"":""Accessibility"",""options"":[{""name"":""Wheelchair-accessible parking lot"",""enabled"":true}]},{""id"":""planning"",""name"":""Planning"",""options"":[{""name"":""Appointment required"",""enabled"":true}]}]","[{""Name"":""Twinkle Sandhu"",""ProfilePicture"":""https://lh3.googleusercontent.com/a/ACg8ocINAL_A97xwuG5LMDzMRHSkL_HiZeKohm4PhwyUUOjTlq9eFg=s120-c-rp-mo-ba2-br100"",""Rating"":5,""Description"":""Applied Roofing supported our apartment building’s strata roof replacement project and was excellent throughout. Stefan is extremely knowledgeable, communicates clearly, and makes complex technical details easy to understand. His guidance helped the council and owners make confident decisions, and we would absolutely recommend him. We are also looking at future projects under his expertise."",""Images"":null,""When"":""""},{""Name"":""Dave Ohori"",""ProfilePicture"":""https://lh3.googleusercontent.com/a/ACg8ocIziTiWGusxrkLEAfcExPvdZNbmSbFWhsSBq9k14NfBxIpjGg=s120-c-rp-mo-br100"",""Rating"":5,""Description"":""Stephan is a the best person to have your roof to be inspected with his experience and professional expertise . He is extremely thorough and honest with the reports he prepares.I would give 100% satisfaction on his services. Good Job. President of the Vancouver Buddhist Temple."",""Images"":null,""When"":""""},{""Name"":""Elaine Leung"",""ProfilePicture"":""https://lh3.googleusercontent.com/a-/ALV-UjVezba7HDkGvWyPx8K-f5r21Q0PaOAxcL8VVTIv9u9rp7jMaDw2=s120-c-rp-mo-ba3-br100"",""Rating"":5,""Description"":""Stefan is the best! I really appreciated his professionalism, expertise and advice in helping me navigate a dispute with a roofing company that had just installed a new roof with deficiencies on my house. I don't know how I would have gotten through this stressful ordeal without his incredible knowledge and support! I definitely recommend hiring Stefan any time you're thinking of installing a new roof!"",""Images"":null,""When"":""""},{""Name"":""Alex W"",""ProfilePicture"":""https://lh3.googleusercontent.com/a/ACg8ocLaFfmuGp2C-GWeffyQeoRCgI5gCjX1FDbYc6fIzT1rXuODoA=s120-c-rp-mo-br100"",""Rating"":5,""Description"":""I don't often write reviews, but I wanted others to know about my incredibly positive experience working with Stefan at Applied Roofing. He helped us deal with a builder to fix a number of issues with our residential roof. He was always very direct and honest in his communications with us and he followed up with the builder to make sure that all of the repairs were done completely and properly. We feel very grateful to have had his support throughout this process. If you need a roofing inspector, Stefan is by far the most professional, honest, and diligent guy out there! Thanks again for all your help!"",""Images"":null,""When"":""""},{""Name"":""David"",""ProfilePicture"":""https://lh3.googleusercontent.com/a/ACg8ocI73FY3_XWZMDIA0rnisC_5f1ugpyqnhg8YoYeY1tjs1qj1kA=s120-c-rp-mo-ba3-br100"",""Rating"":5,""Description"":""I highly recommend Applied Roofing Science. I needed an inspection at short notice and luckily Stefan accepted the job without hesitance. He arrived on time and came prepared. We were pleasantly surprised with how thorough a job Stefan did inspecting the roof, further demonstrating his commitment and expertise in the field. The final inspection report was detailed, informative and contained an extensive list of photos. Most importantly it was easy to understand as a homeowner and even so, Stefan made himself available after the report for any further questions. Overall, I would highly recommend Stefan. It’s not very often you come across someone with so much pride and passion in the work they do."",""Images"":null,""When"":""""},{""Name"":""Elaine Y"",""ProfilePicture"":""https://lh3.googleusercontent.com/a/ACg8ocJwGtIsXwkr5NnoXWiJxFaSxJFQJvHqEMS56g8I5bVjG9UDYg=s120-c-rp-mo-ba2-br100"",""Rating"":5,""Description"":""Highly recommend! Stefan was extremely professional and responsive. I was very impressed from the minute he showed up for the site inspection, how prepared and thorough he was, and how detailed his follow up inspection report was. His long standing experience in roofing coupled with his in depth wealth of knowledge truly makes him an industry expert. Would definitely engage Applied Roofing Science for all of my future roofing inspection and evaluation needs!"",""Images"":null,""When"":""""},{""Name"":""Karen Hansen"",""ProfilePicture"":""https://lh3.googleusercontent.com/a-/ALV-UjUv4bOOIS3l4-r2baeO6-rP2oMm1H2_ltDUxYqLylPfq-2qPRsCrw=s120-c-rp-mo-br100"",""Rating"":5,""Description"":""We would not have managed the roof replacement without Stefan’s help.  For anyone who lives in a strata I highly recommend they hire the services of an independent roof consultant.  He managed to avoid certain owners from making bad decisions for the entire building, and unified our decision making process  A proper roof is essential for all buildings.  Without out a roof, our investments and homes would perish.  Stefan did a pre-inspection, inspected the roof when the roofers opened it, did a post inspection, took lots of photos, and shared detailed reports with our property manager and strata.  He was always able to accommodate us in his schedule and available to answer any of our questions.  Thanks to him, we have peace of mind that the roofing company did not try to cut corners with us."",""Images"":null,""When"":""""},{""Name"":""Surreal Sanguine"",""ProfilePicture"":""https://lh3.googleusercontent.com/a-/ALV-UjXIHxdgRK0vg9Qw6OEB_JI5F7H7ii_7ZGVPhr6S-hNL3sKqCYOZ=s120-c-rp-mo-br100"",""Rating"":2,""Description"":""Totally inconsiderate on the job. They routinely start working and making a LOT of noise early, in some cases even before the city bylaws for such noise allows. When asked to respect a certain start time, totally ignored."",""Images"":null,""When"":""""}]",null,
63b1df2b-1929-4db6-9f85-05cba8710af4,https://www.google.com/maps/place/Simsan+Fraser+Maintenance+Ltd/data=!4m7!3m6!1s0x8d64a713f8717419:0x4cb8cdfc07e644a8!8m2!3d49.2883054!4d-123.0614468!16s%2Fg%2F11sqq338yq!19sChIJGXRx-BOnZI0RqETmB_zNuEw?authuser=0&hl=en&rclk=1,Simsan Fraser Maintenance Ltd,Gutter Cleaning Service,,{},{},http://www.simsanfrasermain.com/,(604) 880-4476,,88,4.900000,"{""1"":2,""2"":1,""3"":0,""4"":0,""5"":85}",49.288305,-123.061447,5528395024945267880,,,,https://lh3.googleusercontent.com/gps-cs-s/AHVAweoGp5kwNXE5qQbOzB7H-t7A6KxPj-735Xg0koP4CIwK_D2h44ymz5aUZm92-BLyQOMTMxauCsV7Hx2uJOkT0VeE8pzdcb4l1eTUMEE5EwOH0ERl91oxBsp6FR6l4uUTasOfd0j6DRE9XbOQ=w426-h240-k-no,America/Vancouver,,0x8d64a713f8717419:0x4cb8cdfc07e644a8,ChIJGXRx-BOnZI0RqETmB_zNuEw,"[{""title"":""All"",""image"":""https://lh3.googleusercontent.com/gps-cs-s/AHVAweoGp5kwNXE5qQbOzB7H-t7A6KxPj-735Xg0koP4CIwK_D2h44ymz5aUZm92-BLyQOMTMxauCsV7Hx2uJOkT0VeE8pzdcb4l1eTUMEE5EwOH0ERl91oxBsp6FR6l4uUTasOfd0j6DRE9XbOQ=w529-h298-k-no""},{""title"":""Latest"",""image"":""https://lh3.googleusercontent.com/gps-cs-s/AHVAweqZMNDwuRkrg4bv3G-fkBVTPqebiHUcNof2b9s2iGKnCtg5Ea2MoL3kKnYgvZlOgVNDpErYmt-VB-tta7dnLmH4EG01S_GI4YHJAKBG8hRGizW7SJm9SxT0ru7NlEhQWXD4D3L-i6B25MOD=w238-h298-k-no""},{""title"":""Videos"",""image"":""https://lh3.googleusercontent.com/gps-cs-s/AHVAwerxXlTVEWBuY8j4Ki-ZUoEpQLh5dNUDNH2DWMQWWhab0qGnQB1WwfZF7zTknHexhYwFSnBR5br67ePO4VMsDWWMQa7h3UxSpo6KTGWdNr0NzP7Hysmt5W5hhVGvhoPBvQYncgyY=w529-h298-k-no""},{""title"":""By owner"",""image"":""https://lh3.googleusercontent.com/gps-cs-s/AHVAwer00eS3kAvWZGLOrR0KVzaEWHaeUHtd_jBSJhPJM-zpoKlOH99glrA9y9Hbt2XKkVG1q2J8WXA3ZbHSnUi2R98JRQ1HpgVXtDJJP-dszjM9xoX-dy5d-Eiyq8D9saXSmapX5j_KEg=w224-h358-k-no""}]",null,null,"{""link"":"""",""source"":""""}","{""id"":""100725460762225371033"",""name"":""Simsan Fraser Maintenance Ltd (Owner)"",""link"":""https://www.google.com/maps/contrib/100725460762225371033""}","{""borough"":"""",""street"":"""",""city"":"""",""postal_code"":"""",""state"":"""",""country"":""""}",null,"[{""Name"":""Kai Lee"",""ProfilePicture"":""https://lh3.googleusercontent.com/a-/ALV-UjU3VR_OrPNo6aF4ar7Kas5spNM9KXMIIAIadoYuG50cxNOXwww=s120-c-rp-mo-ba4-br100"",""Rating"":5,""Description"":""We’re small strata with a few units, and we hadn’t done any exterior maintenance for over 10 years since moving in. Simsan and his team did an amazing job — they carefully removed all the moss and dirt, clean gutters by hand, washed the siding, and treated the roof with care and expertise. The crew was professional, efficient, and hardworking, completing everything in  two days and come back again to make sure everything is good.\n\nIt was very satisfying to watch them work, and the results are incredible — our strata looks brand new again! Both Simon and Sandeep are great guys to deal with: friendly, professional, and easy to communicate with. They also offered us a very reasonable price compared to other vendors.\n\nWe’re extremely happy we chose them. Thank you!"",""Images"":[""www.google.com/local/imagery/report/?cb_client=maps_sv.tactile\u0026image_key=!1e10!2sCIABIhBQJ8RJC7MyQbz3NjHdq2N0\u0026fid=0x0:0x4cb8cdfc07e644a8""],""When"":""2025-11-7""},{""Name"":""Hetty “Hetty Broeren” Broeren Vanderploeg"",""ProfilePicture"":""https://lh3.googleusercontent.com/a/ACg8ocL9m-ZBS5pBykGgB1szb41R1DQH3fnENYzhRMd_tBLgbfq-nw=s120-c-rp-mo-br100"",""Rating"":5,""Description"":""SIMSAN fraser did a great job on cleaning our roof, gutters, windows and washing the siding. Would definitely recommend them. Very professional and nice staff."",""Images"":null,""When"":""""},{""Name"":""Neema Teymory"",""ProfilePicture"":""https://lh3.googleusercontent.com/a-/ALV-UjUBqwgC4Ug5SgQH5fPZQI--l5wsOrqrLnekiS2w3EWnFDJyXeQbFg=s120-c-rp-mo-br100"",""Rating"":5,""Description"":""We live in a detached house with a larger concrete tile roof. It was covered in moss and in desperate need of a cleaning. Raj and his team came in the morning and cleaned the whole roof, gave it a moss treatment, cleaned all the gutters, power washed our concrete landings, and cleaned up the mess in one day. Overall very happy with the results. We'll be reaching out to Simsan again the next time we need similar work done."",""Images"":null,""When"":""""},{""Name"":""Natalie Evans"",""ProfilePicture"":""https://lh3.googleusercontent.com/a-/ALV-UjXvO6PDeM-NkFyg3HPt5i_DEgh2y4Ymcft_ZmU9bb6Mk-DbRQ2FSA=s120-c-rp-mo-ba3-br100"",""Rating"":5,""Description"":""We were very impressed with this company. Super competitive pricing, great communication and they did a fabulous job. We will definitely retain this company as our go-to for exterior house maintenance. Highly, highly recommended."",""Images"":null,""When"":""""},{""Name"":""Stephen Chan"",""ProfilePicture"":""https://lh3.googleusercontent.com/a-/ALV-UjUktdF7GT_w3iu8VbGnvN_pjTSi92Nl-kXhR2ai8IviDcWFWQ6jrQ=s120-c-rp-mo-ba3-br100"",""Rating"":5,""Description"":""I got a cold-call knock on my door offering to clean my roof.  They were more expensive than my prior contractor from 3 years ago, but the crew at Simsan did more meticulous and much better job of cleaning moss from my roof, and worth it.   I took these photos before and the day after.  Would highly recommend."",""Images"":[""www.google.com/local/imagery/report/?cb_client=maps_sv.tactile\u0026image_key=!1e10!2sCIHM0ogKEICAgIDhgaSsXw\u0026fid=0x0:0x4cb8cdfc07e644a8""],""When"":""2023-3-10""},{""Name"":""Lyndon Johnson"",""ProfilePicture"":""https://lh3.googleusercontent.com/a-/ALV-UjXUPUbpUkiJ-FZA8fzAgwi0l7FQXfc_fubG8R_qaPKQg32vXlY=s120-c-rp-mo-br100"",""Rating"":5,""Description"":""Just want to say it was a fabulous experience. The employees were fantastic. I would recommend them price was reasonable. Job was unbelievable. Keep up the good work."",""Images"":null,""When"":""""},{""Name"":""Greg Yoshida"",""ProfilePicture"":""https://lh3.googleusercontent.com/a/ACg8ocKkr7ZQqN8brHwU1--u42HIyzVhmp7_Xmu24WsAnCiqBxUP=s120-c-rp-mo-ba4-br100"",""Rating"":1,""Description"":""I'm highly suspicious of this company. Instead of discreetly dropping business cards in your mailbox or on your doormat, they leave it tucked in the door frame so it's visible from the street. Is this so it's easier for someone to monitor when someone is away? At the very least it's easier for others to know. If you can't be respectful maybe stay off people's private property."",""Images"":null,""When"":""""},{""Name"":""Andrew H"",""ProfilePicture"":""https://lh3.googleusercontent.com/a/ACg8ocLaldCb0AtKU_aCVFLcrbxjeeBIDp_a1szZ6w2kCBLRYWkQzw=s120-c-rp-mo-br100"",""Rating"":2,""Description"":""Had them come through in the summer to clean the moss off roof and clean gutters. Unfortunately when the rain started in the fall my downspouts backed up. When they clear the moss off the roof, it collects in the gutters, and it appears they didnt get it all during gutter cleaning, which caused backups on the downspouts. I was able to disconnect sections of the downspouts and clear it out (in the pouring rain as the gutters were overflowing). Everything is flowing now, so lucky didnt clog up my drain tile. Hope in the future they pay more attention to getting all the cleaned up moss from the roof out of the gutters, and putting the downspout filters back on (i assume the guy tossed mine, had to buy new ones)."",""Images"":null,""When"":""""}]",null,
