input_id,link,title,category,address,open_hours,popular_times,website,phone,plus_code,review_count,review_rating,reviews_per_rating,latitude,longitude,cid,status,descriptions,reviews_link,thumbnail,timezone,price_range,data_id,place_id,images,reservations,order_online,menu,owner,complete_address,about,user_reviews,user_reviews_extended,emails
6470a7f1-bc99-484c-a198-ceb2a05506b7,https://www.google.com/maps/place/TAP+Contracting/data=!4m7!3m6!1s0x548289fa0bf3f507:0xe113e9148f2be154!8m2!3d49.4783629!4d-119.6003278!16s%2Fg%2F11h12f6y5f!19sChIJB_XzC_qJglQRVOErjxTpE-E?authuser=0&hl=en&rclk=1,TAP Contracting,General contractor,"116 Green Mountain Rd unit #8, Penticton, BC V2A 7E2","{""Friday"":[""Closed""],""Monday"":[""7 a.m.–5 p.m.""],""Saturday"":[""Closed""],""Sunday"":[""Closed""],""Thursday"":[""7 a.m.–5 p.m.""],""Tuesday"":[""7 a.m.–5 p.m.""],""Wednesday"":[""7 a.m.–5 p.m.""]}",{},http://www.tapcontracting.com/?utm_source=google&utm_medium=wix_google_business_profile&utm_campaign=17277956146018162331,(250) 462-7606,"F9HX+8V Penticton, British Columbia",7,4.900000,"{""1"":0,""2"":0,""3"":0,""4"":1,""5"":6}",49.478363,-119.600328,16218562957601923412,,,,https://lh3.googleusercontent.com/gps-cs-s/AHVAwepCzpH2kBRK7DOOoVq90lniHqkFStengns6xs7AiSx2KPY-xcyxiPXDtQiFIT6tYpzNz4aRDrlmCza3xaUdyQrc-PqZB1gTGV8emNfc6fFwMihA7s-roFUq5TVfQGZp4JFik_RN=w408-h544-k-no,America/Vancouver,,0x548289fa0bf3f507:0xe113e9148f2be154,ChIJB_XzC_qJglQRVOErjxTpE-E,"[{""title"":""All"",""image"":""https://lh3.googleusercontent.com/gps-cs-s/AHVAwepCzpH2kBRK7DOOoVq90lniHqkFStengns6xs7AiSx2KPY-xcyxiPXDtQiFIT6tYpzNz4aRDrlmCza3xaUdyQrc-PqZB1gTGV8emNfc6fFwMihA7s-roFUq5TVfQGZp4JFik_RN=w224-h298-k-no""},{""title"":""Inside"",""image"":""https://lh3.googleusercontent.com/gps-cs-s/AHVAwequHxeiVVkXBAGAH9plF411HBoJllcVzLqTmObqW0_Myxk_D3dLpL0b5JbAXTDI2ngZAACkB7VNKNrC4j2-JRqvOT5txB_ZLLDERuWL3Oi670TRSi8KsWGLkH_7-7_sAmy3dFZh=w224-h298-k-no""},{""title"":""Machine"",""image"":""https://lh3.googleusercontent.com/gps-cs-s/AHVAwepzQFZRwfUz-68i2amSJ9PJFnjGDamW0bHvBt3ieWLrasu3fY9k5FYdoqp9vU_3QF85P-okRdByVFJ7MaTStl3VXlYZIltqFgOuZ85zxjEGXRLnHOV5DwL6cqTe7UbdZCsKaKqa=w224-h298-k-no""},{""title"":""By owner"",""image"":""https://lh3.googleusercontent.com/gps-cs-s/AHVAweq14FsBMufmBpN9R8_JN6bzz0wuh1xbDHRii8xUUckw-HpfwRxqvZhwXYu530mFPlPImRe37XkZXfnq2nHXbQtaN3RxJywYT_SxBdtiRZFHggkRk6qvy1IY86pbCDs5iKDMmDJPbQ=w224-h298-k-no""},{""title"":""Street View \u0026 360°"",""image"":""https://streetviewpixels-pa.googleapis.com/v1/thumbnail?panoid=R94-QenKHdNDe07qWIS8uw\u0026cb_client=maps_sv.tactile.gps\u0026w=224\u0026h=298\u0026yaw=212.10716\u0026pitch=0\u0026thumbfov=100""}]",null,null,"{""link"":"""",""source"":""""}","{""id"":""107064418284280414223"",""name"":""TAP Contracting (Owner)"",""link"":""https://www.google.com/maps/contrib/107064418284280414223""}","{""borough"":"""",""street"":""116 Green Mountain Rd unit #8"",""city"":""Penticton"",""postal_code"":""V2A 7E2"",""state"":""British Columbia"",""country"":""CA""}","[{""id"":""accessibility"",""name"":""Accessibility"",""options"":[{""name"":""Wheelchair-accessible parking lot"",""enabled"":true}]}]","[{""Name"":""brian hadwin"",""ProfilePicture"":""https://lh3.googleusercontent.com/a-/ALV-UjXOR6ukvRIMEqxNk5xWYVCk6j7znRYh0D5-uCHIdZEjfeidAFc=s120-c-rp-mo-ba2-br100"",""Rating"":5,""Description"":""Tony and his team do amazing work and he always impresses me with the clean - skilled work they do."",""Images"":null,""When"":""""},{""Name"":""darthshitty"",""ProfilePicture"":""https://lh3.googleusercontent.com/a-/ALV-UjVX89BL22uvCsfp4yknQKcYlltT97ShP5MWTYK-azNcj-MUZnjj=s120-c-rp-mo-br100"",""Rating"":4,""Description"":""Very reasonable pricing,  communication all the way, Tony and Jay did a great job on the bathroom."",""Images"":[""www.google.com/local/imagery/report/?cb_client=maps_sv.tactile\u0026image_key=!1e10!2sCIHM0ogKEICAgICal5mPUA\u0026fid=0x0:0xe113e9148f2be154""],""When"":""2021-8-11""},{""Name"":""Brad Jones"",""ProfilePicture"":""https://lh3.googleusercontent.com/a-/ALV-UjUOTIKXuzSYVjIdoOt9twyO70Qbp3ZJK7EPA67iMOvUzVjHz9ZF=s120-c-rp-mo-ba2-br100"",""Rating"":5,""Description"":""The workmanship was outstanding. Their professionalism and commitment to high-quality results were evident throughout the entire process. I highly recommend their services."",""Images"":null,""When"":""""},{""Name"":""Glen Matheson"",""ProfilePicture"":""https://lh3.googleusercontent.com/a/ACg8ocJvMhJmYGDeBc-IqA0uBfPUOiPB7HZUuiGEkPoP8b5YvL7D9g=s120-c-rp-mo-br100"",""Rating"":5,""Description"":""I mentioned I would like to get some work done at my home Tony came by and gave me free estimate and suggestions. Very helpful, respectful, and resourceful.\n\nThank you Tony for your help."",""Images"":null,""When"":""""},{""Name"":""Sophia Heather"",""ProfilePicture"":""https://lh3.googleusercontent.com/a-/ALV-UjWJOQLE6z_o95jermWr55uWyzwZYzL9jVUPgii7Xz8jnurISnt7=s120-c-rp-mo-br100"",""Rating"":5,""Description"":""After such a huge snow fall, my car was COMPLETELY buried in snow. He saw me struggling to dig out my car, happened to be in the area and did the whole thing himself with his bobcat! Thank you so much for such a kind gesture, your kindness and generosity goes such a long way! Absolutely made my day. Thank you so much!"",""Images"":null,""When"":""""},{""Name"":""Matt"",""ProfilePicture"":""https://lh3.googleusercontent.com/a/ACg8ocL3obfp02w8Is9uvm55DBQM9NE9aVkKqO-Mj7u2W7uxllnMGQ=s120-c-rp-mo-br100"",""Rating"":5,""Description"":""10/10 would recommend. Came to fix issues from a previous contractor, djd a great job and was a pleasure to work with. Even added irrigation for our garden bed at no cost."",""Images"":null,""When"":""""},{""Name"":""Stan the Man Ross"",""ProfilePicture"":""https://lh3.googleusercontent.com/a/ACg8ocI0VnfryC2Ey9odNz6OLb_xIX-wqys8fdsHx-ZLiuBGkm6UlgKh=s120-c-rp-mo-ba6-br100"",""Rating"":5,""Description"":""Returned my call right away even tho I called wrong number will now look at site in case I need the service"",""Images"":null,""When"":""""}]",null,
6470a7f1-bc99-484c-a198-ceb2a05506b7,https://www.google.com/maps/place/Affordable+Rain+Flow/data=!4m7!3m6!1s0x5482630c732ab08b:0xaeb4e4bfd75babc9!8m2!3d49.9138876!4d-120.1374166!16s%2Fg%2F11j3g92hpm!19sChIJi7AqcwxjglQRyatb17_ktK4?authuser=0&hl=en&rclk=1,Affordable Rain Flow,Roofing contractor,,{},{},http://rainflow.ca/,(250) 869-7636,,21,3.900000,"{""1"":4,""2"":1,""3"":1,""4"":2,""5"":13}",49.913888,-120.137417,12588938371010374601,,,,https://lh3.googleusercontent.com/gps-cs-s/AHVAwer-gWSxFTsoMsQuUR15kEOlNrwiStUO-tnz52CKo0knGFhmu2TSSW99Umgk9c5wVEm5Nf0mlOWa2hwBSdlrKBJN7y2rGCozb_5ZNGh8xu-mWVjUtlqTDCSWQrogLrZ1GPRZqn-e=w408-h305-k-no,America/Vancouver,,0x5482630c732ab08b:0xaeb4e4bfd75babc9,ChIJi7AqcwxjglQRyatb17_ktK4,"[{""title"":""All"",""image"":""https://lh3.googleusercontent.com/gps-cs-s/AHVAwer-gWSxFTsoMsQuUR15kEOlNrwiStUO-tnz52CKo0knGFhmu2TSSW99Umgk9c5wVEm5Nf0mlOWa2hwBSdlrKBJN7y2rGCozb_5ZNGh8xu-mWVjUtlqTDCSWQrogLrZ1GPRZqn-e=w398-h298-k-no""},{""title"":""House"",""image"":""https://lh3.googleusercontent.com/gps-cs-s/AHVAwepo0fE9YX6vltJ-bxudJa4j3zmfUnersh6OU_OpiVIZclyIZK8HZrMpvX_rpAwKEs05X_xAMuKjb8xzeYFYYdsGMWUjNE_mnXcsVexxAWuBuD3pjVFoSbQJAdcA-H3PoLciyuc_=w224-h298-k-no""},{""title"":""Roof shingle"",""image"":""https://lh3.googleusercontent.com/gps-cs-s/AHVAwepMZqQJKuZZDJ4n__Vc0pZrwiFfq55E18LqMPkHKrwOksK2g6tTkEhLeEixUFTqFpz_p-CYXOq0CIC4NhN0ciPEghgzC5LJIepTpkQ--dNBtu287xq7Agt8QvdEHQVYJV2NAX6Y=w398-h298-k-no""},{""title"":""By owner"",""image"":""https://lh3.googleusercontent.com/gps-cs-s/AHVAwep4Z8UOJGSl-6qlshgtbY6HfZqWgqkcDlEgLAxkozcdoJEaRLerfjnJva6A0MfiRUX1iYM_jDsuVHXUUg1v1FuKsChqXdWJWuNs2bKbvHAv053JSvpnz35gdc0BmTW-qkK_Wqfn=w398-h298-k-no""}]",null,null,"{""link"":"""",""source"":""""}","{""id"":""113699756607099697313"",""name"":""Affordable Rain Flow (Owner)"",""link"":""https://www.google.com/maps/contrib/113699756607099697313""}","{""borough"":"""",""street"":"""",""city"":"""",""postal_code"":"""",""state"":"""",""country"":""""}",null,"[{""Name"":""Nadine Elmer"",""ProfilePicture"":""https://lh3.googleusercontent.com/a/ACg8ocJYEO__rccSI3IU1gEAa117Oq6zzZzVCgrSqWaF2gSPfvUFnA=s120-c-rp-mo-br100"",""Rating"":5,""Description"":""My husband and I decided to take on a huge renovation project, our home!! Went to Vernon Home Show, met a very nice gentleman, Mike from Affordable Rain Flow. Mike was so personable, listen to every word I said. Little did we know it was a one shop deal!! Our home was built in 1990 by my husband and we wanted to do everything to the exterior. Mike came out to our home did some measurements and also an arial measurement, so cool never knew you could do that! After talking for a few days we came up with a plan. Next thing we had guys taking our roof off and replacing with a new roof, that even enclosed our front entrance of the roof line so we would not get rained on. They did all the soffits and gutters and then came the siding! But we first had to get our driveway done. I always wanted a White House. So once the driveway was done, now for our new LP Lap Siding in WHITE!! It was a lot of work for Mike\""s crew members. Everyone was so friendly, professional, always checking in with us to make sure we were happy, so the communication was fantastic. We got to know everyone real good. We are so happy with the finished project as you can see by the pictures!! I joke and tell everyone I live at the Oyama Estate. I would highly recommend Affordable Rain Flow for everything. They did a fantastic job, already had a realtor asking if we want to sell, NO WAY! THANKS SO MUCH TO MIKE AND ALL OF  HIS CREW THEY WENT ABOVE AND BEYOND!!\n\nMAC \u0026 NADINE ELMER\nOYAMA  BC"",""Images"":[""www.google.com/local/imagery/report/?cb_client=maps_sv.tactile\u0026image_key=!1e10!2sCIHM0ogKEICAgMCw99TT3QE\u0026fid=0x0:0xaeb4e4bfd75babc9""],""When"":""2025-3-21""},{""Name"":""Jonathan Bell"",""ProfilePicture"":""https://lh3.googleusercontent.com/a/ACg8ocL0PHx-KyeE9933cGNrUuZeIEzStj-iIzZiI7rZwGWJaoT1Fg=s120-c-rp-mo-ba2-br100"",""Rating"":5,""Description"":""We needed a cedar conversion to GAF 50 year. Their quote was fair, and the staff were very accommodating. The crew worked hard in very hot weather, yet made sure to install the new products exactly as per manufacturers specs. And they cleaned up the yard when they were done.\nGreat job Mike, Chad, Robin, and Trent"",""Images"":[""www.google.com/local/imagery/report/?cb_client=maps_sv.tactile\u0026image_key=!1e10!2sCIHM0ogKEICAgIDqlozcxAE\u0026fid=0x0:0xaeb4e4bfd75babc9""],""When"":""2021-7-7""},{""Name"":""Sherry Heron"",""ProfilePicture"":""https://lh3.googleusercontent.com/a/ACg8ocJ3FLKpOVTEZig-RTe8jX3Pz71PCTHvcW4i-Xgi0tJ8Fvt2FA=s120-c-rp-mo-br100"",""Rating"":4,""Description"":""The work they did was A+.  We have a very steep pitch and was very happy they were fearless.  Thank you to Mike and Chad.  Really good guys. Our roof looks great!"",""Images"":null,""When"":""""},{""Name"":""Mark McMahon"",""ProfilePicture"":""https://lh3.googleusercontent.com/a/ACg8ocKumN6v3DkIW6m2nK870NUJ4ltSPL0XLkg0xFZwdZkoCblD5Q=s120-c-rp-mo-br100"",""Rating"":1,""Description"":""please research and evaluate this company diligently..for your own protection...if you are a senior and have no intent to climb a ladder..??...have a professional roof inspector review the finished job at rain flows expense...i am building a 10,000 sq ft building and they butchered my roof...documented and undeniable...they promised to return and refund me the $15,000. plus cost..then no return calls...it has gone from bad to pathetically unprofessional..i am attaching a few select photo's...after being told one or two nails showing would be acceptable i told myself i could live with ten...the fact is there were over 250 nails showing..unbelievable...skylights not sealed to spec...vents not sealed to spec..an utter absolute gong show...5 months later..??...no refund...no return calls...try calling the owner..terry fleming...see if you get a call back..feel free to contact me.."",""Images"":[""www.google.com/local/imagery/report/?cb_client=maps_sv.tactile\u0026image_key=!1e10!2sCIHM0ogKEICAgIDy0tj-HA\u0026fid=0x0:0xaeb4e4bfd75babc9""],""When"":""2021-3-2""},{""Name"":""Sheila Taylor"",""ProfilePicture"":""https://lh3.googleusercontent.com/a/ACg8ocJkSbi_ZTQRBpURTVT8e7woFLn0o5x1TP8xBdk-9oBatJgSaQ=s120-c-rp-mo-br100"",""Rating"":5,""Description"":""Mike from Affordable Rain Flow responded in a very timely way when i reached out to several Roofing companies to get a quote to replace my\nroof.\nHe listened to what my concerns were and proceeded to give me a competitive quote.\nThey were able to start within a couple days.\nThey vented my roof as well as replaced the stacks.\nThe quote he gave me was exactly as he said.\nI am very pleased with their work and the finished product!\nI may be old fashioned, but i really appreciated him coming out to talk to me first, instead of just sending it via email.\nTHANKS MIKE AND CREW!!"",""Images"":null,""When"":""""},{""Name"":""Jim Wilson"",""ProfilePicture"":""https://lh3.googleusercontent.com/a/ACg8ocJtiR0ZN5MiA5bUVAGdG0ZmuTAE_SsBB1BtHan8s-WwJjgUgA=s120-c-rp-mo-br100"",""Rating"":4,""Description"":""Being a first experience of having a roof replaced on our home we did not know what to expect, We have ro say thar we are quite satisfied with the finished roof provided and installed by the management and crew of Affordable Rain Flow. They were easy to work with and responded well to our questions and requests,"",""Images"":null,""When"":""""},{""Name"":""Ryan Becker"",""ProfilePicture"":""https://lh3.googleusercontent.com/a/ACg8ocIFvPvpzqUiwc3_DurZ1HHBfR3AN1cX722G0WE58rthXx8ryA=s120-c-rp-mo-br100"",""Rating"":2,""Description"":""I bought a house knowing the roof would have to be shingled soon after the purchase. So I started my search, and found affordable rain flow. Agreeing to give them our business, they arrived a few weeks later and placed a large garbage bin in the drive way for ease of discarding old material, which was great to not have nails everywhere. However at the end of the project I noticed my eaves-trough was severely damaged from the materials hitting it as they threw the old material off into the bin. I called and mentioned it to the owner, he said they would replace that portion as he wanted to make things right. About a month later we called again to get a guy here as nothing seemed to be happening. Finally we received a phone call saying a employee was sent and the issue has been corrected. As we got home we realized the employee has taken a hammer to it and tried to straighten it back out as best as he could. It looks absolutely horrible. I should also note that the eaves-trough around the perimeter of the house was filled with nails, old shingles, and pieces of wood. I had to get up there myself to clean them as this company apparently takes no pride in their workmanship. If you're looking to complete a roofing project I would highly recommend looking at another company."",""Images"":null,""When"":""""},{""Name"":""David Bickell"",""ProfilePicture"":""https://lh3.googleusercontent.com/a/ACg8ocI-SjGsnh9-Cya0bgTrac9ykxuALXf_q5siH5yacxYhQ3kq0w=s120-c-rp-mo-br100"",""Rating"":5,""Description"":""If you need your roof done and want it done in a timely manner at good value, this is the company you want doing the job. The initial meeting was quick and painless with a thorough explanation of the work to be done and all costs upfront, very fair. We were given a 3-4 week estimate for job starting and they were right on time with the dump bin and crew showing up as promised. The crew that worked our house was quick, polite around our inquisitive 9yr old daughter and very clean. The driveway was swept with magnetic broom every end of day and the front and back yards tarped to catch any falling materials. Highly recommend them."",""Images"":null,""When"":""""}]",null,
6470a7f1-bc99-484c-a198-ceb2a05506b7,https://www.google.com/maps/place/Ryco+Exteriors/data=!4m7!3m6!1s0x96fb0a5996c3363:0xab14ed9d309c4176!8m2!3d62.6573279!4d-95.989235!16s%2Fg%2F11t_q05qls!19sChIJYzNsmaWwbwkRdkGcMJ3tFKs?authuser=0&hl=en&rclk=1,Ryco Exteriors,Siding contractor,,{},{},http://www.rycoexteriors.ca/,,,10,5.000000,"{""1"":0,""2"":0,""3"":0,""4"":0,""5"":10}",62.657328,-95.989235,12327739339401085302,,,,https://lh3.googleusercontent.com/gps-cs-s/AHVAweq2zeHVtqYRcq6m-l8bA25ldyvHlABEvoBx_e7lGUGHflVnaLIlC0xZ1uDFkWBohcrw_AZ46k3IVytB9ppiWi3wMVEbBneJGe7-hoWCrrAjHRJVDxF09FDEnzJS-11V9xPH-8iH=w408-h272-k-no,America/St_Johns,,0x96fb0a5996c3363:0xab14ed9d309c4176,ChIJYzNsmaWwbwkRdkGcMJ3tFKs,"[{""title"":""All"",""image"":""https://lh3.googleusercontent.com/gps-cs-s/AHVAweq2zeHVtqYRcq6m-l8bA25ldyvHlABEvoBx_e7lGUGHflVnaLIlC0xZ1uDFkWBohcrw_AZ46k3IVytB9ppiWi3wMVEbBneJGe7-hoWCrrAjHRJVDxF09FDEnzJS-11V9xPH-8iH=w447-h298-k-no""},{""title"":""Exterior"",""image"":""https://lh3.googleusercontent.com/gps-cs-s/AHVAweqSUrM41wVaW8h_LHHdjEiVEL3c6SkWM7F5rSrQXecNetZf29njgkA0Y7GgmWp36HCmb-bxN9z_cf4K4cp1xA-HSuQHBd9IXp4ZTlvK4Qg4AY58A8FbHwScYfo0fC1chkZGUYWf=w224-h298-k-no""},{""title"":""Home"",""image"":""https://lh3.googleusercontent.com/gps-cs-s/AHVAwepZ6Z_Q_XsXfxysEFUhTHDWKmy_Icu_kBTlD5iKEAQ54uJj-_Htg39NrIclo4mMtFdlAs4mwIq08Xn6A5sIFrNT2uB_OqKnediEIREyuH3jFHlDjvPP9MhCNE-3swWAymDQHQyjUlOfgHPC=w397-h298-k-no""},{""title"":""By owner"",""image"":""https://lh3.googleusercontent.com/gps-cs-s/AHVAweqiiUR6OGo5f18uyjzvQthp8DleUQfmH6MXxN7bqcYTGGqgtrt1VgGeiooRqYn47z3fsF8d0NRCYLS3QfWX6EzcYGNMs4MEX-rHR4TJls6HnSUYYb3-JnHAcIQfmbbU5iiQsb42kQ=w447-h298-k-no""}]",null,null,"{""link"":"""",""source"":""""}","{""id"":""104347201555293128522"",""name"":""Ryco Exteriors (Owner)"",""link"":""https://www.google.com/maps/contrib/104347201555293128522""}","{""borough"":"""",""street"":"""",""city"":"""",""postal_code"":"""",""state"":"""",""country"":""""}",null,"[{""Name"":""Vasili"",""ProfilePicture"":""https://lh3.googleusercontent.com/a/ACg8ocJn6wG7UdwuU9g9KYzMEf82zbphfcVXXZj5Q1YSDD4YUYGIhQ=s120-c-rp-mo-ba3-br100"",""Rating"":5,""Description"":""Bobby did a great job siding our 2 story home. There was some issues, but Bobby took care of it. Great workmanship! Would definitely recommend Ryco Exteriors."",""Images"":[""www.google.com/local/imagery/report/?cb_client=maps_sv.tactile\u0026image_key=!1e10!2sCIABIhBzFCrt7aNmZDQmWtz1ZISj\u0026fid=0x0:0xab14ed9d309c4176""],""When"":""2026-1-15""},{""Name"":""Giuseppe Gallo (Joey)"",""ProfilePicture"":""https://lh3.googleusercontent.com/a-/ALV-UjW_WGgPIeaaPwVwX3uhQn0F2PNO5oHrpi4DtV1jWr1f--Fg9HEM=s120-c-rp-mo-br100"",""Rating"":5,""Description"":""Bobby and his crew member Carson did an amazing job replacing the deteriorating fascia of my house. House looks a whole lot better. Excellent work! Highly recommend Bobby and Ryco Exteriors!"",""Images"":null,""When"":""""},{""Name"":""Debra Smith"",""ProfilePicture"":""https://lh3.googleusercontent.com/a/ACg8ocK7EWsJASu82RkehJHWr2yK4Kph4aVHLuxl2PgrGn2VKcSgQg=s120-c-rp-mo-br100"",""Rating"":5,""Description"":""Ryco  Construction is very professional! Bobby was quick to reply to texts and calls, gave a great quote, was prompt at coming to do the job and kept to both the timeframe and the quote.\n\nBobby is very friendly and easy to chat with.\n\nWe would highly recommend this company to others… oh wait, we already have!!!"",""Images"":null,""When"":""""},{""Name"":""Brad Walter"",""ProfilePicture"":""https://lh3.googleusercontent.com/a/ACg8ocItzXfLMDvHN-tWFTT6WIy_98tXAZac-b5HYpr4jMAQKUQZog=s120-c-rp-mo-br100"",""Rating"":5,""Description"":""Bobby has worked on many of our homes…he is a true professional…his workmanship and quality are of the highest standard."",""Images"":null,""When"":""""},{""Name"":""Gordon Hoglund"",""ProfilePicture"":""https://lh3.googleusercontent.com/a-/ALV-UjU8LliZEhFEwXZsC6Kb4tJlC3XFaAENP1YSi155o-8Hepnn0-0u=s120-c-rp-mo-ba2-br100"",""Rating"":5,""Description"":""Bobby did an absolute great signing job for me on short notice. Great work and price. Thanks Bobby"",""Images"":null,""When"":""""},{""Name"":""Perold Louw"",""ProfilePicture"":""https://lh3.googleusercontent.com/a/ACg8ocI5dNKYCSEh0vuDU4x2rwVGixPnyYsOg604jhUQkLgaBYRo4Q=s120-c-rp-mo-br100"",""Rating"":5,""Description"":""Bobby was wonderful and delivered excellent quality work. We will recommend him without any hesitation."",""Images"":null,""When"":""""},{""Name"":""Jay Sanghara"",""ProfilePicture"":""https://lh3.googleusercontent.com/a-/ALV-UjXXdz9RqPVeu4IqR3pbcP040FhbDmDMo8aS3cmAEXyNmuOp8A=s120-c-rp-mo-br100"",""Rating"":5,""Description"":""Bobby and his associate Jake did a siding replacement on our house, very professional answering all questions and did a great job, total thumbs from us, thanks Bobby"",""Images"":null,""When"":""""},{""Name"":""Marcello B."",""ProfilePicture"":""https://lh3.googleusercontent.com/a/ACg8ocJs2pCS-z52v6Lw9yhO1UZ2lr6nfzODjemmEwfvDva7qMHX8A=s120-c-rp-mo-br100"",""Rating"":5,""Description"":""Friendly service, good work, fair price and left the job site clean. That's a 5-star in my books!"",""Images"":null,""When"":""""}]",null,
